[
  {
    "question": "柑橘疮痂病的病原菌是什么？",
    "answer": "柑橘疮痂病的病原菌为柑橘痂囊腔菌（Elsinoe fawcettii Bitancourt et Jenk.），属于子囊菌亚门痂囊腔菌属；其无性阶段为柑橘痂圆孢菌（Sphaceloma fawcettii Jenkins），属于半知菌亚门痂圆孢属。",
    "standard_answer": "柑橘疮痂病的病原菌是柑橘痂囊腔菌（Elsinoe fawcettii），其无性阶段为柑橘痂圆孢菌。",
    "contexts": [
      "目前，全国生产柑橘包括台湾在内有 19 个省（直辖市、自治区），南起海南三亚，北至陕、甘、\n豫，东起台湾，西到西藏雅鲁藏布江河谷，均有柑橘的身影。直至 2018 年，中国柑橘栽培面积达\n4 000 余万亩，产量达3 900 多万t，是我国栽培面积及产量最大的水果。上海现有柑橘种植面积5.4\n万亩，栽培区域主要集中在崇明区。得天独厚的生态岛环境，使崇明柑橘自 20 世纪 70 年代开始就\n得到迅速发展，并创造了柑橘北缘地区生产栽培的奇迹。作为全市唯一的出口鲜果，崇明柑橘每年\n都远销加拿大、东南亚等地。\n\n近年来，柑橘在华东地区主要病害有柑橘疮痂病、树脂病、炭疽病、白粉病、煤污病、青霉病、绿\n霉病和苗期立枯病等，主要虫害有红蜘蛛、锈壁虱、黑刺粉虱、柑橘粉虱、矢尖蚧、红蜡蚧、橘\n蚜、橘小实蝇、柑橘花蕾蛆、柑橘潜叶蛾、斜纹夜蛾、柑橘凤蝶、蜗牛和蛞蝓类等。监测的方法主\n要包括人工调查监测、测报灯监测、昆虫信息素监测和孢子捕捉仪监测等。\n\n\n\n柑橘病害\n\n柑橘疮痂病\n\n·病原· 柑橘痂囊腔菌（ Elsinoe fawcettii Bitancourt et Jenk.），属子囊菌亚门（Ascomycotina）痂囊\n腔菌属（ Elsinoe ）；无性阶段为柑橘痂圆孢菌（ Sphaceloma fawcettii Jenkins），属半知菌亚门\n（Deuteromycotina）痂圆孢属（ Sphaceloma ）。\n\n·症状· 主要危害春梢、嫩叶、幼果、花蕾等幼嫩组织。叶片受害初期会产生水渍状黄褐色圆形小斑\n点，后扩大颜色变为蜡黄色，病斑木质化向叶背部位突起呈圆锥形的疮痂，似牛角或漏斗状，叶片\n畸形扭曲。感病枝梢变短而小、扭曲，严重时叶片早期脱落。花瓣受害很快凋落。花瓣落后不久，\n幼果随即产生与叶片相似症状，引起早期落果。近成熟果实染病，病斑小，不明显。\n\n·发病规律· 病原在病枝、叶上越冬，气温达到 15℃以上且多雨潮湿时借助风雨传播。疮痂病只侵\n染幼嫩组织，刚抽出而未展开的嫩叶、嫩梢以及刚谢花的幼果最易受侵害，随着组织不断老熟，抗\n病能力逐渐增强，组织完全老熟后则不会感病。该病发生的温度范围为 15~24℃，在春梢和幼果期\n发生严重；温度高于24℃后很少发病；橘类最易感病。夏梢期由于气温较高，一般发病较轻。15\n年以上树龄发病较轻；反之，较重。\n\n·防治方法·\n\n（1）冬季清除病果病枝，深埋已落入土中的病果，减少越冬病源，对越冬初始侵染源可每亩用 1.5\nkg 45%石硫合剂晶体喷雾。\n\n（2）合理修剪、整枝，增强通透性，降低湿度；控制肥水，增施有机肥，培育健壮树势，促使新\n梢抽发整齐，提高树体抵抗力，减少侵染机会。\n\n（3）一般 1 年喷药 2~3 次，可有效控制该病。第一次在早春萌芽时，第二次在落花时，第三次是\n在第二次用药后间隔 3 周。春芽期和花谢 2/3 时，以防治幼果疮痂病为重点，可选择 70%代森联水\n分散粒剂 500~580 倍液，或 12.5%烯唑醇可湿性粉剂 1 500倍液，或 17.5%氟吡菌酰胺加 17.5%戊\n唑醇悬浮剂 100~200 mg/kg，或 60%唑醚·代森联水分散粒剂1 500倍液等药剂，均匀喷雾即可。注\n意农药的使用次数和安全间隔期。\n\n\n\n柑橘疮痂病 病叶\n\n\n\n柑橘疮痂病 幼果被害状\n\n\n\n柑橘疮痂病 病叶\n\n柑橘疮痂病 病果\n\n\n\n\n\n\n柑橘疮痂病 嫩梢被害状\n\n柑橘疮痂病 病果\n\n\n\n柑橘疮痂病 分生孢子盘和分生孢子\n\n柑橘树脂病\n\n·病原· 柑橘间座壳菌[ Diaporthe citri （Fawcett） Wolf]，属子囊菌亚门（Ascomcotina）痂囊腔菌属\n（ Elsinoe ）。又称砂皮病，因发病部位不同又有不同的别称，发生在枝干上的称为树脂病或流胶\n病，发生在幼果和嫩叶上的称为黑点病或砂皮病，发生在储藏期则称为蒂腐病。\n\n·症状· 主要危害柑橘的枝干、叶片及青果，受害表面散生许多黄褐色或黑褐色小粒，密集成片，手\n感粗糙，凹凸不平。危害主干或主干分杈，流胶型病部初呈灰褐色水渍状，组织松软，皮层具有细\n小裂缝，后流有褐色胶液，边缘皮层干枯或坏死翅起，木质部裸露。干枯型的病部呈红褐色，略下\n陷的皮层干枯，但不剥落。危害叶片时，表面散生黑色硬质突起小点，有的很多密集成片，呈砂皮\n状。危害果实时先是果蒂处产生水渍状圆形褐色病斑，随后病斑向脐部扩展，边缘呈波纹状。\n\n·发病规律· 该病菌丝的寄生性不强，必须在寄主生长衰弱或受伤的情况下才能侵入危害，寄主生长\n不良或有伤口、多雨潮湿、温度为20℃左右的条件下传播较快，传播媒介为风雨或昆虫。梅雨期和\n秋季柑橘受冻后容易发病。\n\n·防治方法·",
      "（1）合理修剪，改善树体通风透光条件，剔除枯枝病枝、叶、果，集中烧毁，降低病菌基数，减\n少传染源。\n\n（2）休眠期内，对腐烂皮层、木质层、刮除流胶硬块进行集中烧毁，并用75%酒精消毒，然后涂\n上药剂。可选用 50%多菌灵可湿性粉剂 100 倍液或 70%托布津可湿性粉剂 300 倍液等药剂，每隔\n一周涂施 1 次，连涂 2~3 次。冬季对柑橘的树干进行涂白处理。\n\n（3）当柑橘春梢长 0.3 cm左右、花谢 2/3、幼果直径达到 1.5~2.0 cm时开展化学防治，选用 60%吡\n唑醚菌酯·代森联水分散粒剂 1 000 倍液喷雾保护。幼果期及壮果期可选用 10%氟硅唑水乳剂 500\n倍液，或 10%苯醚甲环唑水分散粒剂 6 000 倍液与 30%嘧菌酯悬浮剂 4 000 倍液，或 10%苯醚甲环\n唑 1 500 倍液与21%松脂酸铜水乳剂 600~750 倍液等，进行轮换防治。\n\n\n\n柑橘树脂病 枝干被害状\n\n柑橘树脂病 枝干被害状\n\n\n\n柑橘树脂病 树体死亡\n\n柑橘树脂病 果实症状严重\n\n\n\n柑橘树脂病 主干被害状\n\n\n\n柑橘树脂病 1.卵状分生孢子和丝状分子孢子；2.子囊壳；3.分生孢子器\n\n柑橘炭疽病\n\n·病原· 胶孢炭疽病（ Colletotrichum gloeosporioides Penz.），属半知菌亚门（Deuteromycotina）炭\n疽菌属（ Colletotrichum ），又称柑橘爆皮病。\n\n·症状· 主要危害叶片、枝梢、花和果实。叶片病斑多发生在近叶缘、叶尖处，半圆形或近圆形，直\n径 3~20 mm，稍凹陷，中央灰白色，边缘褐色或深褐色，病斑上有同心轮纹状排列的黑色小粒\n点。感病枝梢由梢顶向下枯死，受冻害后的秋梢发病较重，初为淡褐色椭圆形病斑，后扩大为灰白\n\n\n\n色长梭形，呈灰白色或淡褐色枯死，与健部交界明显，其上有黑色小粒点。花期感病，雌蕊柱头变\n褐腐烂，引起落花。染病幼果现暗绿色油渍状斑点，后扩至全果，病斑凹陷，变为深褐色，引起腐\n烂落果或干缩成僵果挂在树上经久不落。果实膨大期果梗受害，初为淡黄色，后变褐干枯，引起落\n果。\n\n·发病规律· 病原物在病残体上越冬，次年气温上升到 20℃时借风雨、昆虫等传播，从伤口或皮孔\n侵入寄主。柑橘炭疽病有潜伏侵染的特征，病菌在嫩叶、幼果期便可侵入，侵入后部分病菌处于潜\n伏状态，当寄主抗性下降时诱发病害。\n\n·防治方法·\n\n（1）剪除病虫枝、交叉枝、过密枝，清除枯枝、落叶、病果，并集中烧毁。采果后或萌芽前，喷\n布石硫合剂进行药剂清园，减少越冬菌源。\n\n（2）加强肥水管理，施足基肥，增施磷、钾肥，增强植株抗病性。及时排除园区积水，干旱时及\n时灌水，增强树势，提高抗病能力。科学修剪，适度取大枝开天窗，利于通风透光。\n\n（3）在春、夏、秋梢嫩叶期，以及幼果期，开展化学防治，药剂可选用 60%唑醚代森联水分散粒\n剂 1 000~1 500 倍液，或 10%苯醚甲环唑水分散粒剂 1 500 倍液。注意农药的使用次数和安全间隔\n期。\n\n柑橘炭疽病 叶片、果实被害状\n\n\n\n柑橘炭疽病 叶片被害状\n\n柑橘炭疽病 果实被害状\n\n\n\n柑橘炭疽病 叶片被害状\n\n\n\n\n\n\n柑橘炭疽病 病枝\n\n柑橘炭疽病 落果\n\n柑橘炭疽病 分生孢子和刚毛\n\n柑橘煤污病\n\n\n\n·病原· 柑橘煤炱菌（ Capnodium citri Berk. et Desm），属子囊菌亚门（Ascom ycotina）煤炱属（\nCapnodium ）；巴特勒小煤炱菌（ Meliola butleri Syd.）属子囊菌亚门（Ascomycotina）小煤炱属\n（ Meliola ）；刺盾炱菌[ Chaetothyrium spinigerum （John） Yam.]，属子囊菌亚门\n（Ascomycotina）刺盾炱属（ Chaetothyrium ）。又称煤烟病、煤病。\n\n·症状· 主要危害叶片、枝梢及果实。发病初期，在叶片、枝梢或果实表面出现灰黑色的小煤斑或暗\n褐色小霉点，以后扩大形成绒毛状黑色或暗褐色霉层，并散生黑色小点。严重发生时，全株大部分\n枝叶变成黑色，影响光合作用，树势下降，开花少，果品差。\n\n·发病规律· 病原物以菌丝体或分生孢子器及闭囊壳在病部越冬，翌春由霉层上飞散孢子借风雨传\n播，并以蚜虫、介壳虫、粉虱的分泌物为营养，辗转危害。\n\n生产上，种植过密，通风不良，荫蔽潮湿及管理不善的橘园发病重。煤污病全年都可发生，在 5~9\n月发病最严重，蚧、蚜、粉虱等害虫分泌“蜜露”是诱发煤污病的先决条件。\n\n·防治方法·\n\n（1）对柑橘树进行适当修剪，促进透风通光；田间施用有机肥，提高柑橘树的抗病能力；合理施\n肥。",
      "（2）及时清理残枝败叶，集中处理销毁，切断其越冬病源和媒介昆虫，减少发病率。及时处理田\n间杂草，防止病原微生物和媒介昆虫在其他寄主上繁殖。\n\n（3）在落花后 1 个月内，每隔 10~15 天喷药 1 次，重点防治蚧、蚜、粉虱等刺吸式口器害虫。可\n用 99%矿物油乳油 100~200 倍液，或 99%矿物油 100~150倍液，或松脂合剂 8~10 倍液，或 70%代\n森联水分散粒剂 500 倍液进行防治。\n\n已发生煤污病的果园，可在冬春清园期喷 65%甲硫·乙霉威可湿性粉剂 1 000倍液，或 40%克菌丹悬\n浮剂 400 倍液，或 0.5∶1∶100 倍式波尔多液，或 70%甲基硫菌可湿性粉剂 600~800 倍液，或 50%\n多菌灵可湿性粉剂 600~800 倍液。\n\n柑橘煤污病 植株被害状\n\n\n\n柑橘煤污病 病叶\n\n红蜡蚧并发煤污病\n\n\n\n柑橘煤污病 病叶\n\n柑橘煤污病 病叶\n\n\n\n柑橘虫害\n\n柑橘红蜘蛛\n\n·学名· Panonychus citri McGregor，又名柑橘全爪螨，属蛛形纲（Arachnida）全爪螨属（\nPanonychus ）。\n\n·鉴别特征· 雌成螨：约长0.39 mm，宽约0.26 mm，近椭圆形。雄成螨：鲜红色，体型略小于雌成\n螨。若虫：身体比成虫小，足 4 对，身体颜色与成虫差别不大。幼虫：体较小，长 0.2 mm，初孵\n时足 3 对，体色呈淡红色。卵：一般多产在叶面和叶背中脉两旁。\n\n·生活习性· 喜干旱，多雨不利发生。温度 24~28℃、相对湿度 60%~85%是红蜘蛛生长发育的最适\n气候，高于 34℃或低于 11℃时生长受到抑制。上海地区红蜘蛛的发生高峰一般出现在 5~6 月；若\n气候适宜，9~10 月也可能再次发生高峰。\n\n·危害特点· 主要危害柑橘叶片和果实。被害叶片呈现大面积灰白，失去光泽，并最终脱落。幼果和\n成熟果实受害后表面出现淡绿色和淡黄色斑点，品质下降。\n\n·防治方法·\n\n（1）冬季清园时，结合修剪，将柑橘红蜘蛛的受害枝叶剪除并集中烧毁。田间释放捕食螨捕食柑\n橘红蜘蛛，开展无公害防治。\n\n（2）气温低于 25℃时，可以用 99%矿物油乳油 100~200 倍液喷雾，对叶片的上下两面喷洒均匀，\n不遗漏。\n\n（3）药剂防治：在若虫期，可选用 4%阿维菌素+24%螺虫乙酯悬浮剂 5 000~7 000 倍液喷雾 1\n次。柑橘红蜘蛛始发盛期时，喷雾 43%联苯肼酯悬浮剂 1 900~2 400 倍液，或 20%丁氟螨酯悬浮剂\n1 500~2 500 倍液（在柑橘树上每季最多使用1 次）。喷雾时应使作物叶面正反面、果实表面以及\n树干、枝条等部位均匀着药。\n\n\n\n\n\n\n柑橘红蜘蛛 柑橘苗被害状\n\n柑橘红蜘蛛 卵\n\n\n\n柑橘红蜘蛛 成虫\n\n柑橘红蜘蛛 群集危害\n\n\n\n柑橘红蜘蛛 成虫\n\n\n\n柑橘红蜘蛛 群集危害叶片\n\n\n\n柑橘红蜘蛛 危害柑橘叶片\n\n柑橘锈壁虱\n\n·学名· Phyllocoptruta oleivora Ashmead，属蛛形纲（Arachnida）瘿螨科（Eriophyidae），又名柑橘\n锈瘿螨、柑橘铜病。\n\n\n\n·鉴别特征· 成螨：体长 0.1~0.2 mm，胡萝卜形或楔形，黄色或橙黄色，头小，向前方伸出。幼\n螨：孵出时为三角形。若螨：体形如成螨，但较小，半透明。\n\n·生活习性· 以成螨在夏、秋梢腋芽、卷叶等部位越冬。越冬螨在 15℃左右时开始活动、产卵。当\n平均气温达 20℃以上时繁殖迅速，7~8 月高温季节种群迅速扩大，易造成果面严重危害。\n\n·危害特点· 成螨、若螨均可危害，以口器刺入柑橘组织吸食汁液。叶片、枝梢、果实被害后，油胞\n破裂，芳香油溢出，经空气氧化，叶背和果皮变成污黑色，叶片受害严重时变小、变脆、畸形，当\n年抽生的春梢叶片大量脱落；果实受害变黑褐色，果皮粗糙布满网状细纹或古铜色锈斑，品质及商\n品价值降低。\n\n·防治方法·\n\n（1）加强栽培管理，肥水管理，增施有机肥，改善果园生态环境，使植株生长健壮，抗病虫力增\n强。\n\n（2）保护利用锈壁虱的天敌，主要有食螨瓢虫、捕食螨、具瘤长须螨、蓟马和多毛菌等。",
      "·病原· 有性阶段为苹果双壳菌（ Diplocarpon mali Harada et Sawamura），属子囊菌门双壳属（\nDiplocarpon ）真菌；无性阶段为苹果盘二孢[ Marssonina coronaria （Ell. et Davis） Davis]，属半\n知菌亚门（Deuteromycotina）盘二孢属（ Marssonina ）真菌。\n\n·症状· 主要危害叶片，也侵染果实。叶片上症状有 3 种类型。\n\n（1）同心轮纹型：发病初期在叶片正面形成黄褐色小点，近圆形，后期病斑表面产生同心轮纹状\n排列的小黑点。\n\n（2）针芒型：病斑呈放射状（针芒状）向外扩展。病斑小，数量较多，常遍布叶片。\n\n（3）混合型：病斑较大，近圆形，其外缘呈针芒状，后期病斑中部灰白色，外缘绿色，其上散生\n许多小黑点。\n\n·发病规律· 以分生孢子盘、子囊盘或未受精的菌丝团在落叶和病梢中越冬。春季温度回升、多雨\n时，产生子囊孢子或分生孢子，通过风雨传播。附着胞和侵染丝直接从叶面或叶背侵入，树冠下部\n和内膛叶片最先发病，逐渐向上及外围蔓延。在苹果生长季节，病菌可产生分生孢子进行再侵染。\n潮湿是落叶上病菌形成子囊盘的必要条件。弱树、弱枝发病重，壮树发病轻。管理粗放果园病害发\n生早而重。\n\n·防治方法·\n\n（1）搞好清园：秋末清除园内落叶，集中烧毁。冬前深翻果园，促进病残体分解。早春苹果发芽\n前，在树体及其地面喷布 45%石硫合剂晶体。\n\n（2）加强栽培管理：提高树体抗病力，土壤肥力较差的果园，要增施肥料。合理修剪，注意改善\n树冠内的通风透光。\n\n（3）喷药保护：药剂防治重点应在前期，一般在落花后 10 天左右即开始喷第一次药，每隔 10~15\n天左右喷 1 次药，连续喷施 4~5 次。常用药剂有 10%多抗霉素 1 200 倍液、80%戊唑醇可湿性粉剂\n3 000 倍液、70%代森联干悬浮剂 1 000 倍液等。\n\n\n\n苹果褐斑病 叶片被害状\n\n\n\n苹果褐斑病 叶片被害状\n\n苹果褐斑病 叶片被害状\n\n\n\n苹果褐斑病 果实被害状\n\n苹果斑点病\n\n·病原· 链格孢苹果专化型（ Alternaria alternaria f.sp. mali），属半知菌亚门（Deuteromycotina）链\n格孢属（ Alternaria ）真菌。\n\n·症状· 果面出现黑红斑点，红斑点比例占 80%以上，但不烂果。果顶周围斑点最多，果梗周围几乎\n不见。红斑中有一些斑点，初发为小黑斑，后发软裂口或软化烂果。\n\n·发病规律· 以菌丝体在病落叶、病枝等病残体和秋梢顶芽上越冬。4、5 月降雨时，越冬病菌可产\n生大量分生孢子，通过风雨传播，从伤口或表皮直接侵入幼叶、新梢和果实等组织。降雨早、雨日\n多、雨量大，发病早、发病期长、发病重。树势衰弱，发病重。\n\n·防治方法·\n\n（1）加强栽培管理，增强树势，提高树体抗病力。秋冬季节清除园内残枝落叶、病虫果集中处理\n以减少菌源量；增施腐熟农家肥；改良土壤，不偏施氮肥；合理修剪，改善果园通风透光条件，保\n证枝枝见光，同时，提高土壤通气性；7~9月份多雨季节温度高，湿度大，应防止果园积水，要及\n时排水。\n\n（2）药剂防治：谢花后套袋前新梢生长期，全园喷施 1~2 次 80%代森锰锌可湿性粉剂 800 倍液。\n果实膨大期全园喷施 43%戊唑醇悬浮剂 3 000 倍液，或 10%苯醚甲环唑水分散粒剂 1 500 倍液，或\n40%氟硅唑可湿性粉剂 4 000 倍液。果实着色至成熟期，除袋后及时给树上补喷 1 次 5%吡唑醚菌\n酯+55%代森联水分散粒剂，进一步杀灭病菌。\n\n\n\n苹果斑点病 病果\n\n\n\n苹果斑点病 病果\n\n\n\n苹果斑点病 病果\n\n苹果斑点病 病果\n\n\n\n苹果斑点病 病果\n\n\n\n苹果斑点病 病果\n\n苹果炭疽病\n\n·病原· 有性阶段为炭疽病菌[ Glomerella cingulate （Stonem.） Spauld. et Schrenk]属子囊菌亚门\n（Ascomycotina）小丛壳属（ Glomerella ）；无性阶段为胶孢炭疽菌（ Colletotrichum\ngloeosporioides Penz. et Sacc.），属半知菌亚门（Deuteromycotina）炭疽菌属（ Colletotrichum ）。",
      "该类虫属软体动物门、腹足纲。多雨潮湿天气上树危害，取食果实和叶片。该类虫喜潮湿环境，正\n常或干旱天气不予防治；园内散放鸡、鸭、鹅等家禽可有效消灭该类害虫；清除种植场所内的杂草\n及杂物，营造通风、干燥的环境；在多雨潮湿天气发生量大时可喷洒药剂防治。\n\n·防治方法·\n\n（1）人工防治：清洁草坪，并撒上生石灰，减少滋生地，或用树叶、杂草诱集，天亮前集中捕\n捉。\n\n（2）生物防治：保护和利用天敌，如步行虫、蛙、蜥蜴等。\n\n（3）化学防治：用生石灰粉或茶枯粉毒杀，用量分别为 75 kg/hm2 和 45 kg/hm 2 ；或 6%三聚乙醛\n颗粒剂 500~700 g/亩。\n\n蛞蝓\n\n\n\n蛞蝓\n\n\n\n蛞蝓 群集危害\n\n\n\n\n\n\n同型巴蜗牛\n\n\n\n同型巴蜗牛\n\n\n\n柑橘病虫防治历\n\n（续表）\n\n\n\n\n\n\n\n\n\n二、桃树\n\n桃，蔷薇科、桃属植物；是一种乔木，高 3~8 m。桃除鲜食外，还可加工成桃脯、桃酱、桃汁、桃\n干和桃罐头；素有“寿桃”和“仙桃”的美称，因肉质鲜美，又被称为“天下第一果”。桃肉富含蛋白\n质、脂肪、碳水化合物、粗纤维、多种营养元素以及有机酸、糖分和挥发油，适宜低血钾和缺铁性\n贫血患者食用。\n\n桃原产中国，主要经济栽培地区在中国华北、华东各省，世界各地均有栽植。全国有许多优良桃品\n种，如山东的肥城桃、天津和上海的水蜜挑、南京时桃、杭州蟠桃、贵州白花桃、血桃以及河北深\n州的蜜桃。上海现在桃树种植面积为 6.7 万亩，水蜜桃主要集中在浦东的南汇地区、松江、崇明；\n黄桃主要集中在奉贤；蟠桃集中在金山地区，其他区有少量分布和油桃零星种植。\n\n目前，桃在上海地区主要病害有桃细菌性穿孔病、桃疮痂病、桃褐腐病、桃炭疽病、桃流胶病、桃\n根癌病、桃树生理性黄化等；主要虫害有桃树蚜虫、红蜘蛛、桃潜叶蛾、桃小绿叶蝉、桃蛀螟、茶\n翅蝽、介壳虫、红颈天牛等。\n\n\n\n桃树病害\n\n桃褐腐病\n\n·病原· 本病原有三种：果生链核盘菌（ Monilinia fructicola ）、核果链核盘菌（ M.laxa ），均属子\n囊菌亚门（Ascomycotina）链核盘菌属（ Monilinia ）；无性阶段为半知菌亚门\n（Deuteromycotina）丛梗孢属（ Monilia ）。\n\n·症状· 主要危害果实、花、叶和枝梢。果实染病初期在果面产生淡褐色圆形或近圆形小斑，斑部果\n肉很快腐烂，造成病果大部甚至整个呈褐色腐烂。近成熟果受害，初为淡褐色至褐色圆形斑，并很\n快扩展至果实的大部分，果肉迅速变褐腐烂，病斑表面产生黄白色或灰色绒球状霉丛或霉层，呈同\n心环纹状排列，引起落果。花部受害自雄蕊及花瓣尖端发生，病部始生褐色水渍状斑点，后扩展至\n全花，变褐枯萎。叶片受害自叶缘开始，产生褐色水渍状病斑，后扩展到叶柄，使全叶变褐萎垂。\n新梢上产生长圆形、灰褐色、边缘为紫褐色溃疡斑，中间稍凹陷，初期病斑常有流胶。\n\n·发病规律· 主要在树上、树下僵果及病枝条溃疡斑部以僵果（病菌的假菌核）和菌丝体越冬。翌春\n气温上升后产生大量病菌孢子，通过气孔、虫伤和机械伤口侵入，借助风、雨水飞溅或昆虫传播。\n该病从开花到果实成熟都能侵染；遇阴雨天气易引起花腐、果腐。栽植过密、地势低洼、管理粗\n放、通风透光不良易发病。\n\n·防治方法·\n\n（1）在休眠期和生长期，及时清除园中和枝条上的病果、僵果、病枝、病叶和病花，减少病菌侵\n染来源；修剪过密枝条，改善果园通风透光条件。雨季及时排水。\n\n（2）在幼果期及时进行套袋，可阻隔病菌侵染。\n\n（3）桃树萌芽前，选用 45%晶体石硫合剂 30 倍液，或波尔多液 100 倍液等喷雾，并同时喷洒地\n面。\n\n（4）在落花后 10 天左右，开始喷药，每次喷药须间隔 10~15 天。药剂可选用混配剂 75%百菌清\n可湿性粉剂 800 倍液加 70%甲基硫菌灵可湿性粉剂 800~1 000倍液、23.4%双炔酰菌胺悬浮剂 1 500\n倍液、4%春雷霉素可湿性粉剂 40~60 g/亩等，交替喷雾防治，每次喷雾间隔 7~15 天，连续防治\n2~3 次。\n\n\n\n桃褐腐病 田间发病状\n\n\n\n桃褐腐病 悬挂在树上的僵果成为病菌持续传播的病源\n\n\n\n桃褐腐病 病果后期表现的霉丛\n\n果实 被害状\n\n\n\n桃褐腐病 叶片被害状\n\n桃褐腐病 1.分生孢子的萌发；2.分生孢子链的一部分；3.子囊、侧丝和子囊孢子\n\n桃菌核病\n\n·病原· 病原为核盘菌[ Sclerotinia sclerotiorum （Lib.） de Bary]，属子囊菌亚门（Ascomycotina）核\n盘菌属（ Sclerotinia ）。"
    ]
  },
  {
    "question": "柑橘树脂病发生在果实储藏期时被称为什么病？",
    "answer": "柑橘树脂病在果实储藏期时被称为蒂腐病。",
    "standard_answer": "柑橘树脂病发生在储藏期称为蒂腐病。",
    "contexts": [
      "（1）合理修剪，改善树体通风透光条件，剔除枯枝病枝、叶、果，集中烧毁，降低病菌基数，减\n少传染源。\n\n（2）休眠期内，对腐烂皮层、木质层、刮除流胶硬块进行集中烧毁，并用75%酒精消毒，然后涂\n上药剂。可选用 50%多菌灵可湿性粉剂 100 倍液或 70%托布津可湿性粉剂 300 倍液等药剂，每隔\n一周涂施 1 次，连涂 2~3 次。冬季对柑橘的树干进行涂白处理。\n\n（3）当柑橘春梢长 0.3 cm左右、花谢 2/3、幼果直径达到 1.5~2.0 cm时开展化学防治，选用 60%吡\n唑醚菌酯·代森联水分散粒剂 1 000 倍液喷雾保护。幼果期及壮果期可选用 10%氟硅唑水乳剂 500\n倍液，或 10%苯醚甲环唑水分散粒剂 6 000 倍液与 30%嘧菌酯悬浮剂 4 000 倍液，或 10%苯醚甲环\n唑 1 500 倍液与21%松脂酸铜水乳剂 600~750 倍液等，进行轮换防治。\n\n\n\n柑橘树脂病 枝干被害状\n\n柑橘树脂病 枝干被害状\n\n\n\n柑橘树脂病 树体死亡\n\n柑橘树脂病 果实症状严重\n\n\n\n柑橘树脂病 主干被害状\n\n\n\n柑橘树脂病 1.卵状分生孢子和丝状分子孢子；2.子囊壳；3.分生孢子器\n\n柑橘炭疽病\n\n·病原· 胶孢炭疽病（ Colletotrichum gloeosporioides Penz.），属半知菌亚门（Deuteromycotina）炭\n疽菌属（ Colletotrichum ），又称柑橘爆皮病。\n\n·症状· 主要危害叶片、枝梢、花和果实。叶片病斑多发生在近叶缘、叶尖处，半圆形或近圆形，直\n径 3~20 mm，稍凹陷，中央灰白色，边缘褐色或深褐色，病斑上有同心轮纹状排列的黑色小粒\n点。感病枝梢由梢顶向下枯死，受冻害后的秋梢发病较重，初为淡褐色椭圆形病斑，后扩大为灰白\n\n\n\n色长梭形，呈灰白色或淡褐色枯死，与健部交界明显，其上有黑色小粒点。花期感病，雌蕊柱头变\n褐腐烂，引起落花。染病幼果现暗绿色油渍状斑点，后扩至全果，病斑凹陷，变为深褐色，引起腐\n烂落果或干缩成僵果挂在树上经久不落。果实膨大期果梗受害，初为淡黄色，后变褐干枯，引起落\n果。\n\n·发病规律· 病原物在病残体上越冬，次年气温上升到 20℃时借风雨、昆虫等传播，从伤口或皮孔\n侵入寄主。柑橘炭疽病有潜伏侵染的特征，病菌在嫩叶、幼果期便可侵入，侵入后部分病菌处于潜\n伏状态，当寄主抗性下降时诱发病害。\n\n·防治方法·\n\n（1）剪除病虫枝、交叉枝、过密枝，清除枯枝、落叶、病果，并集中烧毁。采果后或萌芽前，喷\n布石硫合剂进行药剂清园，减少越冬菌源。\n\n（2）加强肥水管理，施足基肥，增施磷、钾肥，增强植株抗病性。及时排除园区积水，干旱时及\n时灌水，增强树势，提高抗病能力。科学修剪，适度取大枝开天窗，利于通风透光。\n\n（3）在春、夏、秋梢嫩叶期，以及幼果期，开展化学防治，药剂可选用 60%唑醚代森联水分散粒\n剂 1 000~1 500 倍液，或 10%苯醚甲环唑水分散粒剂 1 500 倍液。注意农药的使用次数和安全间隔\n期。\n\n柑橘炭疽病 叶片、果实被害状\n\n\n\n柑橘炭疽病 叶片被害状\n\n柑橘炭疽病 果实被害状\n\n\n\n柑橘炭疽病 叶片被害状\n\n\n\n\n\n\n柑橘炭疽病 病枝\n\n柑橘炭疽病 落果\n\n柑橘炭疽病 分生孢子和刚毛\n\n柑橘煤污病\n\n\n\n·病原· 柑橘煤炱菌（ Capnodium citri Berk. et Desm），属子囊菌亚门（Ascom ycotina）煤炱属（\nCapnodium ）；巴特勒小煤炱菌（ Meliola butleri Syd.）属子囊菌亚门（Ascomycotina）小煤炱属\n（ Meliola ）；刺盾炱菌[ Chaetothyrium spinigerum （John） Yam.]，属子囊菌亚门\n（Ascomycotina）刺盾炱属（ Chaetothyrium ）。又称煤烟病、煤病。\n\n·症状· 主要危害叶片、枝梢及果实。发病初期，在叶片、枝梢或果实表面出现灰黑色的小煤斑或暗\n褐色小霉点，以后扩大形成绒毛状黑色或暗褐色霉层，并散生黑色小点。严重发生时，全株大部分\n枝叶变成黑色，影响光合作用，树势下降，开花少，果品差。\n\n·发病规律· 病原物以菌丝体或分生孢子器及闭囊壳在病部越冬，翌春由霉层上飞散孢子借风雨传\n播，并以蚜虫、介壳虫、粉虱的分泌物为营养，辗转危害。\n\n生产上，种植过密，通风不良，荫蔽潮湿及管理不善的橘园发病重。煤污病全年都可发生，在 5~9\n月发病最严重，蚧、蚜、粉虱等害虫分泌“蜜露”是诱发煤污病的先决条件。\n\n·防治方法·\n\n（1）对柑橘树进行适当修剪，促进透风通光；田间施用有机肥，提高柑橘树的抗病能力；合理施\n肥。",
      "目前，全国生产柑橘包括台湾在内有 19 个省（直辖市、自治区），南起海南三亚，北至陕、甘、\n豫，东起台湾，西到西藏雅鲁藏布江河谷，均有柑橘的身影。直至 2018 年，中国柑橘栽培面积达\n4 000 余万亩，产量达3 900 多万t，是我国栽培面积及产量最大的水果。上海现有柑橘种植面积5.4\n万亩，栽培区域主要集中在崇明区。得天独厚的生态岛环境，使崇明柑橘自 20 世纪 70 年代开始就\n得到迅速发展，并创造了柑橘北缘地区生产栽培的奇迹。作为全市唯一的出口鲜果，崇明柑橘每年\n都远销加拿大、东南亚等地。\n\n近年来，柑橘在华东地区主要病害有柑橘疮痂病、树脂病、炭疽病、白粉病、煤污病、青霉病、绿\n霉病和苗期立枯病等，主要虫害有红蜘蛛、锈壁虱、黑刺粉虱、柑橘粉虱、矢尖蚧、红蜡蚧、橘\n蚜、橘小实蝇、柑橘花蕾蛆、柑橘潜叶蛾、斜纹夜蛾、柑橘凤蝶、蜗牛和蛞蝓类等。监测的方法主\n要包括人工调查监测、测报灯监测、昆虫信息素监测和孢子捕捉仪监测等。\n\n\n\n柑橘病害\n\n柑橘疮痂病\n\n·病原· 柑橘痂囊腔菌（ Elsinoe fawcettii Bitancourt et Jenk.），属子囊菌亚门（Ascomycotina）痂囊\n腔菌属（ Elsinoe ）；无性阶段为柑橘痂圆孢菌（ Sphaceloma fawcettii Jenkins），属半知菌亚门\n（Deuteromycotina）痂圆孢属（ Sphaceloma ）。\n\n·症状· 主要危害春梢、嫩叶、幼果、花蕾等幼嫩组织。叶片受害初期会产生水渍状黄褐色圆形小斑\n点，后扩大颜色变为蜡黄色，病斑木质化向叶背部位突起呈圆锥形的疮痂，似牛角或漏斗状，叶片\n畸形扭曲。感病枝梢变短而小、扭曲，严重时叶片早期脱落。花瓣受害很快凋落。花瓣落后不久，\n幼果随即产生与叶片相似症状，引起早期落果。近成熟果实染病，病斑小，不明显。\n\n·发病规律· 病原在病枝、叶上越冬，气温达到 15℃以上且多雨潮湿时借助风雨传播。疮痂病只侵\n染幼嫩组织，刚抽出而未展开的嫩叶、嫩梢以及刚谢花的幼果最易受侵害，随着组织不断老熟，抗\n病能力逐渐增强，组织完全老熟后则不会感病。该病发生的温度范围为 15~24℃，在春梢和幼果期\n发生严重；温度高于24℃后很少发病；橘类最易感病。夏梢期由于气温较高，一般发病较轻。15\n年以上树龄发病较轻；反之，较重。\n\n·防治方法·\n\n（1）冬季清除病果病枝，深埋已落入土中的病果，减少越冬病源，对越冬初始侵染源可每亩用 1.5\nkg 45%石硫合剂晶体喷雾。\n\n（2）合理修剪、整枝，增强通透性，降低湿度；控制肥水，增施有机肥，培育健壮树势，促使新\n梢抽发整齐，提高树体抵抗力，减少侵染机会。\n\n（3）一般 1 年喷药 2~3 次，可有效控制该病。第一次在早春萌芽时，第二次在落花时，第三次是\n在第二次用药后间隔 3 周。春芽期和花谢 2/3 时，以防治幼果疮痂病为重点，可选择 70%代森联水\n分散粒剂 500~580 倍液，或 12.5%烯唑醇可湿性粉剂 1 500倍液，或 17.5%氟吡菌酰胺加 17.5%戊\n唑醇悬浮剂 100~200 mg/kg，或 60%唑醚·代森联水分散粒剂1 500倍液等药剂，均匀喷雾即可。注\n意农药的使用次数和安全间隔期。\n\n\n\n柑橘疮痂病 病叶\n\n\n\n柑橘疮痂病 幼果被害状\n\n\n\n柑橘疮痂病 病叶\n\n柑橘疮痂病 病果\n\n\n\n\n\n\n柑橘疮痂病 嫩梢被害状\n\n柑橘疮痂病 病果\n\n\n\n柑橘疮痂病 分生孢子盘和分生孢子\n\n柑橘树脂病\n\n·病原· 柑橘间座壳菌[ Diaporthe citri （Fawcett） Wolf]，属子囊菌亚门（Ascomcotina）痂囊腔菌属\n（ Elsinoe ）。又称砂皮病，因发病部位不同又有不同的别称，发生在枝干上的称为树脂病或流胶\n病，发生在幼果和嫩叶上的称为黑点病或砂皮病，发生在储藏期则称为蒂腐病。\n\n·症状· 主要危害柑橘的枝干、叶片及青果，受害表面散生许多黄褐色或黑褐色小粒，密集成片，手\n感粗糙，凹凸不平。危害主干或主干分杈，流胶型病部初呈灰褐色水渍状，组织松软，皮层具有细\n小裂缝，后流有褐色胶液，边缘皮层干枯或坏死翅起，木质部裸露。干枯型的病部呈红褐色，略下\n陷的皮层干枯，但不剥落。危害叶片时，表面散生黑色硬质突起小点，有的很多密集成片，呈砂皮\n状。危害果实时先是果蒂处产生水渍状圆形褐色病斑，随后病斑向脐部扩展，边缘呈波纹状。\n\n·发病规律· 该病菌丝的寄生性不强，必须在寄主生长衰弱或受伤的情况下才能侵入危害，寄主生长\n不良或有伤口、多雨潮湿、温度为20℃左右的条件下传播较快，传播媒介为风雨或昆虫。梅雨期和\n秋季柑橘受冻后容易发病。\n\n·防治方法·",
      "（2）及时清理残枝败叶，集中处理销毁，切断其越冬病源和媒介昆虫，减少发病率。及时处理田\n间杂草，防止病原微生物和媒介昆虫在其他寄主上繁殖。\n\n（3）在落花后 1 个月内，每隔 10~15 天喷药 1 次，重点防治蚧、蚜、粉虱等刺吸式口器害虫。可\n用 99%矿物油乳油 100~200 倍液，或 99%矿物油 100~150倍液，或松脂合剂 8~10 倍液，或 70%代\n森联水分散粒剂 500 倍液进行防治。\n\n已发生煤污病的果园，可在冬春清园期喷 65%甲硫·乙霉威可湿性粉剂 1 000倍液，或 40%克菌丹悬\n浮剂 400 倍液，或 0.5∶1∶100 倍式波尔多液，或 70%甲基硫菌可湿性粉剂 600~800 倍液，或 50%\n多菌灵可湿性粉剂 600~800 倍液。\n\n柑橘煤污病 植株被害状\n\n\n\n柑橘煤污病 病叶\n\n红蜡蚧并发煤污病\n\n\n\n柑橘煤污病 病叶\n\n柑橘煤污病 病叶\n\n\n\n柑橘虫害\n\n柑橘红蜘蛛\n\n·学名· Panonychus citri McGregor，又名柑橘全爪螨，属蛛形纲（Arachnida）全爪螨属（\nPanonychus ）。\n\n·鉴别特征· 雌成螨：约长0.39 mm，宽约0.26 mm，近椭圆形。雄成螨：鲜红色，体型略小于雌成\n螨。若虫：身体比成虫小，足 4 对，身体颜色与成虫差别不大。幼虫：体较小，长 0.2 mm，初孵\n时足 3 对，体色呈淡红色。卵：一般多产在叶面和叶背中脉两旁。\n\n·生活习性· 喜干旱，多雨不利发生。温度 24~28℃、相对湿度 60%~85%是红蜘蛛生长发育的最适\n气候，高于 34℃或低于 11℃时生长受到抑制。上海地区红蜘蛛的发生高峰一般出现在 5~6 月；若\n气候适宜，9~10 月也可能再次发生高峰。\n\n·危害特点· 主要危害柑橘叶片和果实。被害叶片呈现大面积灰白，失去光泽，并最终脱落。幼果和\n成熟果实受害后表面出现淡绿色和淡黄色斑点，品质下降。\n\n·防治方法·\n\n（1）冬季清园时，结合修剪，将柑橘红蜘蛛的受害枝叶剪除并集中烧毁。田间释放捕食螨捕食柑\n橘红蜘蛛，开展无公害防治。\n\n（2）气温低于 25℃时，可以用 99%矿物油乳油 100~200 倍液喷雾，对叶片的上下两面喷洒均匀，\n不遗漏。\n\n（3）药剂防治：在若虫期，可选用 4%阿维菌素+24%螺虫乙酯悬浮剂 5 000~7 000 倍液喷雾 1\n次。柑橘红蜘蛛始发盛期时，喷雾 43%联苯肼酯悬浮剂 1 900~2 400 倍液，或 20%丁氟螨酯悬浮剂\n1 500~2 500 倍液（在柑橘树上每季最多使用1 次）。喷雾时应使作物叶面正反面、果实表面以及\n树干、枝条等部位均匀着药。\n\n\n\n\n\n\n柑橘红蜘蛛 柑橘苗被害状\n\n柑橘红蜘蛛 卵\n\n\n\n柑橘红蜘蛛 成虫\n\n柑橘红蜘蛛 群集危害\n\n\n\n柑橘红蜘蛛 成虫\n\n\n\n柑橘红蜘蛛 群集危害叶片\n\n\n\n柑橘红蜘蛛 危害柑橘叶片\n\n柑橘锈壁虱\n\n·学名· Phyllocoptruta oleivora Ashmead，属蛛形纲（Arachnida）瘿螨科（Eriophyidae），又名柑橘\n锈瘿螨、柑橘铜病。\n\n\n\n·鉴别特征· 成螨：体长 0.1~0.2 mm，胡萝卜形或楔形，黄色或橙黄色，头小，向前方伸出。幼\n螨：孵出时为三角形。若螨：体形如成螨，但较小，半透明。\n\n·生活习性· 以成螨在夏、秋梢腋芽、卷叶等部位越冬。越冬螨在 15℃左右时开始活动、产卵。当\n平均气温达 20℃以上时繁殖迅速，7~8 月高温季节种群迅速扩大，易造成果面严重危害。\n\n·危害特点· 成螨、若螨均可危害，以口器刺入柑橘组织吸食汁液。叶片、枝梢、果实被害后，油胞\n破裂，芳香油溢出，经空气氧化，叶背和果皮变成污黑色，叶片受害严重时变小、变脆、畸形，当\n年抽生的春梢叶片大量脱落；果实受害变黑褐色，果皮粗糙布满网状细纹或古铜色锈斑，品质及商\n品价值降低。\n\n·防治方法·\n\n（1）加强栽培管理，肥水管理，增施有机肥，改善果园生态环境，使植株生长健壮，抗病虫力增\n强。\n\n（2）保护利用锈壁虱的天敌，主要有食螨瓢虫、捕食螨、具瘤长须螨、蓟马和多毛菌等。",
      "·病原· 苹果黑腐皮壳菌（ Valsa mali Miyabe et Yamada），属子囊菌亚门（Ascomycotina）腐皮壳\n属（ Diaporthe ）。无性阶段为苹果干腐烂壳蕉孢菌（ Cytospora mandshurica Miura），属半知菌\n亚门（Deuteromycotina）囊孢壳属（ Physalospora ）。\n\n·症状· 主要在苹果树的主干和大枝分杈部位发病，一般表现为主干受害皮层腐烂坏死，具体为两\n种，即溃疡性和枝枯型。溃疡型：发病初期，病部呈现红褐色，稍微隆起，出现水渍状或组织松\n软，内部组织变成暗红褐色，使用手指按压下陷。一般的病部流出黄褐色的液体，病皮易破裂。病\n部因失水而逐渐收缩下陷，产生明显的小黑点。最终致上部枝条枯死。枝枯型：发病于比较弱势的\n枝条以及干桩等部位，随着病部的逐渐扩大，形状出现变化，病斑环绕一周后，树木枯死，后出现\n黑色小点。\n\n·发病规律· 主要以菌丝体、分生孢子器及子囊壳在病枝干、果园及其周围堆放的病残体上越冬。春\n天遇雨时，大量分生孢子和子囊孢子通过雨水飞溅和昆虫活动传播，从伤口（冻伤、剪锯伤、环剥\n伤、虫伤等）、叶痕、果柄痕和皮孔侵入。当树体或局部组织衰弱、抗病力低下时，病菌迅速生\n长，产生毒素，并向四周扩展蔓延，导致皮层组织腐烂。当侵染点组织健康、树势强壮时，病菌则\n停止扩展，处于潜伏状态。\n\n·防治方法·\n\n（1）11 月进行树干涂白，常用配制方为生石灰 10 kg、石硫合剂原液 1 kg、盐 1 kg、动物油 0.5\nkg、水 30 kg。\n\n（2）入冬前进行病斑治疗，检查表面溃疡，将病部树皮表层组织及周围少量健康组织刮除，以防\n入冬后向深层蔓延。每次刮治后，伤口涂抹腐必清乳剂3倍液，或 5%菌毒清 50 倍液等，或 45%石\n硫合剂晶体 150 倍液，杀死残留在病部的病菌。\n\n（3）春季发芽前进行药剂铲除，刮掉粗皮，清除病残枝干、残桩。全树喷 45%石硫合剂晶体，再\n对树体易发病部位涂抹 70%甲基硫菌灵可湿性粉剂 150 倍液。\n\n（4）6 月下旬和 11 月上旬用 5%菌毒清 500 倍液喷洒，或用甲基硫菌灵涂刷主干、主枝等，防止\n表层产生溃疡和晚秋出现新的坏死病痕，施药前先刮除病疤及表层溃疡斑和粗皮下干斑。\n\n\n\n苹果腐烂病 病枝干\n\n\n\n苹果腐烂病 溃疡型病枝干\n\n\n\n苹果腐烂病 子囊壳、子囊，子囊孢子和拟侧丝\n\n\n\n\n\n\n苹果干腐病 病枝干\n\n苹果轮纹病\n\n·病原· 葡萄座腔菌（ Botryosphaeria dothidea ）和粗皮葡萄座腔菌（ B. kuwatsukai ），均属子囊菌\n亚门（Ascomycotina）葡萄座腔菌属（ Botryosphaeria ），又称粗皮病。\n\n·症状· 主要侵染枝干和果实。先是侵染枝干，随后通过降雨侵染果实。危害枝干：病菌从皮孔中心\n侵入，形成扁圆形或椭圆形、红褐色小病斑，质地紧硬，边缘龟裂，与正常组织形成一道环沟。翌\n年龟裂加深，病变组织翘起，病斑连在一起，表皮粗糙。侵染果实：一般从幼果开始，多在近成熟\n期和贮藏期发病，以皮孔为中心，生成水浸状小斑点，后形成同心轮纹状，向四周扩大，病部呈现\n褐色或淡褐色，并有茶褐色黏液溢出。如条件适宜，病斑发展快，病果不凹陷，不变形，有酸臭\n味。\n\n·发病规律· 以菌丝体、子座在被害枝干、死枝及散落在果园中的树枝上越冬。春季温度回升后，越\n冬菌丝体扩展危害，通过风雨传播，侵染枝干、果实或叶片。当气温20℃以上，相对湿度75%以\n上，或连续降雨3~4天，病原开始在果园内传播、侵染。雨量大，降雨日数多，病菌孢子释放量\n多，寄主感染概率增加，病害发生严重；干旱易导致树势衰弱，诱发枝干严重发病。果实自坐果后\n至成熟期（4 月底至9 月）均能感染轮纹病，尤以 5~7 月为病菌集中侵入时期。随着果实长大和表\n皮木栓化，果实染病率不断下降。近成熟的果实抗侵入能力较强，抗扩展能力较弱。\n\n·防治方法·\n\n（1）培育、选用无病苗木，发现病苗应立即拔除，并及时喷药保护。\n\n（2）冬季结合修剪，剪除病虫枝，发芽前带出园外烧毁。发芽前喷 5 波美度石硫合剂。\n\n（3）开春刮除主干和主枝上病斑，并涂杀菌剂。\n\n（4）在落花后 7~10 天，每隔 10~15 天喷 1 次，共喷 2~3 次。可选用药剂有 1∶2（~3）∶200 波\n尔多液、70%甲基硫菌灵可湿性粉剂 800 倍液，或 10%苯醚甲环唑水分散粒剂 1 500 倍液等。\n\n\n\n苹果轮纹病 果实被害状\n\n苹果轮纹病 果实被害状\n\n\n\n苹果轮纹病 果实被害状（后期）\n\n苹果轮纹病 果实被害状\n\n\n\n\n\n\n苹果轮纹病 枝干被害状\n\n苹果褐斑病",
      "·病原· 有性阶段为苹果双壳菌（ Diplocarpon mali Harada et Sawamura），属子囊菌门双壳属（\nDiplocarpon ）真菌；无性阶段为苹果盘二孢[ Marssonina coronaria （Ell. et Davis） Davis]，属半\n知菌亚门（Deuteromycotina）盘二孢属（ Marssonina ）真菌。\n\n·症状· 主要危害叶片，也侵染果实。叶片上症状有 3 种类型。\n\n（1）同心轮纹型：发病初期在叶片正面形成黄褐色小点，近圆形，后期病斑表面产生同心轮纹状\n排列的小黑点。\n\n（2）针芒型：病斑呈放射状（针芒状）向外扩展。病斑小，数量较多，常遍布叶片。\n\n（3）混合型：病斑较大，近圆形，其外缘呈针芒状，后期病斑中部灰白色，外缘绿色，其上散生\n许多小黑点。\n\n·发病规律· 以分生孢子盘、子囊盘或未受精的菌丝团在落叶和病梢中越冬。春季温度回升、多雨\n时，产生子囊孢子或分生孢子，通过风雨传播。附着胞和侵染丝直接从叶面或叶背侵入，树冠下部\n和内膛叶片最先发病，逐渐向上及外围蔓延。在苹果生长季节，病菌可产生分生孢子进行再侵染。\n潮湿是落叶上病菌形成子囊盘的必要条件。弱树、弱枝发病重，壮树发病轻。管理粗放果园病害发\n生早而重。\n\n·防治方法·\n\n（1）搞好清园：秋末清除园内落叶，集中烧毁。冬前深翻果园，促进病残体分解。早春苹果发芽\n前，在树体及其地面喷布 45%石硫合剂晶体。\n\n（2）加强栽培管理：提高树体抗病力，土壤肥力较差的果园，要增施肥料。合理修剪，注意改善\n树冠内的通风透光。\n\n（3）喷药保护：药剂防治重点应在前期，一般在落花后 10 天左右即开始喷第一次药，每隔 10~15\n天左右喷 1 次药，连续喷施 4~5 次。常用药剂有 10%多抗霉素 1 200 倍液、80%戊唑醇可湿性粉剂\n3 000 倍液、70%代森联干悬浮剂 1 000 倍液等。\n\n\n\n苹果褐斑病 叶片被害状\n\n\n\n苹果褐斑病 叶片被害状\n\n苹果褐斑病 叶片被害状\n\n\n\n苹果褐斑病 果实被害状\n\n苹果斑点病\n\n·病原· 链格孢苹果专化型（ Alternaria alternaria f.sp. mali），属半知菌亚门（Deuteromycotina）链\n格孢属（ Alternaria ）真菌。\n\n·症状· 果面出现黑红斑点，红斑点比例占 80%以上，但不烂果。果顶周围斑点最多，果梗周围几乎\n不见。红斑中有一些斑点，初发为小黑斑，后发软裂口或软化烂果。\n\n·发病规律· 以菌丝体在病落叶、病枝等病残体和秋梢顶芽上越冬。4、5 月降雨时，越冬病菌可产\n生大量分生孢子，通过风雨传播，从伤口或表皮直接侵入幼叶、新梢和果实等组织。降雨早、雨日\n多、雨量大，发病早、发病期长、发病重。树势衰弱，发病重。\n\n·防治方法·\n\n（1）加强栽培管理，增强树势，提高树体抗病力。秋冬季节清除园内残枝落叶、病虫果集中处理\n以减少菌源量；增施腐熟农家肥；改良土壤，不偏施氮肥；合理修剪，改善果园通风透光条件，保\n证枝枝见光，同时，提高土壤通气性；7~9月份多雨季节温度高，湿度大，应防止果园积水，要及\n时排水。\n\n（2）药剂防治：谢花后套袋前新梢生长期，全园喷施 1~2 次 80%代森锰锌可湿性粉剂 800 倍液。\n果实膨大期全园喷施 43%戊唑醇悬浮剂 3 000 倍液，或 10%苯醚甲环唑水分散粒剂 1 500 倍液，或\n40%氟硅唑可湿性粉剂 4 000 倍液。果实着色至成熟期，除袋后及时给树上补喷 1 次 5%吡唑醚菌\n酯+55%代森联水分散粒剂，进一步杀灭病菌。\n\n\n\n苹果斑点病 病果\n\n\n\n苹果斑点病 病果\n\n\n\n苹果斑点病 病果\n\n苹果斑点病 病果\n\n\n\n苹果斑点病 病果\n\n\n\n苹果斑点病 病果\n\n苹果炭疽病\n\n·病原· 有性阶段为炭疽病菌[ Glomerella cingulate （Stonem.） Spauld. et Schrenk]属子囊菌亚门\n（Ascomycotina）小丛壳属（ Glomerella ）；无性阶段为胶孢炭疽菌（ Colletotrichum\ngloeosporioides Penz. et Sacc.），属半知菌亚门（Deuteromycotina）炭疽菌属（ Colletotrichum ）。"
    ]
  },
  {
    "question": "柑橘红蜘蛛（柑橘全爪螨）生长的最适温度范围是多少？",
    "answer": "柑橘红蜘蛛生长发育的最适温度范围为24～28℃。",
    "standard_answer": "温度24~28℃是柑橘红蜘蛛生长发育的最适气候。",
    "contexts": [
      "（2）及时清理残枝败叶，集中处理销毁，切断其越冬病源和媒介昆虫，减少发病率。及时处理田\n间杂草，防止病原微生物和媒介昆虫在其他寄主上繁殖。\n\n（3）在落花后 1 个月内，每隔 10~15 天喷药 1 次，重点防治蚧、蚜、粉虱等刺吸式口器害虫。可\n用 99%矿物油乳油 100~200 倍液，或 99%矿物油 100~150倍液，或松脂合剂 8~10 倍液，或 70%代\n森联水分散粒剂 500 倍液进行防治。\n\n已发生煤污病的果园，可在冬春清园期喷 65%甲硫·乙霉威可湿性粉剂 1 000倍液，或 40%克菌丹悬\n浮剂 400 倍液，或 0.5∶1∶100 倍式波尔多液，或 70%甲基硫菌可湿性粉剂 600~800 倍液，或 50%\n多菌灵可湿性粉剂 600~800 倍液。\n\n柑橘煤污病 植株被害状\n\n\n\n柑橘煤污病 病叶\n\n红蜡蚧并发煤污病\n\n\n\n柑橘煤污病 病叶\n\n柑橘煤污病 病叶\n\n\n\n柑橘虫害\n\n柑橘红蜘蛛\n\n·学名· Panonychus citri McGregor，又名柑橘全爪螨，属蛛形纲（Arachnida）全爪螨属（\nPanonychus ）。\n\n·鉴别特征· 雌成螨：约长0.39 mm，宽约0.26 mm，近椭圆形。雄成螨：鲜红色，体型略小于雌成\n螨。若虫：身体比成虫小，足 4 对，身体颜色与成虫差别不大。幼虫：体较小，长 0.2 mm，初孵\n时足 3 对，体色呈淡红色。卵：一般多产在叶面和叶背中脉两旁。\n\n·生活习性· 喜干旱，多雨不利发生。温度 24~28℃、相对湿度 60%~85%是红蜘蛛生长发育的最适\n气候，高于 34℃或低于 11℃时生长受到抑制。上海地区红蜘蛛的发生高峰一般出现在 5~6 月；若\n气候适宜，9~10 月也可能再次发生高峰。\n\n·危害特点· 主要危害柑橘叶片和果实。被害叶片呈现大面积灰白，失去光泽，并最终脱落。幼果和\n成熟果实受害后表面出现淡绿色和淡黄色斑点，品质下降。\n\n·防治方法·\n\n（1）冬季清园时，结合修剪，将柑橘红蜘蛛的受害枝叶剪除并集中烧毁。田间释放捕食螨捕食柑\n橘红蜘蛛，开展无公害防治。\n\n（2）气温低于 25℃时，可以用 99%矿物油乳油 100~200 倍液喷雾，对叶片的上下两面喷洒均匀，\n不遗漏。\n\n（3）药剂防治：在若虫期，可选用 4%阿维菌素+24%螺虫乙酯悬浮剂 5 000~7 000 倍液喷雾 1\n次。柑橘红蜘蛛始发盛期时，喷雾 43%联苯肼酯悬浮剂 1 900~2 400 倍液，或 20%丁氟螨酯悬浮剂\n1 500~2 500 倍液（在柑橘树上每季最多使用1 次）。喷雾时应使作物叶面正反面、果实表面以及\n树干、枝条等部位均匀着药。\n\n\n\n\n\n\n柑橘红蜘蛛 柑橘苗被害状\n\n柑橘红蜘蛛 卵\n\n\n\n柑橘红蜘蛛 成虫\n\n柑橘红蜘蛛 群集危害\n\n\n\n柑橘红蜘蛛 成虫\n\n\n\n柑橘红蜘蛛 群集危害叶片\n\n\n\n柑橘红蜘蛛 危害柑橘叶片\n\n柑橘锈壁虱\n\n·学名· Phyllocoptruta oleivora Ashmead，属蛛形纲（Arachnida）瘿螨科（Eriophyidae），又名柑橘\n锈瘿螨、柑橘铜病。\n\n\n\n·鉴别特征· 成螨：体长 0.1~0.2 mm，胡萝卜形或楔形，黄色或橙黄色，头小，向前方伸出。幼\n螨：孵出时为三角形。若螨：体形如成螨，但较小，半透明。\n\n·生活习性· 以成螨在夏、秋梢腋芽、卷叶等部位越冬。越冬螨在 15℃左右时开始活动、产卵。当\n平均气温达 20℃以上时繁殖迅速，7~8 月高温季节种群迅速扩大，易造成果面严重危害。\n\n·危害特点· 成螨、若螨均可危害，以口器刺入柑橘组织吸食汁液。叶片、枝梢、果实被害后，油胞\n破裂，芳香油溢出，经空气氧化，叶背和果皮变成污黑色，叶片受害严重时变小、变脆、畸形，当\n年抽生的春梢叶片大量脱落；果实受害变黑褐色，果皮粗糙布满网状细纹或古铜色锈斑，品质及商\n品价值降低。\n\n·防治方法·\n\n（1）加强栽培管理，肥水管理，增施有机肥，改善果园生态环境，使植株生长健壮，抗病虫力增\n强。\n\n（2）保护利用锈壁虱的天敌，主要有食螨瓢虫、捕食螨、具瘤长须螨、蓟马和多毛菌等。",
      "（4）安全间隔期：柑橘树 20 天，每个生长季最多施用 2 次；苹果树 21 天，每个季节最多施药 2\n次；梨树 21 天，每个生长季最多施药 2 次。\n\n（5）为了避免和延缓抗性的产生，建议与其他不同作用机制的杀虫剂轮用，同时应确保无不良影\n响。\n\n［注意事项］\n\n（1）在配制和施用本品时，仍应穿防护服、戴手套、口罩；严禁吸烟和饮食。\n\n\n\n（2）避免误食或溅到皮肤、眼睛等处。\n\n（3）施药后应用肥皂和足量清水冲洗手部、面部和其他身体裸露部位以及受药剂污染的衣物等。\n\n（4）空包装应两次清洗并砸烂或划破后妥善处理，切勿重复使用。\n\n（5）水产养殖区、河塘等水体附近禁用，禁止在河塘等水域中清洗施药器具。\n\n（6）开花植物花期、桑园及蚕室附近禁用。\n\n（7）孕妇及哺乳期的妇女应避免接触。\n\n24%螺螨酯悬浮剂\n\n［产品特点］ 本剂是一种酮烯醇类杀螨剂，杀螨机理与一般杀螨剂完全不同。其通过抑制叶螨脂\n肪合成，破坏其能量代谢来杀死害螨，故对现有的抗性害螨均有效。对叶螨的卵，若螨及雌成螨都\n有触杀效果，但以杀卵效果最好。适合于害螨的综合防治。本剂持效期长，在稀释 4 000~5 000 倍\n时，喷药 1 次对柑橘全爪螨的控制时间长达 35~45 天。杀螨谱广。除柑橘全爪螨外，还能有效防\n治柑橘始叶螨（黄蜘蛛）、柑橘锈壁虱（锈螨）、山楂叶螨、朱砂叶螨和一斑叶螨。对作物安全，\n在高温下施用对柑橘的不同品种也很安全。亲脂性强，耐雨水冲刷。施药 3 小时后遇阴雨不影响药\n效。毒性很低，对人和自然环境比较安全。\n\n［防治对象及使用方法］\n\n技术要点\n\n（1）使用前，充分摇匀；使用时均匀喷雾。\n\n（2）安全间隔期：柑橘树 30 天，每个生长季最多施用 1 次。\n\n（3）为了避免害螨产生抗药性，建议与其他作用机制不同的药剂轮用，避免在作物花期施药，以\n免对蜂群产生影响。\n\n［注意事项］\n\n（1）在配制和使用时，应穿防护服，戴手套，口罩，严禁吸烟和饮食。避免误食或溅到皮肤、眼\n睛；如溅入眼中，立即用大量清水冲洗。\n\n（2）药后应用肥皂和足量清水冲洗手部、面部和其他裸露在外身体部位以及药剂污染的衣物等。\n\n（3）孕妇及哺乳期孕妇禁止接触。\n\n（4）本品对鱼类等水生生物有毒，远离水产养殖区施药，禁止在河塘等水体中清洗施药器具。\n\n34%螺螨酯悬浮剂\n\n［产品特点］ 螺螨酯属于非内吸性杀螨剂，主要通过触杀和胃毒作用防治卵、若螨和雌成螨的杀\n螨剂，其作用机制为抑制害螨体内脂肪合成、阻断能量代谢，与常规杀螨剂无交互抗性；其杀卵效\n果突出，并对不同发育阶段的害螨（雄性成螨除外）均有较好防效，可在柑橘的各个生长期使用。\n\n［防治对象及使用方法］\n\n\n\n技术要点\n\n（1）在红蜘蛛盛发初期施药。施用时应使作物叶片正反面、果实表面以及树干、枝条等充分均匀\n着药。\n\n（2）大风天或预计 1 小时内有雨，勿施药。\n\n（3）安全间隔期：柑橘树 30 天；每个生长季最多施用 1 次。\n\n（4）为了避免害螨产生抗药性，建议与其他作用机制不同的药剂轮用。\n\n［注意事项］\n\n（1）避免在作物花期施药，以免对蜂群产生影响。\n\n（2）在配制和施用本品时，应穿防护服，戴手套、口罩，严禁吸烟和饮食。\n\n（3）避免误食或溅到皮肤、眼睛。如溅入眼中，应立即用大量清水冲洗。\n\n（4）药后应用肥皂和足量清水冲洗手部、面部和其他裸露的身体部位以及药剂污染的衣物等。\n\n（5）本品对鱼类等水生生物有毒，远离水产养殖区施药，禁止在河塘等水体中清洗施药器具。\n\n（6）用药过后的空瓶应置于安全场所，不应随便放置。\n\n（7）孕妇及哺乳期妇女避免接触。\n\n240g/L螺螨酯悬浮剂\n\n［产品特点］ 螺螨酯属于非内吸性杀螨剂，主要通过触杀和胃毒作用防治卵、若螨和雌成螨的杀\n螨剂，其作用机制为抑制害螨体内脂肪合成、阻断能量代谢，与常规杀螨剂无交互抗性；其杀卵效\n果突出，并对不同发育阶段的害螨（雄性成螨除外）均有较好防效。\n\n［防治对象及使用方法］\n\n技术要点\n\n（1）本品应于柑橘树红蜘蛛盛发初期施药，对柑橘树植株枝条及叶片正反面常规均匀喷雾。\n\n（2）本品在柑橘上的安全间隔期为 20 天，每季最多使用 1 次。\n\n（3）大风天或预计 1 小时内下雨，勿施药。\n\n（4）为了避免害螨产生抗药性，建议与其他作用机制不同的药剂轮用。\n\n［注意事项］\n\n（1）本品对蜜蜂、鱼类等水生生物、家蚕有毒，施药期间应避免对周围蜂群的影响，禁止在开花\n植物花期、蚕室和桑园附近使用。远离水产养殖区、河塘等水域施药，禁止在河塘等水域清洗施药\n\n\n\n器具。赤眼蜂等天敌放飞区域禁用。\n\n（2）在配制和施用本品时，应穿防护服，戴手套、口罩，严禁吸烟和饮食。\n\n（3）孕妇及哺乳期妇女禁止使用。",
      "目前，全国生产柑橘包括台湾在内有 19 个省（直辖市、自治区），南起海南三亚，北至陕、甘、\n豫，东起台湾，西到西藏雅鲁藏布江河谷，均有柑橘的身影。直至 2018 年，中国柑橘栽培面积达\n4 000 余万亩，产量达3 900 多万t，是我国栽培面积及产量最大的水果。上海现有柑橘种植面积5.4\n万亩，栽培区域主要集中在崇明区。得天独厚的生态岛环境，使崇明柑橘自 20 世纪 70 年代开始就\n得到迅速发展，并创造了柑橘北缘地区生产栽培的奇迹。作为全市唯一的出口鲜果，崇明柑橘每年\n都远销加拿大、东南亚等地。\n\n近年来，柑橘在华东地区主要病害有柑橘疮痂病、树脂病、炭疽病、白粉病、煤污病、青霉病、绿\n霉病和苗期立枯病等，主要虫害有红蜘蛛、锈壁虱、黑刺粉虱、柑橘粉虱、矢尖蚧、红蜡蚧、橘\n蚜、橘小实蝇、柑橘花蕾蛆、柑橘潜叶蛾、斜纹夜蛾、柑橘凤蝶、蜗牛和蛞蝓类等。监测的方法主\n要包括人工调查监测、测报灯监测、昆虫信息素监测和孢子捕捉仪监测等。\n\n\n\n柑橘病害\n\n柑橘疮痂病\n\n·病原· 柑橘痂囊腔菌（ Elsinoe fawcettii Bitancourt et Jenk.），属子囊菌亚门（Ascomycotina）痂囊\n腔菌属（ Elsinoe ）；无性阶段为柑橘痂圆孢菌（ Sphaceloma fawcettii Jenkins），属半知菌亚门\n（Deuteromycotina）痂圆孢属（ Sphaceloma ）。\n\n·症状· 主要危害春梢、嫩叶、幼果、花蕾等幼嫩组织。叶片受害初期会产生水渍状黄褐色圆形小斑\n点，后扩大颜色变为蜡黄色，病斑木质化向叶背部位突起呈圆锥形的疮痂，似牛角或漏斗状，叶片\n畸形扭曲。感病枝梢变短而小、扭曲，严重时叶片早期脱落。花瓣受害很快凋落。花瓣落后不久，\n幼果随即产生与叶片相似症状，引起早期落果。近成熟果实染病，病斑小，不明显。\n\n·发病规律· 病原在病枝、叶上越冬，气温达到 15℃以上且多雨潮湿时借助风雨传播。疮痂病只侵\n染幼嫩组织，刚抽出而未展开的嫩叶、嫩梢以及刚谢花的幼果最易受侵害，随着组织不断老熟，抗\n病能力逐渐增强，组织完全老熟后则不会感病。该病发生的温度范围为 15~24℃，在春梢和幼果期\n发生严重；温度高于24℃后很少发病；橘类最易感病。夏梢期由于气温较高，一般发病较轻。15\n年以上树龄发病较轻；反之，较重。\n\n·防治方法·\n\n（1）冬季清除病果病枝，深埋已落入土中的病果，减少越冬病源，对越冬初始侵染源可每亩用 1.5\nkg 45%石硫合剂晶体喷雾。\n\n（2）合理修剪、整枝，增强通透性，降低湿度；控制肥水，增施有机肥，培育健壮树势，促使新\n梢抽发整齐，提高树体抵抗力，减少侵染机会。\n\n（3）一般 1 年喷药 2~3 次，可有效控制该病。第一次在早春萌芽时，第二次在落花时，第三次是\n在第二次用药后间隔 3 周。春芽期和花谢 2/3 时，以防治幼果疮痂病为重点，可选择 70%代森联水\n分散粒剂 500~580 倍液，或 12.5%烯唑醇可湿性粉剂 1 500倍液，或 17.5%氟吡菌酰胺加 17.5%戊\n唑醇悬浮剂 100~200 mg/kg，或 60%唑醚·代森联水分散粒剂1 500倍液等药剂，均匀喷雾即可。注\n意农药的使用次数和安全间隔期。\n\n\n\n柑橘疮痂病 病叶\n\n\n\n柑橘疮痂病 幼果被害状\n\n\n\n柑橘疮痂病 病叶\n\n柑橘疮痂病 病果\n\n\n\n\n\n\n柑橘疮痂病 嫩梢被害状\n\n柑橘疮痂病 病果\n\n\n\n柑橘疮痂病 分生孢子盘和分生孢子\n\n柑橘树脂病\n\n·病原· 柑橘间座壳菌[ Diaporthe citri （Fawcett） Wolf]，属子囊菌亚门（Ascomcotina）痂囊腔菌属\n（ Elsinoe ）。又称砂皮病，因发病部位不同又有不同的别称，发生在枝干上的称为树脂病或流胶\n病，发生在幼果和嫩叶上的称为黑点病或砂皮病，发生在储藏期则称为蒂腐病。\n\n·症状· 主要危害柑橘的枝干、叶片及青果，受害表面散生许多黄褐色或黑褐色小粒，密集成片，手\n感粗糙，凹凸不平。危害主干或主干分杈，流胶型病部初呈灰褐色水渍状，组织松软，皮层具有细\n小裂缝，后流有褐色胶液，边缘皮层干枯或坏死翅起，木质部裸露。干枯型的病部呈红褐色，略下\n陷的皮层干枯，但不剥落。危害叶片时，表面散生黑色硬质突起小点，有的很多密集成片，呈砂皮\n状。危害果实时先是果蒂处产生水渍状圆形褐色病斑，随后病斑向脐部扩展，边缘呈波纹状。\n\n·发病规律· 该病菌丝的寄生性不强，必须在寄主生长衰弱或受伤的情况下才能侵入危害，寄主生长\n不良或有伤口、多雨潮湿、温度为20℃左右的条件下传播较快，传播媒介为风雨或昆虫。梅雨期和\n秋季柑橘受冻后容易发病。\n\n·防治方法·",
      "·生活习性· 老熟幼虫在树冠下土中 3~7 cm处越冬。成虫在柑橘现蕾期羽化出土，4 月中下旬至 5 月\n初危害严重。成虫多于早、晚活动，以傍晚最盛，飞行力弱，羽化后 1~2 天即可交配产卵；一般\n阴湿低洼橘园发生较多，壤土、砂壤土利于幼虫存活，发生较多，3~4 月多阴雨有利于成虫发生，\n幼虫脱蕾期，多雨有利于幼虫入土。柑橘显蕾开花季节遇多雨天气，该虫发生严重。\n\n·危害特点· 喜在花蕾开始现白、直径 2~3 mm的花蕾内产卵；孵化的幼虫在花蕾内活动取食，并产\n生大量黏液。受害花蕾膨大变形如灯笼，花瓣略带绿色，并有分散绿色小点，导致被害花蕾不能正\n常开花和授粉，最后枯萎脱落，严重影响产量。\n\n·防治方法·\n\n（1）冬季深翻或春季浅耕树冠周围土壤。在开花期发现灯笼状畸形花蕾，立即人工摘除受害花\n蕾，集中园外深埋或烧毁。\n\n（2）多数花蕾变白时，于产卵之前树冠喷药毒杀成虫，可喷洒 75%灭蝇胺可湿性粉剂 5 000 倍液\n等，选择无风，特别是雨后天晴的傍晚或早晨喷施树冠。喷药时周到均匀，每隔 5~7 天喷 1 次，\n共喷 2~3 次；重点是花蕾和叶背，地面和树冠同时喷药。\n\n\n\n柑橘花蕾蛆 幼虫\n\n\n\n柑橘花蕾蛆 蛹\n\n柑橘花蕾蛆 危害花（中间）和正常开放花\n\n\n\n柑橘潜叶蛾\n\n·学名· Phyllocnistis citrella Stainton，属鳞翅目（Lepidoptera）潜叶蛾科（Lyone tiidae），又名橘潜\n蛾、潜叶虫。\n\n·鉴别特征· 成虫：体银白色，体长 2 mm，翅展 4 mm，触角丝状，前翅披针形，翅基部具 2 条黑\n褐色纹，翅近中部有黑褐色“Y”形斜纹，前缘中部至外缘有橘黄色缘毛，顶角有黑圆斑 1 个；后翅\n银白色，针叶形，缘毛极长。卵：椭圆形，白色、透明，底部平而成半圆形突起，长 0.3~0.6\nmm。初孵幼虫：浅绿色，形似蝌蚪。老熟幼虫：体扁平，纺锤形，长约 4 mm，胸腹部背面背中\n线两侧有 4 个凹陷孔，排列整齐。体黄绿色，头三角形，腹部末端尖细，具 1 对细长的铗状物。\n蛹：纺锤形，初为淡黄色，后为深黄褐色，长 2.5 mm。茧：黄褐色。\n\n·生活习性· 一般一年发生 9~10 代，多的达 15 代，世代重叠，多以幼虫和蛹在柑橘的秋梢或冬梢上\n越冬，5 月下旬晚春梢上始见幼虫危害，7~9 月严重危害秋梢。成虫昼伏夜出，飞行敏捷，趋光性\n弱，卵多散产在嫩叶背面主脉附近。初孵幼虫由卵底潜入皮下危害，蛀道白色光亮，有 1 条由虫粪\n组成的细线。\n\n·危害特点· 幼虫潜入嫩叶、嫩梢表皮下蛀食叶肉，形成银白色弯曲的隧道，内留有虫粪，在中央形\n成一条黑线，虫道蜿蜒曲折，导致被害叶卷缩、硬化，叶片易脱落，新梢生长停滞。幼虫危害造成\n的伤口易染溃疡病，常诱发柑橘溃疡病，被害卷叶又为红蜘蛛、介壳虫、卷叶蛾等害虫提供了越冬\n场所。\n\n·防治方法·\n\n（1）结合栽培管理及时抹芽控梢，摘除过早、过晚的新梢，通过水、肥管理使夏梢、秋梢抽发整\n齐健壮。\n\n（2）于潜叶蛾发生始盛期或新梢 3 mm长时，选用 20%氯虫苯甲酰胺悬浮剂3 000 倍液，或 1%苦\n皮藤素水乳剂 4 000~5 000 倍液、0.3%印楝素乳油 400~600倍液、1.8%阿维菌素水乳剂 4 000~5 000\n倍液等喷雾防治。\n\n一般隔 7 天左右喷药 1 次，连喷 2~3 次。防治成虫应在傍晚喷药，潜入叶内的低龄幼虫应在午后\n喷药，并注意药剂的轮换使用。\n\n\n\n柑橘被害状\n\n\n\n柑橘潜叶蛾 卵\n\n柑橘潜叶蛾 成虫\n\n\n\n柑橘潜叶蛾 幼虫\n\n\n\n柑橘潜叶蛾 蛹\n\n\n\n柑橘被害状\n\n\n\n柑橘潜叶蛾 幼虫\n\n\n\n柑橘潜叶蛾 幼虫\n\n\n\n柑橘潜叶蛾 成虫\n\n斜纹夜蛾\n\n·学名· Prodenia litura Fabricius，属鳞翅目（Lepidoptera）夜蛾科（Noctuidae），又名连纹夜蛾、斜\n纹贪夜蛾。\n\n·鉴别特征· 成虫：体长 16~21 mm，翅展 37~42 mm，全体灰褐色；前翅黄褐色，具有复杂的黑褐\n色斑纹，后翅白色，带有红色闪光，外缘有 1 条褐色线。老熟幼虫：体长 38~51 mm，体色因虫\n龄、食料、季节而变化，从初孵幼虫时的绿色渐变为老熟时的黑褐色，背线、亚背线橘黄色，亚背\n线内侧具三角形黑斑一对。卵：半球形，直径约 0.5 mm，成块，黄白色，外覆黄白色绒毛。蛹：\n长 18~20 mm，圆筒形，赤褐至暗褐色。\n\n·生活习性· 斜纹夜蛾为迁飞性害虫。主要以蛹在土中越冬。成虫昼伏夜出，有较强的趋光性，喜食\n糖、酒、醋等发酵物。成虫多产卵于叶背，产卵后 2~3 天即能孵化，初孵幼虫常群集危害，2~3 龄\n后分散，4 龄后进入暴食期。幼虫畏光，7 月下旬至 9 月下旬为盛发期。",
      "（3）入冬后剪除枯枝、病虫枝和残弱枝等，并移出园外烧毁。树干刷石灰水，消灭越冬虫源。每\n月喷施 45%石硫合剂结晶 150~200 倍液。春季清园可在柑橘萌芽前进行，药剂可选用 20%松脂酸\n钠可溶粉剂 150~200 倍液。当发现春梢的叶片上有锈色或黑色斑点，个别果实有暗灰色或黑色斑\n点，或个别枝梢叶片黄褐色脱落时，应立即喷药防治。叶背、叶面应均匀喷布，尤其是树冠下部、\n内膛和果实的背阴面，都要喷到。药剂可选用 50%苯丁锡可湿性粉剂 2 000~3 000 倍液等。结合潜\n叶蛾及其他虫害防治，也可选 1.8%阿维菌素水乳剂 2 500 倍液。\n\n柑橘锈壁虱 危害柑橘果实\n\n\n\n柑橘锈壁虱 危害果实\n\n\n\n柑橘锈壁虱 若螨\n\n\n\n柑橘锈壁虱 成螨\n\n\n\n柑橘锈壁虱 被害果、叶\n\n黑刺粉虱\n\n·学名· Aleurocanthus spiniferus Quaintance，属半翅目（Hemiptera）粉虱科（Aleyrodidae），又名橘\n刺粉虱。\n\n·鉴别特征· 常见虫态为若虫，共四个龄期。成虫：体长 0.96~1.3 mm，橙黄色，体表薄敷白色蜡\n粉；前翅紫褐色，上有 7 个白斑；后翅小，淡紫褐色。若虫：体长0.7 mm，黑色，体背上具刺毛\n14 对，体周缘泌有明显的白蜡圈。卵：香蕉形，长0.25 mm，基部钝圆，有1小柄，直立附着在叶\n上，初乳白后变淡黄，孵化前灰黑色。蛹：椭圆形，黑色有光泽，蛹壳边缘锯齿状，壳背显著隆\n起，背脊两侧具 19 对黑刺，周缘有 10 对（雄）或 11 对（雌）黑刺。\n\n·生活习性· 上海 1 年发生 3 代，主要以四龄若虫在叶片背面越冬，于翌年 4 月中下旬羽化，成虫喜\n产卵于嫩叶背面；第一代发生期在 5 月上旬到 7 月，第二代 7月到 8 月底，第三代 9 月下旬到 11\n月。成虫喜较阴暗的环境，有趋嫩（新）性，成虫盛发期与新梢抽出期一致，在树冠内膛枝叶上活\n动。初孵若虫多在卵壳附近爬动吸食。\n\n·危害特点· 成虫、若虫刺吸叶、果实和嫩枝的汁液，被害叶出现失绿黄白斑点，后斑点扩展成片，\n后期全叶苍白早落；被害果实风味品质降低，幼果受害严重时常脱落。严重时，一叶可达数百头，\n虫体堆叠，并分泌蜜露诱发煤污病，使柑橘树枝叶发黑，枝弱叶薄，树势弱，开花少，产量低，果\n质劣。\n\n·防治方法·\n\n（1）冬季剪除果树内膛的弱枝、交叉荫蔽枝，减少越冬基数；及时抹除夏梢，清除成虫产卵场\n所，抹梢还可兼治柑橘潜叶蛾；种植绿肥，保留果园良性杂草。\n\n（2）设置黄色黏虫板诱杀成虫。也可分区连片安装杀虫灯或在果园放置诱虫带，诱杀成虫。\n\n（3）在开展药剂防治时，抓住冬季清园，可喷 99%矿物油乳油 100~200 倍液杀灭越冬若虫。黑刺\n粉虱发生严重的果园，在第二代和第三代若虫盛发期再防治2~3 次。可选用 22.4%螺虫乙酯悬浮剂\n4 000~5 000 倍液喷雾。喷药做到均匀，并尽量喷到叶背，才有良好效果。注意要交替使用不同类\n型的药剂，以上药剂与矿物油乳油农药混用，可以提高防效并兼治煤污病，减少锈果率，提高果品\n\n\n\n的商品价值。\n\n黑刺粉虱 危害状\n\n黑刺粉虱 危害初期\n\n\n\n黑刺粉虱 危害初期\n\n黑刺粉虱 危害初期\n\n柑橘粉虱\n\n·学名· Dialeurodes citri Ashmead，属半翅目（Hemiptera）粉虱科（Aleyrodidae），别名橘绿粉虱、\n裸粉虱、通草粉虱等。\n\n·鉴别特征· 成虫：体长 1~1.2 mm，黄色，翅半透明，披有一层白色蜡粉。若虫：体小扁平，椭圆\n形，淡黄色，长约 0.7 mm，有半透明蜡质物披盖，触角随龄期变化呈现出不同形态和结构。蛹：\n椭圆形，长 1.3~1.6 mm，扁平，质软薄而透明，背面无刺毛。\n\n\n\n·生活习性· 上海地区一年发生 3 代，一般以大龄幼虫或蛹在叶背越冬。翌年 4月下旬开始羽化，越\n冬代和第一代成虫盛发期分别在 5 月上旬和 7 月中旬，第二代受气候、食源等因素的影响，会在\n8~9 月呈现出 2~3 次的高峰，12 月底停止羽化，进入越冬期。该虫喜阴湿环境，在郁闭度大和徒\n长枝多的橘园发生较严重。\n\n·危害特点· 幼虫群集叶片背面吸食汁液，造成柑橘树体营养生长停滞、落叶、新梢抽发少，抑制植\n物及果实发育。柑橘粉虱一旦大发生，橘园紧接着会诱发煤污病大发生，特别是 8、9 两个月，粉\n虱危害导致柑橘叶片布满霉层，使叶片失去光合作用能力，后期果实停滞不长，果小味酸。\n\n·防治方法·\n\n（1）冬季剪除果树内膛的弱枝、交叉荫蔽枝，减少越冬基数；及时抹除夏梢，清除成虫产卵场\n所，抹梢还可兼治柑橘潜叶蛾；种植绿肥，保留果园良性杂草。\n\n（2）设置黄色黏虫板诱杀成虫；也可分区连片安装杀虫灯或在果园放置诱虫带，诱杀成虫。"
    ]
  },
  {
    "question": "黑刺粉虱主要以什么虫态在何处越冬？",
    "answer": "黑刺粉虱主要以四龄若虫在叶片背面越冬。",
    "standard_answer": "黑刺粉虱主要以四龄若虫在叶片背面越冬。",
    "contexts": [
      "（3）入冬后剪除枯枝、病虫枝和残弱枝等，并移出园外烧毁。树干刷石灰水，消灭越冬虫源。每\n月喷施 45%石硫合剂结晶 150~200 倍液。春季清园可在柑橘萌芽前进行，药剂可选用 20%松脂酸\n钠可溶粉剂 150~200 倍液。当发现春梢的叶片上有锈色或黑色斑点，个别果实有暗灰色或黑色斑\n点，或个别枝梢叶片黄褐色脱落时，应立即喷药防治。叶背、叶面应均匀喷布，尤其是树冠下部、\n内膛和果实的背阴面，都要喷到。药剂可选用 50%苯丁锡可湿性粉剂 2 000~3 000 倍液等。结合潜\n叶蛾及其他虫害防治，也可选 1.8%阿维菌素水乳剂 2 500 倍液。\n\n柑橘锈壁虱 危害柑橘果实\n\n\n\n柑橘锈壁虱 危害果实\n\n\n\n柑橘锈壁虱 若螨\n\n\n\n柑橘锈壁虱 成螨\n\n\n\n柑橘锈壁虱 被害果、叶\n\n黑刺粉虱\n\n·学名· Aleurocanthus spiniferus Quaintance，属半翅目（Hemiptera）粉虱科（Aleyrodidae），又名橘\n刺粉虱。\n\n·鉴别特征· 常见虫态为若虫，共四个龄期。成虫：体长 0.96~1.3 mm，橙黄色，体表薄敷白色蜡\n粉；前翅紫褐色，上有 7 个白斑；后翅小，淡紫褐色。若虫：体长0.7 mm，黑色，体背上具刺毛\n14 对，体周缘泌有明显的白蜡圈。卵：香蕉形，长0.25 mm，基部钝圆，有1小柄，直立附着在叶\n上，初乳白后变淡黄，孵化前灰黑色。蛹：椭圆形，黑色有光泽，蛹壳边缘锯齿状，壳背显著隆\n起，背脊两侧具 19 对黑刺，周缘有 10 对（雄）或 11 对（雌）黑刺。\n\n·生活习性· 上海 1 年发生 3 代，主要以四龄若虫在叶片背面越冬，于翌年 4 月中下旬羽化，成虫喜\n产卵于嫩叶背面；第一代发生期在 5 月上旬到 7 月，第二代 7月到 8 月底，第三代 9 月下旬到 11\n月。成虫喜较阴暗的环境，有趋嫩（新）性，成虫盛发期与新梢抽出期一致，在树冠内膛枝叶上活\n动。初孵若虫多在卵壳附近爬动吸食。\n\n·危害特点· 成虫、若虫刺吸叶、果实和嫩枝的汁液，被害叶出现失绿黄白斑点，后斑点扩展成片，\n后期全叶苍白早落；被害果实风味品质降低，幼果受害严重时常脱落。严重时，一叶可达数百头，\n虫体堆叠，并分泌蜜露诱发煤污病，使柑橘树枝叶发黑，枝弱叶薄，树势弱，开花少，产量低，果\n质劣。\n\n·防治方法·\n\n（1）冬季剪除果树内膛的弱枝、交叉荫蔽枝，减少越冬基数；及时抹除夏梢，清除成虫产卵场\n所，抹梢还可兼治柑橘潜叶蛾；种植绿肥，保留果园良性杂草。\n\n（2）设置黄色黏虫板诱杀成虫。也可分区连片安装杀虫灯或在果园放置诱虫带，诱杀成虫。\n\n（3）在开展药剂防治时，抓住冬季清园，可喷 99%矿物油乳油 100~200 倍液杀灭越冬若虫。黑刺\n粉虱发生严重的果园，在第二代和第三代若虫盛发期再防治2~3 次。可选用 22.4%螺虫乙酯悬浮剂\n4 000~5 000 倍液喷雾。喷药做到均匀，并尽量喷到叶背，才有良好效果。注意要交替使用不同类\n型的药剂，以上药剂与矿物油乳油农药混用，可以提高防效并兼治煤污病，减少锈果率，提高果品\n\n\n\n的商品价值。\n\n黑刺粉虱 危害状\n\n黑刺粉虱 危害初期\n\n\n\n黑刺粉虱 危害初期\n\n黑刺粉虱 危害初期\n\n柑橘粉虱\n\n·学名· Dialeurodes citri Ashmead，属半翅目（Hemiptera）粉虱科（Aleyrodidae），别名橘绿粉虱、\n裸粉虱、通草粉虱等。\n\n·鉴别特征· 成虫：体长 1~1.2 mm，黄色，翅半透明，披有一层白色蜡粉。若虫：体小扁平，椭圆\n形，淡黄色，长约 0.7 mm，有半透明蜡质物披盖，触角随龄期变化呈现出不同形态和结构。蛹：\n椭圆形，长 1.3~1.6 mm，扁平，质软薄而透明，背面无刺毛。\n\n\n\n·生活习性· 上海地区一年发生 3 代，一般以大龄幼虫或蛹在叶背越冬。翌年 4月下旬开始羽化，越\n冬代和第一代成虫盛发期分别在 5 月上旬和 7 月中旬，第二代受气候、食源等因素的影响，会在\n8~9 月呈现出 2~3 次的高峰，12 月底停止羽化，进入越冬期。该虫喜阴湿环境，在郁闭度大和徒\n长枝多的橘园发生较严重。\n\n·危害特点· 幼虫群集叶片背面吸食汁液，造成柑橘树体营养生长停滞、落叶、新梢抽发少，抑制植\n物及果实发育。柑橘粉虱一旦大发生，橘园紧接着会诱发煤污病大发生，特别是 8、9 两个月，粉\n虱危害导致柑橘叶片布满霉层，使叶片失去光合作用能力，后期果实停滞不长，果小味酸。\n\n·防治方法·\n\n（1）冬季剪除果树内膛的弱枝、交叉荫蔽枝，减少越冬基数；及时抹除夏梢，清除成虫产卵场\n所，抹梢还可兼治柑橘潜叶蛾；种植绿肥，保留果园良性杂草。\n\n（2）设置黄色黏虫板诱杀成虫；也可分区连片安装杀虫灯或在果园放置诱虫带，诱杀成虫。",
      "（3）在开展药剂防治时，抓住冬季清园，可喷 99%矿物油乳油 100~200 倍液，杀灭越冬若虫。柑\n橘粉虱发生严重的果园，在第二代和第三代若虫盛发期再防治2~3 次。可选用 10%吡虫啉可湿性粉\n剂 4 000~5 000 倍液，或 22.4%螺虫乙酯悬浮剂 4 000~5 000 倍液喷雾。做到喷药均匀，并尽量喷到\n叶背，才有良好效果。注意要交替使用不同类型的药剂。以上药剂与矿物油乳油农药混用，可以提\n高防效并兼治煤污病，减少锈果率，提高果品的商品价值。\n\n柑橘粉虱 成虫及卵\n\n柑橘粉虱 成虫羽化\n\n\n\n柑橘粉虱 若虫\n\n\n\n柑橘粉虱 成、若虫群集危害\n\n\n\n柑橘粉虱 若虫\n\n\n\n柑橘粉虱 成虫\n\n矢尖蚧\n\n·学名· Unaspis yanonensis Kuwana，属半翅目（Hemiptera）盾蚧科（Diaspididc），又名箭头蚧，\n矢尖盾蚧。\n\n·鉴别特征· 雌成虫：介壳长形，稍弯曲，长约 3.5 mm，介壳前窄后宽，末端稍窄，形似箭头，介\n壳呈褐色或棕色，边缘有灰白色膜，中央有一条明显的纵线，前端有两个黄褐色壳点，通常在果皮\n和树叶上分布些斑点较为集中、大小一致的褐色箭头附着物。雄成虫：介壳狭长，粉白色，壳背有\n3 条纵脊。\n\n·生活习性· 上海 1 年发生 3 代，以受精雌成虫在枝、叶上越冬。翌年 3 月上中旬开始孕卵，4~6 月\n产卵于介壳下，每雌产卵 39~165 粒，卵期极短，仅 1 小时左右，边产卵边孵化。第一代若虫 5 月\n下旬开始出现，在雌成虫介壳下停留 2~3 天才爬离，于附近枝、叶处固定危害，多固定在老叶上\n危害。7 月上旬始见雄虫；7 月下旬第二代若虫出现，大部分寄生在新叶上，一部分在果实上。9\n月中旬见雄虫；9 月中、下旬第三代若虫出现，11 月上旬见雄虫，交尾后以雌成虫越冬，也有少量\n以若虫和蛹越冬。\n\n·危害特点· 主要危害柑橘叶片、枝梢和果实，导致叶片褪绿发黄，严重时叶片卷缩、干枯，树势衰\n弱，甚至整株死亡。果面布满虫壳，不着色，影响商品价值。\n\n·防治方法·\n\n（1）在卵孵化前剪去虫枝，剪好的虫枝最好集中放在果园内的空地上，让其寄生天敌羽化、飞\n出，约一周后再进行烧毁处理。\n\n（2）在矢尖蚧发生的地区，可以引进大红瓢虫、澳洲瓢虫等天敌对虫害进行有效控制。\n\n\n\n（3）在若虫孵化盛期，可用 99%矿物乳油 100~200 倍液，连喷 2 次。在第一代低龄若虫始盛期喷\n施 22.4%螺虫乙酯悬浮剂 4 000~5 000 倍液，或 30%松脂酸钠水乳剂 150~200 倍液。\n\n矢尖蚧 危害状\n\n\n\n矢尖蚧 危害状\n\n\n\n矢尖蚧 成虫危害\n\n\n\n矢尖蚧 雌成虫\n\n\n\n矢尖蚧 雄成虫\n\n\n\n矢尖蚧 雄成虫\n\n红蜡蚧\n\n·学名· Ceroplastes rubens Maskell，属半翅目（Hemiptera）蜡蚧科（Coccidae）。\n\n·鉴别特征· 雌成虫：体球形或半球形，暗红色，体长约 2.5 mm；蜡壳近椭圆形，蜡质坚硬，长\n3~4 mm，初为玫瑰红色，后呈紫红色；老熟时背面隆起呈半球形，顶部凹陷，中央有 1 白色脐状\n点。有 4 条白色蜡带向上卷起。雄成虫：体长 1 mm，翅展 2.4 mm，白色，半透明；雄虫至化蛹时\n蜡壳长椭圆形，暗紫红色。卵：椭圆形，淡紫红色，长 0.3 mm。若虫：初孵若虫扁平椭圆形，灰\n紫红；2 次蜕皮后，体背覆以白色透明蜡质。蛹：椭圆形，头、胸、腹明显，紫红色，长约 1\nmm。\n\n·生活习性· 上海 1 年发生 1 代，以受精雌成虫在枝干上越冬。越冬雌成虫于翌年 5 月下旬开始产\n卵；6 月上旬至 7 月上旬为孵化期。初孵若虫经一定时间爬行后固定于寄主上取食。初孵若虫多寄\n生于叶上，少数也寄生于嫩枝和叶柄上，后雌虫则随虫体的各次蜕皮陆续转移到枝条上寄生，雄若\n虫直至化蛹仍留在叶片上。雄成虫于 8 月下旬化蛹，9 月中旬羽化、交尾。\n\n·危害特点· 雌虫在枝干、叶柄上危害，雄虫多在叶柄和叶片上危害。可诱发煤污病，致使植株长势\n衰退，树冠萎缩，全株发黑，严重危害时整株枯死。\n\n·防治方法·\n\n（1）冬季树木越冬期向枝干喷洒 45%石硫合剂晶体，杀死越冬虫体。\n\n（2）植物生长期的防治应立足于初孵活动若虫期，在蜡质形成前及时进行防治，喷洒99%矿物油\n100倍液，或22.4%螺虫乙酯4 000倍液，或1.2%苦参碱·烟碱 1 000 倍液。交替使用上述农药可有效\n避免害虫产生抗药性。鉴于此虫孵化期要延续 30 天左右，因此喷药次数需在孵化始、盛、末期喷\n施 3 次（第一次喷药后每隔 7~10 天喷 1 次）才能取得满意效果。防治时要重点照顾树冠外围尤其\n\n\n\n是顶部枝条即当年春梢。\n\n（3）保护、利用天敌。",
      "·鉴别特征· 成虫：体长 8.5~10 mm，翅展 24~36 mm；头胸背面黑褐色，腹面深褐色；头、胸及前\n翅表面多被绿色蜡粉；前翅前缘、外缘深褐色，向中域及后缘颜色逐渐变淡；前缘外方 1/3 处稍凹\n入，此处有 1 个三角形至半圆形淡黄褐色斑；后翅暗褐色，半透明。卵：长 0.8~1.2 mm，乳白\n色，长卵形；初产时为乳白色，后渐变成白色至浅蓝色；近孵化时为灰褐色。若虫：体长 3~6\nmm，体略呈钝菱形，翅芽处最宽，体疏被白色蜡粉，腹部末端有 10 条白色绵毛状蜡丝，呈扇状\n伸出，其中 2条向上向前弯曲并张开，平时腹端上弯，白色绵毛状蜡丝覆于体背以保护身体，常可\n作孔雀开屏状。\n\n·生活习性· 南方一般 1 年发生 2 代，以卵于当年生枝条内、叶脉或叶柄的组织内越冬。翌年 4 月上\n旬至 4 月下旬陆续孵化，若虫盛发期在 4 月中旬至 6 月上旬；第二代若虫盛发期在 8~9 月。成虫\n白天活动，擅跳、飞行迅速，喜于嫩枝、芽、叶上刺吸汁液。\n\n·危害特点· 成虫飞行力较强且迅速，产卵于当年生枝木质部内，再分泌白色棉絮状物覆盖卵表面。\n若产卵枝条较粗，尚不会造成枝枯，但如枝条较细，则会造成枝梢枯死。\n\n·防治方法·\n\n（1）冬春季节，剪除树枝上卵块，清除果园内杂草，集中销毁，减少越冬虫源。\n\n（2）保护好园内草蛉、异色瓢虫、螳螂等生物天敌。\n\n（3）及时监测虫情，在若虫 1~3 龄期，选择 0.3%苦参碱水剂 600~800 倍液进行喷雾防治。\n\n\n\n柿广翅蜡蝉 若虫\n\n柿广翅蜡蝉 成虫\n\n柿广翅蜡蝉 产卵及危害状\n\n\n\n柿广翅蜡蝉 成虫\n\n八点广翅蜡蝉\n\n·学名· Ricania speculum Walker，属半翅目（Hemiptera）广翅蜡蝉科（Ricaniidae）。\n\n·鉴别特征· 成虫：体长 6~7 mm，翅展 18~27 mm；头、胸部黑褐色；触角刚毛状；翅革质、密布\n纵横网状脉纹；前翅宽大，略呈三角形，翅面被稀薄白色蜡粉，翅上具灰白色透明斑 5~6 个；后\n翅半透明，翅脉煤褐色，中室端有 1 个白色透明斑。卵：长卵圆形，长 1.2~1.4 mm，乳白色。若\n虫：低龄乳白色；体略呈钝菱形，暗黄褐色；腹部末端有 4 束白色绵毛状蜡丝，呈扇状伸出，中间\n一对略长；蜡丝被于体背以保护身体，常可呈孔雀开屏状，向上直立或伸向后方。\n\n·生活习性· 1 年发生一代，以卵在当年生枝条里越冬。若虫 5 月中下旬至 6 月上中旬孵化，低龄若\n虫常数头排列于同一嫩枝上刺吸汁液危害，4 龄后散布于枝梢叶果间，爬行迅速，善于跳跃，若虫\n期 40~50 天。7 月上旬成虫羽化，危害至 10 月。成虫产卵于当年生嫩枝木质部内，产卵孔排成一\n纵列，孔外带出部分木丝并覆有白色絮状蜡丝。成虫有聚集产卵的习性。\n\n·危害特点· 成、若虫刺吸嫩枝、芽、叶汁液；排泄物易引发病害；雌虫产卵时将产卵器刺入嫩枝茎\n内，破坏枝条组织，被害嫩枝轻则叶枯黄、长势弱且难以形成叶芽和花芽，重则枯死。\n\n·防治方法· 参照柿广翅蜡蝉。\n\n\n\n八点广翅蜡蝉 产卵刻槽\n\n八点广翅蜡蝉 成虫\n\n\n\n八点广翅蜡蝉 成虫\n\n八点广翅蜡蝉 成虫\n\n白星花金龟\n\n\n\n·学名· Liocola brevitarsis Lewis，属鞘翅目（Coleoptera）金龟科（Scarabaeidae），别称白星花金龟\n子。\n\n·鉴别特征· 成虫：体长 17~24 mm，宽 9~12 mm，椭圆形，具古铜或青铜色光泽，体表散布众多不\n规则白绒斑；触角深褐色；前胸背板与鞘翅前缘之间有一个三角片；鞘翅宽大，近长方形，白绒斑\n多为横向波浪形。卵：圆形至椭圆形，乳白色，长1.7~2 mm。幼虫：体长 24~39 mm，头部褐色，\n体柔软肥胖而多皱纹，常弯曲呈“C”状。蛹：体长 20~23 mm，裸蛹，初为黄白，渐变为黄褐。\n\n·生活习性· 一年发生 1 代，主要以 2~3 龄幼虫于土中越冬，以地下根或腐殖质为食。翌年 4~6 月，\n幼虫在地下 20 cm深的土壤中老熟化蛹；大约 20 天后，蛹羽化为成虫；成虫于 5 月上旬出现，6~7\n月为发生盛期。成虫白天活动，有假死性，受惊后掉落或飞走；对甜味、酒醋味有趋性，飞行力\n强，常群聚危害花、果，产卵于土中。卵期 10~12 天孵化成幼虫（蛴螬），幼虫在土壤中取食并\n进行越冬。幼虫多以腐败物为食，并危害根系。\n\n·危害特点· 成虫主要危害花和果实，至花腐烂，果实近成熟时被啃食至果肉腐烂。幼虫主要危害果\n树根系。\n\n·防治方法·\n\n（1）冬春深翻土壤，树干涂白，消灭越冬虫源。\n\n（2）自制糖醋液诱杀成虫。\n\n（3）利用成虫的假死性和趋化性，于清早或傍晚在树下铺塑料布，摇动树体，捕杀成虫。\n\n（4）利用杀虫灯光诱杀成虫。\n\n\n\n\n\n\n白星花金龟 成虫",
      "·生活习性· 老熟幼虫在树冠下土中 3~7 cm处越冬。成虫在柑橘现蕾期羽化出土，4 月中下旬至 5 月\n初危害严重。成虫多于早、晚活动，以傍晚最盛，飞行力弱，羽化后 1~2 天即可交配产卵；一般\n阴湿低洼橘园发生较多，壤土、砂壤土利于幼虫存活，发生较多，3~4 月多阴雨有利于成虫发生，\n幼虫脱蕾期，多雨有利于幼虫入土。柑橘显蕾开花季节遇多雨天气，该虫发生严重。\n\n·危害特点· 喜在花蕾开始现白、直径 2~3 mm的花蕾内产卵；孵化的幼虫在花蕾内活动取食，并产\n生大量黏液。受害花蕾膨大变形如灯笼，花瓣略带绿色，并有分散绿色小点，导致被害花蕾不能正\n常开花和授粉，最后枯萎脱落，严重影响产量。\n\n·防治方法·\n\n（1）冬季深翻或春季浅耕树冠周围土壤。在开花期发现灯笼状畸形花蕾，立即人工摘除受害花\n蕾，集中园外深埋或烧毁。\n\n（2）多数花蕾变白时，于产卵之前树冠喷药毒杀成虫，可喷洒 75%灭蝇胺可湿性粉剂 5 000 倍液\n等，选择无风，特别是雨后天晴的傍晚或早晨喷施树冠。喷药时周到均匀，每隔 5~7 天喷 1 次，\n共喷 2~3 次；重点是花蕾和叶背，地面和树冠同时喷药。\n\n\n\n柑橘花蕾蛆 幼虫\n\n\n\n柑橘花蕾蛆 蛹\n\n柑橘花蕾蛆 危害花（中间）和正常开放花\n\n\n\n柑橘潜叶蛾\n\n·学名· Phyllocnistis citrella Stainton，属鳞翅目（Lepidoptera）潜叶蛾科（Lyone tiidae），又名橘潜\n蛾、潜叶虫。\n\n·鉴别特征· 成虫：体银白色，体长 2 mm，翅展 4 mm，触角丝状，前翅披针形，翅基部具 2 条黑\n褐色纹，翅近中部有黑褐色“Y”形斜纹，前缘中部至外缘有橘黄色缘毛，顶角有黑圆斑 1 个；后翅\n银白色，针叶形，缘毛极长。卵：椭圆形，白色、透明，底部平而成半圆形突起，长 0.3~0.6\nmm。初孵幼虫：浅绿色，形似蝌蚪。老熟幼虫：体扁平，纺锤形，长约 4 mm，胸腹部背面背中\n线两侧有 4 个凹陷孔，排列整齐。体黄绿色，头三角形，腹部末端尖细，具 1 对细长的铗状物。\n蛹：纺锤形，初为淡黄色，后为深黄褐色，长 2.5 mm。茧：黄褐色。\n\n·生活习性· 一般一年发生 9~10 代，多的达 15 代，世代重叠，多以幼虫和蛹在柑橘的秋梢或冬梢上\n越冬，5 月下旬晚春梢上始见幼虫危害，7~9 月严重危害秋梢。成虫昼伏夜出，飞行敏捷，趋光性\n弱，卵多散产在嫩叶背面主脉附近。初孵幼虫由卵底潜入皮下危害，蛀道白色光亮，有 1 条由虫粪\n组成的细线。\n\n·危害特点· 幼虫潜入嫩叶、嫩梢表皮下蛀食叶肉，形成银白色弯曲的隧道，内留有虫粪，在中央形\n成一条黑线，虫道蜿蜒曲折，导致被害叶卷缩、硬化，叶片易脱落，新梢生长停滞。幼虫危害造成\n的伤口易染溃疡病，常诱发柑橘溃疡病，被害卷叶又为红蜘蛛、介壳虫、卷叶蛾等害虫提供了越冬\n场所。\n\n·防治方法·\n\n（1）结合栽培管理及时抹芽控梢，摘除过早、过晚的新梢，通过水、肥管理使夏梢、秋梢抽发整\n齐健壮。\n\n（2）于潜叶蛾发生始盛期或新梢 3 mm长时，选用 20%氯虫苯甲酰胺悬浮剂3 000 倍液，或 1%苦\n皮藤素水乳剂 4 000~5 000 倍液、0.3%印楝素乳油 400~600倍液、1.8%阿维菌素水乳剂 4 000~5 000\n倍液等喷雾防治。\n\n一般隔 7 天左右喷药 1 次，连喷 2~3 次。防治成虫应在傍晚喷药，潜入叶内的低龄幼虫应在午后\n喷药，并注意药剂的轮换使用。\n\n\n\n柑橘被害状\n\n\n\n柑橘潜叶蛾 卵\n\n柑橘潜叶蛾 成虫\n\n\n\n柑橘潜叶蛾 幼虫\n\n\n\n柑橘潜叶蛾 蛹\n\n\n\n柑橘被害状\n\n\n\n柑橘潜叶蛾 幼虫\n\n\n\n柑橘潜叶蛾 幼虫\n\n\n\n柑橘潜叶蛾 成虫\n\n斜纹夜蛾\n\n·学名· Prodenia litura Fabricius，属鳞翅目（Lepidoptera）夜蛾科（Noctuidae），又名连纹夜蛾、斜\n纹贪夜蛾。\n\n·鉴别特征· 成虫：体长 16~21 mm，翅展 37~42 mm，全体灰褐色；前翅黄褐色，具有复杂的黑褐\n色斑纹，后翅白色，带有红色闪光，外缘有 1 条褐色线。老熟幼虫：体长 38~51 mm，体色因虫\n龄、食料、季节而变化，从初孵幼虫时的绿色渐变为老熟时的黑褐色，背线、亚背线橘黄色，亚背\n线内侧具三角形黑斑一对。卵：半球形，直径约 0.5 mm，成块，黄白色，外覆黄白色绒毛。蛹：\n长 18~20 mm，圆筒形，赤褐至暗褐色。\n\n·生活习性· 斜纹夜蛾为迁飞性害虫。主要以蛹在土中越冬。成虫昼伏夜出，有较强的趋光性，喜食\n糖、酒、醋等发酵物。成虫多产卵于叶背，产卵后 2~3 天即能孵化，初孵幼虫常群集危害，2~3 龄\n后分散，4 龄后进入暴食期。幼虫畏光，7 月下旬至 9 月下旬为盛发期。",
      "（5）幼虫孵化后仍在皮层内蛀食（6~7 月），可利用“细木屑”和“酱油状液体流出”等特征在危害\n部人工挖除、钩杀皮层内的幼虫。\n\n星天牛 排泄物\n\n\n\n星天牛 羽化孔\n\n\n\n星天牛 取食刻槽\n\n\n\n星天牛 幼虫\n\n\n\n星天牛 蛹\n\n\n\n星天牛 雌成虫\n\n\n\n星天牛 雄成虫\n\n褐天牛\n\n·学名· Nadezhdiella cantori Hope，属鞘翅目（Coleoptera）天牛科（Ceram bycidae）。\n\n·鉴别特征· 成虫：体长 26~51 mm，黑褐色或黑色，有光泽，体表长有灰黄色绒毛，头、胸、背面\n稍带黄褐色；雄成虫触角超过体长的 1/2~2/3，雌成虫触角较身体略短。卵：圆形，长约 8 mm，初\n产时呈乳白色，后变为黄褐色，卵壳上有网状花纹。老熟幼虫：体长 46~50 mm，乳白色。蛹：乳\n白色或淡黄色，翅芽端部可达腹部第三节末端。\n\n·生活习性· 褐天牛在浙江省 2 年发生 1 代，以幼虫或成虫在枝干内越冬，幼虫期长达 15~20 个月。\n7 月上旬前孵化的幼虫，于翌年 8 月上旬到 10 月上旬化蛹，10月上旬至 11 月上旬羽化为成虫，并\n在蛹室中潜伏越冬；8 月以后孵化的幼虫需经历2 个冬季，到第三年的 5~6 月化蛹，8 月以后成虫\n外出活动，越冬虫态有成虫、2 年生幼虫和当年生幼虫。\n\n·防治方法·\n\n（1）剪除杨梅树上的病虫枝，保持树干光滑，4~8 月清除树根基部杂草，杜绝天牛成虫钻入危\n害。在天牛成虫钻出羽化孔时，人工捕捉成虫，一般在 5~6 月晴天中午及午后或傍晚进行，此时\n\n\n\n成虫多栖息枝端，在树枝上交尾。利用天牛成虫体型较大、行动迟缓、受震后假死坠地的特性，直\n接摇树，待成虫假死坠地后捕杀。4~8 月发现树干基部有幼虫蛀食排出木屑，可用细钢丝钩杀幼\n虫，或在蛀入孔塞入药棉杀灭幼虫。\n\n（2）清除果园周围杂草、残枝落叶，及时中耕除草，破坏杨梅天牛的栖息与产卵场所。加强栽培\n管理，树干根茎部定期培上厚土，以提高天牛的产卵部位，便于清除卵粒。在冬春季涂白枝干，堵\n塞树干上洞孔，以减少杨梅天牛产卵。\n\n（3）在果园边缘、山顶、林道旁设置诱捕器，或悬挂频振式杀虫灯、黑光灯等，诱杀天牛成虫。\n\n（4）充分利用天敌昆虫、食虫螨类、食虫鸟类等防控杨梅天牛，亦可应用肿腿蜂、病原线虫等进\n行生物防治。\n\n褐天牛 成虫\n\n\n\n褐天牛 成虫\n\n\n\n褐天牛 成虫\n\n褐天牛 成虫\n\n梳扁粉虱\n\n·学名· Aleuroplatus pectiniferus Quaintance ＆ Baker，属半翅目（Hemiptera）扁粉虱属（\nAleuroplatus ），又称胶扁粉虱、黑胶粉虱。\n\n·鉴别特征· 雌成虫：长 2 mm，头胸部暗灰色，腹部橘红色，腹末开口呈钝端，有短柄附于叶背\n\n\n\n面，前翅暗灰色，有 6 块淡黄色斑，后翅亦有淡色斑。雄成虫：略小于雌成虫，交配辅器钳状，突\n出于腹部末端，配器楔形。卵：黄褐色，香蕉形，略弯曲，竖立，卵壳表面光滑，长约 0.2 mm，\n有卵柄，附于叶背上。幼虫：初孵时体长 0.25 mm左右，粉红或浅黄色，后逐渐变成红棕色；2 龄\n幼虫长梨圆形，前端略尖，后端平截而向内略凹入，背部漆黑革质，腹面灰白膜质，背面中部有脊\n状隆起。胸气门陷处各有一簇白色蜡毛，臀部也有一团蜡毛，体缘腺成栉齿状突出；2龄后的幼虫\n失去胸足与触角，呈扁椭圆形，介壳状，黑色，臀部有一簇白色蜡毛。蛹：长约lmm，为裸蛹，初\n蛹淡黄色，半透明；后渐变为橙黄色，复眼黑色，翅芽灰色，伪蛹壳黑色，卵圆形，前端尖小，后\n端锐圆，在胸气管褶处稍收缩，整个蛹壳深埋于胶质下。\n\n·生活习性· 在浙江 1 年发生 1 代，以 2 龄幼虫于黑色蛹壳下在叶背越冬。次年 3月下旬化蛹，4 月\n上旬开始羽化，4 月中旬为羽化盛期。成虫有多次交尾现象，交尾后即可产卵，卵大多产于新梢叶\n背边缘。每次雌成虫产卵量 21~40 粒。成虫产卵后转移到新梢嫩叶上栖息，善飞翔，群集性。卵\n期 2 个月，幼虫在 6 月上中旬出现，善于爬行，幼虫群集在叶片背面吸取汁液，严重时每叶近百\n头，分泌大量蜜露等排泄物，从而诱发煤污病，影响光合作用，导致枝枯叶落，树势衰退。7 月中\n下旬普遍蜕皮后进入 2 龄幼虫，虫体背腹扁平，形成黑色介壳，并分泌无色透明的黏胶固定着虫\n体，2龄幼虫以后就在介壳下发育至 3 龄，直到化蛹为止不再迁移位置。\n\n·防治方法·\n\n（1）剪掉衰弱和密生枝条，增加树体通风透光，降低虫口密度。\n\n（2）喷洒生物益菌座壳孢菌，对水喷洒树冠或与其他杀虫剂混用。\n\n（3）用背负式喷雾器，在叶背、叶面、树干喷施 99%矿物油乳油 100~200倍液。\n\n\n\n梳扁粉虱 危害状\n\n\n\n梳扁粉虱 虫体\n\n\n\n梳扁粉虱 危害状\n\n蓑蛾"
    ]
  },
  {
    "question": "防治矢尖蚧时，若虫孵化盛期推荐使用什么浓度的矿物油乳油？",
    "answer": "防治矢尖蚧时，在若虫孵化盛期推荐使用99%矿物油乳油100~200倍液，连喷2次。",
    "standard_answer": "在若虫孵化盛期，可用99%矿物油乳油100~200倍液防治。",
    "contexts": [
      "（3）在开展药剂防治时，抓住冬季清园，可喷 99%矿物油乳油 100~200 倍液，杀灭越冬若虫。柑\n橘粉虱发生严重的果园，在第二代和第三代若虫盛发期再防治2~3 次。可选用 10%吡虫啉可湿性粉\n剂 4 000~5 000 倍液，或 22.4%螺虫乙酯悬浮剂 4 000~5 000 倍液喷雾。做到喷药均匀，并尽量喷到\n叶背，才有良好效果。注意要交替使用不同类型的药剂。以上药剂与矿物油乳油农药混用，可以提\n高防效并兼治煤污病，减少锈果率，提高果品的商品价值。\n\n柑橘粉虱 成虫及卵\n\n柑橘粉虱 成虫羽化\n\n\n\n柑橘粉虱 若虫\n\n\n\n柑橘粉虱 成、若虫群集危害\n\n\n\n柑橘粉虱 若虫\n\n\n\n柑橘粉虱 成虫\n\n矢尖蚧\n\n·学名· Unaspis yanonensis Kuwana，属半翅目（Hemiptera）盾蚧科（Diaspididc），又名箭头蚧，\n矢尖盾蚧。\n\n·鉴别特征· 雌成虫：介壳长形，稍弯曲，长约 3.5 mm，介壳前窄后宽，末端稍窄，形似箭头，介\n壳呈褐色或棕色，边缘有灰白色膜，中央有一条明显的纵线，前端有两个黄褐色壳点，通常在果皮\n和树叶上分布些斑点较为集中、大小一致的褐色箭头附着物。雄成虫：介壳狭长，粉白色，壳背有\n3 条纵脊。\n\n·生活习性· 上海 1 年发生 3 代，以受精雌成虫在枝、叶上越冬。翌年 3 月上中旬开始孕卵，4~6 月\n产卵于介壳下，每雌产卵 39~165 粒，卵期极短，仅 1 小时左右，边产卵边孵化。第一代若虫 5 月\n下旬开始出现，在雌成虫介壳下停留 2~3 天才爬离，于附近枝、叶处固定危害，多固定在老叶上\n危害。7 月上旬始见雄虫；7 月下旬第二代若虫出现，大部分寄生在新叶上，一部分在果实上。9\n月中旬见雄虫；9 月中、下旬第三代若虫出现，11 月上旬见雄虫，交尾后以雌成虫越冬，也有少量\n以若虫和蛹越冬。\n\n·危害特点· 主要危害柑橘叶片、枝梢和果实，导致叶片褪绿发黄，严重时叶片卷缩、干枯，树势衰\n弱，甚至整株死亡。果面布满虫壳，不着色，影响商品价值。\n\n·防治方法·\n\n（1）在卵孵化前剪去虫枝，剪好的虫枝最好集中放在果园内的空地上，让其寄生天敌羽化、飞\n出，约一周后再进行烧毁处理。\n\n（2）在矢尖蚧发生的地区，可以引进大红瓢虫、澳洲瓢虫等天敌对虫害进行有效控制。\n\n\n\n（3）在若虫孵化盛期，可用 99%矿物乳油 100~200 倍液，连喷 2 次。在第一代低龄若虫始盛期喷\n施 22.4%螺虫乙酯悬浮剂 4 000~5 000 倍液，或 30%松脂酸钠水乳剂 150~200 倍液。\n\n矢尖蚧 危害状\n\n\n\n矢尖蚧 危害状\n\n\n\n矢尖蚧 成虫危害\n\n\n\n矢尖蚧 雌成虫\n\n\n\n矢尖蚧 雄成虫\n\n\n\n矢尖蚧 雄成虫\n\n红蜡蚧\n\n·学名· Ceroplastes rubens Maskell，属半翅目（Hemiptera）蜡蚧科（Coccidae）。\n\n·鉴别特征· 雌成虫：体球形或半球形，暗红色，体长约 2.5 mm；蜡壳近椭圆形，蜡质坚硬，长\n3~4 mm，初为玫瑰红色，后呈紫红色；老熟时背面隆起呈半球形，顶部凹陷，中央有 1 白色脐状\n点。有 4 条白色蜡带向上卷起。雄成虫：体长 1 mm，翅展 2.4 mm，白色，半透明；雄虫至化蛹时\n蜡壳长椭圆形，暗紫红色。卵：椭圆形，淡紫红色，长 0.3 mm。若虫：初孵若虫扁平椭圆形，灰\n紫红；2 次蜕皮后，体背覆以白色透明蜡质。蛹：椭圆形，头、胸、腹明显，紫红色，长约 1\nmm。\n\n·生活习性· 上海 1 年发生 1 代，以受精雌成虫在枝干上越冬。越冬雌成虫于翌年 5 月下旬开始产\n卵；6 月上旬至 7 月上旬为孵化期。初孵若虫经一定时间爬行后固定于寄主上取食。初孵若虫多寄\n生于叶上，少数也寄生于嫩枝和叶柄上，后雌虫则随虫体的各次蜕皮陆续转移到枝条上寄生，雄若\n虫直至化蛹仍留在叶片上。雄成虫于 8 月下旬化蛹，9 月中旬羽化、交尾。\n\n·危害特点· 雌虫在枝干、叶柄上危害，雄虫多在叶柄和叶片上危害。可诱发煤污病，致使植株长势\n衰退，树冠萎缩，全株发黑，严重危害时整株枯死。\n\n·防治方法·\n\n（1）冬季树木越冬期向枝干喷洒 45%石硫合剂晶体，杀死越冬虫体。\n\n（2）植物生长期的防治应立足于初孵活动若虫期，在蜡质形成前及时进行防治，喷洒99%矿物油\n100倍液，或22.4%螺虫乙酯4 000倍液，或1.2%苦参碱·烟碱 1 000 倍液。交替使用上述农药可有效\n避免害虫产生抗药性。鉴于此虫孵化期要延续 30 天左右，因此喷药次数需在孵化始、盛、末期喷\n施 3 次（第一次喷药后每隔 7~10 天喷 1 次）才能取得满意效果。防治时要重点照顾树冠外围尤其\n\n\n\n是顶部枝条即当年春梢。\n\n（3）保护、利用天敌。",
      "［产品特点］ 本剂是用食品级、精炼的饱和矿物油制造的杀虫/杀菌剂，对植物、人、畜安全，对\n天敌风险小。通过空气氧化和微生物降解为水和一氧化碳，对环境友好。使用矿物油，使成虫迁\n入，嗅觉干扰，取食难、产卵少；卵壳接触油，孵化难；低龄活动若虫接触油，气门封闭被憋死；\n固定若虫和伪蛹接触油，蜡溶后发育难；成虫接触油，翅膀被粘，迁飞难，交配减少，产卵难；矿\n物油是典型的物理性药剂，不具内吸性和内渗性，不参与植物代谢。\n\n和叶面肥混用前，要求在小杯中预混；如有油珠浮出，不能混用。\n\n［防治对象及使用方法］\n\n技术要点\n\n（1）防治虫害、螨害时，于害虫、害螨发生初期使用本品。防治病害时，于发病初期使用本品。\n\n（2）使用本产品前在容器内装入所需要量的水，再加入所需要量的本品，充分搅拌以防油水分\n离；在喷药期间，应每隔10分钟搅拌1次，药液应均匀喷施于叶面、叶背、新梢、枝条和果实的表\n面。\n\n（3）当气温高于 35℃，或土壤干旱和作物缺水时，不要使用本品。夏季高温时，在早晨和傍晚使\n用。\n\n（4）勿与离子化的叶面肥混用，勿与不相容的农药混用，如硫磺和部分含硫的杀虫剂和杀菌剂。\n\n［注意事项］\n\n（1）施用本品时，应按常规要求，穿戴必要的防护服，保护水源。\n\n\n\n（2）孕妇及哺乳期妇女应避免接触。\n\n0.5%藜芦碱可溶液剂\n\n［产品特点］ 本品为植物源杀虫剂，具有触杀和胃毒作用。药剂经虫体表皮或吸食进入消化系\n统，造成局部刺激，引起反射性虫体兴奋，继之抑制虫体感觉神经末梢，经传导抑制中枢神经而致\n害虫死亡。\n\n［防治对象及使用方法］\n\n技术要点\n\n（1）应在害虫低龄幼虫期或卵孵化盛期施用，注意喷雾均匀。\n\n（2）大风天或预计 1 小时内降雨，勿施药；施药后如遇雨水需补喷。\n\n（3）使用前充分摇匀，保证药效。\n\n（4）使用本品后的柑橘、枣、猕猴桃至少应间隔10天才能收获，每季最多施用1次。\n\n（5）建议与其他作用机制不同的杀虫剂轮换使用，以延缓抗性产生。\n\n［注意事项］\n\n（1）本品对蜜蜂、水生生物有毒，施药期间应避免对周围蜂群的影响，开花作物花期禁用。远离\n水产养殖区施药，禁止在河塘等水体中清洗施药器具。清洗施药器具的水不能排入河塘等水体。\n\n（2）使用本品应采取相应的安全防护措施，戴防护手套、口罩等，避免皮肤接触及口鼻吸入。使\n用中不可吸烟、饮水及吃东西，使用后及时清洗手、脸等暴露部位皮肤并更换衣物。\n\n（3）用过的容器应妥善处理，不可做他用，也不可随意丢弃。\n\n（4）禁止儿童、孕妇及哺乳期的妇女接触。过敏者禁用，使用中有任何不良反应应及时就医。\n\n43%联苯肼酯悬浮剂\n\n［产品特点］ 本品是一种新型选择性叶面喷雾用杀螨剂，其作用机理为对螨类的中枢神经传导系\n统的γ~氨基丁酸（GABA）受体的独特作用。对螨的各个生活阶段有效，具有杀卵活性和对成螨的\n击倒活性，且持效期长。推荐使用剂量范围内对作物安全，对捕食性益螨没有负面影响，在环境中\n持效期短。\n\n［防治对象及使用方法］\n\n技术要点\n\n\n\n（1）本品的适宜施药时期为柑橘树红蜘蛛始发盛期，施药 1 次，注意均匀喷雾。\n\n（2）本品在柑橘上使用的安全间隔期为 30 天，每季最多使用 1 次。\n\n（3）大风天或预计 1 小时内降雨，勿施药。\n\n（4）建议与其他作用机制不同的杀虫剂轮换使用，以延缓抗性产生。\n\n［注意事项］\n\n（1）使用本品应采取相应的安全防护措施，穿长袖上衣、长裤、靴子，戴防护手套、口罩等，避\n免皮肤接触及口鼻吸入。使用中不可吸烟、饮水及吃东西，使用后及时洗手、脸等暴露部位皮肤并\n更换衣物。\n\n（2）本品对鱼类等水生生物有毒，应远离水产养殖区试药，禁止在河塘等水体中清洗施药器具。\n药液及其废液不得污染各类水域、土壤等环境。\n\n（3）用过的容器应妥善处理，不可作他用，不可随意丢弃。禁止儿童、孕妇和哺乳期妇女接触本\n品。\n\n22.4%螺虫乙酯悬浮剂\n\n［产品特点］ 螺虫乙酯是防治刺吸式口器害虫的杀虫（螨）剂，持效期较长。其作用机制为干扰\n害虫脂肪合成、阻断能量代谢。其内吸性较强，可在植株体内上下传导。正常使用技术条件下可有\n效防治番茄烟粉虱、柑橘树介壳虫、红蜘蛛、柑橘木虱、苹果树绵蚜和梨树梨木虱。\n\n［防治对象及使用方法］\n\n技术要点\n\n（1）配药前先按农药科学使用规范原包装摇匀，再采用一次稀释法配药。\n\n（2）防治柑橘树介壳虫时，应于介壳虫孵化初期施药；防治柑橘树红蜘蛛时，应于红蜘蛛种群始\n建期施药；防治柑橘木虱时，应于柑橘木虱卵孵化高峰期施药；防治苹果绵蚜应在苹果落花后绵蚜\n产卵初期施药；防治梨树梨木虱时，应于梨木虱卵孵高峰期施药；用药时应将药液喷雾在作物叶片\n上，根据植物大小确定用水量并使作物叶片充分均匀着药。\n\n（3）大风天或预计 1 小时内降雨，勿施药。",
      "（2）及时清理残枝败叶，集中处理销毁，切断其越冬病源和媒介昆虫，减少发病率。及时处理田\n间杂草，防止病原微生物和媒介昆虫在其他寄主上繁殖。\n\n（3）在落花后 1 个月内，每隔 10~15 天喷药 1 次，重点防治蚧、蚜、粉虱等刺吸式口器害虫。可\n用 99%矿物油乳油 100~200 倍液，或 99%矿物油 100~150倍液，或松脂合剂 8~10 倍液，或 70%代\n森联水分散粒剂 500 倍液进行防治。\n\n已发生煤污病的果园，可在冬春清园期喷 65%甲硫·乙霉威可湿性粉剂 1 000倍液，或 40%克菌丹悬\n浮剂 400 倍液，或 0.5∶1∶100 倍式波尔多液，或 70%甲基硫菌可湿性粉剂 600~800 倍液，或 50%\n多菌灵可湿性粉剂 600~800 倍液。\n\n柑橘煤污病 植株被害状\n\n\n\n柑橘煤污病 病叶\n\n红蜡蚧并发煤污病\n\n\n\n柑橘煤污病 病叶\n\n柑橘煤污病 病叶\n\n\n\n柑橘虫害\n\n柑橘红蜘蛛\n\n·学名· Panonychus citri McGregor，又名柑橘全爪螨，属蛛形纲（Arachnida）全爪螨属（\nPanonychus ）。\n\n·鉴别特征· 雌成螨：约长0.39 mm，宽约0.26 mm，近椭圆形。雄成螨：鲜红色，体型略小于雌成\n螨。若虫：身体比成虫小，足 4 对，身体颜色与成虫差别不大。幼虫：体较小，长 0.2 mm，初孵\n时足 3 对，体色呈淡红色。卵：一般多产在叶面和叶背中脉两旁。\n\n·生活习性· 喜干旱，多雨不利发生。温度 24~28℃、相对湿度 60%~85%是红蜘蛛生长发育的最适\n气候，高于 34℃或低于 11℃时生长受到抑制。上海地区红蜘蛛的发生高峰一般出现在 5~6 月；若\n气候适宜，9~10 月也可能再次发生高峰。\n\n·危害特点· 主要危害柑橘叶片和果实。被害叶片呈现大面积灰白，失去光泽，并最终脱落。幼果和\n成熟果实受害后表面出现淡绿色和淡黄色斑点，品质下降。\n\n·防治方法·\n\n（1）冬季清园时，结合修剪，将柑橘红蜘蛛的受害枝叶剪除并集中烧毁。田间释放捕食螨捕食柑\n橘红蜘蛛，开展无公害防治。\n\n（2）气温低于 25℃时，可以用 99%矿物油乳油 100~200 倍液喷雾，对叶片的上下两面喷洒均匀，\n不遗漏。\n\n（3）药剂防治：在若虫期，可选用 4%阿维菌素+24%螺虫乙酯悬浮剂 5 000~7 000 倍液喷雾 1\n次。柑橘红蜘蛛始发盛期时，喷雾 43%联苯肼酯悬浮剂 1 900~2 400 倍液，或 20%丁氟螨酯悬浮剂\n1 500~2 500 倍液（在柑橘树上每季最多使用1 次）。喷雾时应使作物叶面正反面、果实表面以及\n树干、枝条等部位均匀着药。\n\n\n\n\n\n\n柑橘红蜘蛛 柑橘苗被害状\n\n柑橘红蜘蛛 卵\n\n\n\n柑橘红蜘蛛 成虫\n\n柑橘红蜘蛛 群集危害\n\n\n\n柑橘红蜘蛛 成虫\n\n\n\n柑橘红蜘蛛 群集危害叶片\n\n\n\n柑橘红蜘蛛 危害柑橘叶片\n\n柑橘锈壁虱\n\n·学名· Phyllocoptruta oleivora Ashmead，属蛛形纲（Arachnida）瘿螨科（Eriophyidae），又名柑橘\n锈瘿螨、柑橘铜病。\n\n\n\n·鉴别特征· 成螨：体长 0.1~0.2 mm，胡萝卜形或楔形，黄色或橙黄色，头小，向前方伸出。幼\n螨：孵出时为三角形。若螨：体形如成螨，但较小，半透明。\n\n·生活习性· 以成螨在夏、秋梢腋芽、卷叶等部位越冬。越冬螨在 15℃左右时开始活动、产卵。当\n平均气温达 20℃以上时繁殖迅速，7~8 月高温季节种群迅速扩大，易造成果面严重危害。\n\n·危害特点· 成螨、若螨均可危害，以口器刺入柑橘组织吸食汁液。叶片、枝梢、果实被害后，油胞\n破裂，芳香油溢出，经空气氧化，叶背和果皮变成污黑色，叶片受害严重时变小、变脆、畸形，当\n年抽生的春梢叶片大量脱落；果实受害变黑褐色，果皮粗糙布满网状细纹或古铜色锈斑，品质及商\n品价值降低。\n\n·防治方法·\n\n（1）加强栽培管理，肥水管理，增施有机肥，改善果园生态环境，使植株生长健壮，抗病虫力增\n强。\n\n（2）保护利用锈壁虱的天敌，主要有食螨瓢虫、捕食螨、具瘤长须螨、蓟马和多毛菌等。",
      "［注意事项］\n\n（1）药液稀释后不宜放置过久，应现配现用。\n\n（2）配药及施药人员需身体健康。施药时应站上风头，不要迎风施药。\n\n（3）施药器械宜用清水洗干净。不准在天然水域中清洗，防止污染水源；残液不能随便泼洒，应\n选择安全地点妥善处置。对未使用完的剩余药剂应密封好后，贮存于安全的地方。\n\n（4）使用过程中应穿戴好防护用品，避免药液溅及衣服、皮肤和眼睛。操作完毕后，应及时清洗\n防护用品，并清洗手、脸和可能污染的部位。\n\n3%啶虫脒微乳剂\n\n［产品特点］ 本品属吡啶类杀虫剂，具有触杀、胃毒和渗透作用，作用机制独特，主要是干扰昆\n虫神经系统的刺激传导，从而导致昆虫麻痹，最终死亡。活性较高，杀虫较迅速，能防治对现有药\n剂有抗性的害虫。内吸传导效率较高，渗透性能较强，耐雨水冲刷，对蚜虫等刺吸式口器害虫防效\n显著。\n\n［防治对象及使用方法］\n\n技术要点\n\n（1）需用清水配制药剂，现配现用，不宜久置。\n\n（2）在蚜虫发生初盛期施药，施药时应均匀、周到。\n\n（3）使用前仔细阅读本标签，须按照本标签使用。\n\n（4）每季作物最多施药次数为 1 次，安全间隔期为 14 天。\n\n\n\n（5）本品不能与铜制剂、碱性制剂、碱性物质混用。\n\n（6）注意与其他不同作用机制的杀虫剂品种交替使用，延缓抗药性。\n\n（7）大风天或预计 1 小时内降雨，勿施药。\n\n［注意事项］\n\n（1）施药人员需戴口罩，使用时切勿吸烟或饮食，如药液接触皮肤应及时用清水洗净。作业完毕\n后，应立即清洗身体裸露部位。\n\n（2）本品剂型为液体状，开启药袋时，注意用力不要过大，以免药剂四处洒溅而造成不必要的伤\n害。注意用清水配制药剂。\n\n（3）注意环境保护，施药前、后要彻底清洗喷药器械，清洗喷施器具及衣物，不要将清洗液倒入\n池塘、鱼塘中，应远离池塘、鱼塘地方低洼处挖一小坑，将污水掩埋。空袋应销毁，不得移作他\n用。\n\n（4）本品对蜜蜂、家蚕有毒，施药期间应避免对周围蜂群的影响。开花植物花期、蚕室和桑园附\n近、赤眼蜂等天敌放飞区域禁用。防止药液污染水源地。地下水、饮用水、水源地附近禁用。\n\n（5）用过的容器应妥善处理，不可做他用，也不可随意丢弃。\n\n（6）避免孕妇及哺乳期的妇女接触。\n\n（7）水产养殖区、河塘等水体附近禁用，禁止在河塘等水域清洗施药器械。\n\n6%三聚乙醛颗粒剂\n\n［产品特点］ 本品是一种杀软体动物剂，以胃毒作用为主，兼有触杀作用，通过消化道吸收后使\n其麻痹神经而死亡，或接触本品的蜗牛分泌大量的黏液、脱水而死亡。\n\n［防治对象及使用方法］\n\n技术要点\n\n（1）在蜗牛盛发期直接均匀撒施。适宜的施药温度为 15~35℃，施药后不要在田中践踏，以免影\n响药效。\n\n（2）叶菜上使用安全间隔期为 7 天，每季最多使用次数为 2 次。\n\n（3）不能与酸性物质混用，以免分解失效；不宜与化肥、农药混用。\n\n［注意事项］\n\n（1）施药后如遇大雨，需补充施药，否则会影响药效。\n\n（2）使用本品时应穿防护服和戴手套。施药期间不可吃东西和饮水。施药后应及时洗手。\n\n（3）禁止在河塘等水源地清洗施药器具，避免污染水源地。\n\n（4）孕妇及哺乳期妇女避免接触。\n\n（5）用过的容器应妥善处理，不可做他用，也不可随意丢弃。\n\n\n\n45%石硫合剂晶体\n\n［产品特点］ 石硫合剂结晶是在液体石硫合剂的基础上经化学加工而成的固体剂型，其杂质少，\n药效好。产品分解后，有效成分起杀菌杀螨作用，残留部分为钙、硫等元素的化合物，均可被植物\n的果、叶吸收，它是植物生长所必需的中量元素。石硫合剂已有一百多年的使用历史，是一种廉价\n的杀菌、杀螨剂。\n\n［防治对象及使用方法］\n\n（续表）\n\n技术要点\n\n（1）先将本剂按使用量用少量水对成母液，再稀释至所需倍数喷雾。\n\n（2）不得与波尔多液、铜制剂、机械油乳剂及在碱性条件下易分解的农药混合。在波尔多液使用\n后要间隔 2~3 周。使用本剂后 10 天即可使用波尔多液。\n\n（3）温度越高，药效越好。气温达到 32℃以上时慎用，稀释倍数应加大至1 000 倍以上；气温在\n38℃以上时禁用。\n\n［注意事项］\n\n（1）配制石硫合剂的水温应低于 30℃，热水会降低效力。\n\n（2）配药及施药时应穿戴保护性衣服，喷药后应清洗全身。清洗喷雾器时，勿让废水污染水源。\n药液溅到皮肤上，可用大量清水冲洗，以防皮肤灼伤。\n\n0.3%苦参碱水剂\n\n［产品特点］ 本品是植物源杀虫剂，害虫一旦接触药剂，即麻痹神经中枢，继而使虫体蛋白凝\n固，堵死虫体气孔，使虫体窒息死亡，能有效防治十字花科蔬菜上的蚜虫和梨树黑星病。\n\n［防治对象及使用方法］\n\n技术要点\n\n\n\n（1）于蚜虫盛发期施药。\n\n（2）于梨树黑星病发病初期施药，喷雾时注意均匀。本品在梨树上的安全间隔期为 21 天。每季最\n多使用 3 次。",
      "［产品特点］ 本品是阿维菌素和灭幼脲混配制剂。具有触杀和胃毒作用并有微弱的熏蒸作用，无\n内吸作用，有渗透作用。作用机理干扰神经生理活动，抑制神经传导。\n\n［防治对象及使用方法］\n\n技术要点\n\n（1）防治桃小食心虫，于幼虫初发期进行喷雾处理，注意喷雾均匀彻底。\n\n（2）在桃树上使用安全间隔期 21 天，每季最多使用次数为 2 次，施药间隔期10 天。\n\n（3）不与碱性物质如波尔多液等混用。\n\n［注意事项］\n\n（1）配药和施药时，应穿防护服，戴口罩或防毒面具以及胶皮手套，以避免污染皮肤和眼睛；施\n药完毕后应及时换洗衣物，洗净手、脸和被污染的皮肤。\n\n（2）禁止在河塘等水体中清洗施药器具，远离水产养殖区、河塘等水体施药，未用完的药液应密\n封后妥善放置。\n\n（3）开启封口应小心药液溅出，废弃包装物应冲洗后深埋或由生产企业回收处理。\n\n（4）对蜜蜂有毒，（周围）开花植物花期禁用，施药期间应密切关注对附近蜂群影响。\n\n（5）蚕室及桑园附近禁用，赤眼蜂等天敌放飞区域禁用。\n\n1.8%阿维菌素水乳剂\n\n［产品特点］ 本品有效成分属大环内酯双糖类化合物，对昆虫和螨类具触杀、胃毒作用，并有微\n弱的熏蒸作用。通过干扰神经生理活动，使节肢动物的神经传导受到抑制，成、若螨和昆虫与药剂\n接触后即出现麻痹、拒食、不动症状；由于不引起昆虫迅速脱水，致死作用较慢。该成分对叶片有\n较强的渗透作用，可杀死植物表皮下的害虫，使持效期延长。本品主要用于防治柑橘树锈壁虱。\n\n［防治对象及使用方法］\n\n技术要点\n\n（1）用于防治柑橘锈壁虱时，在害虫盛发期喷雾，根据虫口发生严重情况，可隔 15~20 天左右施\n药 1 次，可连续 2 次用药。该产品在柑橘树上使用安全间隔期为21 天，每个作物周期最多使用次\n数为 2 次。\n\n（2）大风天气或预计 1 小时内有雨，勿施药。\n\n\n\n（3）不可与呈碱性的农药等物质混合使用。\n\n（4）与其他作用机制不同的杀虫剂轮换使用。\n\n（5）对阿维菌素产生高抗药性的地区不推荐使用本品。\n\n［注意事项］\n\n（1）本品对蜜蜂、家蚕剧毒，对鱼高毒，对鸟中毒。施药期间应避免对周围蜂群的影响，蜜源作\n物花期、蚕室和桑园附近禁用。远离水产养殖区施药，禁止在河塘等水体中清洗施药器具。用后包\n装物等应回收妥善处理。赤眼蜂等天敌放飞区禁用。\n\n（2）避免与皮肤、眼睛接触，防止由口鼻吸入。施药时应穿防护服，戴防护眼镜和手套，不要迎\n风施药。施药期间不可吃东西、不可饮水，施药后应及时洗手和洗脸。\n\n（3）孕妇及哺乳期妇女避免接触本品。\n\n（4）本品属易燃液体，注意贮存、运输和使用安全。\n\n240g/L虫螨腈悬浮剂\n\n［产品特点］ 虫螨腈是吡咯类杀虫剂，对黄瓜斜纹夜蛾、苹果金纹细蛾、茄子朱砂叶螨及蓟马、\n茶树茶小绿叶蝉和梨树木虱等具有良好的防治效果。\n\n［防治对象及使用方法］\n\n技术要点\n\n（1）苹果树：在卵孵化盛期施药，间隔 7~10 天施药 1 次，连续使用 2 次。安全间隔期为 14 天，\n每个生长季节使用不超过 2 次。\n\n（2）梨树：叶面喷雾 1~2 次。在低龄幼虫盛发期（1~2 龄）开始用药，新梢芽长 5 cm时开展第一\n次防治。若虫龄有世代重叠时要连续用药 2 次，每次间隔 7~10天，安全间隔期为 14 天，每个生长\n季节使用不超过 2 次。\n\n（3）本品不可与呈碱性的农药等物质混合使用。\n\n（4）建议与其他作用机制不同的杀虫剂轮换使用，以延缓抗性产生。\n\n［注意事项］\n\n（1）本品对蜜蜂、鱼类等水生生物、家蚕有毒，施药期间应避免对周围蜂群的影响。蜜源（周\n围）开花植物花期、蚕室和桑园附近、赤眼蜂等天敌放飞区域禁用。\n\n（2）远离水产养殖区、河塘等水体施药，禁止在河塘内等水体中清洗施药器具。\n\n（3）使用本品时应穿戴防护服和手套、口罩，避免吸入药液。施药期间不可吃东西和饮水。施药\n后应及时洗手和洗脸及暴露部位皮肤。\n\n（4）孕妇、哺乳期妇女及过敏者禁用，使用时有任何不良症状，应及时就医。\n\n（5）用过的容器和废弃包装物应妥善处理。\n\n\n\n20%丁氟螨酯悬浮剂\n\n［产品特点］ 本品属于酰基乙腈化合物类的一种全新专利杀螨剂，作用方式独特，主要通过触杀\n和胃毒作用防治卵、若螨和成螨，其作用机制为抑制线粒体蛋白复合体Ⅱ、阻碍电子（氢）传递、\n破坏磷酸化反应，其对不同发育阶段的害螨均有很好防效，可在柑橘的各个生长期使用。产生抗性\n的风险小，能有效杀灭红蜘蛛、黄蜘蛛和白蜘蛛，对白蜘蛛特效。\n\n［防治对象及使用方法］\n\n技术要点\n\n（1）本品在柑橘树上每季最多施用 1 次，安全间隔期 21 天。\n\n（2）在若螨发生盛期或害螨危害早期施药。施用时应使作物叶片正反面、果实表面以及树干、枝\n条等部位充分均匀着药。\n\n（3）大风或预计 1 小时内有雨，则勿施药。"
    ]
  },
  {
    "question": "桃褐腐病主要危害桃树的哪些部位？",
    "answer": "桃褐腐病主要危害桃树的果实、花、叶片和新梢。",
    "standard_answer": "主要危害果实、花、叶和枝梢。",
    "contexts": [
      "·症状· 初期的症状与桃褐腐病极为相似，花期受害，病花迅速变褐枯死，多残，留在枝上而不脱\n落，叶片发病初为圆形或近圆形褐色水烫状病斑，后可见有深浅相间的轮纹；新梢上病斑褐色，有\n流胶，幼果发病初期，果面上产生淡绿褐色近圆形病斑，后病果全部腐烂，并干缩成僵果，果面产\n生很厚的白色菌丝，并形成很多白色至灰黑色大小不一的菌核，病果无霉臭味。\n\n·发病规律· 本病病菌主要以菌核在病僵果、树上、地面上越冬。翌年桃树开花时菌核萌发形成子囊\n盘，从中散发出大量的子囊孢子，如天气潮湿多雨，即能造成大量花朵的发病。病花的组织碎片及\n残体遇到风雨即被吹散，并散落和黏附在叶片和幼果上，引起叶片和幼果的发病。因此在病叶和病\n果的病斑上，多可明显地看到黏附有由病花散落的花器残余物。\n\n·防治方法·\n\n（1）落叶后至发芽前，彻底清除树上、树下的病僵果，集中烧毁；及时疏花疏果；合理修剪，使\n园内通风良好，降低小气候湿度。\n\n（2）发芽前全园喷施一次 45%石硫合剂晶体 200~300 倍液，铲除树上的病原菌；落花后 3~5 天开\n始喷药防病，常用药剂有 500 g/L异菌脲悬浮剂 800 倍液、70%甲基托布津可湿性粉剂 1 000~1 200\n倍液；每隔 10~15 天防治 1 次，共防治2~3 次。\n\n桃菌核病 嫩梢被害状\n\n\n\n桃菌核病 发病后期果实\n\n\n\n桃菌核病 果实被害状\n\n桃菌核病 分生孢子和孢子囊\n\n\n\n桃菌核病 无性孢子\n\n桃煤污病\n\n·病原· 无性阶段属半知菌亚门（Deuteromycotina）丝孢目（Hyphomycetales），主要有多主枝孢[\nCladosporium hergarum （Pers.） Link.]、大孢枝孢（ C.macrocarpum preuss ）、链格孢[ Alternaria\nalternata （Fr.） Keissl]、出芽短梗霉[ Aureobasidium pullulans （de Bary） Arn].和炱壳小圆孢（\nCheatasbalisa microglobulosa ）等，上海以煤烟霉属（ Fumago sp.）常见。有性阶段为子囊菌亚门\n（Ascomycotina）煤炱科（Capnodiaceae）或小煤炱科（Meliolaceac）。\n\n·症状· 主要危害叶片、果实和枝条。被害处初现污褐色霉点，圆形或不规则形，后形成煤烟状黑色\n霉层，严重时布满叶面、果面及枝，影响光合作用，降低果实商品价值。\n\n·发病规律· 病原菌以菌丝体和分生孢子在病叶上、土壤内及植物残体上越过休眠期，翌春病菌借风\n雨或蚜虫、介壳虫、粉虱等昆虫传播蔓延。以蚜虫、介壳虫、粉虱等刺吸式口器昆虫的分泌物为养\n料。凡刺吸式口器昆虫发生严重、果园种植过密、枝杈过密、湿度大、通风透光差，往往发病严\n重。\n\n·防治方法·\n\n（1）改善桃园小气候，雨后及时排水，增强通透性，防止湿气滞留。及时防治蚜虫等害虫。\n\n（2）发病初期，可选用 40%多菌灵胶悬剂 600 倍液，40%克菌丹可湿性粉剂400 倍液，每 15 天喷\n洒 1 次，共喷 1~2 次。\n\n\n\n桃煤污病 被害叶片\n\n\n\n桃煤污病 叶片被害状\n\n\n\n桃煤污病 叶片被害状\n\n桃煤污病 果实被害状\n\n\n\n桃煤污病 叶片被害状\n\n\n\n桃煤污病 叶片被害状\n\n桃细菌性穿孔病\n\n·病原· 油菜黄单孢菌桃李致病变种[ Xanthomonas campestris pv. pruni（Smith） Dowson]，属于变形\n菌门（Proteobacteria）黄单孢杆菌属（ Xnthomons ）细菌。\n\n\n\n·症状· 该病主要危害叶片，枝梢和果实也能受害。叶片感病后出现水渍状小点，淡褐色，逐渐扩大\n成圆形，近圆形斑，直径 2~5 mm，褐色或紫褐色，外有黄色晕圈。数个病斑可相互连成不规则\n斑，后期病斑周围产生裂纹，病斑脱落后形成穿孔斑；穿孔斑边缘常残留病斑组织，同一叶病斑多\n时叶片变黄，提早脱落。高湿环境下病斑背面分泌黄白色黏液。夏秋抽生的枝梢感病后产生春季溃\n疡斑，紫褐色，油浸状，微隆起，长圆形小斑，成为第二年初侵染主要来源。春夏抽生的枝梢感病\n后产生夏季溃疡斑，暗紫色，油浸状，椭圆形，中间稍凹陷，当年干枯死亡，不能成为第二年来\n源。枝梢病斑绕枝条一周后，病斑以上枝条枯死。果实受害后产生淡褐色水渍状小圆斑，扩大后褐\n色，稍凹陷，病斑常开裂，较深，易腐烂。\n\n·发病规律· 病菌主要在病梢上越冬，第二年病斑出现菌脓，经风雨或昆虫传播，一般 4 月中旬展叶\n后就可发病，5~6 月梅雨季节和 8~9 月台风季节为病害高峰期。果实成熟期多雨发病更重。\n\n·防治方法·\n\n（1）选栽抗病桃树品种。",
      "该类虫属软体动物门、腹足纲。多雨潮湿天气上树危害，取食果实和叶片。该类虫喜潮湿环境，正\n常或干旱天气不予防治；园内散放鸡、鸭、鹅等家禽可有效消灭该类害虫；清除种植场所内的杂草\n及杂物，营造通风、干燥的环境；在多雨潮湿天气发生量大时可喷洒药剂防治。\n\n·防治方法·\n\n（1）人工防治：清洁草坪，并撒上生石灰，减少滋生地，或用树叶、杂草诱集，天亮前集中捕\n捉。\n\n（2）生物防治：保护和利用天敌，如步行虫、蛙、蜥蜴等。\n\n（3）化学防治：用生石灰粉或茶枯粉毒杀，用量分别为 75 kg/hm2 和 45 kg/hm 2 ；或 6%三聚乙醛\n颗粒剂 500~700 g/亩。\n\n蛞蝓\n\n\n\n蛞蝓\n\n\n\n蛞蝓 群集危害\n\n\n\n\n\n\n同型巴蜗牛\n\n\n\n同型巴蜗牛\n\n\n\n柑橘病虫防治历\n\n（续表）\n\n\n\n\n\n\n\n\n\n二、桃树\n\n桃，蔷薇科、桃属植物；是一种乔木，高 3~8 m。桃除鲜食外，还可加工成桃脯、桃酱、桃汁、桃\n干和桃罐头；素有“寿桃”和“仙桃”的美称，因肉质鲜美，又被称为“天下第一果”。桃肉富含蛋白\n质、脂肪、碳水化合物、粗纤维、多种营养元素以及有机酸、糖分和挥发油，适宜低血钾和缺铁性\n贫血患者食用。\n\n桃原产中国，主要经济栽培地区在中国华北、华东各省，世界各地均有栽植。全国有许多优良桃品\n种，如山东的肥城桃、天津和上海的水蜜挑、南京时桃、杭州蟠桃、贵州白花桃、血桃以及河北深\n州的蜜桃。上海现在桃树种植面积为 6.7 万亩，水蜜桃主要集中在浦东的南汇地区、松江、崇明；\n黄桃主要集中在奉贤；蟠桃集中在金山地区，其他区有少量分布和油桃零星种植。\n\n目前，桃在上海地区主要病害有桃细菌性穿孔病、桃疮痂病、桃褐腐病、桃炭疽病、桃流胶病、桃\n根癌病、桃树生理性黄化等；主要虫害有桃树蚜虫、红蜘蛛、桃潜叶蛾、桃小绿叶蝉、桃蛀螟、茶\n翅蝽、介壳虫、红颈天牛等。\n\n\n\n桃树病害\n\n桃褐腐病\n\n·病原· 本病原有三种：果生链核盘菌（ Monilinia fructicola ）、核果链核盘菌（ M.laxa ），均属子\n囊菌亚门（Ascomycotina）链核盘菌属（ Monilinia ）；无性阶段为半知菌亚门\n（Deuteromycotina）丛梗孢属（ Monilia ）。\n\n·症状· 主要危害果实、花、叶和枝梢。果实染病初期在果面产生淡褐色圆形或近圆形小斑，斑部果\n肉很快腐烂，造成病果大部甚至整个呈褐色腐烂。近成熟果受害，初为淡褐色至褐色圆形斑，并很\n快扩展至果实的大部分，果肉迅速变褐腐烂，病斑表面产生黄白色或灰色绒球状霉丛或霉层，呈同\n心环纹状排列，引起落果。花部受害自雄蕊及花瓣尖端发生，病部始生褐色水渍状斑点，后扩展至\n全花，变褐枯萎。叶片受害自叶缘开始，产生褐色水渍状病斑，后扩展到叶柄，使全叶变褐萎垂。\n新梢上产生长圆形、灰褐色、边缘为紫褐色溃疡斑，中间稍凹陷，初期病斑常有流胶。\n\n·发病规律· 主要在树上、树下僵果及病枝条溃疡斑部以僵果（病菌的假菌核）和菌丝体越冬。翌春\n气温上升后产生大量病菌孢子，通过气孔、虫伤和机械伤口侵入，借助风、雨水飞溅或昆虫传播。\n该病从开花到果实成熟都能侵染；遇阴雨天气易引起花腐、果腐。栽植过密、地势低洼、管理粗\n放、通风透光不良易发病。\n\n·防治方法·\n\n（1）在休眠期和生长期，及时清除园中和枝条上的病果、僵果、病枝、病叶和病花，减少病菌侵\n染来源；修剪过密枝条，改善果园通风透光条件。雨季及时排水。\n\n（2）在幼果期及时进行套袋，可阻隔病菌侵染。\n\n（3）桃树萌芽前，选用 45%晶体石硫合剂 30 倍液，或波尔多液 100 倍液等喷雾，并同时喷洒地\n面。\n\n（4）在落花后 10 天左右，开始喷药，每次喷药须间隔 10~15 天。药剂可选用混配剂 75%百菌清\n可湿性粉剂 800 倍液加 70%甲基硫菌灵可湿性粉剂 800~1 000倍液、23.4%双炔酰菌胺悬浮剂 1 500\n倍液、4%春雷霉素可湿性粉剂 40~60 g/亩等，交替喷雾防治，每次喷雾间隔 7~15 天，连续防治\n2~3 次。\n\n\n\n桃褐腐病 田间发病状\n\n\n\n桃褐腐病 悬挂在树上的僵果成为病菌持续传播的病源\n\n\n\n桃褐腐病 病果后期表现的霉丛\n\n果实 被害状\n\n\n\n桃褐腐病 叶片被害状\n\n桃褐腐病 1.分生孢子的萌发；2.分生孢子链的一部分；3.子囊、侧丝和子囊孢子\n\n桃菌核病\n\n·病原· 病原为核盘菌[ Sclerotinia sclerotiorum （Lib.） de Bary]，属子囊菌亚门（Ascomycotina）核\n盘菌属（ Sclerotinia ）。",
      "·症状· 病树叶表面最初出现浅绿色至淡黄色、多角形至不整齐形、直径约1 mm的斑点，后变为鲜\n黄色。病斑反面出现稍隆起、突破表皮的浅褐色的粉状夏孢子堆。秋天，叶片反面长出雪白色、黏\n质和隆起的冬孢子堆。冬孢子堆和夏孢子堆可以混生，也可以各自在另外的叶片上出现。\n\n·发病规律· 夏孢子借风力飘落到叶面萌发，长出芽管，从气孔侵入寄主。接种 12~15 天后，表现症\n状，三周后形成夏孢子。秋天形成冬孢子。冬孢子形成后，萌发很容易。在合适的温、湿度条件\n下，经 2~4 小时即萌发，从芽管长出前菌丝，7~15 小时形成担孢子。担孢子侵染转主寄主天葵。\n担孢子从叶上萌发，通过角皮层侵入表皮细胞，在栅状组织细胞间伸长，以肿大的吸盘插入细胞\n内。菌丝通过叶柄组织向下蔓延。春天，天葵的地下块茎有很多菌丝。后来，天葵抽出新叶。若叶\n从感染的块茎抽出，则呈萎缩状，叶背面长出性孢子器，叶正面则呈现锈子器，锈孢子借风力飞\n散，传染桃叶。此时约为春、夏之间。锈孢子在桃叶上萌发，芽管先端到达桃叶气孔，并形成附着\n孢，下面长出侵染菌丝，从气孔侵入寄主组织内。发病潜育期为 29 天，夏孢子堆出现则需要 45\n天。病原菌的菌丝在天葵的块茎内，可持续数年，每年均形成性孢子器和锈子器。\n\n·防治方法·\n\n（1）铲除桃园附近杂草，冬季清扫果园，烧尽落叶，杜绝病源。\n\n（2）加强树体管理，增强抗病能力。\n\n（3）芽萌动期喷洒 45%石硫合剂晶体 150~200 倍液，或 1∶1∶100 波尔多液。6~7 月间喷洒 30%\n嘧菌酯悬浮剂 1 000~2 000 倍液，或 25%乙嘧酚磺酸酯微乳剂500~700 倍液。\n\n\n\n桃白锈病 叶片正面被害状\n\n桃白锈病 叶背面被害状\n\n\n\n桃白锈病 整株被害状\n\n桃白锈病 叶正面被害状\n\n\n\n桃白锈病 叶背面被害状\n\n\n\n桃根癌病\n\n·病原· 根癌土壤杆菌［ Agrobacterium tumefaciens （Smith et Towns.）Conn.］，属根瘤菌科\n（Rhizobiaceae）土壤杆菌属（ Agrobacterium ）细菌。\n\n·症状· 染病桃树地上部分无肿瘤症状，只显出树势差，生长缓慢，抽梢晚且慢，重病树叶片黄化早\n落，树体寿命明显缩短，果实变小。受害部位在根颈、主根、侧根、支根，以嫁接处常见，肿瘤最\n大。长出肿瘤初生时乳白色或略带红色，光滑、柔软，球形或扁球形，或相互愈合成不规则形，后\n渐变为褐色、深褐色，表面粗糙凹凸不平，木质化坚硬，最后变为黑褐色、形状不规则的空洞。\n\n·发病规律· 病原细菌在土壤中可存活 1 年，在未经分解的病株残体中可存活 2年；通过机械伤、嫁\n\n\n\n接口、虫伤、冻伤等伤口侵入。雨水和灌溉水是传播的主要媒介，地下害虫、带菌土壤、修剪工\n具、病残组织亦可传病。带病接穗和苗木的调运，是远距离传播的主要途径。降水多、湿度大，病\n情扩散快且严重。受冻害的梨树，病害亦重。地势较高、排水良好的砂壤土较地势低洼、排水不良\n的黏壤土和碱性土壤生长的梨树发病轻。\n\n·防治方法·\n\n（1）严格检疫。不从疫区调苗，不栽带病苗木。\n\n（2）移栽时发现有肿瘤应予处理，可疑的用 1%硫酸铜浸 5 分钟，再用 2%的石灰水浸 1 分钟。\n\n（3）嫁接工具用 75%酒精消毒，伤口和接穗避免和土壤接触，减少染病机会和人为传播。\n\n（4）发现病株，应彻底刮除病部，再涂石硫合剂和波尔多液保护。刮下的肿瘤应随即烧毁。\n\n\n\n桃树根癌病 根被害状\n\n\n\n桃树根癌病 根被害状\n\n桃树根癌病 根被害状\n\n\n\n桃树根癌病 根被害状\n\n\n\n桃树虫害\n\n桃潜叶蛾\n\n·学名· Lyonetia clerkella （Linnaeus），又名桃潜蛾，属鳞翅目（Lepidoptera）潜叶蛾科\n（Lyonetiidae）。\n\n·鉴别特征· 成虫：体长 3 mm，体及前翅银白色。前翅狭长，翅基部有 2 条褐色纵纹，先端尖，翅\n先端有黑色斑纹。幼虫：体长 4 mm左右，胸部淡绿色，体扁平椭圆形，头部尖，足退化，尾端尖\n细具细长的尾状。\n\n·生活习性· 桃潜叶蛾一年发生 7~9 代，翌年 4 月桃树展叶后成虫羽化，产卵于叶表皮内取食。3~5\n天幼虫即老熟后，从蛀道脱出，在叶缘尖叶片边缘折成蛹室，吐丝作茧化蛹，也在树干翘皮缝、草\n丛中结白色薄茧化蛹。5 月上旬发生第一代成虫。以后每月发生 1 代，除第一、二代整齐外，以后\n各代明显世代重叠。\n\n·危害特点· 主要以幼虫潜食叶肉组织，在叶中纵横窜食，形成弯弯曲曲的虫道，并将粪粒充塞其\n中，最终干枯、脱落；7~9 月严重危害，尤以秋梢受害最烈。虫口密度大时还蛀食嫩梢皮层，形成\n银白色弯曲蛀道。\n\n·防治方法·",
      "·病原· 畸形外囊菌[ Taphrina deformans （Berk.） Tul]，属子囊菌亚门（Ascom ycotina）外囊菌属\n（ Taphrina ）。\n\n·症状· 早春桃树展叶期即能发病，病叶卷曲畸形，呈红褐色，春末病叶上有一层白色粉状物是病菌\n子囊层，后病叶变褐色、枯焦脱落；新梢发病后节间缩短，略肿大扭曲，灰绿色至黄绿色，叶片丛\n生，最后整枝枯死。小幼果感病后畸形，果面疮痂状开裂，很快脱落；较大的果实感病后，果实畸\n形，肿起，黄色或红色，毛茸多消失，病果易早落。\n\n·发病规律· 病菌主要以孢子附着在枝上或芽鳞上越冬，也能在土壤中越冬，次年桃芽萌动期和露红\n期即可侵入，展叶初期也能侵入。一年只有一次侵染，病菌喜欢冷凉潮湿的气候。春季，桃树发芽\n展叶期如多雨低温天气，桃树萌芽和展叶过程延长，往往发病严重。病害盛发期在 4 月下旬至 5 月\n上旬，6 月以后气温升至 20℃以上时，病害停止发展。一般在沿海、地势低洼的桃园发病严重。\n\n·防治方法·\n\n（1）在早春桃芽开始膨大但未展开时，喷射波美 5 度石硫合剂一次，这样连续喷药二三年，就可\n彻底根除桃缩叶病。在发病很严重的桃园，由于果园内菌量极多，一次喷药往往不能全歼病菌，可\n在当年桃树落叶后（11~12 月）喷 2%~3%硫酸铜一次，以杀灭黏附在冬芽上的大量芽孢子。到第\n二年早春再喷 45%石硫合剂晶体 150 倍液一次，使防治效果更加稳定。早春萌芽期喷用的药剂，\n除石硫合剂外，也可喷用 1%波尔多液，但不能同时使用。\n\n（2）喷药后，如有少数病叶出现，应及时摘除，集中烧毁，以减少第二年的菌源。\n\n（3）发病重、落叶多的桃园，要增施肥料，加强栽培管理，以促使树势恢复。摘除病梢，加强管\n理。当初见病叶而尚未出现银灰色粉状物前摘除销毁，可减少翌年的越冬菌量。对发病树应加强管\n理，追施肥料，使树势得到恢复，增强抗性。\n\n在早春桃发芽前喷药防治，可达到良好的效果。如果错过这个时期，而在展叶后喷药，则不仅不能\n起到防病的作用，且容易发生药害，必须引起注意。\n\n桃缩叶病 1.双核菌丝穿破叶角质层伸入表皮细胞间隙；2.叶组织中的菌丝及叶面的子囊层\n\n\n\n桃缩叶病 病叶\n\n\n\n桃缩叶病 发病叶片\n\n\n\n桃缩叶病 病叶\n\n桃缩叶病 病叶\n\n桃炭疽病\n\n·病原· 无性阶段为胶孢炭疽菌（ Colletotrichum gloeosporioides Penz），异名 Gloeosporium\n\n\n\nlaeticolor Berk，属半知菌亚门（Deuteromycotina）刺盘孢属（ Colletotrichum ）。\n\n·症状· 该病主要危害果实，也能侵染新梢、叶片。幼果染病，果面上产生水渍状浅褐色小点，随后\n扩大为红褐色或深褐色圆形或椭圆形凹陷有明显同心轮纹状病斑。新梢染病，呈长椭圆形褐色凹陷\n病斑，病梢侧向弯曲，严重时枯死。叶片染病产生淡褐色圆形或不规则形灰褐色病斑，其上产生橘\n红色至黑色粒点。后病斑干枯脱落穿孔，新梢顶部叶片萎缩下垂，纵卷成管状。\n\n·发病规律· 病菌以菌丝体在病枝、病果及僵果内越冬。翌春产生分生孢子，借风雨或昆虫传播，侵\n染新梢和幼果引起发病；后病部可再产生分生孢子，借风雨或昆虫进行多次侵染。桃树整个生长期\n均可被侵染。该病的发生与气候、品种有关，其中高温、高湿是该病发生的前提条件，果实成熟前\n温暖、高湿极易发病。\n\n·防治方法·\n\n（1）细致修剪，彻底清除树上病梢、枯死枝、僵果，结合施基肥，彻底清扫落叶和地面病残体，\n深埋于施肥坑内。\n\n（2）增加果园通风透光条件，落叶后深翻果园、保持土壤疏松和通透性。\n\n（3）以腐熟有机肥为主，增施钾肥，禁施单一含氮肥料。\n\n（4）发芽前细致喷洒 45%石硫合剂晶体 200~300 倍液，消灭越冬病菌。落花后喷 70%甲基硫菌灵\n可湿性粉剂 1 000 倍液；生长季节结合防治褐腐病等及时喷洒 2 000 倍液 10%苯醚甲环唑水分散粒\n剂，或 3 000 倍液 3%嘧菌酯悬浮剂等药液，保护叶片和果实。\n\n桃炭疽病 病果\n\n\n\n桃炭疽病 病叶\n\n桃炭疽病 病叶\n\n\n\n桃炭疽病 病果和卷成筒状的叶\n\n\n\n桃炭疽病 留在枝上的僵果引起周围幼果发病状\n\n\n\n桃炭疽病 病幼果干缩成僵果\n\n\n\n桃炭疽病 分生孢子盘和分生孢子\n\n桃白锈病\n\n·病原· 桃不休白双胞锈菌[ Leucotelium pruni~persicae （Hori） Tranzsechel]，属担子菌亚门\n（Basidiomycotina）不休白双胞锈属（ Leucotelium ）。",
      "（2）开春后要注意开沟排水，达到雨停水干，降低空气湿度。增施有机肥和磷钾肥，避免偏施氮\n肥。\n\n（3）适当增加内膛疏枝量，改善通风透光条件，促使树体生长健壮，提高抗病能力。在 10~11 月\n桃休眠期，也正是病原在被害枝条上开始越冬，结合冬季清园修剪，彻底剪除枯枝、病梢，及时清\n扫落叶、落果等，集中烧毁，消灭越冬菌源。桃园附近应避免种植杏、李等核果类果树。\n\n（4）发芽前喷 45%石硫合剂晶体 300 倍液，或 1∶1∶100 倍式波尔多液，铲除越冬菌源。发芽后\n喷 8%宁南霉素水剂 2 000~3 000 倍液，或 20%噻菌铜悬浮剂 300~700 倍液。6 月末至 7 月初喷第一\n遍，隔半个月至 20 天再喷 1 次，共喷2~3 次。\n\n桃细菌性穿孔病 病原细菌\n\n\n\n桃细菌性穿孔病 叶片被害状\n\n\n\n桃细菌性穿孔病 叶片被害状\n\n\n\n细菌性穿孔病 危害后期\n\n\n\n桃细菌性穿孔病 果实危害后期\n\n\n\n\n\n\n桃细菌性穿孔病 整株危害状\n\n桃侵染性流胶病\n\n·病原· 主要有葡萄座腔菌（ Botryosphaeria dothidea ）、柑橘葡萄座腔菌（ B.rhodina ）等，均属子\n囊菌亚门（Ascomycotina）葡萄座腔菌属（ Botryosphaeria ）。\n\n·症状· 该病主要危害枝干和果实，后期隆起开裂，溢出树脂。病部易被腐生菌侵染，树势衰弱，叶\n片变黄，严重时全株枯死。果实发病，有时龟裂。\n\n·发病规律· 病菌主要以菌丝体、分生孢子器和子囊壳在被害枝干部越冬，翌年3 月下旬至 4 月中旬\n产生分生孢子或弹射出子囊孢子，通过风、雨传播，从皮孔、伤口及侧芽侵入。一般直立生长的枝\n干基部以上部位受害严重，侧生枝干向地表的一面重于向上的部位，枝干分杈处受害亦重；土质瘠\n薄，肥水不足，负载量大，均可诱发该病。\n\n·防治方法·\n\n（1）加强桃园管理，增强树势。增施有机肥，改善土壤团粒结构，提高土壤通气性能；低洼积水\n地注意排水，酸碱土壤适当施用石灰或过磷酸钙，改良土壤，盐碱地要注意排盐。\n\n（2）做好桃园清园工作：冬前或开春后清理果园，将受害枝梢及枯枝落叶集中烧毁；刮除流胶硬\n块及腐烂组织，消灭菌源。土施硼或生长季节根外喷硼，对防治流胶病有较好的效果。\n\n（3）调整修剪时间：合理修剪，减少枝干伤口。桃树生长季节进行短截和疏枝修剪，人为造成伤\n口，遇中温高湿环境，伤口容易出现流胶现象。通过调整修剪时期，生长期采取轻剪，及时摘心疏\n除部分过密枝条。主要的疏枝、短截、回缩修剪，调到冬季后进行。\n\n（4）树干涂白：冬夏季节进行两次主干刷白，第一次刷白于桃树落叶后进行，用 45%石硫合剂晶\n体 200~300 倍液或用 20%~25%石灰乳涂刷主干杀菌消毒，防治冻害、日灼，消灭树干越冬病虫，\n减少病虫害侵染和辐射热危害，可有效地减少流胶病发生。\n\n（5）夏季全园覆草：没有种植绿肥的果园，夏秋高温干旱季节全园覆盖 10 cm厚的杂草或稻草，\n不但能够提高果园土壤含水量，利于果树根系生长，强壮树体，而且十分有效地防止地面辐射热导\n致的日灼病，从而防止发生流胶病。\n\n\n\n桃流胶病 枝干流胶\n\n\n\n桃流胶病 枝干流胶\n\n桃树流胶病\n\n·病原· 桃树流胶病是一种非侵染性病害。凡造成桃树不能正常生长发育的原因，如各种伤口、管理\n不当，环境条件不宜都能引诱树体流胶。\n\n·症状· 主要发生在枝干，尤以主干和主枝杈桠部最为常见。枝干受害病部稍肿胀，木质部变色，从\n病部流出半透明黄色树胶，尤其雨后流胶现象更为严重。流出的树胶与空气接触后，变为黄褐色，\n胶冻状，干燥后变为红褐、茶褐、黑色的硬胶块；致树势衰弱，易遭天牛危害，严重时，枝干或全\n株枯死。果实也能流胶。\n\n·发病规律· 整个生长期都发病，梅雨和台风季节发生最重，特别是长期干旱后降暴雨常引发严重流\n胶。老树、弱树较幼树健壮树流胶严重。\n\n·防治方法· 凡虫害严重、施肥不当、土质黏重，排水不良，夏季修剪过重，遭受各种损伤等都能加\n重流胶危害。可结合冬剪，清除被害枝梢。低洼积水地注意开沟排渍；增施有机肥及磷、钾肥，控\n制树体负载量。\n\n（1）加强肥水管理，增施有机肥，桃树耐干旱，适宜于疏松土壤内种植。\n\n（2）科学修剪，注意生长季节及时疏枝回缩，冬季修剪少疏枝，减少枝干伤口，修剪的伤口上要\n及时涂抹愈伤防腐膜，保护伤口不受外界细菌的侵染，有效防治伤口腐烂流胶。注意疏花疏果，减\n少负载量。\n\n（3）增施有机肥，氮、磷、钾配比合理；加有机肥和砂土改良黏重土壤；雨后及时排水；涂白减\n少冻伤和日灼；防治枝干病虫害，减少伤口。\n\n\n\n桃树流胶病 枝干被害状\n\n\n\n桃树流胶病 枝干被害状\n\n\n\n桃树流胶病 枝干被害状\n\n\n\n桃树流胶病 被害枝\n\n\n\n桃缩叶病"
    ]
  },
  {
    "question": "桃树流胶病的主要发病部位在哪里？",
    "answer": "桃树流胶病主要发生在枝干，尤以主干和主枝杈桠部最为常见。果实也可能发生流胶。",
    "standard_answer": "主要发生在枝干，尤以主干和主枝杈桠部最为常见。",
    "contexts": [
      "（2）开春后要注意开沟排水，达到雨停水干，降低空气湿度。增施有机肥和磷钾肥，避免偏施氮\n肥。\n\n（3）适当增加内膛疏枝量，改善通风透光条件，促使树体生长健壮，提高抗病能力。在 10~11 月\n桃休眠期，也正是病原在被害枝条上开始越冬，结合冬季清园修剪，彻底剪除枯枝、病梢，及时清\n扫落叶、落果等，集中烧毁，消灭越冬菌源。桃园附近应避免种植杏、李等核果类果树。\n\n（4）发芽前喷 45%石硫合剂晶体 300 倍液，或 1∶1∶100 倍式波尔多液，铲除越冬菌源。发芽后\n喷 8%宁南霉素水剂 2 000~3 000 倍液，或 20%噻菌铜悬浮剂 300~700 倍液。6 月末至 7 月初喷第一\n遍，隔半个月至 20 天再喷 1 次，共喷2~3 次。\n\n桃细菌性穿孔病 病原细菌\n\n\n\n桃细菌性穿孔病 叶片被害状\n\n\n\n桃细菌性穿孔病 叶片被害状\n\n\n\n细菌性穿孔病 危害后期\n\n\n\n桃细菌性穿孔病 果实危害后期\n\n\n\n\n\n\n桃细菌性穿孔病 整株危害状\n\n桃侵染性流胶病\n\n·病原· 主要有葡萄座腔菌（ Botryosphaeria dothidea ）、柑橘葡萄座腔菌（ B.rhodina ）等，均属子\n囊菌亚门（Ascomycotina）葡萄座腔菌属（ Botryosphaeria ）。\n\n·症状· 该病主要危害枝干和果实，后期隆起开裂，溢出树脂。病部易被腐生菌侵染，树势衰弱，叶\n片变黄，严重时全株枯死。果实发病，有时龟裂。\n\n·发病规律· 病菌主要以菌丝体、分生孢子器和子囊壳在被害枝干部越冬，翌年3 月下旬至 4 月中旬\n产生分生孢子或弹射出子囊孢子，通过风、雨传播，从皮孔、伤口及侧芽侵入。一般直立生长的枝\n干基部以上部位受害严重，侧生枝干向地表的一面重于向上的部位，枝干分杈处受害亦重；土质瘠\n薄，肥水不足，负载量大，均可诱发该病。\n\n·防治方法·\n\n（1）加强桃园管理，增强树势。增施有机肥，改善土壤团粒结构，提高土壤通气性能；低洼积水\n地注意排水，酸碱土壤适当施用石灰或过磷酸钙，改良土壤，盐碱地要注意排盐。\n\n（2）做好桃园清园工作：冬前或开春后清理果园，将受害枝梢及枯枝落叶集中烧毁；刮除流胶硬\n块及腐烂组织，消灭菌源。土施硼或生长季节根外喷硼，对防治流胶病有较好的效果。\n\n（3）调整修剪时间：合理修剪，减少枝干伤口。桃树生长季节进行短截和疏枝修剪，人为造成伤\n口，遇中温高湿环境，伤口容易出现流胶现象。通过调整修剪时期，生长期采取轻剪，及时摘心疏\n除部分过密枝条。主要的疏枝、短截、回缩修剪，调到冬季后进行。\n\n（4）树干涂白：冬夏季节进行两次主干刷白，第一次刷白于桃树落叶后进行，用 45%石硫合剂晶\n体 200~300 倍液或用 20%~25%石灰乳涂刷主干杀菌消毒，防治冻害、日灼，消灭树干越冬病虫，\n减少病虫害侵染和辐射热危害，可有效地减少流胶病发生。\n\n（5）夏季全园覆草：没有种植绿肥的果园，夏秋高温干旱季节全园覆盖 10 cm厚的杂草或稻草，\n不但能够提高果园土壤含水量，利于果树根系生长，强壮树体，而且十分有效地防止地面辐射热导\n致的日灼病，从而防止发生流胶病。\n\n\n\n桃流胶病 枝干流胶\n\n\n\n桃流胶病 枝干流胶\n\n桃树流胶病\n\n·病原· 桃树流胶病是一种非侵染性病害。凡造成桃树不能正常生长发育的原因，如各种伤口、管理\n不当，环境条件不宜都能引诱树体流胶。\n\n·症状· 主要发生在枝干，尤以主干和主枝杈桠部最为常见。枝干受害病部稍肿胀，木质部变色，从\n病部流出半透明黄色树胶，尤其雨后流胶现象更为严重。流出的树胶与空气接触后，变为黄褐色，\n胶冻状，干燥后变为红褐、茶褐、黑色的硬胶块；致树势衰弱，易遭天牛危害，严重时，枝干或全\n株枯死。果实也能流胶。\n\n·发病规律· 整个生长期都发病，梅雨和台风季节发生最重，特别是长期干旱后降暴雨常引发严重流\n胶。老树、弱树较幼树健壮树流胶严重。\n\n·防治方法· 凡虫害严重、施肥不当、土质黏重，排水不良，夏季修剪过重，遭受各种损伤等都能加\n重流胶危害。可结合冬剪，清除被害枝梢。低洼积水地注意开沟排渍；增施有机肥及磷、钾肥，控\n制树体负载量。\n\n（1）加强肥水管理，增施有机肥，桃树耐干旱，适宜于疏松土壤内种植。\n\n（2）科学修剪，注意生长季节及时疏枝回缩，冬季修剪少疏枝，减少枝干伤口，修剪的伤口上要\n及时涂抹愈伤防腐膜，保护伤口不受外界细菌的侵染，有效防治伤口腐烂流胶。注意疏花疏果，减\n少负载量。\n\n（3）增施有机肥，氮、磷、钾配比合理；加有机肥和砂土改良黏重土壤；雨后及时排水；涂白减\n少冻伤和日灼；防治枝干病虫害，减少伤口。\n\n\n\n桃树流胶病 枝干被害状\n\n\n\n桃树流胶病 枝干被害状\n\n\n\n桃树流胶病 枝干被害状\n\n\n\n桃树流胶病 被害枝\n\n\n\n桃缩叶病",
      "·症状· 初期的症状与桃褐腐病极为相似，花期受害，病花迅速变褐枯死，多残，留在枝上而不脱\n落，叶片发病初为圆形或近圆形褐色水烫状病斑，后可见有深浅相间的轮纹；新梢上病斑褐色，有\n流胶，幼果发病初期，果面上产生淡绿褐色近圆形病斑，后病果全部腐烂，并干缩成僵果，果面产\n生很厚的白色菌丝，并形成很多白色至灰黑色大小不一的菌核，病果无霉臭味。\n\n·发病规律· 本病病菌主要以菌核在病僵果、树上、地面上越冬。翌年桃树开花时菌核萌发形成子囊\n盘，从中散发出大量的子囊孢子，如天气潮湿多雨，即能造成大量花朵的发病。病花的组织碎片及\n残体遇到风雨即被吹散，并散落和黏附在叶片和幼果上，引起叶片和幼果的发病。因此在病叶和病\n果的病斑上，多可明显地看到黏附有由病花散落的花器残余物。\n\n·防治方法·\n\n（1）落叶后至发芽前，彻底清除树上、树下的病僵果，集中烧毁；及时疏花疏果；合理修剪，使\n园内通风良好，降低小气候湿度。\n\n（2）发芽前全园喷施一次 45%石硫合剂晶体 200~300 倍液，铲除树上的病原菌；落花后 3~5 天开\n始喷药防病，常用药剂有 500 g/L异菌脲悬浮剂 800 倍液、70%甲基托布津可湿性粉剂 1 000~1 200\n倍液；每隔 10~15 天防治 1 次，共防治2~3 次。\n\n桃菌核病 嫩梢被害状\n\n\n\n桃菌核病 发病后期果实\n\n\n\n桃菌核病 果实被害状\n\n桃菌核病 分生孢子和孢子囊\n\n\n\n桃菌核病 无性孢子\n\n桃煤污病\n\n·病原· 无性阶段属半知菌亚门（Deuteromycotina）丝孢目（Hyphomycetales），主要有多主枝孢[\nCladosporium hergarum （Pers.） Link.]、大孢枝孢（ C.macrocarpum preuss ）、链格孢[ Alternaria\nalternata （Fr.） Keissl]、出芽短梗霉[ Aureobasidium pullulans （de Bary） Arn].和炱壳小圆孢（\nCheatasbalisa microglobulosa ）等，上海以煤烟霉属（ Fumago sp.）常见。有性阶段为子囊菌亚门\n（Ascomycotina）煤炱科（Capnodiaceae）或小煤炱科（Meliolaceac）。\n\n·症状· 主要危害叶片、果实和枝条。被害处初现污褐色霉点，圆形或不规则形，后形成煤烟状黑色\n霉层，严重时布满叶面、果面及枝，影响光合作用，降低果实商品价值。\n\n·发病规律· 病原菌以菌丝体和分生孢子在病叶上、土壤内及植物残体上越过休眠期，翌春病菌借风\n雨或蚜虫、介壳虫、粉虱等昆虫传播蔓延。以蚜虫、介壳虫、粉虱等刺吸式口器昆虫的分泌物为养\n料。凡刺吸式口器昆虫发生严重、果园种植过密、枝杈过密、湿度大、通风透光差，往往发病严\n重。\n\n·防治方法·\n\n（1）改善桃园小气候，雨后及时排水，增强通透性，防止湿气滞留。及时防治蚜虫等害虫。\n\n（2）发病初期，可选用 40%多菌灵胶悬剂 600 倍液，40%克菌丹可湿性粉剂400 倍液，每 15 天喷\n洒 1 次，共喷 1~2 次。\n\n\n\n桃煤污病 被害叶片\n\n\n\n桃煤污病 叶片被害状\n\n\n\n桃煤污病 叶片被害状\n\n桃煤污病 果实被害状\n\n\n\n桃煤污病 叶片被害状\n\n\n\n桃煤污病 叶片被害状\n\n桃细菌性穿孔病\n\n·病原· 油菜黄单孢菌桃李致病变种[ Xanthomonas campestris pv. pruni（Smith） Dowson]，属于变形\n菌门（Proteobacteria）黄单孢杆菌属（ Xnthomons ）细菌。\n\n\n\n·症状· 该病主要危害叶片，枝梢和果实也能受害。叶片感病后出现水渍状小点，淡褐色，逐渐扩大\n成圆形，近圆形斑，直径 2~5 mm，褐色或紫褐色，外有黄色晕圈。数个病斑可相互连成不规则\n斑，后期病斑周围产生裂纹，病斑脱落后形成穿孔斑；穿孔斑边缘常残留病斑组织，同一叶病斑多\n时叶片变黄，提早脱落。高湿环境下病斑背面分泌黄白色黏液。夏秋抽生的枝梢感病后产生春季溃\n疡斑，紫褐色，油浸状，微隆起，长圆形小斑，成为第二年初侵染主要来源。春夏抽生的枝梢感病\n后产生夏季溃疡斑，暗紫色，油浸状，椭圆形，中间稍凹陷，当年干枯死亡，不能成为第二年来\n源。枝梢病斑绕枝条一周后，病斑以上枝条枯死。果实受害后产生淡褐色水渍状小圆斑，扩大后褐\n色，稍凹陷，病斑常开裂，较深，易腐烂。\n\n·发病规律· 病菌主要在病梢上越冬，第二年病斑出现菌脓，经风雨或昆虫传播，一般 4 月中旬展叶\n后就可发病，5~6 月梅雨季节和 8~9 月台风季节为病害高峰期。果实成熟期多雨发病更重。\n\n·防治方法·\n\n（1）选栽抗病桃树品种。",
      "·症状· 病树叶表面最初出现浅绿色至淡黄色、多角形至不整齐形、直径约1 mm的斑点，后变为鲜\n黄色。病斑反面出现稍隆起、突破表皮的浅褐色的粉状夏孢子堆。秋天，叶片反面长出雪白色、黏\n质和隆起的冬孢子堆。冬孢子堆和夏孢子堆可以混生，也可以各自在另外的叶片上出现。\n\n·发病规律· 夏孢子借风力飘落到叶面萌发，长出芽管，从气孔侵入寄主。接种 12~15 天后，表现症\n状，三周后形成夏孢子。秋天形成冬孢子。冬孢子形成后，萌发很容易。在合适的温、湿度条件\n下，经 2~4 小时即萌发，从芽管长出前菌丝，7~15 小时形成担孢子。担孢子侵染转主寄主天葵。\n担孢子从叶上萌发，通过角皮层侵入表皮细胞，在栅状组织细胞间伸长，以肿大的吸盘插入细胞\n内。菌丝通过叶柄组织向下蔓延。春天，天葵的地下块茎有很多菌丝。后来，天葵抽出新叶。若叶\n从感染的块茎抽出，则呈萎缩状，叶背面长出性孢子器，叶正面则呈现锈子器，锈孢子借风力飞\n散，传染桃叶。此时约为春、夏之间。锈孢子在桃叶上萌发，芽管先端到达桃叶气孔，并形成附着\n孢，下面长出侵染菌丝，从气孔侵入寄主组织内。发病潜育期为 29 天，夏孢子堆出现则需要 45\n天。病原菌的菌丝在天葵的块茎内，可持续数年，每年均形成性孢子器和锈子器。\n\n·防治方法·\n\n（1）铲除桃园附近杂草，冬季清扫果园，烧尽落叶，杜绝病源。\n\n（2）加强树体管理，增强抗病能力。\n\n（3）芽萌动期喷洒 45%石硫合剂晶体 150~200 倍液，或 1∶1∶100 波尔多液。6~7 月间喷洒 30%\n嘧菌酯悬浮剂 1 000~2 000 倍液，或 25%乙嘧酚磺酸酯微乳剂500~700 倍液。\n\n\n\n桃白锈病 叶片正面被害状\n\n桃白锈病 叶背面被害状\n\n\n\n桃白锈病 整株被害状\n\n桃白锈病 叶正面被害状\n\n\n\n桃白锈病 叶背面被害状\n\n\n\n桃根癌病\n\n·病原· 根癌土壤杆菌［ Agrobacterium tumefaciens （Smith et Towns.）Conn.］，属根瘤菌科\n（Rhizobiaceae）土壤杆菌属（ Agrobacterium ）细菌。\n\n·症状· 染病桃树地上部分无肿瘤症状，只显出树势差，生长缓慢，抽梢晚且慢，重病树叶片黄化早\n落，树体寿命明显缩短，果实变小。受害部位在根颈、主根、侧根、支根，以嫁接处常见，肿瘤最\n大。长出肿瘤初生时乳白色或略带红色，光滑、柔软，球形或扁球形，或相互愈合成不规则形，后\n渐变为褐色、深褐色，表面粗糙凹凸不平，木质化坚硬，最后变为黑褐色、形状不规则的空洞。\n\n·发病规律· 病原细菌在土壤中可存活 1 年，在未经分解的病株残体中可存活 2年；通过机械伤、嫁\n\n\n\n接口、虫伤、冻伤等伤口侵入。雨水和灌溉水是传播的主要媒介，地下害虫、带菌土壤、修剪工\n具、病残组织亦可传病。带病接穗和苗木的调运，是远距离传播的主要途径。降水多、湿度大，病\n情扩散快且严重。受冻害的梨树，病害亦重。地势较高、排水良好的砂壤土较地势低洼、排水不良\n的黏壤土和碱性土壤生长的梨树发病轻。\n\n·防治方法·\n\n（1）严格检疫。不从疫区调苗，不栽带病苗木。\n\n（2）移栽时发现有肿瘤应予处理，可疑的用 1%硫酸铜浸 5 分钟，再用 2%的石灰水浸 1 分钟。\n\n（3）嫁接工具用 75%酒精消毒，伤口和接穗避免和土壤接触，减少染病机会和人为传播。\n\n（4）发现病株，应彻底刮除病部，再涂石硫合剂和波尔多液保护。刮下的肿瘤应随即烧毁。\n\n\n\n桃树根癌病 根被害状\n\n\n\n桃树根癌病 根被害状\n\n桃树根癌病 根被害状\n\n\n\n桃树根癌病 根被害状\n\n\n\n桃树虫害\n\n桃潜叶蛾\n\n·学名· Lyonetia clerkella （Linnaeus），又名桃潜蛾，属鳞翅目（Lepidoptera）潜叶蛾科\n（Lyonetiidae）。\n\n·鉴别特征· 成虫：体长 3 mm，体及前翅银白色。前翅狭长，翅基部有 2 条褐色纵纹，先端尖，翅\n先端有黑色斑纹。幼虫：体长 4 mm左右，胸部淡绿色，体扁平椭圆形，头部尖，足退化，尾端尖\n细具细长的尾状。\n\n·生活习性· 桃潜叶蛾一年发生 7~9 代，翌年 4 月桃树展叶后成虫羽化，产卵于叶表皮内取食。3~5\n天幼虫即老熟后，从蛀道脱出，在叶缘尖叶片边缘折成蛹室，吐丝作茧化蛹，也在树干翘皮缝、草\n丛中结白色薄茧化蛹。5 月上旬发生第一代成虫。以后每月发生 1 代，除第一、二代整齐外，以后\n各代明显世代重叠。\n\n·危害特点· 主要以幼虫潜食叶肉组织，在叶中纵横窜食，形成弯弯曲曲的虫道，并将粪粒充塞其\n中，最终干枯、脱落；7~9 月严重危害，尤以秋梢受害最烈。虫口密度大时还蛀食嫩梢皮层，形成\n银白色弯曲蛀道。\n\n·防治方法·",
      "该类虫属软体动物门、腹足纲。多雨潮湿天气上树危害，取食果实和叶片。该类虫喜潮湿环境，正\n常或干旱天气不予防治；园内散放鸡、鸭、鹅等家禽可有效消灭该类害虫；清除种植场所内的杂草\n及杂物，营造通风、干燥的环境；在多雨潮湿天气发生量大时可喷洒药剂防治。\n\n·防治方法·\n\n（1）人工防治：清洁草坪，并撒上生石灰，减少滋生地，或用树叶、杂草诱集，天亮前集中捕\n捉。\n\n（2）生物防治：保护和利用天敌，如步行虫、蛙、蜥蜴等。\n\n（3）化学防治：用生石灰粉或茶枯粉毒杀，用量分别为 75 kg/hm2 和 45 kg/hm 2 ；或 6%三聚乙醛\n颗粒剂 500~700 g/亩。\n\n蛞蝓\n\n\n\n蛞蝓\n\n\n\n蛞蝓 群集危害\n\n\n\n\n\n\n同型巴蜗牛\n\n\n\n同型巴蜗牛\n\n\n\n柑橘病虫防治历\n\n（续表）\n\n\n\n\n\n\n\n\n\n二、桃树\n\n桃，蔷薇科、桃属植物；是一种乔木，高 3~8 m。桃除鲜食外，还可加工成桃脯、桃酱、桃汁、桃\n干和桃罐头；素有“寿桃”和“仙桃”的美称，因肉质鲜美，又被称为“天下第一果”。桃肉富含蛋白\n质、脂肪、碳水化合物、粗纤维、多种营养元素以及有机酸、糖分和挥发油，适宜低血钾和缺铁性\n贫血患者食用。\n\n桃原产中国，主要经济栽培地区在中国华北、华东各省，世界各地均有栽植。全国有许多优良桃品\n种，如山东的肥城桃、天津和上海的水蜜挑、南京时桃、杭州蟠桃、贵州白花桃、血桃以及河北深\n州的蜜桃。上海现在桃树种植面积为 6.7 万亩，水蜜桃主要集中在浦东的南汇地区、松江、崇明；\n黄桃主要集中在奉贤；蟠桃集中在金山地区，其他区有少量分布和油桃零星种植。\n\n目前，桃在上海地区主要病害有桃细菌性穿孔病、桃疮痂病、桃褐腐病、桃炭疽病、桃流胶病、桃\n根癌病、桃树生理性黄化等；主要虫害有桃树蚜虫、红蜘蛛、桃潜叶蛾、桃小绿叶蝉、桃蛀螟、茶\n翅蝽、介壳虫、红颈天牛等。\n\n\n\n桃树病害\n\n桃褐腐病\n\n·病原· 本病原有三种：果生链核盘菌（ Monilinia fructicola ）、核果链核盘菌（ M.laxa ），均属子\n囊菌亚门（Ascomycotina）链核盘菌属（ Monilinia ）；无性阶段为半知菌亚门\n（Deuteromycotina）丛梗孢属（ Monilia ）。\n\n·症状· 主要危害果实、花、叶和枝梢。果实染病初期在果面产生淡褐色圆形或近圆形小斑，斑部果\n肉很快腐烂，造成病果大部甚至整个呈褐色腐烂。近成熟果受害，初为淡褐色至褐色圆形斑，并很\n快扩展至果实的大部分，果肉迅速变褐腐烂，病斑表面产生黄白色或灰色绒球状霉丛或霉层，呈同\n心环纹状排列，引起落果。花部受害自雄蕊及花瓣尖端发生，病部始生褐色水渍状斑点，后扩展至\n全花，变褐枯萎。叶片受害自叶缘开始，产生褐色水渍状病斑，后扩展到叶柄，使全叶变褐萎垂。\n新梢上产生长圆形、灰褐色、边缘为紫褐色溃疡斑，中间稍凹陷，初期病斑常有流胶。\n\n·发病规律· 主要在树上、树下僵果及病枝条溃疡斑部以僵果（病菌的假菌核）和菌丝体越冬。翌春\n气温上升后产生大量病菌孢子，通过气孔、虫伤和机械伤口侵入，借助风、雨水飞溅或昆虫传播。\n该病从开花到果实成熟都能侵染；遇阴雨天气易引起花腐、果腐。栽植过密、地势低洼、管理粗\n放、通风透光不良易发病。\n\n·防治方法·\n\n（1）在休眠期和生长期，及时清除园中和枝条上的病果、僵果、病枝、病叶和病花，减少病菌侵\n染来源；修剪过密枝条，改善果园通风透光条件。雨季及时排水。\n\n（2）在幼果期及时进行套袋，可阻隔病菌侵染。\n\n（3）桃树萌芽前，选用 45%晶体石硫合剂 30 倍液，或波尔多液 100 倍液等喷雾，并同时喷洒地\n面。\n\n（4）在落花后 10 天左右，开始喷药，每次喷药须间隔 10~15 天。药剂可选用混配剂 75%百菌清\n可湿性粉剂 800 倍液加 70%甲基硫菌灵可湿性粉剂 800~1 000倍液、23.4%双炔酰菌胺悬浮剂 1 500\n倍液、4%春雷霉素可湿性粉剂 40~60 g/亩等，交替喷雾防治，每次喷雾间隔 7~15 天，连续防治\n2~3 次。\n\n\n\n桃褐腐病 田间发病状\n\n\n\n桃褐腐病 悬挂在树上的僵果成为病菌持续传播的病源\n\n\n\n桃褐腐病 病果后期表现的霉丛\n\n果实 被害状\n\n\n\n桃褐腐病 叶片被害状\n\n桃褐腐病 1.分生孢子的萌发；2.分生孢子链的一部分；3.子囊、侧丝和子囊孢子\n\n桃菌核病\n\n·病原· 病原为核盘菌[ Sclerotinia sclerotiorum （Lib.） de Bary]，属子囊菌亚门（Ascomycotina）核\n盘菌属（ Sclerotinia ）。",
      "·病原· 畸形外囊菌[ Taphrina deformans （Berk.） Tul]，属子囊菌亚门（Ascom ycotina）外囊菌属\n（ Taphrina ）。\n\n·症状· 早春桃树展叶期即能发病，病叶卷曲畸形，呈红褐色，春末病叶上有一层白色粉状物是病菌\n子囊层，后病叶变褐色、枯焦脱落；新梢发病后节间缩短，略肿大扭曲，灰绿色至黄绿色，叶片丛\n生，最后整枝枯死。小幼果感病后畸形，果面疮痂状开裂，很快脱落；较大的果实感病后，果实畸\n形，肿起，黄色或红色，毛茸多消失，病果易早落。\n\n·发病规律· 病菌主要以孢子附着在枝上或芽鳞上越冬，也能在土壤中越冬，次年桃芽萌动期和露红\n期即可侵入，展叶初期也能侵入。一年只有一次侵染，病菌喜欢冷凉潮湿的气候。春季，桃树发芽\n展叶期如多雨低温天气，桃树萌芽和展叶过程延长，往往发病严重。病害盛发期在 4 月下旬至 5 月\n上旬，6 月以后气温升至 20℃以上时，病害停止发展。一般在沿海、地势低洼的桃园发病严重。\n\n·防治方法·\n\n（1）在早春桃芽开始膨大但未展开时，喷射波美 5 度石硫合剂一次，这样连续喷药二三年，就可\n彻底根除桃缩叶病。在发病很严重的桃园，由于果园内菌量极多，一次喷药往往不能全歼病菌，可\n在当年桃树落叶后（11~12 月）喷 2%~3%硫酸铜一次，以杀灭黏附在冬芽上的大量芽孢子。到第\n二年早春再喷 45%石硫合剂晶体 150 倍液一次，使防治效果更加稳定。早春萌芽期喷用的药剂，\n除石硫合剂外，也可喷用 1%波尔多液，但不能同时使用。\n\n（2）喷药后，如有少数病叶出现，应及时摘除，集中烧毁，以减少第二年的菌源。\n\n（3）发病重、落叶多的桃园，要增施肥料，加强栽培管理，以促使树势恢复。摘除病梢，加强管\n理。当初见病叶而尚未出现银灰色粉状物前摘除销毁，可减少翌年的越冬菌量。对发病树应加强管\n理，追施肥料，使树势得到恢复，增强抗性。\n\n在早春桃发芽前喷药防治，可达到良好的效果。如果错过这个时期，而在展叶后喷药，则不仅不能\n起到防病的作用，且容易发生药害，必须引起注意。\n\n桃缩叶病 1.双核菌丝穿破叶角质层伸入表皮细胞间隙；2.叶组织中的菌丝及叶面的子囊层\n\n\n\n桃缩叶病 病叶\n\n\n\n桃缩叶病 发病叶片\n\n\n\n桃缩叶病 病叶\n\n桃缩叶病 病叶\n\n桃炭疽病\n\n·病原· 无性阶段为胶孢炭疽菌（ Colletotrichum gloeosporioides Penz），异名 Gloeosporium\n\n\n\nlaeticolor Berk，属半知菌亚门（Deuteromycotina）刺盘孢属（ Colletotrichum ）。\n\n·症状· 该病主要危害果实，也能侵染新梢、叶片。幼果染病，果面上产生水渍状浅褐色小点，随后\n扩大为红褐色或深褐色圆形或椭圆形凹陷有明显同心轮纹状病斑。新梢染病，呈长椭圆形褐色凹陷\n病斑，病梢侧向弯曲，严重时枯死。叶片染病产生淡褐色圆形或不规则形灰褐色病斑，其上产生橘\n红色至黑色粒点。后病斑干枯脱落穿孔，新梢顶部叶片萎缩下垂，纵卷成管状。\n\n·发病规律· 病菌以菌丝体在病枝、病果及僵果内越冬。翌春产生分生孢子，借风雨或昆虫传播，侵\n染新梢和幼果引起发病；后病部可再产生分生孢子，借风雨或昆虫进行多次侵染。桃树整个生长期\n均可被侵染。该病的发生与气候、品种有关，其中高温、高湿是该病发生的前提条件，果实成熟前\n温暖、高湿极易发病。\n\n·防治方法·\n\n（1）细致修剪，彻底清除树上病梢、枯死枝、僵果，结合施基肥，彻底清扫落叶和地面病残体，\n深埋于施肥坑内。\n\n（2）增加果园通风透光条件，落叶后深翻果园、保持土壤疏松和通透性。\n\n（3）以腐熟有机肥为主，增施钾肥，禁施单一含氮肥料。\n\n（4）发芽前细致喷洒 45%石硫合剂晶体 200~300 倍液，消灭越冬病菌。落花后喷 70%甲基硫菌灵\n可湿性粉剂 1 000 倍液；生长季节结合防治褐腐病等及时喷洒 2 000 倍液 10%苯醚甲环唑水分散粒\n剂，或 3 000 倍液 3%嘧菌酯悬浮剂等药液，保护叶片和果实。\n\n桃炭疽病 病果\n\n\n\n桃炭疽病 病叶\n\n桃炭疽病 病叶\n\n\n\n桃炭疽病 病果和卷成筒状的叶\n\n\n\n桃炭疽病 留在枝上的僵果引起周围幼果发病状\n\n\n\n桃炭疽病 病幼果干缩成僵果\n\n\n\n桃炭疽病 分生孢子盘和分生孢子\n\n桃白锈病\n\n·病原· 桃不休白双胞锈菌[ Leucotelium pruni~persicae （Hori） Tranzsechel]，属担子菌亚门\n（Basidiomycotina）不休白双胞锈属（ Leucotelium ）。"
    ]
  },
  {
    "question": "引起桃树细菌性穿孔病的病原菌属于哪一类？",
    "answer": "引起桃树细菌性穿孔病的病原菌属于变形菌门（Proteobacteria）黄单孢杆菌属（Xanthomonas），具体为油菜黄单孢菌桃李致病变种（Xanthomonas campestris pv. pruni）。",
    "standard_answer": "属于黄单孢杆菌属（Xanthomonas）细菌，具体为油菜黄单孢菌桃李致病变种。",
    "contexts": [
      "·症状· 初期的症状与桃褐腐病极为相似，花期受害，病花迅速变褐枯死，多残，留在枝上而不脱\n落，叶片发病初为圆形或近圆形褐色水烫状病斑，后可见有深浅相间的轮纹；新梢上病斑褐色，有\n流胶，幼果发病初期，果面上产生淡绿褐色近圆形病斑，后病果全部腐烂，并干缩成僵果，果面产\n生很厚的白色菌丝，并形成很多白色至灰黑色大小不一的菌核，病果无霉臭味。\n\n·发病规律· 本病病菌主要以菌核在病僵果、树上、地面上越冬。翌年桃树开花时菌核萌发形成子囊\n盘，从中散发出大量的子囊孢子，如天气潮湿多雨，即能造成大量花朵的发病。病花的组织碎片及\n残体遇到风雨即被吹散，并散落和黏附在叶片和幼果上，引起叶片和幼果的发病。因此在病叶和病\n果的病斑上，多可明显地看到黏附有由病花散落的花器残余物。\n\n·防治方法·\n\n（1）落叶后至发芽前，彻底清除树上、树下的病僵果，集中烧毁；及时疏花疏果；合理修剪，使\n园内通风良好，降低小气候湿度。\n\n（2）发芽前全园喷施一次 45%石硫合剂晶体 200~300 倍液，铲除树上的病原菌；落花后 3~5 天开\n始喷药防病，常用药剂有 500 g/L异菌脲悬浮剂 800 倍液、70%甲基托布津可湿性粉剂 1 000~1 200\n倍液；每隔 10~15 天防治 1 次，共防治2~3 次。\n\n桃菌核病 嫩梢被害状\n\n\n\n桃菌核病 发病后期果实\n\n\n\n桃菌核病 果实被害状\n\n桃菌核病 分生孢子和孢子囊\n\n\n\n桃菌核病 无性孢子\n\n桃煤污病\n\n·病原· 无性阶段属半知菌亚门（Deuteromycotina）丝孢目（Hyphomycetales），主要有多主枝孢[\nCladosporium hergarum （Pers.） Link.]、大孢枝孢（ C.macrocarpum preuss ）、链格孢[ Alternaria\nalternata （Fr.） Keissl]、出芽短梗霉[ Aureobasidium pullulans （de Bary） Arn].和炱壳小圆孢（\nCheatasbalisa microglobulosa ）等，上海以煤烟霉属（ Fumago sp.）常见。有性阶段为子囊菌亚门\n（Ascomycotina）煤炱科（Capnodiaceae）或小煤炱科（Meliolaceac）。\n\n·症状· 主要危害叶片、果实和枝条。被害处初现污褐色霉点，圆形或不规则形，后形成煤烟状黑色\n霉层，严重时布满叶面、果面及枝，影响光合作用，降低果实商品价值。\n\n·发病规律· 病原菌以菌丝体和分生孢子在病叶上、土壤内及植物残体上越过休眠期，翌春病菌借风\n雨或蚜虫、介壳虫、粉虱等昆虫传播蔓延。以蚜虫、介壳虫、粉虱等刺吸式口器昆虫的分泌物为养\n料。凡刺吸式口器昆虫发生严重、果园种植过密、枝杈过密、湿度大、通风透光差，往往发病严\n重。\n\n·防治方法·\n\n（1）改善桃园小气候，雨后及时排水，增强通透性，防止湿气滞留。及时防治蚜虫等害虫。\n\n（2）发病初期，可选用 40%多菌灵胶悬剂 600 倍液，40%克菌丹可湿性粉剂400 倍液，每 15 天喷\n洒 1 次，共喷 1~2 次。\n\n\n\n桃煤污病 被害叶片\n\n\n\n桃煤污病 叶片被害状\n\n\n\n桃煤污病 叶片被害状\n\n桃煤污病 果实被害状\n\n\n\n桃煤污病 叶片被害状\n\n\n\n桃煤污病 叶片被害状\n\n桃细菌性穿孔病\n\n·病原· 油菜黄单孢菌桃李致病变种[ Xanthomonas campestris pv. pruni（Smith） Dowson]，属于变形\n菌门（Proteobacteria）黄单孢杆菌属（ Xnthomons ）细菌。\n\n\n\n·症状· 该病主要危害叶片，枝梢和果实也能受害。叶片感病后出现水渍状小点，淡褐色，逐渐扩大\n成圆形，近圆形斑，直径 2~5 mm，褐色或紫褐色，外有黄色晕圈。数个病斑可相互连成不规则\n斑，后期病斑周围产生裂纹，病斑脱落后形成穿孔斑；穿孔斑边缘常残留病斑组织，同一叶病斑多\n时叶片变黄，提早脱落。高湿环境下病斑背面分泌黄白色黏液。夏秋抽生的枝梢感病后产生春季溃\n疡斑，紫褐色，油浸状，微隆起，长圆形小斑，成为第二年初侵染主要来源。春夏抽生的枝梢感病\n后产生夏季溃疡斑，暗紫色，油浸状，椭圆形，中间稍凹陷，当年干枯死亡，不能成为第二年来\n源。枝梢病斑绕枝条一周后，病斑以上枝条枯死。果实受害后产生淡褐色水渍状小圆斑，扩大后褐\n色，稍凹陷，病斑常开裂，较深，易腐烂。\n\n·发病规律· 病菌主要在病梢上越冬，第二年病斑出现菌脓，经风雨或昆虫传播，一般 4 月中旬展叶\n后就可发病，5~6 月梅雨季节和 8~9 月台风季节为病害高峰期。果实成熟期多雨发病更重。\n\n·防治方法·\n\n（1）选栽抗病桃树品种。",
      "（2）开春后要注意开沟排水，达到雨停水干，降低空气湿度。增施有机肥和磷钾肥，避免偏施氮\n肥。\n\n（3）适当增加内膛疏枝量，改善通风透光条件，促使树体生长健壮，提高抗病能力。在 10~11 月\n桃休眠期，也正是病原在被害枝条上开始越冬，结合冬季清园修剪，彻底剪除枯枝、病梢，及时清\n扫落叶、落果等，集中烧毁，消灭越冬菌源。桃园附近应避免种植杏、李等核果类果树。\n\n（4）发芽前喷 45%石硫合剂晶体 300 倍液，或 1∶1∶100 倍式波尔多液，铲除越冬菌源。发芽后\n喷 8%宁南霉素水剂 2 000~3 000 倍液，或 20%噻菌铜悬浮剂 300~700 倍液。6 月末至 7 月初喷第一\n遍，隔半个月至 20 天再喷 1 次，共喷2~3 次。\n\n桃细菌性穿孔病 病原细菌\n\n\n\n桃细菌性穿孔病 叶片被害状\n\n\n\n桃细菌性穿孔病 叶片被害状\n\n\n\n细菌性穿孔病 危害后期\n\n\n\n桃细菌性穿孔病 果实危害后期\n\n\n\n\n\n\n桃细菌性穿孔病 整株危害状\n\n桃侵染性流胶病\n\n·病原· 主要有葡萄座腔菌（ Botryosphaeria dothidea ）、柑橘葡萄座腔菌（ B.rhodina ）等，均属子\n囊菌亚门（Ascomycotina）葡萄座腔菌属（ Botryosphaeria ）。\n\n·症状· 该病主要危害枝干和果实，后期隆起开裂，溢出树脂。病部易被腐生菌侵染，树势衰弱，叶\n片变黄，严重时全株枯死。果实发病，有时龟裂。\n\n·发病规律· 病菌主要以菌丝体、分生孢子器和子囊壳在被害枝干部越冬，翌年3 月下旬至 4 月中旬\n产生分生孢子或弹射出子囊孢子，通过风、雨传播，从皮孔、伤口及侧芽侵入。一般直立生长的枝\n干基部以上部位受害严重，侧生枝干向地表的一面重于向上的部位，枝干分杈处受害亦重；土质瘠\n薄，肥水不足，负载量大，均可诱发该病。\n\n·防治方法·\n\n（1）加强桃园管理，增强树势。增施有机肥，改善土壤团粒结构，提高土壤通气性能；低洼积水\n地注意排水，酸碱土壤适当施用石灰或过磷酸钙，改良土壤，盐碱地要注意排盐。\n\n（2）做好桃园清园工作：冬前或开春后清理果园，将受害枝梢及枯枝落叶集中烧毁；刮除流胶硬\n块及腐烂组织，消灭菌源。土施硼或生长季节根外喷硼，对防治流胶病有较好的效果。\n\n（3）调整修剪时间：合理修剪，减少枝干伤口。桃树生长季节进行短截和疏枝修剪，人为造成伤\n口，遇中温高湿环境，伤口容易出现流胶现象。通过调整修剪时期，生长期采取轻剪，及时摘心疏\n除部分过密枝条。主要的疏枝、短截、回缩修剪，调到冬季后进行。\n\n（4）树干涂白：冬夏季节进行两次主干刷白，第一次刷白于桃树落叶后进行，用 45%石硫合剂晶\n体 200~300 倍液或用 20%~25%石灰乳涂刷主干杀菌消毒，防治冻害、日灼，消灭树干越冬病虫，\n减少病虫害侵染和辐射热危害，可有效地减少流胶病发生。\n\n（5）夏季全园覆草：没有种植绿肥的果园，夏秋高温干旱季节全园覆盖 10 cm厚的杂草或稻草，\n不但能够提高果园土壤含水量，利于果树根系生长，强壮树体，而且十分有效地防止地面辐射热导\n致的日灼病，从而防止发生流胶病。\n\n\n\n桃流胶病 枝干流胶\n\n\n\n桃流胶病 枝干流胶\n\n桃树流胶病\n\n·病原· 桃树流胶病是一种非侵染性病害。凡造成桃树不能正常生长发育的原因，如各种伤口、管理\n不当，环境条件不宜都能引诱树体流胶。\n\n·症状· 主要发生在枝干，尤以主干和主枝杈桠部最为常见。枝干受害病部稍肿胀，木质部变色，从\n病部流出半透明黄色树胶，尤其雨后流胶现象更为严重。流出的树胶与空气接触后，变为黄褐色，\n胶冻状，干燥后变为红褐、茶褐、黑色的硬胶块；致树势衰弱，易遭天牛危害，严重时，枝干或全\n株枯死。果实也能流胶。\n\n·发病规律· 整个生长期都发病，梅雨和台风季节发生最重，特别是长期干旱后降暴雨常引发严重流\n胶。老树、弱树较幼树健壮树流胶严重。\n\n·防治方法· 凡虫害严重、施肥不当、土质黏重，排水不良，夏季修剪过重，遭受各种损伤等都能加\n重流胶危害。可结合冬剪，清除被害枝梢。低洼积水地注意开沟排渍；增施有机肥及磷、钾肥，控\n制树体负载量。\n\n（1）加强肥水管理，增施有机肥，桃树耐干旱，适宜于疏松土壤内种植。\n\n（2）科学修剪，注意生长季节及时疏枝回缩，冬季修剪少疏枝，减少枝干伤口，修剪的伤口上要\n及时涂抹愈伤防腐膜，保护伤口不受外界细菌的侵染，有效防治伤口腐烂流胶。注意疏花疏果，减\n少负载量。\n\n（3）增施有机肥，氮、磷、钾配比合理；加有机肥和砂土改良黏重土壤；雨后及时排水；涂白减\n少冻伤和日灼；防治枝干病虫害，减少伤口。\n\n\n\n桃树流胶病 枝干被害状\n\n\n\n桃树流胶病 枝干被害状\n\n\n\n桃树流胶病 枝干被害状\n\n\n\n桃树流胶病 被害枝\n\n\n\n桃缩叶病",
      "·症状· 病树叶表面最初出现浅绿色至淡黄色、多角形至不整齐形、直径约1 mm的斑点，后变为鲜\n黄色。病斑反面出现稍隆起、突破表皮的浅褐色的粉状夏孢子堆。秋天，叶片反面长出雪白色、黏\n质和隆起的冬孢子堆。冬孢子堆和夏孢子堆可以混生，也可以各自在另外的叶片上出现。\n\n·发病规律· 夏孢子借风力飘落到叶面萌发，长出芽管，从气孔侵入寄主。接种 12~15 天后，表现症\n状，三周后形成夏孢子。秋天形成冬孢子。冬孢子形成后，萌发很容易。在合适的温、湿度条件\n下，经 2~4 小时即萌发，从芽管长出前菌丝，7~15 小时形成担孢子。担孢子侵染转主寄主天葵。\n担孢子从叶上萌发，通过角皮层侵入表皮细胞，在栅状组织细胞间伸长，以肿大的吸盘插入细胞\n内。菌丝通过叶柄组织向下蔓延。春天，天葵的地下块茎有很多菌丝。后来，天葵抽出新叶。若叶\n从感染的块茎抽出，则呈萎缩状，叶背面长出性孢子器，叶正面则呈现锈子器，锈孢子借风力飞\n散，传染桃叶。此时约为春、夏之间。锈孢子在桃叶上萌发，芽管先端到达桃叶气孔，并形成附着\n孢，下面长出侵染菌丝，从气孔侵入寄主组织内。发病潜育期为 29 天，夏孢子堆出现则需要 45\n天。病原菌的菌丝在天葵的块茎内，可持续数年，每年均形成性孢子器和锈子器。\n\n·防治方法·\n\n（1）铲除桃园附近杂草，冬季清扫果园，烧尽落叶，杜绝病源。\n\n（2）加强树体管理，增强抗病能力。\n\n（3）芽萌动期喷洒 45%石硫合剂晶体 150~200 倍液，或 1∶1∶100 波尔多液。6~7 月间喷洒 30%\n嘧菌酯悬浮剂 1 000~2 000 倍液，或 25%乙嘧酚磺酸酯微乳剂500~700 倍液。\n\n\n\n桃白锈病 叶片正面被害状\n\n桃白锈病 叶背面被害状\n\n\n\n桃白锈病 整株被害状\n\n桃白锈病 叶正面被害状\n\n\n\n桃白锈病 叶背面被害状\n\n\n\n桃根癌病\n\n·病原· 根癌土壤杆菌［ Agrobacterium tumefaciens （Smith et Towns.）Conn.］，属根瘤菌科\n（Rhizobiaceae）土壤杆菌属（ Agrobacterium ）细菌。\n\n·症状· 染病桃树地上部分无肿瘤症状，只显出树势差，生长缓慢，抽梢晚且慢，重病树叶片黄化早\n落，树体寿命明显缩短，果实变小。受害部位在根颈、主根、侧根、支根，以嫁接处常见，肿瘤最\n大。长出肿瘤初生时乳白色或略带红色，光滑、柔软，球形或扁球形，或相互愈合成不规则形，后\n渐变为褐色、深褐色，表面粗糙凹凸不平，木质化坚硬，最后变为黑褐色、形状不规则的空洞。\n\n·发病规律· 病原细菌在土壤中可存活 1 年，在未经分解的病株残体中可存活 2年；通过机械伤、嫁\n\n\n\n接口、虫伤、冻伤等伤口侵入。雨水和灌溉水是传播的主要媒介，地下害虫、带菌土壤、修剪工\n具、病残组织亦可传病。带病接穗和苗木的调运，是远距离传播的主要途径。降水多、湿度大，病\n情扩散快且严重。受冻害的梨树，病害亦重。地势较高、排水良好的砂壤土较地势低洼、排水不良\n的黏壤土和碱性土壤生长的梨树发病轻。\n\n·防治方法·\n\n（1）严格检疫。不从疫区调苗，不栽带病苗木。\n\n（2）移栽时发现有肿瘤应予处理，可疑的用 1%硫酸铜浸 5 分钟，再用 2%的石灰水浸 1 分钟。\n\n（3）嫁接工具用 75%酒精消毒，伤口和接穗避免和土壤接触，减少染病机会和人为传播。\n\n（4）发现病株，应彻底刮除病部，再涂石硫合剂和波尔多液保护。刮下的肿瘤应随即烧毁。\n\n\n\n桃树根癌病 根被害状\n\n\n\n桃树根癌病 根被害状\n\n桃树根癌病 根被害状\n\n\n\n桃树根癌病 根被害状\n\n\n\n桃树虫害\n\n桃潜叶蛾\n\n·学名· Lyonetia clerkella （Linnaeus），又名桃潜蛾，属鳞翅目（Lepidoptera）潜叶蛾科\n（Lyonetiidae）。\n\n·鉴别特征· 成虫：体长 3 mm，体及前翅银白色。前翅狭长，翅基部有 2 条褐色纵纹，先端尖，翅\n先端有黑色斑纹。幼虫：体长 4 mm左右，胸部淡绿色，体扁平椭圆形，头部尖，足退化，尾端尖\n细具细长的尾状。\n\n·生活习性· 桃潜叶蛾一年发生 7~9 代，翌年 4 月桃树展叶后成虫羽化，产卵于叶表皮内取食。3~5\n天幼虫即老熟后，从蛀道脱出，在叶缘尖叶片边缘折成蛹室，吐丝作茧化蛹，也在树干翘皮缝、草\n丛中结白色薄茧化蛹。5 月上旬发生第一代成虫。以后每月发生 1 代，除第一、二代整齐外，以后\n各代明显世代重叠。\n\n·危害特点· 主要以幼虫潜食叶肉组织，在叶中纵横窜食，形成弯弯曲曲的虫道，并将粪粒充塞其\n中，最终干枯、脱落；7~9 月严重危害，尤以秋梢受害最烈。虫口密度大时还蛀食嫩梢皮层，形成\n银白色弯曲蛀道。\n\n·防治方法·",
      "·病原· 畸形外囊菌[ Taphrina deformans （Berk.） Tul]，属子囊菌亚门（Ascom ycotina）外囊菌属\n（ Taphrina ）。\n\n·症状· 早春桃树展叶期即能发病，病叶卷曲畸形，呈红褐色，春末病叶上有一层白色粉状物是病菌\n子囊层，后病叶变褐色、枯焦脱落；新梢发病后节间缩短，略肿大扭曲，灰绿色至黄绿色，叶片丛\n生，最后整枝枯死。小幼果感病后畸形，果面疮痂状开裂，很快脱落；较大的果实感病后，果实畸\n形，肿起，黄色或红色，毛茸多消失，病果易早落。\n\n·发病规律· 病菌主要以孢子附着在枝上或芽鳞上越冬，也能在土壤中越冬，次年桃芽萌动期和露红\n期即可侵入，展叶初期也能侵入。一年只有一次侵染，病菌喜欢冷凉潮湿的气候。春季，桃树发芽\n展叶期如多雨低温天气，桃树萌芽和展叶过程延长，往往发病严重。病害盛发期在 4 月下旬至 5 月\n上旬，6 月以后气温升至 20℃以上时，病害停止发展。一般在沿海、地势低洼的桃园发病严重。\n\n·防治方法·\n\n（1）在早春桃芽开始膨大但未展开时，喷射波美 5 度石硫合剂一次，这样连续喷药二三年，就可\n彻底根除桃缩叶病。在发病很严重的桃园，由于果园内菌量极多，一次喷药往往不能全歼病菌，可\n在当年桃树落叶后（11~12 月）喷 2%~3%硫酸铜一次，以杀灭黏附在冬芽上的大量芽孢子。到第\n二年早春再喷 45%石硫合剂晶体 150 倍液一次，使防治效果更加稳定。早春萌芽期喷用的药剂，\n除石硫合剂外，也可喷用 1%波尔多液，但不能同时使用。\n\n（2）喷药后，如有少数病叶出现，应及时摘除，集中烧毁，以减少第二年的菌源。\n\n（3）发病重、落叶多的桃园，要增施肥料，加强栽培管理，以促使树势恢复。摘除病梢，加强管\n理。当初见病叶而尚未出现银灰色粉状物前摘除销毁，可减少翌年的越冬菌量。对发病树应加强管\n理，追施肥料，使树势得到恢复，增强抗性。\n\n在早春桃发芽前喷药防治，可达到良好的效果。如果错过这个时期，而在展叶后喷药，则不仅不能\n起到防病的作用，且容易发生药害，必须引起注意。\n\n桃缩叶病 1.双核菌丝穿破叶角质层伸入表皮细胞间隙；2.叶组织中的菌丝及叶面的子囊层\n\n\n\n桃缩叶病 病叶\n\n\n\n桃缩叶病 发病叶片\n\n\n\n桃缩叶病 病叶\n\n桃缩叶病 病叶\n\n桃炭疽病\n\n·病原· 无性阶段为胶孢炭疽菌（ Colletotrichum gloeosporioides Penz），异名 Gloeosporium\n\n\n\nlaeticolor Berk，属半知菌亚门（Deuteromycotina）刺盘孢属（ Colletotrichum ）。\n\n·症状· 该病主要危害果实，也能侵染新梢、叶片。幼果染病，果面上产生水渍状浅褐色小点，随后\n扩大为红褐色或深褐色圆形或椭圆形凹陷有明显同心轮纹状病斑。新梢染病，呈长椭圆形褐色凹陷\n病斑，病梢侧向弯曲，严重时枯死。叶片染病产生淡褐色圆形或不规则形灰褐色病斑，其上产生橘\n红色至黑色粒点。后病斑干枯脱落穿孔，新梢顶部叶片萎缩下垂，纵卷成管状。\n\n·发病规律· 病菌以菌丝体在病枝、病果及僵果内越冬。翌春产生分生孢子，借风雨或昆虫传播，侵\n染新梢和幼果引起发病；后病部可再产生分生孢子，借风雨或昆虫进行多次侵染。桃树整个生长期\n均可被侵染。该病的发生与气候、品种有关，其中高温、高湿是该病发生的前提条件，果实成熟前\n温暖、高湿极易发病。\n\n·防治方法·\n\n（1）细致修剪，彻底清除树上病梢、枯死枝、僵果，结合施基肥，彻底清扫落叶和地面病残体，\n深埋于施肥坑内。\n\n（2）增加果园通风透光条件，落叶后深翻果园、保持土壤疏松和通透性。\n\n（3）以腐熟有机肥为主，增施钾肥，禁施单一含氮肥料。\n\n（4）发芽前细致喷洒 45%石硫合剂晶体 200~300 倍液，消灭越冬病菌。落花后喷 70%甲基硫菌灵\n可湿性粉剂 1 000 倍液；生长季节结合防治褐腐病等及时喷洒 2 000 倍液 10%苯醚甲环唑水分散粒\n剂，或 3 000 倍液 3%嘧菌酯悬浮剂等药液，保护叶片和果实。\n\n桃炭疽病 病果\n\n\n\n桃炭疽病 病叶\n\n桃炭疽病 病叶\n\n\n\n桃炭疽病 病果和卷成筒状的叶\n\n\n\n桃炭疽病 留在枝上的僵果引起周围幼果发病状\n\n\n\n桃炭疽病 病幼果干缩成僵果\n\n\n\n桃炭疽病 分生孢子盘和分生孢子\n\n桃白锈病\n\n·病原· 桃不休白双胞锈菌[ Leucotelium pruni~persicae （Hori） Tranzsechel]，属担子菌亚门\n（Basidiomycotina）不休白双胞锈属（ Leucotelium ）。",
      "该类虫属软体动物门、腹足纲。多雨潮湿天气上树危害，取食果实和叶片。该类虫喜潮湿环境，正\n常或干旱天气不予防治；园内散放鸡、鸭、鹅等家禽可有效消灭该类害虫；清除种植场所内的杂草\n及杂物，营造通风、干燥的环境；在多雨潮湿天气发生量大时可喷洒药剂防治。\n\n·防治方法·\n\n（1）人工防治：清洁草坪，并撒上生石灰，减少滋生地，或用树叶、杂草诱集，天亮前集中捕\n捉。\n\n（2）生物防治：保护和利用天敌，如步行虫、蛙、蜥蜴等。\n\n（3）化学防治：用生石灰粉或茶枯粉毒杀，用量分别为 75 kg/hm2 和 45 kg/hm 2 ；或 6%三聚乙醛\n颗粒剂 500~700 g/亩。\n\n蛞蝓\n\n\n\n蛞蝓\n\n\n\n蛞蝓 群集危害\n\n\n\n\n\n\n同型巴蜗牛\n\n\n\n同型巴蜗牛\n\n\n\n柑橘病虫防治历\n\n（续表）\n\n\n\n\n\n\n\n\n\n二、桃树\n\n桃，蔷薇科、桃属植物；是一种乔木，高 3~8 m。桃除鲜食外，还可加工成桃脯、桃酱、桃汁、桃\n干和桃罐头；素有“寿桃”和“仙桃”的美称，因肉质鲜美，又被称为“天下第一果”。桃肉富含蛋白\n质、脂肪、碳水化合物、粗纤维、多种营养元素以及有机酸、糖分和挥发油，适宜低血钾和缺铁性\n贫血患者食用。\n\n桃原产中国，主要经济栽培地区在中国华北、华东各省，世界各地均有栽植。全国有许多优良桃品\n种，如山东的肥城桃、天津和上海的水蜜挑、南京时桃、杭州蟠桃、贵州白花桃、血桃以及河北深\n州的蜜桃。上海现在桃树种植面积为 6.7 万亩，水蜜桃主要集中在浦东的南汇地区、松江、崇明；\n黄桃主要集中在奉贤；蟠桃集中在金山地区，其他区有少量分布和油桃零星种植。\n\n目前，桃在上海地区主要病害有桃细菌性穿孔病、桃疮痂病、桃褐腐病、桃炭疽病、桃流胶病、桃\n根癌病、桃树生理性黄化等；主要虫害有桃树蚜虫、红蜘蛛、桃潜叶蛾、桃小绿叶蝉、桃蛀螟、茶\n翅蝽、介壳虫、红颈天牛等。\n\n\n\n桃树病害\n\n桃褐腐病\n\n·病原· 本病原有三种：果生链核盘菌（ Monilinia fructicola ）、核果链核盘菌（ M.laxa ），均属子\n囊菌亚门（Ascomycotina）链核盘菌属（ Monilinia ）；无性阶段为半知菌亚门\n（Deuteromycotina）丛梗孢属（ Monilia ）。\n\n·症状· 主要危害果实、花、叶和枝梢。果实染病初期在果面产生淡褐色圆形或近圆形小斑，斑部果\n肉很快腐烂，造成病果大部甚至整个呈褐色腐烂。近成熟果受害，初为淡褐色至褐色圆形斑，并很\n快扩展至果实的大部分，果肉迅速变褐腐烂，病斑表面产生黄白色或灰色绒球状霉丛或霉层，呈同\n心环纹状排列，引起落果。花部受害自雄蕊及花瓣尖端发生，病部始生褐色水渍状斑点，后扩展至\n全花，变褐枯萎。叶片受害自叶缘开始，产生褐色水渍状病斑，后扩展到叶柄，使全叶变褐萎垂。\n新梢上产生长圆形、灰褐色、边缘为紫褐色溃疡斑，中间稍凹陷，初期病斑常有流胶。\n\n·发病规律· 主要在树上、树下僵果及病枝条溃疡斑部以僵果（病菌的假菌核）和菌丝体越冬。翌春\n气温上升后产生大量病菌孢子，通过气孔、虫伤和机械伤口侵入，借助风、雨水飞溅或昆虫传播。\n该病从开花到果实成熟都能侵染；遇阴雨天气易引起花腐、果腐。栽植过密、地势低洼、管理粗\n放、通风透光不良易发病。\n\n·防治方法·\n\n（1）在休眠期和生长期，及时清除园中和枝条上的病果、僵果、病枝、病叶和病花，减少病菌侵\n染来源；修剪过密枝条，改善果园通风透光条件。雨季及时排水。\n\n（2）在幼果期及时进行套袋，可阻隔病菌侵染。\n\n（3）桃树萌芽前，选用 45%晶体石硫合剂 30 倍液，或波尔多液 100 倍液等喷雾，并同时喷洒地\n面。\n\n（4）在落花后 10 天左右，开始喷药，每次喷药须间隔 10~15 天。药剂可选用混配剂 75%百菌清\n可湿性粉剂 800 倍液加 70%甲基硫菌灵可湿性粉剂 800~1 000倍液、23.4%双炔酰菌胺悬浮剂 1 500\n倍液、4%春雷霉素可湿性粉剂 40~60 g/亩等，交替喷雾防治，每次喷雾间隔 7~15 天，连续防治\n2~3 次。\n\n\n\n桃褐腐病 田间发病状\n\n\n\n桃褐腐病 悬挂在树上的僵果成为病菌持续传播的病源\n\n\n\n桃褐腐病 病果后期表现的霉丛\n\n果实 被害状\n\n\n\n桃褐腐病 叶片被害状\n\n桃褐腐病 1.分生孢子的萌发；2.分生孢子链的一部分；3.子囊、侧丝和子囊孢子\n\n桃菌核病\n\n·病原· 病原为核盘菌[ Sclerotinia sclerotiorum （Lib.） de Bary]，属子囊菌亚门（Ascomycotina）核\n盘菌属（ Sclerotinia ）。"
    ]
  },
  {
    "question": "梨锈病的病原菌需要在哪些转主寄主上越冬？",
    "answer": "梨锈病的病原菌需要在龙柏、桧柏、塔柏等植物上越冬。",
    "standard_answer": "病菌在龙柏、桧柏、塔柏等植物上越冬。",
    "contexts": [
      "梨树主要病虫种类有梨锈病、梨轮纹病、梨黑星病等病害，梨小食心虫、桃蛀螟、梨木虱、梨冠网\n蝽等害虫。开展梨树病虫害监测，能够掌握病虫害的发生变化规律，及时有效地控制病虫灾害，为\n梨树的有效防治提供科学的依据。\n\n\n\n梨树病害\n\n梨锈病\n\n·病原· 梨胶锈菌（ Gymnosporangium haraeanum Syd.），属担子菌亚门（Basidiomycotina）胶锈菌\n属（ Gymnosporangium ）。\n\n·症状· 侵害叶片、新梢、果实，受害叶片正面出现橙黄色小点，后变成圆形斑，小点变成黑色。病\n斑扩大后正面凹下，叶背凸起，产生灰褐色毛状物是病菌锈子器，散发出黄褐色粉末，是病菌锈孢\n子，以后病斑变黑，病叶枯死早落。幼果病斑中央凹下，边缘产生毛状物，病果生长停滞，畸形早\n落。果柄、叶柄受害则病部稍膨大，也产生毛状物；新梢受害产生龟裂病斑，易折断。\n\n·发病规律· 病菌在龙柏、桧柏、塔柏等植物上越冬，可存活多年。3 月中旬至4 月中旬病菌担孢子\n借风雨传播到梨树危害。梨树在 4 月底、5 月初出现症状，5 月中旬开始出现毛状物，散出的锈孢\n子借风雨传播到龙柏等植物，侵入后越冬成次年病菌来源。梨树四周 5~10 km范围内存在龙柏等植\n物就有利病害发生。2 月温度偏高，3~4 月雨水偏多，有利病害发生，加重危害。\n\n·防治方法·\n\n（1）在梨园 5 km范围内不种植桧柏。\n\n（2）加强果园栽培管理。合理施肥，及时排水，科学修剪，使果园通风透光，降低环境湿度，创\n造不利于病害发生的环境条件。发芽前彻底清扫落叶，集中深埋或烧毁，消灭病菌越冬场所。\n\n（3）药剂防治：梨树开始萌芽展叶时，喷洒波尔多液保护新叶；落花后若叶片上出现锈病时可喷\n洒 10%苯醚甲环唑水分散粒剂 5 000~6 000 倍液，或 22.5%啶氧菌酯悬浮剂 1 500~2 000 倍液等，每\n次喷药间隔 7~10 天，连续喷雾 2~3 次。注意避开开花期喷药。\n\n梨锈病 叶片正面危害状\n\n\n\n梨锈病 病叶\n\n梨锈病 叶片背面危害状\n\n\n\n转主寄主-桧柏 冬孢子角\n\n梨锈病 发病后期危害状\n\n\n\n梨锈病 1.性孢子器；2.冬孢子及其萌发；3.龙柏上的冬孢子角（部分已吸水膨胀）；4.锈子器和锈\n孢子\n\n\n\n梨锈病 病果\n\n梨黑星病\n\n·病原· 有性阶段为梨黑星菌（ Venturia nashicola Tanak et Yamamota），属子囊菌亚门\n（Ascomycotina）黑星菌属（ Venturia ）；无性阶段为梨黑腥孢菌（ Fusicladium virecens Bon.），\n属半知菌亚门（Deuteromycotina）黑星孢属（ Fusicladium ）。\n\n·症状· 可危害梨树的所有绿色幼嫩组织。以叶片、果实和新梢受害为主。发病后的主要特点是病斑\n表面产生墨绿色至黑色霉状物。\n\n（1）叶片染病：多数先在背面产生墨绿色至黑色星芒型霉状物，正面相对应处为边缘不明显的淡\n黄绿色病斑；严重时霉状物可布满叶背大部分，叶正面则呈花叶状。后期病斑变褐枯死，严重时导\n\n\n\n致早期落叶。\n\n（2）果实染病：果实膨大期受害，多数形成圆形或近圆形黑色病斑。较早发病者，病斑凹陷、开\n裂，病果畸形、易早落；较晚发病者，病斑略凹陷，可产生浓密霉状物，有时病斑外围有明显的黄\n晕；气候干燥时病斑表面很少产生霉层，表现为“青疔”状；环境潮湿时，霉状物上有时可腐生“红\n粉菌”。\n\n（3）新梢染病：从下至上逐渐产生黑色霉层，并可扩展到叶柄甚至叶片基部及叶脉上；严重时，\n病梢叶片逐渐变黄、变红、干枯、脱落，最后只留下一个“黑橛”。\n\n·发病规律· 黑星病在田间有多次再侵染现象，流行性很强，有两个发生高峰：一是落花后至果实膨\n大初期；二是采收前 1~1.5 个月。前期病梢出现的多少、幼叶幼果发病率的高低是决定当年黑星病\n发生轻重的主要因素之一。后期果实越接近成熟受害越重，是病菌严重危害果实的时期。黑星病的\n发生轻重与降雨关系密切，尤其是幼果期的降雨，雨日多，病害发生重；密植果园、低洼潮湿果园\n往往发病较重。\n\n·防治方法·\n\n（1）加强果园管理：落叶后至发芽前彻底清除树上、树下落叶，集中深埋或烧毁。\n\n（2）药剂防治：梨树开始萌芽展叶时，喷洒波尔多液保护新叶；萌芽后开花前喷洒 1 次内吸治疗\n性药剂，杀死芽内病菌，减少病梢形成数量，药剂可选 10%苯醚甲环唑水分散粒剂 5 000~6 000 倍\n液；落花后至果实膨大初期，控制幼叶、幼果发病，一般喷药 3~4 次，每次喷药间隔 7~10 天。药\n剂可选 10%苯醚甲环唑水分散粒剂 5 000~6 000 倍液、50%醚菌酯水分散粒剂 3 000~5 000 倍液、\n70%代森联水分散粒剂 500~700 倍液等。",
      "·病原· 有性阶段为梨球腔菌［ Mycosphaerella sentina （Fr.） Schrter］，属子囊菌亚门\n（Ascomycotina）球腔菌属（ Mycosphaerella ）；无性阶段为梨生壳针孢（ Septoria piricola\nDesm.），属半知菌亚门（Deuteromycotina）壳针孢属（ Septoria ），又称白星病、斑枯病。\n\n·症状· 主要危害叶片，初期形成圆形或近圆形深褐色斑点，扩展后为病斑中部灰白色、边缘褐色，\n病斑较小。后期病斑表面可散生小黑点。受害严重叶片，其上散布数十个病斑，且常相互愈合成不\n规则形褐色大斑，有时病斑穿孔。严重时，病叶早期脱落，导致树势衰弱。\n\n·发病规律· 是一种高等真菌性病害，病菌主要以分生孢子器在病落叶上越冬。次年产生并释放分生\n孢子，借风雨传播到叶片上进行侵染危害。生长期可有多次再侵染。病害一般在 4 月中旬开始发\n生，5 月中下旬盛发。发病严重的，在 5 月下旬就开始落叶，7 月中下旬落叶最严重。雨水早、湿\n度大时发病较重，树势衰弱、排水不良、管理粗放的果园发病较多。\n\n·防治方法·\n\n（1）加强果园栽培管理。合理施肥，及时排水，科学修剪，使果园通风透光良好，降低环境湿\n度，创造不利于病害发生的环境条件。发芽前彻底清扫落叶，集中深埋或烧毁，消灭病菌越冬场\n所。\n\n（2）药剂防治：该病一般不需单独防治。往年发病严重的个别果园，从发病初期开始喷药，每隔\n10~15 天喷 1 次药，连喷 2 次左右即可有效控制该病的发生危害。常用药剂有 70%甲基托布津可湿\n性粉剂 800~1 000 倍液、10%苯醚甲环唑水分散粒剂 2 000~2 500 倍液等。\n\n\n\n梨褐斑病 叶片中期被害状\n\n\n\n梨褐斑病 叶片正面后期被害状\n\n梨褐斑病 叶片背面后期被害状\n\n\n\n梨褐斑病 叶片早期被害状\n\n梨白粉病\n\n·病原· 梨球针壳菌［ Phyllactinia pyri （Cast.）Homma.］，属子囊菌亚门（Ascom ycotina）球针壳\n属（ Phyllactinia ）。\n\n·症状· 最初在叶背面产生白色霉点，后扩展成大小不一、近圆形白色粉状斑，是病菌菌丝和分生孢\n子，后期白粉层上产生黄色小点，逐渐加深至黑褐色小点，是病菌闭囊壳，白粉斑相应叶片正面黄\n绿色，严重时白粉布满整个叶片，导致病叶变褐枯萎、脱落。\n\n·发病规律· 白粉病是一种高等真菌性病害。病原菌主要以闭囊壳在落叶上或黏附在枝干表面越冬。\n第二年 6~7 月闭囊壳内散出子囊孢子，通过气流或风雨传播，从叶背气孔侵染叶片危害。初侵染\n发病后产生的分生孢子经气流传播后进行再侵染，使病害不断扩散蔓延。白粉病多在雨季开始发\n生，多雨潮湿季节为发生盛期。果园郁蔽、通风透光不良、地势低洼、排水不及时、偏施氮肥等均\n可加重该病发生。\n\n·防治方法·\n\n（1）加强果园栽培管理。合理施肥，及时排水，科学修剪，使果园通风透光良好，降低环境湿\n度，创造不利于病害发生的生态条件。发芽前彻底清扫落叶，集中深埋或烧毁，消灭病菌越冬场\n所。\n\n（2）药剂防治：萌芽期，喷施 1 次 45%石硫合剂晶体 50~80 倍液，杀灭树上越冬病菌。生长期，\n从病害发生初期或雨季到来前开始喷药，每隔 10 天左右喷 1 次，连喷 2~3 次，重点喷洒叶片背\n面。常用药剂有 10%苯醚甲环唑水分散粒剂 2 500~3 000倍液、250 g/L戊唑醇水乳剂 2 000~2 500\n倍液等。\n\n\n\n梨白粉病 叶片被害状\n\n\n\n梨白粉病 叶片被害状\n\n\n\n梨白粉病 叶片被害状\n\n\n\n梨白粉病 叶片被害状\n\n梨白粉病病菌闭囊壳\n\n\n\n梨白粉病 病斑放大\n\n梨炭疽病\n\n·病原· 有性阶段为围小丛壳［ Glomerella cingulata （Stonem.）Spauld. et Schrenk］，属子囊菌亚门\n（Ascomycotina）小丛壳属（ Glomerella ）；无性阶段为胶孢炭疽菌（ Colletotrichum\ngloeosporioides Penz.），属半知菌亚门（Deuteromycotina）炭疽菌属（ Colletotrichum ），又称“苦\n腐病”。\n\n·症状· 病菌主要危害果实，也可侵害枝条，有时还可危害叶片及叶柄。果实染病多从膨大后期开始\n发病，初期在果面上产生褐色至黑褐色小斑点，后病斑逐渐扩大，形成淡褐色至深褐色的腐烂病\n斑，表面凹陷，严重时病斑可烂到果实的 1/4 以上；从发病中后期开始，病斑表面逐渐产生小黑\n点，小黑点上可溢出淡粉红色黏液。",
      "·发病规律· 梨炭疽病是一种高等真菌性病害，病菌主要以菌丝体在病枝条上及病落叶、病僵果中越\n冬。第二年温湿度适宜时产生大量病菌孢子，主要通过风雨传播进行侵染危害。该病在田间多次再\n侵染。落花后 10 天左右病菌即可不断侵染果实，到膨大后期果实逐渐开始发病，发病后产生的病\n菌孢子还可不断扩散危害。该病具有潜伏侵染现象。多雨潮湿、通风透光不良、果园湿度大是导致\n该病发生较重的主要环境条件。\n\n·防治方法·\n\n（1）加强果园管理。落叶后至发芽前，彻底清除果园内枯枝、落叶、病僵果，集中销毁或深埋，\n消灭越冬病菌。合理修剪、及时中耕除草，及时排水，合理施肥。\n\n（2）药剂防治：萌芽期，喷施 1 次 77%硫酸铜钙可湿性粉剂 300~400 倍液，铲除树体上越冬的残\n余病菌。从落花后 10 天左右开始喷药，每隔 10~15 天喷 1 次，连续喷 3 次。常用药剂有 70%甲基\n托布津可湿性粉剂 800~1 000 倍液、10%苯醚甲环唑水分散粒剂 2 000~2 500 倍液、250 g/L戊唑醇\n水乳剂 2 000~2 500 倍液。\n\n\n\n梨炭疽病 叶片被害状\n\n\n\n梨炭疽病 被害状\n\n\n\n\n\n\n梨炭疽病 叶片被害状\n\n\n\n梨炭疽病 叶片被害状\n\n梨炭疽病 植株被害状\n\n\n\n梨炭疽病 分子孢子梗，分生孢子及刚毛\n\n\n\n梨冠瘿病\n\n·病原· 根癌土壤杆菌［ Agrobacterium tumefaciens （Smith et Towns.）Conn.］，属根瘤菌科\n（Rhizobiaceae）土壤杆菌属（ Agrobacterium ）细菌，又称梨根癌病。\n\n·症状· 主要危害根部，也可发生在根颈部，甚至在主干、主枝上。发病后在发病部位形成肿瘤。肿\n瘤多不规则，大小差异很大。初生肿瘤乳白色或略带红色，柔软，后逐渐变褐色至深褐色，木质化\n而坚硬，表面粗糙或凹凸不平。病树根系发育不良，地上部分生长衰弱，植株矮小，叶黄化、稀\n疏、早落，严重时可致全株死亡。\n\n·发病规律· 参照桃根癌病（p66）。\n\n·防治方法· 参照桃根癌病（p66）。\n\n\n\n梨树根癌病 被害状\n\n\n\n梨树根癌病 被害状\n\n\n\n梨树根癌病 被害状\n\n\n\n梨树虫害\n\n草履蚧\n\n·学名· Drosicha corpulenta Kuwana，属半翅目（Hemiptera）珠蚧科Drosicha corpulenta，又名日本\n履绵蚧、草鞋蚧。\n\n·鉴别特征· 参照桃树草履蚧（p82）。\n\n·生活习性· 参照桃树草履蚧（p82）。\n\n·危害特点· 参照桃树草履蚧（p82）。\n\n·防治方法· 参照桃树草履蚧（p82）。\n\n\n\n\n\n\n草履蚧 聚集危害\n\n草履蚧 聚集危害\n\n\n\n草履蚧 聚集危害\n\n梨二叉蚜\n\n·学名· Schizaphis piricola Matsumura，属半翅目（Hemiptera）蚜科（Aphididae），又名梨蚜。\n\n·鉴别特征· 无翅孤雌胎生蚜：体长约 2 mm，绿色至黄绿色，被有白色蜡粉，背中央有 1 条翠绿色\n纵线，腹管长筒状，黑色，长为尾片的 2 倍，尾片舌状，近中部收缩。有翅孤雌胎生蚜：体长约\n1.8 mm，头胸部黑色，腹部黄绿至绿色，背中央有 1 条翠绿色纵线，触角第三节有次生感觉孔\n18~27 个，前翅中脉 2 叉。若虫与无翅孤雌胎生蚜类似。\n\n·生活习性· 梨二叉蚜一年发生约 20 代。以卵在芽腋、枝杈的缝隙内越冬，梨芽萌动时开始孵化。\n若蚜群集于露绿的芽上危害，待梨芽开绽时钻入芽内，展叶期又集中到嫩梢叶面危害，致使叶片向\n上纵卷成筒状或饺子状。落花后大量出现卷叶，半月左右开始出现有翅蚜，5~6 月大量迁飞到越夏\n寄主狗尾草和茅草上；9~10 月间，在越夏寄主上产生大量有翅蚜迁回梨树上繁殖危害，并产生性\n蚜。雌蚜交尾后产卵，以卵越冬。\n\n·危害特点· 以成蚜、若蚜群集在梨树新梢叶片正面刺吸危害，受害叶片向正面纵向卷曲成筒状，后\n逐渐皱缩变脆，受害叶不能伸展，严重时容易脱落。\n\n·防治方法·\n\n（1）冬季清园：上年秋季蚜虫数量较多的梨园，结合其他害虫防治，在萌芽期喷施 1 次 45%石硫\n合剂晶体 50~70 倍液，杀灭越冬虫卵。\n\n（2）人工防治：从梨二叉蚜危害卷叶初期开始，摘除被害卷叶，集中销毁，消灭卷叶内蚜虫，降\n低园内虫量。\n\n（3）药剂防治：花序分离期至铃铛球期和落花后 10 天内是药剂防治的两个关键期，各喷药 1 次即\n可。药剂可选用 0.3%苦参碱水剂 150~250 ml/亩等。\n\n\n\n梨二叉蚜 聚集危害\n\n瓢虫捕食蚜虫\n\n\n\n梨二叉蚜 梨树被害状\n\n\n\n梨二叉蚜 有翅蚜\n\n梨二叉蚜 触角\n\n梨木虱",
      "（3）果实套袋。\n\n梨黑星病 叶片正面危害状\n\n\n\n\n\n\n梨黑星病 叶片背面危害状\n\n梨黑星病 叶片正面危害状\n\n梨黑星病 叶片背面危害状\n\n\n\n梨黑星病 果实危害状\n\n梨黑星病 果实危害状\n\n\n\n梨黑星病 1.分生孢子梗和分子孢子；2.子囊壳、子囊孢子\n\n梨黑星病 无性孢子（镜下）\n\n梨黑斑病\n\n\n\n·病原· 菊池链格胞（ Alternaria kikuchiana Tanaka），属半知菌亚门（Deuterom ycotina）链格孢属\n（ Alternaria ）真菌。\n\n·症状· 主要危害叶片，有时也可危害果实和新梢。叶片染病初为米粒大小、褐色至黑褐色斑点，后\n逐渐扩大，形成近圆形或不规则形病斑，中心灰白至灰褐色，边缘黑褐色，有时病斑颜色呈轮纹\n状。病叶焦枯、畸形，早期脱落。天气潮湿时，病斑表面产生黑色霉状物。\n\n·发病规律· 病菌以菌丝体和分生孢子在病梢、病叶、病果和落于地面的病残体上越冬。翌年春季产\n生分生孢子后借风雨传播，从气孔、皮孔或直接侵染危害。该病潜育期短，病菌在田间可引起多次\n再侵染。一般 4 月下旬开始发病，嫩叶极易受害。6~7 月如遇多雨，更易流行。地势低洼、偏施化\n肥或肥料不足、修剪不合理、树势衰弱以及梨网蝽、蚜虫猖獗危害等不利因素均可加重该病的危\n害。\n\n·防治方法·\n\n（1）加强果园管理：落叶后至萌芽前，彻底清除果园内枯枝、落叶、病僵果，集中销毁或深埋，\n消灭越冬病菌。合理修剪、及时中耕除草，及时排水，合理施肥。\n\n（2）药剂防治：萌芽前，喷施 77%硫酸铜钙可湿性粉剂 300~400 倍液，铲除树体上越冬的残余病\n菌。生长期，从初见病叶或雨季到来前开始喷药，每隔10~15 天喷 1 次，需喷药 3~5 次。雨季及时\n喷药是该病药剂防治的关键。常用药剂有 10%多抗霉素可湿性粉剂 1 000~1 500 倍液、10%苯醚甲\n环唑水分散粒剂1 500~2 000 倍液等。\n\n梨黑斑病 被害果实\n\n\n\n梨黑斑病 被害果实\n\n\n\n梨黑斑病 被害果实\n\n\n\n梨黑斑病 被害果实\n\n\n\n梨黑斑病 病幼果和病叶\n\n梨黑斑病 病果（示裂果）\n\n\n\n梨黑斑病 分生孢子梗和分生孢子\n\n梨轮纹病\n\n·病原· 病原有两种：梨生囊壳孢（ Physalospora piricola Nose），属子囊菌亚门（Ascomycotina）\n囊孢壳属（ Physalospora ）；无性阶段为轮纹大茎点菌（ Macrophoma kawatsukai Hara.），属半知\n菌亚门（Deuteromycotina）大茎点霉属（ Macrophoma ）。\n\n·症状· 主要危害枝干和果实，也危害叶片，造成树势衰弱，枝条枯死，果实腐烂，严重影响产量和\n质量。\n\n（1）枝干染病：初期以皮孔为中心，产生水渍状褐色小斑，后扩大为近圆形或不规则的褐色疣状\n病斑，质地坚硬，以后病斑四周下陷，成为凹陷的圆圈。第二年产生小黑点，病健交界处产生裂\n缝。发病严重时，许多病斑密集在一起，围绕枝干 1 周后上部枝条死亡，树势极度衰退。\n\n（2）果实染病：多在近成熟期发病。初期以皮孔为中心形成水渍状褐色圆斑，以后迅速扩大为同\n心轮纹状的红褐色病斑，流出茶褐色的黏液，几天后全果腐烂。后期在表皮下产生黑色小粒。\n\n·发病规律· 病菌以菌丝、分生孢子器等在枝干病组织上越冬，病菌在斑内可存活多年，第二年、第\n三年产生大量孢子。枝干上的病斑是病菌的主要来源。病菌于3月下旬开始释放孢子，4 月中下旬\n孢子数量上升，5 月中下旬到 6 月中下旬是孢子释放盛期，7~8 月极少释放，9~10 月有少量孢子释\n放。果实大多在幼果期感染病菌，但不立即表现症状，直到近成熟时才显现症状。\n\n·防治方法·\n\n\n\n（1）加强果园栽培管理：增施有机肥料，合理结果量，提高树体抗病能力。发芽前刮除枝干轮纹\n病斑及干腐病斑的变色组织，并集中销毁，减少越冬菌源。\n\n（2）药剂防治：从落花后 7~10 天开始喷药，每隔 10~15 天喷药 1 次，直到果实皮孔封闭或果实\n套袋后结束。常用药剂有：70%甲基托布津可湿性粉剂800~1 000 倍液、10%苯醚甲环唑水分散粒\n剂 5 000~6 000 倍液等。\n\n（3）果实套袋。\n\n梨轮纹病 1.分生孢子器和器孢子；2.子囊壳；3.侧丝、子囊和子囊孢子\n\n\n\n梨轮纹病 枝干被害状\n\n\n\n梨轮纹病 叶片被害状\n\n梨轮纹病 果实被害状\n\n\n\n梨轮纹病 果实被害状\n\n梨轮纹病 果实被害状\n\n\n\n梨轮纹病 果实被害状\n\n梨褐斑病",
      "·症状· 病树叶表面最初出现浅绿色至淡黄色、多角形至不整齐形、直径约1 mm的斑点，后变为鲜\n黄色。病斑反面出现稍隆起、突破表皮的浅褐色的粉状夏孢子堆。秋天，叶片反面长出雪白色、黏\n质和隆起的冬孢子堆。冬孢子堆和夏孢子堆可以混生，也可以各自在另外的叶片上出现。\n\n·发病规律· 夏孢子借风力飘落到叶面萌发，长出芽管，从气孔侵入寄主。接种 12~15 天后，表现症\n状，三周后形成夏孢子。秋天形成冬孢子。冬孢子形成后，萌发很容易。在合适的温、湿度条件\n下，经 2~4 小时即萌发，从芽管长出前菌丝，7~15 小时形成担孢子。担孢子侵染转主寄主天葵。\n担孢子从叶上萌发，通过角皮层侵入表皮细胞，在栅状组织细胞间伸长，以肿大的吸盘插入细胞\n内。菌丝通过叶柄组织向下蔓延。春天，天葵的地下块茎有很多菌丝。后来，天葵抽出新叶。若叶\n从感染的块茎抽出，则呈萎缩状，叶背面长出性孢子器，叶正面则呈现锈子器，锈孢子借风力飞\n散，传染桃叶。此时约为春、夏之间。锈孢子在桃叶上萌发，芽管先端到达桃叶气孔，并形成附着\n孢，下面长出侵染菌丝，从气孔侵入寄主组织内。发病潜育期为 29 天，夏孢子堆出现则需要 45\n天。病原菌的菌丝在天葵的块茎内，可持续数年，每年均形成性孢子器和锈子器。\n\n·防治方法·\n\n（1）铲除桃园附近杂草，冬季清扫果园，烧尽落叶，杜绝病源。\n\n（2）加强树体管理，增强抗病能力。\n\n（3）芽萌动期喷洒 45%石硫合剂晶体 150~200 倍液，或 1∶1∶100 波尔多液。6~7 月间喷洒 30%\n嘧菌酯悬浮剂 1 000~2 000 倍液，或 25%乙嘧酚磺酸酯微乳剂500~700 倍液。\n\n\n\n桃白锈病 叶片正面被害状\n\n桃白锈病 叶背面被害状\n\n\n\n桃白锈病 整株被害状\n\n桃白锈病 叶正面被害状\n\n\n\n桃白锈病 叶背面被害状\n\n\n\n桃根癌病\n\n·病原· 根癌土壤杆菌［ Agrobacterium tumefaciens （Smith et Towns.）Conn.］，属根瘤菌科\n（Rhizobiaceae）土壤杆菌属（ Agrobacterium ）细菌。\n\n·症状· 染病桃树地上部分无肿瘤症状，只显出树势差，生长缓慢，抽梢晚且慢，重病树叶片黄化早\n落，树体寿命明显缩短，果实变小。受害部位在根颈、主根、侧根、支根，以嫁接处常见，肿瘤最\n大。长出肿瘤初生时乳白色或略带红色，光滑、柔软，球形或扁球形，或相互愈合成不规则形，后\n渐变为褐色、深褐色，表面粗糙凹凸不平，木质化坚硬，最后变为黑褐色、形状不规则的空洞。\n\n·发病规律· 病原细菌在土壤中可存活 1 年，在未经分解的病株残体中可存活 2年；通过机械伤、嫁\n\n\n\n接口、虫伤、冻伤等伤口侵入。雨水和灌溉水是传播的主要媒介，地下害虫、带菌土壤、修剪工\n具、病残组织亦可传病。带病接穗和苗木的调运，是远距离传播的主要途径。降水多、湿度大，病\n情扩散快且严重。受冻害的梨树，病害亦重。地势较高、排水良好的砂壤土较地势低洼、排水不良\n的黏壤土和碱性土壤生长的梨树发病轻。\n\n·防治方法·\n\n（1）严格检疫。不从疫区调苗，不栽带病苗木。\n\n（2）移栽时发现有肿瘤应予处理，可疑的用 1%硫酸铜浸 5 分钟，再用 2%的石灰水浸 1 分钟。\n\n（3）嫁接工具用 75%酒精消毒，伤口和接穗避免和土壤接触，减少染病机会和人为传播。\n\n（4）发现病株，应彻底刮除病部，再涂石硫合剂和波尔多液保护。刮下的肿瘤应随即烧毁。\n\n\n\n桃树根癌病 根被害状\n\n\n\n桃树根癌病 根被害状\n\n桃树根癌病 根被害状\n\n\n\n桃树根癌病 根被害状\n\n\n\n桃树虫害\n\n桃潜叶蛾\n\n·学名· Lyonetia clerkella （Linnaeus），又名桃潜蛾，属鳞翅目（Lepidoptera）潜叶蛾科\n（Lyonetiidae）。\n\n·鉴别特征· 成虫：体长 3 mm，体及前翅银白色。前翅狭长，翅基部有 2 条褐色纵纹，先端尖，翅\n先端有黑色斑纹。幼虫：体长 4 mm左右，胸部淡绿色，体扁平椭圆形，头部尖，足退化，尾端尖\n细具细长的尾状。\n\n·生活习性· 桃潜叶蛾一年发生 7~9 代，翌年 4 月桃树展叶后成虫羽化，产卵于叶表皮内取食。3~5\n天幼虫即老熟后，从蛀道脱出，在叶缘尖叶片边缘折成蛹室，吐丝作茧化蛹，也在树干翘皮缝、草\n丛中结白色薄茧化蛹。5 月上旬发生第一代成虫。以后每月发生 1 代，除第一、二代整齐外，以后\n各代明显世代重叠。\n\n·危害特点· 主要以幼虫潜食叶肉组织，在叶中纵横窜食，形成弯弯曲曲的虫道，并将粪粒充塞其\n中，最终干枯、脱落；7~9 月严重危害，尤以秋梢受害最烈。虫口密度大时还蛀食嫩梢皮层，形成\n银白色弯曲蛀道。\n\n·防治方法·"
    ]
  },
  {
    "question": "梨小食心虫在上海地区一年发生几代？",
    "answer": "梨小食心虫在上海地区一年发生2代。",
    "standard_answer": "梨小食心虫在上海地区一年发生4~5代。",
    "contexts": [
      "·生活习性· 上海 1 年发生 1 代，以卵在树根茎四周的土缝中越冬。翌年 1 月下旬至 3 月上旬开始孵\n化，历期 1 个多月；2 月下旬至 3 月上旬，若虫出蛰上树，群集于幼嫩枝芽处吸食危害。若虫于 4\n月上旬进行第一次蜕皮，4 月下旬进行第二次蜕皮。雄成虫于 5 月上中旬出现，傍晚群集飞舞，寻\n找雌成虫交配；雌若虫于 5 月上中旬进行第三次蜕皮，变为成虫，并与羽化的雄成虫交配。随后，\n雌成虫于 5 月底至 6 月初陆续下树，在树基部周围 10 cm左右深的土层中、砖瓦石块下产卵于卵囊\n中，过夏越冬。\n\n·危害特点· 若虫和雌成虫常成堆聚集在芽腋、嫩梢、叶片和枝干上，吮吸汁液危害，造成植株生长\n不良，早期落叶。\n\n·防治方法·\n\n（1）整形修剪：结合草履蚧生活习性，在冬季、早春结合修剪，剪除虫枝，对生长过旺、枝叶郁\n闭的枝条进行疏剪，改善通透性，将剪除的枝条集中销毁。\n\n（2）清除虫源：于秋冬季节结合日常养护管理，对当年虫害发生严重的树木，可用竹片、软刷清\n\n\n\n除树缝内的卵囊，以减少虫量。\n\n（3）环涂粘虫胶：根据若虫上树危害的生物习性，可于早春（2 月中下旬至 3月中旬）在树干环涂\n宽度为 10~20 cm的黏虫胶，阻止若虫上树。采取该措施防治时应注意：一是在涂胶前，应刮除涂\n胶部位的粗皮，但不可破坏树木形成层，高度和宽度要整齐划一，达到美观的目的；二是绿地中的\n树木涂胶应尽量涂在较低部位，绿篱中的乔木涂胶，一定要低于绿篱的高度；三是注意清理涂胶部\n位的脏污，及时增添新虫胶，保持胶状物的粘虫度，以使其充分发挥作用；四是及时清理杀灭被阻\n止上树的若虫。\n\n（4）喷药防治：发现已有若虫上树，应及时用 99%矿物油乳油 100~200 倍液加有机硅助剂 3 000\n倍液防治，喷药时间应在 3 月中旬之前，此时虫体小、体被蜡质层薄，抗药性差。\n\n（5）草履蚧有很多种类的天敌，如大红瓢虫、红环瓢虫、红点唇瓢虫、鸟类等，在生产中应注意\n减少化学药物的使用，充分保护天敌昆虫和鸟类，增加天敌的种类和数量，控制草履蚧危害。\n\n草履蚧 聚集危害\n\n\n\n草履蚧 聚集危害\n\n草履蚧 雄成虫\n\n\n\n草履蚧 雌成虫\n\n草履蚧 卵\n\n\n\n红环瓢虫 成虫\n\n\n\n草履蚧 雌成虫\n\n\n\n草履蚧 雌成虫入土产卵\n\n桑白盾蚧\n\n\n\n·学名· Pseudaulacaspis pentagona （Targioni-Tozzetti），属半翅目（Hemiptera）盾蚧科\n（Diaspididae），又名桑盾蚧、桑白蚧、桑介壳虫、桃介壳虫、桑蚧。\n\n·鉴别特征· 成虫：雌体长 0.9~1.2 mm，淡黄至橙黄色，介壳灰白至黄褐色，近圆形，长 2~2.5\nmm，略隆起，有螺旋形纹，壳点黄褐色，偏生一方；雄体长0.6~0.7 mm，翅展 1.8 mm，橙黄至橘\n红色。\n\n·生活习性· 一年发生 3 代，以受精雌成虫在枝条上越冬。翌春 3 月中旬开始产卵；4 月下旬第一代\n若虫孵化，固定在母蚧附近的枝干上，吮吸危害，并分泌白色蜡粉；6 月出现第一代成虫并开始产\n卵；7 月孵化第二代若虫，分散危害；第二、第三代成虫分别于 8 月和 9 月发生。\n\n·危害特点· 主要以若虫和雌成虫寄生在枝干上，吸汁危害，分泌的灰白色蜡质物似一层棉絮，妨碍\n植株生长，使枝条枯萎，并能诱发煤污病害。\n\n·防治方法·\n\n（1）经常修剪，保持枝叶通风透光以减少虫害发生。\n\n（2）在植物冬眠期间喷洒 45%石硫合剂晶体 150 倍液。\n\n（3）在若虫初孵时可喷施 99%矿物油乳油 100~200 倍液加有机硅助剂 3 000倍液，严重发生区要\n每隔 7 天喷施 1 次，连喷 2~3 次，施药前刮擦枝干上层叠加的介壳，效果好。\n\n（4）保护和利用天敌昆虫，如蚜小蜂、跳小蜂、瓢虫、草蛉等。\n\n桑白盾蚧 雄介壳\n\n\n\n桑白盾蚧 危害状\n\n桑白盾蚧 雌介壳\n\n\n\n桑白盾蚧 雄介壳\n\n\n\n\n\n\n桑白盾蚧 桃枝被害状\n\n桑白盾蚧 雌成虫腹面观\n\n\n\n桑白盾蚧 雌成虫盾蚧\n\n\n\n桑白盾蚧 雄蛹蜡茧\n\n\n\n桑白盾蚧 雄成虫腹面观\n\n\n\n桃树病虫防治历\n\n（续表）\n\n\n\n\n\n\n\n\n\n三、梨树\n\n梨，是一种落叶乔木或灌木，极少数品种为常绿，属于蔷薇科苹果亚科。叶片多卵形，花白色，或\n略带黄色、粉红色，有五瓣。果实形状有圆形的，也有基部较细、尾部较粗的“梨形”。梨的果实通\n常用来食用，味美汁多，甜中带酸，营养丰富，含有多种维生素和纤维素，既可生食，也可蒸煮后\n食用，利消化，对心血管也有好处。\n\n在我国，梨栽培面积和产量仅次于苹果。安徽、河北、山东、辽宁四省是我国梨的集中产区，栽培\n面积占全国一半左右，产量超过 60%。上海地区梨树种植面积约 2.8 万亩，主要分布于浦东、奉\n贤、松江、金山、嘉定、宝山、崇明等区。",
      "·危害特点· 主要在苹果树干枝的伤疤、隙缝及根部等处吸取养分，影响树势和花芽分化，造成减\n产，危害方式较为隐蔽。树干、枝条和根系受害严重处，逐渐形成瘤状突起，被覆大量白色棉絮状\n物，拨去棉絮状物，可见红色蚜虫体。\n\n·防治方法·\n\n（1）苹果发芽前树干喷施 45%石硫合剂晶体。\n\n（2）参见苹果黄蚜的防治用药。\n\n\n\n苹果绵蚜 聚集危害\n\n苹果绵蚜 聚集危害\n\n\n\n苹果绵蚜 聚集危害\n\n苹果绵蚜 聚集危害\n\n\n\n苹果绵蚜 聚集危害\n\n山楂叶螨\n\n·学名· Tetranyhus viennensis ，属蛛形纲（Arachnida）叶螨科（Tetranychidae）。\n\n·鉴别特征· 成螨：雌成螨卵圆形，体长 0.54~0.59 mm，冬型鲜红色，夏型暗红色；雄成螨体长\n0.35~0.45 mm，体末端尖削，橙黄色。卵：圆球形，春季产卵呈橙黄色，夏季产卵呈黄白色。幼\n螨：初孵幼螨体圆形、黄白色，取食后为淡绿色，3对足。若螨：4 对足，前期若螨体背开始出现\n刚毛，两侧有明显墨绿色斑，后期若螨体较大，体形似成螨。\n\n·生活习性· 1 年发生 5~9 代，以受精雌虫在树皮裂缝、靠近树干基部 3 cm处的土缝中越冬，有时还\n可以在杂草、枯枝落叶或石块下面越冬。华北地区多在 4 月上旬出蛰，并上树危害；6 月上旬为第\n二代卵孵化盛期，如防治不及时，易导致山楂叶螨的暴发流行，致叶片焦枯脱落。该虫危害时间较\n长，4~7 月均可危害，7 月份以后出现越冬虫态。\n\n·危害特点· 以幼螨、若螨和成螨危害叶片。常群集在叶片背面的叶脉两侧，并吐丝拉网，在网下刺\n吸叶片汁液。被害叶片出现失绿斑点，甚至变成黄褐色或红褐色，光合作用降低，严重者枯焦，似\n火烧状，提前落叶。\n\n·防治方法·\n\n（1）萌芽前刮除翘皮、粗皮，消灭大量越冬虫源。\n\n（2）3 月下旬喷布 45%石硫合剂晶体。\n\n（3）药剂防治：生长期喷药，可选用 5%噻螨酮可湿性粉剂、20%哒螨灵可湿性粉剂 2 000 倍液、\n5.6%阿维·哒螨灵微乳剂 1 000 倍液、24%螺螨酯悬浮剂4 000 倍液等。\n\n\n\n山楂叶螨 成螨\n\n\n\n山楂叶螨（镜下） 成螨\n\n\n\n山楂叶螨 危害状\n\n\n\n山楂叶螨 聚集危害\n\n桃小食心虫\n\n·学名· Carposina sasakii Matsumura ，属鳞翅目（Lepidoptera）卷蛾科（Tortricidae）。\n\n\n\n·鉴别特征· 雌性成虫：体较大，体长 7~8 mm，翅展 15~18 mm；雄性虫体较小，体长 5~6 mm，翅\n展 13~15 mm，全体灰白色至灰褐色，复眼红褐色，成虫前翅前缘后方有一个倒三角形黑斑。老熟\n幼虫：长13~16 mm，桃红色，腹部色淡，头黄褐色，前胸盾黄褐至深褐色，臀板黄褐或粉红；前\n胸只 2 根刚毛；腹足趾钩单序环 10~24个，臀足趾钩 9~14 个，无臀栉。\n\n·生活习性· 1 年发生 1~2 代，以 2 代为主。以老熟幼虫在树干周围土层内做扁圆形茧越冬。5 月中\n下旬开始咬破越冬茧爬出地面，寻找土质松软、较潮湿的场所做“蛹化茧”化蛹。5 月初土壤越潮\n湿，幼虫开始出土时间越晚。一般越冬代幼虫出土至成虫羽化需 14~20 天。越冬代成虫出现时间\n在 6 月中下旬，可延续到 7 月初。第一代成虫 8 月中下旬发生，以晚熟品种（如富士）落卵最多，\n幼虫发育成熟后脱果入土结茧越冬。\n\n·危害特点· 初孵幼虫蛀果后，蛀孔常流出透明水珠状果胶，称“眼泪滴”，干后呈白色。幼虫在果内\n窜食，后达果心。蛀道内留有淡褐色虫粪，称“豆沙馅”。危害严重时，果面凹凸不平，畸形，\n称“猴头果”。幼虫脱果后，果面有小圆形脱果孔。\n\n·防治方法·\n\n（1）6 月上旬使用 3%辛硫磷颗粒剂，按每亩 3~5 kg撒施到树干周围，施药后浅锄，使农药进入表\n土层内，或用 40%辛硫磷乳油 500 倍液喷灌树基周围。\n\n（2）利用桃小食心虫性诱剂测报，从连续诱到成虫开始喷药。药剂有 25%灭幼脲悬浮剂 1 000 倍\n液、35%氯虫苯甲酰胺悬浮剂 7 000~10 000 倍液等。\n\n\n\n桃小食心虫 苹果被害状\n\n桃小食心虫 越冬茧\n\n\n\n桃小食心虫 卵\n\n\n\n桃小食心虫 蛹化茧\n\n桃小食心虫 幼虫\n\n\n\n桃小食心虫 蛹\n\n\n\n桃小食心虫 羽化状\n\n\n\n桃小食心虫 成虫\n\n\n\n桃小食心虫 成虫\n\n桑天牛\n\n·学名· Apriona germari （Hope），属鞘翅目（Coleoptera）天牛科（Cerambycidae）。\n\n·鉴别特征· 成虫：体长 34~46 mm，体和鞘翅黑色，被黄褐色短毛。卵：长椭圆形，长 5~7 mm，\n前端较细，略弯曲，黄白色。幼虫：圆筒形，长大时长 45~60 mm，乳白色。蛹：纺锤形，长约 50",
      "·危害特点· 幼虫吐丝缀连叶片，潜居缀叶中取食危害，新叶受害严重。树上有果时，常将叶片缀贴\n果面上或将两果缀连在一起，在叶果间啃食果皮，将果面啃食成一个个小坑洼状虫斑，故称“舔皮\n虫”，多雨时常导致果实腐烂。\n\n·防治方法·\n\n（1）利用成虫趋光性，杀虫灯诱杀成虫。\n\n（2）药剂防治：幼虫期防治，药剂可选用 32 000 IU/mg苏云金杆菌可湿性粉剂200倍液、20%除虫\n脲悬浮剂1 200~2 000倍液、0.3%印楝素乳油400~600倍液、1%苦参碱可溶液剂 1 000~1 500 倍液。\n\n棉褐带卷蛾 成虫\n\n\n\n棉褐带卷蛾 成虫\n\n\n\n棉褐带卷蛾 幼虫\n\n棉褐带卷蛾 雄成虫\n\n\n\n棉褐带卷蛾 雄成虫\n\n梨小食心虫\n\n·学名· Grapholita molesta Busck，属鳞翅目（Lepidoptera）卷蛾科（Tortricidae），又名梨小。\n\n·鉴别特征· 参照桃树梨小食心虫（p70）。\n\n·生活习性· 参照桃树梨小食心虫（p70）。\n\n\n\n·危害特点· 参照桃树梨小食心虫（p70）。\n\n·防治方法· 参照桃树梨小食心虫（p70）。\n\n梨小食心虫 成虫\n\n\n\n梨小食心虫 成虫\n\n\n\n梨小食心虫 危害状\n\n\n\n梨小食心虫 幼虫\n\n桃蛀螟\n\n·学名· Dichocrocis punctiferalis Guenée，属鳞翅目（Lepidoptera）螟蛾科（Pyra lidae），又名桃蠹\n螟，桃斑螟。\n\n·鉴别特征· 参照桃树虫害（p72）。\n\n·生活习性· 参照桃树虫害（p72）。\n\n·危害特点· 参照桃树虫害（p72）。\n\n·防治方法· 参照桃树虫害（p72）。\n\n\n\n桃蛀螟 成虫\n\n\n\n桃蛀螟 成虫\n\n\n\n桃蛀螟 危害状\n\n\n\n桃蛀螟 幼虫\n\n梨剑纹夜蛾\n\n·学名· Acronicta rumicis Linnaeus，属鳞翅目（Lepidoptera）夜蛾科（Noctuidae），又名梨叶夜蛾。\n\n·鉴别特征· 成虫：体长 14~17 mm，翅展 32~46 mm，体灰棕色、暗棕色，头、胸及前翅黑色，前\n翅有白色斑纹，基线、内线和外线为双曲黑线，外线、亚端线为曲折白线，后翅棕黄色，外缘色\n浓，缘毛白褐色。卵：半球形，初为乳白色，后为红褐色。老熟幼虫：体长约 30 mm，褐色，体\n疏生有黄褐色长毛的毛瘤，头部黑色，腹部背面有 1 列黑斑，第二、第八节背面有 2 个红色斑纹；\n亚背线有 1 列白点；气门下线白色或灰黄色，曲折；第一至第八气门之间生有 1 个近三角形斑纹；\n毛片枯黄色、毛红色或黑色。蛹：长 15~18 mm，黑褐色。茧：长约 20 mm，椭圆形，土色。\n\n·生活习性· 梨剑纹夜蛾一年发生 3~4 代，以蛹在土中结茧越冬。翌年 5~6 月成虫羽化、交尾，卵产\n于叶上。6~7 月和 8~9 月是各代幼虫发生期，夏季在叶上结茧化蛹。10 月幼虫入土结茧、化蛹越\n冬。\n\n·危害特点· 初孵幼虫啮食叶片叶肉残留表皮，稍大食叶成缺刻和孔洞。\n\n·防治方法·\n\n（1）利用成虫趋光性，杀虫灯诱杀成虫。\n\n（2）药剂防治：幼虫期防治，药剂可选用 32 000 IU/mg苏云金杆菌可湿性粉剂200倍液、20%除虫\n脲悬浮剂1 200~2 000倍液、0.3%印楝素乳油400~600倍液、1%苦参碱可溶液剂 1 000~1 500 倍液。\n\n\n\n梨剑纹夜蛾 幼虫\n\n\n\n梨纹剑夜蛾 幼虫\n\n\n\n梨剑纹夜蛾 成虫\n\n\n\n梨剑纹夜蛾 成虫\n\n梨瘿蚊\n\n·学名· Dasineua pyri Bonche，属双翅目（Diptera）瘿蚊科（Cecidomyiidae）。\n\n·鉴别特征· 雌成虫：体长 1.4~1.8 mm，翅展 3.3~4.3 mm，腹末有长约 1.2 mm的管状伪产卵器。雄\n成虫：体长 1.2~1.4 mm，翅展约 3.5 mm，体暗红色，头小，前翅具蓝紫色闪光，后翅退化成平衡\n棒，淡黄色。卵：长椭圆形，长约 0.28 mm，初产时淡橘黄色，孵化前变为橘红色。老熟幼虫：体\n长 1.8~2.4 mm，长纺锤形，橘红色，前胸腹面有“丫”字形黄色剑骨片。蛹：裸蛹，橘红色，长\n1.6~1.8 mm，蛹外有白色胶质茧。\n\n·生活习性· 梨瘿蚊一年发生 2~3 代。3 月中旬开始出现越冬代成虫，4 月上旬为发生盛期。第一代\n成虫 5 月上旬发生，第二代成虫 6 月上旬发生。老熟幼虫脱叶后，弹落地面或随雨水沿枝干下行，\n寻找适当的场所结茧化蛹，降雨潮湿有利于梨瘿蚊的发生。\n\n·危害特点· 以幼虫危害芽和嫩叶，芽、叶被害后出现黄色斑点，叶面呈现凹凸不平，叶缘向正面卷\n曲，严重时叶片纵卷，甚至成双筒状。幼虫危害的同时不断分泌刺激性物质，使叶肉组织肿胀、畸\n形，不能展开，造成受害叶早期脱落。\n\n·防治方法·",
      "mm，黄白色。\n\n·生活习性· 华东地区 2 年发生 1 代，以一或二年生幼虫于蛀道内越冬。经过两个冬天的幼虫到第三\n年 6~7 月间化蛹。成虫 6 月下旬至 7 月中下旬为盛发期。成虫喜欢取食桑树枝干皮补充营养。成\n虫产卵前，用上颚将树皮啃成乱麻状，然后在内产一粒卵。幼虫孵化后渐入心髓，由上向下钻蛀，\n每隔 5~6 cm咬一排粪孔，第三年达 17~19 个。\n\n·危害特点· 成虫食害嫩枝皮和叶；幼虫蛀害枝干的皮下和木质部内，向下蛀食，隧道内无粪屑，隔\n一定距离向外蛀 1 通气排粪屑孔，排出大量粪屑，导致树势早衰，重者枯死。\n\n·防治方法·\n\n（1）根据啃食枝条皮层症状及早捕杀成虫。根据产卵刻槽切除卵粒。\n\n（2）果园周围少种桑类植物、榆树、杨树、刺槐等。\n\n（3）春秋两季为药杀幼虫关键时期。向鲜粪排孔内注药，每孔蛀入 10 ml药液后用泥土将孔封\n闭，药剂可用 1.8%阿维菌素水乳剂 500 倍液，发现幼虫排粪孔后，将药液注入。\n\n\n\n桑天牛 卵\n\n桑天牛 幼虫\n\n\n\n\n\n\n桑天牛 幼虫及危害状\n\n桑天牛 蛹\n\n\n\n桑天牛 羽化孔\n\n\n\n桑天牛 成虫\n\n\n\n桑天牛 取食刻槽\n\n\n\n\n\n\n七、柿\n\n柿树为柿科柿属落叶大乔木，原产我国长江流域，且已有三千多年栽培历史。柿树是深根性树种，\n喜温暖，适生于中性土壤，较耐寒，耐旱，不耐盐碱。柿树除有食用价值，还具有良好的观赏效\n果，可作为观赏树种。入秋后的柿果和柿叶颜色鲜艳，令人赏心悦目。\n\n据不完全统计，中国栽培的柿树品种有 800 个以上。上海地区柿主要分布在金山区、崇明区等地，\n上海柿生产总面积约 520 亩，主要病虫包括柿绒蚧、白星花金龟、柿树角斑病、柿黑星病等。\n\n\n\n柿树病害\n\n柿树炭疽病\n\n·病原· 柿盘长孢菌（ Gloeosporium kaki ），属半知菌亚门（Deuteromycotina）盘长孢属（\nGloeosporium ）。\n\n·症状· 果实、嫩梢和叶片均可染病。果实发病初期出现深褐色或黑色小斑点，逐渐扩大为圆形或椭\n圆形病斑，稍凹陷，外围呈黄褐色，病斑中央密生灰色至黑色轮纹状排列的小粒；果内形成黑色硬\n块，果实早落，一般一个病果上有 1~2 个病斑，多的也有十几个。新梢感病初期产生黑色小圆\n斑，扩大后病斑暗褐色，长椭圆形，中部稍凹陷并现褐色纵裂，产生黑色小点；病斑下部木质部腐\n朽，枝条易枯死。叶片发病时，叶片病斑多在叶柄和叶脉上出现，病斑开始为黄褐色，后期变为黑\n色或黑褐色，长条状或不规则形。\n\n·发病规律· 病菌以菌丝体在枝梢病部或病果、叶痕及冬芽中越冬。翌年夏天产生分生孢子，借风\n雨、昆虫传播，从伤口或皮孔直接侵入。枝梢发病一般始于 6 月上旬；果实发病时期一般在 6 月下\n旬至采收期。发病重时 7 月下旬果实开始脱落。高温、高湿利于发病，雨后气温升高或夏季多雨发\n病重。\n\n·防治方法·\n\n（1）加强水肥管理，增强树势，提高树体抗病力，改善园内通风透光条件，降低田间湿度。多施\n有机肥，增施磷、钾肥。\n\n（2）冬春季节及时修剪病枝，摘除病僵果，并清园，消灭越冬病原。\n\n（3）药剂防治：发芽前喷施 45%石硫合剂晶体 30 倍液做好预防保护；展叶、幼果期喷施波尔多\n液 100 倍液等杀菌剂进行治疗性防治。\n\n柿树炭疽病 病果\n\n\n\n柿树炭疽病 病果\n\n柿树炭疽病 病果\n\n\n\n柿树炭疽病 病枝和病果\n\n\n\n柿树炭疽病 分生孢子盘和分生孢子\n\n柿树黑星病\n\n·病原· 柿黑星孢（ Fusicladium kaki Hori et Yoshino），属半知菌亚门（Deutero mycotina）黑星孢属\n（ Fusicladium ）。\n\n·症状· 果实、叶片和枝梢均可染病。果实病斑圆形或不规则形，稍硬化呈疮痂状，病斑处易裂开，\n病果易脱落。叶片染病初期，叶脉上生黑色小点，后沿叶脉蔓延扩大为多角形或不定形漆黑色病\n斑，湿度大时背面出现黑色霉层，即病菌分生孢子梗和分生孢子。枝梢染病形成纺锤形或椭圆形淡\n褐色凹陷病斑，重则病斑处开裂呈溃疡状或折断。\n\n·发病规律· 病菌以菌丝或分生孢子在枝梢病斑上或病叶、病果上越冬。翌年春孢子萌发，从气孔、\n皮孔和伤口等处直接侵入，5 月间病菌形成菌丝后产生分生孢子，借风雨传播，潜育期 7~10 天，\n进行多次再侵染，扩大蔓延。\n\n·防治方法·\n\n（1）萌芽展叶时，树体喷施 5 波美度石硫合剂或 1∶4∶400 倍式波尔多液 1~2次，预防保护新\n叶；萌芽后喷施苯醚甲环唑等内吸治疗药剂进行防治；生长季节一般掌握在 6 月上中旬、落花后喷\n施嘧菌酯、代森联等杀菌剂杀灭园内病菌孢子，可使用 50%嘧菌酯水分散粒剂 1 000~2 000 倍液，\n或 50%多菌灵可湿性粉剂600~800 倍液等。",
      "（1）冬季结合清园，刮除树干上的粗老翘皮，树干涂白，清理的枝丫叶片和杂草集中粉碎或深\n埋。\n\n（2）药剂防治：要掌握在夏季和秋季嫩梢长出不到 3 mm时或新叶受害 5%时开始用药，喷洒 25%\n灭幼脲悬浮剂 1 500 倍液，或 34%螺螨酯悬浮剂 400~600 倍液，每 7~10 天用 1 次药，连续用药\n2~3 次。\n\n（3）用性诱剂诱杀成虫，每亩挂 2~3 个诱芯。\n\n\n\n桃潜叶蛾 危害状\n\n\n\n桃潜叶蛾 幼虫出孔\n\n\n\n桃潜叶蛾 茧\n\n\n\n桃潜叶蛾 蛹\n\n桃潜叶蛾 成虫\n\n梨小食心虫\n\n·学名· Grapholita molesta Busck，属鳞翅目（Lepidoptera）卷蛾科（Tortricidae），又名梨小。\n\n·鉴别特征· 成虫：体长 6~7 mm，翅展 10~15 mm，灰褐色，前缘具有 10 组白色斜纹，翅面中央有\n一小白点，近外缘处有 10 个黑色斑点。卵：扁椭圆形，淡黄白色、半透明。幼虫：末龄幼虫体长\n10~13 mm，淡黄白色或粉红色。蛹：纺锤形，黄褐色；茧：灰白色。\n\n·生活习性· 梨小食心虫一年发生 4~5 代。以老熟幼虫在枝干裂皮缝隙及树干周围的土缝里结茧越\n冬。次年 3 月开始化蛹，4 月上中旬成虫羽化，4 月下旬至 5 月初第一代幼虫开始危害桃梢。第二\n代幼虫也危害桃梢，3~4 代在梨果上危害。危害梨果的卵多产在梨果萼洼处或两果接缝处。蛀果盛\n期在 8 月下旬至 9 月上旬，所以晚熟品种受害最重。第一二代幼虫蛀食桃梢；第三四代幼虫钻蛀梨\n果。梨小食心虫成虫对糖、醋、酒的气味和灯光有趋性。\n\n\n\n·危害特点· 以幼虫蛀食桃嫩梢和钻蛀果实。危害嫩梢时，新梢顶部出现萎蔫，几天后新梢顶部干枯\n死亡；危害果实时，幼虫多从梗凹处蛀入在果皮下取食，当果实近成熟时幼虫直接蛀食果心。\n\n·防治方法·\n\n（1）彻底刮除树体上的粗翘皮，将潜藏其中的越冬幼虫刮死、刮掉集中烧毁，以减少次年成虫的\n发蛾量。落叶后喷施 5 波美度石硫合剂。\n\n（2）生长季节及时剪除虫梢，摘除虫果及感病果以控制其一二代数量。\n\n（3）用糖醋液挂容器诱捕其成虫，糖醋液比例为：红糖∶醋∶酒∶水=2∶4∶1∶16。此外梨果套\n袋可大大减少梨小食心虫的侵染及危害。\n\n（4）使用梨小食心虫迷向素防治。\n\n（5）药剂防治：在搞好预测预报的基础上，在卵孵盛期和成虫盛发期及时用药，准确用药。防治\n幼虫药剂可选用 20%除虫脲悬浮剂 1 200~2 000 倍液，或 4.3%氯虫苯甲酰胺加 1.8%阿维菌素水乳\n剂 3 000~4 000 倍液等。\n\n（6）杀虫灯诱杀，利用太阳能频振式杀虫灯，不仅可以诱杀梨小食心虫，还可以诱杀其他害虫，\n每盏灯可控面积 15 亩左右。杀虫灯架设在果园周围位置比较高、比较开阔的地方，这样能更好地\n诱杀害虫。\n\n\n\n梨小食心虫 危害新梢\n\n\n\n梨小食心虫 危害新梢\n\n\n\n梨小食心虫 幼虫\n\n\n\n梨小食心虫 成虫\n\n\n\n梨小食心虫 梨果被害状\n\n梨小食心虫 卵\n\n\n\n梨小食心虫 幼虫\n\n梨小食心虫 蛹\n\n\n\n梨小食心虫 成虫\n\n桃蛀螟\n\n·学名· Dichocrocis punctiferalis Guenée，属鳞翅目（Lepidoptera）螟蛾科（Pyralidae），又名桃蠹\n螟，桃斑螟。\n\n·鉴别特征· 成虫：体长约 12 mm，翅展 24 mm左右，体橙黄色，前后翅及胸、腹背面都散生许多\n小黑斑。雌蛾末端圆锥形，雄蛾尾端有 1 丛黑毛。卵：椭圆形，长 0.6~0.7 mm，初产时乳白色，\n后渐变橘红色。老熟幼虫：体长 20~25 mm，灰褐色或暗红色，前胸背板褐色，背腹面各节有毛片\n4 个；雄性幼虫腹部第五节背面可见 1 对灰黑色性腺。蛹：长 12~15 mm，褐色，尾端有臀刺 6\n个。\n\n·生活习性· 桃蛀螟一年发生 4 代，第一二代幼虫主要危害桃、李、梨、石榴等果实；第三四代主要\n危害葵花、玉米、蓖麻。5 月下旬到 6 月上旬为第一代产卵高峰期，第一代幼虫孵化高峰在 6 月下\n旬；幼虫孵化后，多从果蒂、果叶或两果相接处蛀入果内取食。蛀入孔处堆积很多深褐色粒状虫\n粪，并流出黄褐色胶液，致使果实腐烂、脱落，幼虫会转移危害多个果实，造成“十桃九蛀”。幼虫\n老熟后在果柄、两果相接或在果内化蛹。成虫昼伏夜出，趋光性强。早熟桃着卵早，晚熟桃着卵量\n大，受害期长。\n\n·危害特点· 幼虫钻蛀桃、梨、柑橘、石榴等果实。幼虫蛀入孔处堆积很多深褐色粒状虫粪，并流出\n黄褐色胶液，致使果实腐烂、脱落，幼虫会转移危害多个果实，造成“十桃九蛀”。\n\n·防治方法·\n\n（1）在每年 4 月中旬，越冬幼虫化蛹前，清除玉米、向日葵等寄主植物的残体，并刮除苹果、\n梨、桃等果树翘皮、集中烧毁，减少虫源。"
    ]
  },
  {
    "question": "梨网蝽（梨冠网蝽）主要以什么虫态越冬？",
    "answer": "梨冠网蝽主要以成虫越冬。",
    "standard_answer": "梨网蝽以成虫在枯枝落叶、树皮缝、杂草及根际土块中越冬。",
    "contexts": [
      "·学名· Psylla chinensis Yang et Li，属半翅目（Hemiptera）木虱科（Psyllidae），又名中国梨木虱。\n\n·鉴别特征· 成虫：分冬型和夏型。冬型成虫体型较大，长 2.8~3.2 mm，深灰色至黑褐色；夏型成\n虫体型较小，长 2.3~2.9 mm，黄绿色。中胸背板有 4 条红黄色或黄色的纵纹；翅透明，翅脉淡黄\n褐色。卵：长 0.3 mm，黄褐色，卵圆形，一端尖细并延长成长丝，另一端钝圆，下方有 1 个刺\n突。若虫：形似成虫，体边缘有刺突，体背褐色，有红绿相间的斑纹。\n\n·生活习性· 梨木虱一年发生 4~5 代，以成虫在树皮裂缝、落叶、杂草内越冬。翌年梨芽萌动时恢复\n活动，萌芽期为越冬代成虫产卵盛期。产卵在短枝和芽的缝隙处等。第一代若虫发生在 4 月上旬至\n6 月上旬。第一代成虫 5 月上旬出现。世代重叠。若虫多在叶片危害，分泌大量蜜状黏液，并致使\n叶片卷缩并产生严重的煤污现象，引起大规模落叶，影响产量和果实质量。\n\n·危害特点· 以成虫和若虫刺吸嫩绿组织的汁液进行危害。受害叶片叶脉扭曲、叶面皱缩，严重时形\n成褐色枯斑，甚至早期脱落。若虫分泌大量黏液，常使叶片粘在一起或粘在果实上，诱发煤污病污\n染叶片和果实。\n\n·防治方法·\n\n（1）早春刮树皮，清洁果园，消灭成虫越冬场所，压低虫口密度。芽萌动期，选择温暖无风的晴\n朗天气喷药，杀灭越冬代成虫；花铃铛球期时再喷药 1 次，集中杀灭第一代卵。\n\n（2）应抓住落花后的第一代和第二代。终花期是防治第一代若虫的关键期，落花后 30 天左右是防\n治第一代成虫的关键期，落花后 1.5 个月左右是防治第二代若虫的关键期。防治药剂可选用 20%除\n虫脲悬浮剂 1 200~2 000 倍液、4.3%氯虫苯甲酰胺加 1.8%阿维菌素水乳剂 3 000~4 000 倍液、\n\n\n\n22.4%螺虫乙酯悬浮剂4 000~5 000 倍液等。防治若虫时，在虫体尚未被黏液完全覆盖时喷药效果最\n好；若在药液中加入有机硅等助剂，可分解部分黏液，提高杀虫效果。\n\n梨木虱 危害状\n\n\n\n梨木虱 危害状\n\n\n\n梨木虱 若虫\n\n\n\n梨木虱 危害状\n\n\n\n梨木虱 成虫\n\n梨木虱 成虫\n\n梨冠网蝽\n\n\n\n·学名· Stephanitis nashi Esaki et Takeya，属半翅目（Hemiptera）网蝽科（Tingidae），又名梨网\n蝽。\n\n·鉴别特征· 成虫：体长 3~3.5 mm，扁平，黑褐色；头部有 6 个锥状突起；前胸两侧向外呈翼片\n状，前胸两侧及前翅均有网格状纹，上有褐斑并具有金属光泽；静止时两翅重叠，黑褐色纹\n呈“X”状。卵：长椭圆形，长约 0.6 mm，一端略弯曲，初产时淡绿色，后渐变为浅黄色。若虫：初\n孵时白色、透明，后渐变为淡褐色；3龄出现翅芽，外形似成虫，体两侧有刺锥状刺突起。\n\n·生活习性· 梨冠网蝽一年发生 4~5 代，以成虫在枯枝落叶、树皮缝、杂草及根际土块中越冬。翌年\n4 月上中旬成虫开始活动，集中到叶背取食、产卵；5 月下旬孵化。第一代成虫 6 月初出现，以后\n各代出现期为 7 月上旬、8 月上旬、9 月上旬，有世代重叠现象。7~8 月危害最重，成、若虫群集\n于叶背刺吸危害；被害叶正面出现苍白色斑点，严重时叶面失绿呈灰白色并枯萎。叶背分泌物及卵\n壳导致叶片变黄，诱发煤污病；严重时叶片脱落，影响植株生长。遇干旱高温天气危害严重。10\n月后成虫停止取食，开始越冬。\n\n·危害特点· 以成虫和若虫在叶片背面刺吸汁液危害。受害叶片正面初期产生黄白色小斑点，虫量大\n时斑点扩大连片，导致叶片苍白；严重时叶片变褐，容易脱落。叶片背面附有害虫分泌物和排泄\n物，使叶背呈现黄褐色锈斑，易引起煤污。\n\n·防治方法·\n\n（1）冬季清园：梨树发芽前，彻底清除落叶、杂草，刮除枝干老翘皮，集中烧毁，消灭越冬成\n虫。萌芽期喷施 45%石硫合剂晶体 40~60 倍液，杀灭越冬成虫。\n\n（2）药剂防治：关键期有两个，一是越冬成虫出蛰至第一代若虫发生期，以压低春季虫口密度为\n主；二是夏季较重发生前喷药，以控制 7~8 月份的危害，在每一关键时期喷药 1~2 次即可。防治\n药剂有 3%啶虫脒微乳剂 6 000~8 000 倍液等。喷药时以喷洒叶片背面为主。\n\n梨冠网蝽 危害状\n\n\n\n梨冠网蝽 危害状\n\n梨冠网蝽 成虫\n\n\n\n梨冠网蝽 成虫\n\n梨冠网蝽 若虫\n\n\n\n梨冠网蝽 梨叶被害状\n\n\n\n梨冠网蝽 成虫\n\n麻皮蝽\n\n·学名· Erthesina fullo Thunberg，属半翅目（Hemiptera）蝽科Pentatomidae。",
      "·鉴别特征· 成虫：体长 18~24.5 mm，宽 8~11.5 mm，密布黑色点刻；背部棕褐色；前胸背板、小\n盾片、前翅革质部有不规则细碎黄色突起斑纹；前翅膜质部分黑色；腹面黄白色；头部稍狭长，前\n尖；触角 5 节，黑色丝状。卵：近鼓状，顶端具盖，白色。若虫：初龄若虫胸、腹背面有许多红、\n黄、黑相间的横纹；2 龄若虫腹背前面有 6 个红黄色斑点，后面中间有 1 个椭圆形褐色突起斑；老\n熟若虫与成虫相似，红褐色或黑褐色，触角 4 节、黑色，前胸背板中部及小盾片两侧具有 6 个淡红\n色斑点，腹背中部具暗色斑 3 个，其上各有淡红色臭腺孔 2 个。\n\n·生活习性· 一年发生一代，以成虫在草丛、屋檐、墙缝、树皮裂缝、枯枝落叶下等隐蔽处越冬。越\n冬成虫于翌年 5~7 月交配产卵，卵多产于叶背，卵期 10 天。5月中旬始见初孵若虫，7~8 月羽化为\n成虫，10 月开始越冬。成虫飞行力强，喜在树冠上部活动，有假死性，受惊时分泌臭液，会假死\n掉落地面。\n\n·危害特点· 以成虫和若虫刺吸危害果实，果实整个生长期均可受害。果实受害处表面凹陷，内部组\n织石细胞增多，局部停止生长，果面凹凸不平，果实变硬、畸形、形成疙瘩梨，丧失商品价值。\n\n·防治方法·\n\n（1）人工防治：梨树发芽前，彻底清除果园内枯枝落叶、杂草，消灭越冬害虫。果实套袋，防止\n果实受害。\n\n（2）药剂防治：在产卵高峰期至若虫孵化盛期及时喷药。药剂可选用 20%啶虫脒可湿性粉剂 6\n000~8 000 倍液等。\n\n\n\n麻皮蝽 危害梨果\n\n\n\n麻皮蝽 初孵若虫\n\n\n\n麻皮蝽 若虫\n\n\n\n麻皮蝽 成虫\n\n铜绿异丽金龟\n\n·学名· Anomala corpulenta Motschulsky，属鞘翅目（Coleoptera）丽金龟科（Rutelidae），又名铜绿\n金龟子。\n\n·鉴别特征· 成虫：体长 24~30 mm，宽 15~18 mm；背面铜绿色，有光泽，前胸背板两侧具有黄褐\n色细边，鞘翅铜绿色；每翅各有隆起的纵线 3 条，腹部米黄色，有光泽，臀板三角形，常有 1 个近\n三角形黑斑。卵：白色，初产为椭圆形，后逐渐变为球形，长 2 mm左右。幼虫：体长约 40 mm，\n头部暗黄色，体乳白色，常弯曲呈“C”形，各体节多褶皱，腹部末端 3 节膨大，青黑色，肛门\n呈“一”字横裂，在肛门周边散生多根刚毛。蛹：椭圆形，长约 25 mm，土黄色。\n\n\n\n·生活习性· 铜绿异丽金龟一年发生 1 代，以 3 龄幼虫在土中越冬。翌年 4 月下旬化蛹，6~7 月成虫\n羽化出土危害，到 8 月下旬终止。成虫具有较强的趋光性和假死性，成虫咬食梨、葡萄等果树和红\n叶李、女贞等林木的叶片补充营养。幼虫于 8月出现，幼虫为蛴螬，是重要的地下害虫，在土中啃\n食多种果树、林木的根茎或根部皮层。11 月蛴螬进入越冬期。\n\n·危害特点· 以成虫咬食花蕾、花器、嫩芽及叶片危害，食成孔洞、缺刻等，严重时将花蕾、花器、\n嫩芽吃光，影响开花、坐果及树体生长。\n\n·防治方法·\n\n（1）灯光诱杀成虫。\n\n（2）下午或傍晚用震落法捕杀成虫。\n\n（3）加强管理，中耕除草、松土，捕杀幼虫。\n\n（4）幼虫危害时，开沟、打洞浇灌或泼浇杀虫剂。药剂可用苏云金杆菌或20%除虫脲悬浮剂 1\n200~2 000 倍液。\n\n\n\n铜绿异丽金龟 成虫\n\n\n\n铜绿异丽金龟 成虫\n\n\n\n铜绿异丽金龟 成虫\n\n\n\n铜绿异丽金龟 成虫\n\n\n\n铜绿异丽金龟 成虫\n\n棉褐带卷蛾\n\n·学名· Adoxophyes orana Fischer von Roslerstamm，属鳞翅目（Lepidoptera）卷蛾科\n（Tortricidae），又名苹果小卷蛾、小黄卷叶蛾。\n\n·鉴别特征· 成虫：体长 6~10 mm，翅展 15~20 mm，体黄褐色；前翅外缘较直，呈长方形，黄褐色\n或暗褐色，前翅前缘中央有斜向后缘的暗褐色带，在末端分为 2叉，呈倒“Y”字形，近前缘前端也\n有 1 条斜向后缘的暗褐色带；后翅暗黄褐色。卵：浅黄色，椭圆形略扁平，孵化时褐色。老熟幼\n虫：体长 13~15 mm，黄绿至淡绿色，头小，全身细长。蛹：黄褐色，长 9~10 mm，腹部 2~7 节背\n\n\n\n面各有 2 排刺突，第一排较第二排大。\n\n·生活习性· 棉褐带卷蛾一年发生 5~6 代，以老熟幼虫在枯枝叶中越冬。越冬幼虫 4 月末 5 月初化\n蛹，5 月上中旬羽化。成虫有趋光性，羽化后 1~2 天交尾，交尾后 2 天产卵，卵块呈鱼鳞状产在叶\n背。卵期 6~9 天。幼虫缀叶取食，当叶苞内叶片枯死时，转移结新苞，受惊后吐丝下垂。老熟幼\n虫在叶苞内化蛹。",
      "（1）发芽前刮除枝干粗皮翘皮，并深翻树盘，促进越冬虫体死亡。生长期发现虫叶及时摘除，减\n少虫源。\n\n（2）药剂防治：一是地面用药防治成虫羽化，二是树上喷药杀灭成虫、幼虫。地面用药在越冬成\n虫羽化前 1 周进行。药剂可选用 20%除虫脲悬浮剂 1 200~2 000倍液，或 4.3%氯虫苯甲酰胺加\n1.8%阿维菌素水乳剂 4 000~5 000 倍液等。\n\n\n\n梨瘿蚊 危害状\n\n梨瘿蚊 危害状\n\n\n\n梨瘿蚊 幼虫\n\n梨瘿蚊 幼虫\n\n\n\n梨瘿蚊 幼虫\n\n梨茎蜂\n\n·学名· Janus piri Okamoto et Muramatsa，属膜翅目（Hymenoptera）茎蜂科（Cephidae），又名梨简\n脉茎蜂。\n\n·鉴别特征· 成虫：体长 7~10 mm，翅展 13~16 mm，细长、黑色、有光泽，翅透明，翅脉黑褐色。\n卵：长椭圆形，白色，半透明，略弯曲。老熟幼虫：体长8~11 mm，体稍扁平，头部淡褐色，头胸\n下弯，尾端上翘，无腹足。蛹：长7~10 mm，初化蛹时为乳白色，渐变为黑色。茧：棕黑色，膜\n状。\n\n·生活习性· 梨茎蜂一年发生 1 代。以幼虫及蛹在被害枝内越冬。翌年梨树开花期成虫逐渐羽化，谢\n花时成虫开始产卵危害。幼虫 5 月初开始孵化，在嫩枝内向下蛀食，7 月大部分都已蛀入二年生枝\n条内；幼虫老熟后头向上作茧越冬。成虫出现的早晚与当年早春的气温及梨树新梢生长期密切相\n关。早春温暖，气温较高，梨树开花早，新梢生长快，往往成虫出现也早；反之，则晚。\n\n·危害特点· 以成虫和幼虫危害梨树新梢。当新梢长至 6~7 cm时，成虫开始危害，用锯状产卵器在\n嫩梢 4~5 片叶处锯伤，再将伤口下方 3~4 片叶的叶片切去，仅留叶柄。新梢被锯后萎缩下垂，干\n枯脱落。幼虫在残留的嫩茎髓部蛀食，虫粪填塞虫道，受害嫩茎后期成褐色枝橛，脆而易折。\n\n·防治方法·\n\n（1）在落花后半月内，及时剪除上端枯萎的虫梢，集中销毁。结合冬季修剪，剪除被害枝条，集\n中烧毁。\n\n（2）成龄的果园一般不需喷药防治。幼树园需喷药。当新梢长至 5~10 cm时，第一次喷药；梨落\n花后喷第二次药。常用药剂有 20%除虫脲悬浮剂 1 200~2 000倍液、4.3%氯虫苯甲酰胺加 1.8%阿维\n菌素水乳剂 4 000~5 000 倍液等。\n\n\n\n梨茎蜂 危害状\n\n\n\n梨茎蜂 危害状\n\n梨茎蜂 危害状\n\n\n\n梨茎蜂 成虫\n\n梨茎蜂 幼虫\n\n\n\n梨树病虫防治历\n\n附：梨树病虫害监测及有关防治措施\n\n（一）梨树病虫害监测\n\n\n\n1.人工调查监测\n\n线路踏查结合标准地调查展开。根据梨树病虫害发生历期，分别在不同虫态或不同发病时期进行发\n生程度、危害程度监测。\n\n3月上旬至 4 月上旬开展梨锈病冬孢子、担孢子监测；梨木虱成虫、若虫监测；梨冠网蝽成虫监\n测。\n\n4月中旬至 6 月上旬开展梨锈病叶片危害情况调查；梨黑星病果实危害情况调查；梨轮纹病枝干危\n害情况调查；梨木虱成虫监测；梨冠网蝽若虫、成虫监测；梨小食心虫、桃蛀螟成虫监测及叶片危\n害情况调查。\n\n6月中旬至 9 月下旬开展梨黑星病果实危害情况调查；梨轮纹病果实危害情况调查；梨小食心虫、\n桃蛀螟成虫监测及叶片、果实危害情况调查。\n\n10 月至翌年 2 月开展梨树病虫害越冬基数调查。\n\n2.测报灯监测\n\n桃蛀螟等梨树害虫具有趋光性，利用这一特性开展测报灯监测。每年 4 月 1 日至 11 月 15 日，逐日\n记录、统计测报灯下的害虫种类和数量。每月对测报灯监测的数据进行分析，绘制害虫数量发生态\n势图，对未来 1~2 个月作出预测，指导生产防治。\n\n3.性信息素监测\n\n梨小食心虫、桃蛀螟具有趋化性，可利用这一特性开展性信息素监测。根据梨小食心虫、桃蛀螟的\n发生历期，每年 4 月 1 日至 10 月 31 日放置梨小食心虫、桃蛀螟性信息素开展害虫监测。自放置引\n诱剂监测之日起逐日记录统计引诱数量。每月对监测的数据进行分析，绘制害虫数量发生态势图，\n对未来 1~2 个月作出预测，指导生产防治。\n\n4.孢子捕捉仪监测\n\n在病害发生期，运用孢子捕捉仪捕捉病害孢子，开展梨锈病等病害的监测。\n\n（二）梨树病虫害防治措施\n\n梨树病虫害的防治需要结合梨树的物候期开展。\n\n在梨树的休眠期（12 月至翌年 2 月），需要冬季清园，加强果园的栽培管理。合理施肥，科学修\n剪，彻底清扫落叶，刮除枝干粗皮翘皮，集中深埋或烧毁，消灭病虫害越冬场所，降低菌源、虫\n源。",
      "·危害特点· 幼虫吐丝缀连叶片，潜居缀叶中取食危害，新叶受害严重。树上有果时，常将叶片缀贴\n果面上或将两果缀连在一起，在叶果间啃食果皮，将果面啃食成一个个小坑洼状虫斑，故称“舔皮\n虫”，多雨时常导致果实腐烂。\n\n·防治方法·\n\n（1）利用成虫趋光性，杀虫灯诱杀成虫。\n\n（2）药剂防治：幼虫期防治，药剂可选用 32 000 IU/mg苏云金杆菌可湿性粉剂200倍液、20%除虫\n脲悬浮剂1 200~2 000倍液、0.3%印楝素乳油400~600倍液、1%苦参碱可溶液剂 1 000~1 500 倍液。\n\n棉褐带卷蛾 成虫\n\n\n\n棉褐带卷蛾 成虫\n\n\n\n棉褐带卷蛾 幼虫\n\n棉褐带卷蛾 雄成虫\n\n\n\n棉褐带卷蛾 雄成虫\n\n梨小食心虫\n\n·学名· Grapholita molesta Busck，属鳞翅目（Lepidoptera）卷蛾科（Tortricidae），又名梨小。\n\n·鉴别特征· 参照桃树梨小食心虫（p70）。\n\n·生活习性· 参照桃树梨小食心虫（p70）。\n\n\n\n·危害特点· 参照桃树梨小食心虫（p70）。\n\n·防治方法· 参照桃树梨小食心虫（p70）。\n\n梨小食心虫 成虫\n\n\n\n梨小食心虫 成虫\n\n\n\n梨小食心虫 危害状\n\n\n\n梨小食心虫 幼虫\n\n桃蛀螟\n\n·学名· Dichocrocis punctiferalis Guenée，属鳞翅目（Lepidoptera）螟蛾科（Pyra lidae），又名桃蠹\n螟，桃斑螟。\n\n·鉴别特征· 参照桃树虫害（p72）。\n\n·生活习性· 参照桃树虫害（p72）。\n\n·危害特点· 参照桃树虫害（p72）。\n\n·防治方法· 参照桃树虫害（p72）。\n\n\n\n桃蛀螟 成虫\n\n\n\n桃蛀螟 成虫\n\n\n\n桃蛀螟 危害状\n\n\n\n桃蛀螟 幼虫\n\n梨剑纹夜蛾\n\n·学名· Acronicta rumicis Linnaeus，属鳞翅目（Lepidoptera）夜蛾科（Noctuidae），又名梨叶夜蛾。\n\n·鉴别特征· 成虫：体长 14~17 mm，翅展 32~46 mm，体灰棕色、暗棕色，头、胸及前翅黑色，前\n翅有白色斑纹，基线、内线和外线为双曲黑线，外线、亚端线为曲折白线，后翅棕黄色，外缘色\n浓，缘毛白褐色。卵：半球形，初为乳白色，后为红褐色。老熟幼虫：体长约 30 mm，褐色，体\n疏生有黄褐色长毛的毛瘤，头部黑色，腹部背面有 1 列黑斑，第二、第八节背面有 2 个红色斑纹；\n亚背线有 1 列白点；气门下线白色或灰黄色，曲折；第一至第八气门之间生有 1 个近三角形斑纹；\n毛片枯黄色、毛红色或黑色。蛹：长 15~18 mm，黑褐色。茧：长约 20 mm，椭圆形，土色。\n\n·生活习性· 梨剑纹夜蛾一年发生 3~4 代，以蛹在土中结茧越冬。翌年 5~6 月成虫羽化、交尾，卵产\n于叶上。6~7 月和 8~9 月是各代幼虫发生期，夏季在叶上结茧化蛹。10 月幼虫入土结茧、化蛹越\n冬。\n\n·危害特点· 初孵幼虫啮食叶片叶肉残留表皮，稍大食叶成缺刻和孔洞。\n\n·防治方法·\n\n（1）利用成虫趋光性，杀虫灯诱杀成虫。\n\n（2）药剂防治：幼虫期防治，药剂可选用 32 000 IU/mg苏云金杆菌可湿性粉剂200倍液、20%除虫\n脲悬浮剂1 200~2 000倍液、0.3%印楝素乳油400~600倍液、1%苦参碱可溶液剂 1 000~1 500 倍液。\n\n\n\n梨剑纹夜蛾 幼虫\n\n\n\n梨纹剑夜蛾 幼虫\n\n\n\n梨剑纹夜蛾 成虫\n\n\n\n梨剑纹夜蛾 成虫\n\n梨瘿蚊\n\n·学名· Dasineua pyri Bonche，属双翅目（Diptera）瘿蚊科（Cecidomyiidae）。\n\n·鉴别特征· 雌成虫：体长 1.4~1.8 mm，翅展 3.3~4.3 mm，腹末有长约 1.2 mm的管状伪产卵器。雄\n成虫：体长 1.2~1.4 mm，翅展约 3.5 mm，体暗红色，头小，前翅具蓝紫色闪光，后翅退化成平衡\n棒，淡黄色。卵：长椭圆形，长约 0.28 mm，初产时淡橘黄色，孵化前变为橘红色。老熟幼虫：体\n长 1.8~2.4 mm，长纺锤形，橘红色，前胸腹面有“丫”字形黄色剑骨片。蛹：裸蛹，橘红色，长\n1.6~1.8 mm，蛹外有白色胶质茧。\n\n·生活习性· 梨瘿蚊一年发生 2~3 代。3 月中旬开始出现越冬代成虫，4 月上旬为发生盛期。第一代\n成虫 5 月上旬发生，第二代成虫 6 月上旬发生。老熟幼虫脱叶后，弹落地面或随雨水沿枝干下行，\n寻找适当的场所结茧化蛹，降雨潮湿有利于梨瘿蚊的发生。\n\n·危害特点· 以幼虫危害芽和嫩叶，芽、叶被害后出现黄色斑点，叶面呈现凹凸不平，叶缘向正面卷\n曲，严重时叶片纵卷，甚至成双筒状。幼虫危害的同时不断分泌刺激性物质，使叶肉组织肿胀、畸\n形，不能展开，造成受害叶早期脱落。\n\n·防治方法·",
      "·发病规律· 梨炭疽病是一种高等真菌性病害，病菌主要以菌丝体在病枝条上及病落叶、病僵果中越\n冬。第二年温湿度适宜时产生大量病菌孢子，主要通过风雨传播进行侵染危害。该病在田间多次再\n侵染。落花后 10 天左右病菌即可不断侵染果实，到膨大后期果实逐渐开始发病，发病后产生的病\n菌孢子还可不断扩散危害。该病具有潜伏侵染现象。多雨潮湿、通风透光不良、果园湿度大是导致\n该病发生较重的主要环境条件。\n\n·防治方法·\n\n（1）加强果园管理。落叶后至发芽前，彻底清除果园内枯枝、落叶、病僵果，集中销毁或深埋，\n消灭越冬病菌。合理修剪、及时中耕除草，及时排水，合理施肥。\n\n（2）药剂防治：萌芽期，喷施 1 次 77%硫酸铜钙可湿性粉剂 300~400 倍液，铲除树体上越冬的残\n余病菌。从落花后 10 天左右开始喷药，每隔 10~15 天喷 1 次，连续喷 3 次。常用药剂有 70%甲基\n托布津可湿性粉剂 800~1 000 倍液、10%苯醚甲环唑水分散粒剂 2 000~2 500 倍液、250 g/L戊唑醇\n水乳剂 2 000~2 500 倍液。\n\n\n\n梨炭疽病 叶片被害状\n\n\n\n梨炭疽病 被害状\n\n\n\n\n\n\n梨炭疽病 叶片被害状\n\n\n\n梨炭疽病 叶片被害状\n\n梨炭疽病 植株被害状\n\n\n\n梨炭疽病 分子孢子梗，分生孢子及刚毛\n\n\n\n梨冠瘿病\n\n·病原· 根癌土壤杆菌［ Agrobacterium tumefaciens （Smith et Towns.）Conn.］，属根瘤菌科\n（Rhizobiaceae）土壤杆菌属（ Agrobacterium ）细菌，又称梨根癌病。\n\n·症状· 主要危害根部，也可发生在根颈部，甚至在主干、主枝上。发病后在发病部位形成肿瘤。肿\n瘤多不规则，大小差异很大。初生肿瘤乳白色或略带红色，柔软，后逐渐变褐色至深褐色，木质化\n而坚硬，表面粗糙或凹凸不平。病树根系发育不良，地上部分生长衰弱，植株矮小，叶黄化、稀\n疏、早落，严重时可致全株死亡。\n\n·发病规律· 参照桃根癌病（p66）。\n\n·防治方法· 参照桃根癌病（p66）。\n\n\n\n梨树根癌病 被害状\n\n\n\n梨树根癌病 被害状\n\n\n\n梨树根癌病 被害状\n\n\n\n梨树虫害\n\n草履蚧\n\n·学名· Drosicha corpulenta Kuwana，属半翅目（Hemiptera）珠蚧科Drosicha corpulenta，又名日本\n履绵蚧、草鞋蚧。\n\n·鉴别特征· 参照桃树草履蚧（p82）。\n\n·生活习性· 参照桃树草履蚧（p82）。\n\n·危害特点· 参照桃树草履蚧（p82）。\n\n·防治方法· 参照桃树草履蚧（p82）。\n\n\n\n\n\n\n草履蚧 聚集危害\n\n草履蚧 聚集危害\n\n\n\n草履蚧 聚集危害\n\n梨二叉蚜\n\n·学名· Schizaphis piricola Matsumura，属半翅目（Hemiptera）蚜科（Aphididae），又名梨蚜。\n\n·鉴别特征· 无翅孤雌胎生蚜：体长约 2 mm，绿色至黄绿色，被有白色蜡粉，背中央有 1 条翠绿色\n纵线，腹管长筒状，黑色，长为尾片的 2 倍，尾片舌状，近中部收缩。有翅孤雌胎生蚜：体长约\n1.8 mm，头胸部黑色，腹部黄绿至绿色，背中央有 1 条翠绿色纵线，触角第三节有次生感觉孔\n18~27 个，前翅中脉 2 叉。若虫与无翅孤雌胎生蚜类似。\n\n·生活习性· 梨二叉蚜一年发生约 20 代。以卵在芽腋、枝杈的缝隙内越冬，梨芽萌动时开始孵化。\n若蚜群集于露绿的芽上危害，待梨芽开绽时钻入芽内，展叶期又集中到嫩梢叶面危害，致使叶片向\n上纵卷成筒状或饺子状。落花后大量出现卷叶，半月左右开始出现有翅蚜，5~6 月大量迁飞到越夏\n寄主狗尾草和茅草上；9~10 月间，在越夏寄主上产生大量有翅蚜迁回梨树上繁殖危害，并产生性\n蚜。雌蚜交尾后产卵，以卵越冬。\n\n·危害特点· 以成蚜、若蚜群集在梨树新梢叶片正面刺吸危害，受害叶片向正面纵向卷曲成筒状，后\n逐渐皱缩变脆，受害叶不能伸展，严重时容易脱落。\n\n·防治方法·\n\n（1）冬季清园：上年秋季蚜虫数量较多的梨园，结合其他害虫防治，在萌芽期喷施 1 次 45%石硫\n合剂晶体 50~70 倍液，杀灭越冬虫卵。\n\n（2）人工防治：从梨二叉蚜危害卷叶初期开始，摘除被害卷叶，集中销毁，消灭卷叶内蚜虫，降\n低园内虫量。\n\n（3）药剂防治：花序分离期至铃铛球期和落花后 10 天内是药剂防治的两个关键期，各喷药 1 次即\n可。药剂可选用 0.3%苦参碱水剂 150~250 ml/亩等。\n\n\n\n梨二叉蚜 聚集危害\n\n瓢虫捕食蚜虫\n\n\n\n梨二叉蚜 梨树被害状\n\n\n\n梨二叉蚜 有翅蚜\n\n梨二叉蚜 触角\n\n梨木虱"
    ]
  },
  {
    "question": "葡萄黑痘病主要侵染葡萄的哪些组织？",
    "answer": "葡萄黑痘病主要侵染葡萄的叶片、枝梢和果实。",
    "standard_answer": "病菌侵染葡萄的幼嫩绿色部分，包括幼叶、嫩梢、幼果等。",
    "contexts": [
      "（4）生长期药剂保护：从幼叶展开 3~4 片时，喷第一次药，间隔 10~12 天再喷第二次药。开花前\n和谢花 70%~80%时各再喷 1 次，以后每隔 10~15 天喷 1 次，直至果实着色后结束。药剂可用\n1∶1∶200~400 波尔多液，或 22.5%啶氧菌酯悬浮剂 1 500~2 000 倍液，或 250 g/L嘧菌酯悬浮剂\n800~1 200 倍液，或 10%苯醚甲环唑水分散粒剂 1 000 倍液。\n\n（5）适当增施生物有机肥料，增强抗病力。\n\n\n\n葡萄黑痘病 枝梢被害状\n\n\n\n葡萄黑痘病 果实被害状\n\n\n\n\n\n\n葡萄黑痘病 果实被害状\n\n葡萄黑痘病 果实被害状\n\n\n\n葡萄黑痘病 叶片被害状\n\n葡萄黑痘病 分生孢子盘和分生孢子\n\n葡萄黑痘病 菌丝块\n\n葡萄炭疽病\n\n·病原· 胶孢炭疽菌（ Colletotrichum gloeosporioides Penz），属半知菌亚门（Deuteromycotina）炭疽\n菌属（ Colletotrichum ）。\n\n·症状· 葡萄炭疽病是一种在葡萄开始上色或接近成熟时才表现出来的一种病，又叫晚腐病。主要侵\n害葡萄果实，也能侵害叶片、新梢、卷须、果梗和穗轴等部位，是葡萄的主要病害之一。果实发\n\n\n\n病，最初在果面产生针头大小的褐色圆斑，后病斑扩大并凹陷、表面产生轮纹状排列的小黑点。天\n气潮湿时病斑中央有绯红色黏质物。发病最适温度为 25~28℃，超过 32℃不利于孢子的产生和孢\n子的侵入。虽然温度对病菌发生很重要，但湿度更重要。成熟期如多雨高温，病情蔓延会很快。\n\n·发病规律· 主要在一年生枝蔓表层组织及病果上以菌丝越冬，5~6 月病原菌侵入果实，潜伏至果实\n变色期出现症状，越近成熟发病越快。9 月如降雨多，在二次果上仍可发病。\n\n·防治方法·\n\n（1）冬季修剪时仔细剪除病弱枝及病僵果，集中深埋或烧毁，减少病源。发芽前喷洒 45%晶体石\n硫合剂 50~80 倍液。\n\n（2）建立良好排水系统，降低湿度，提高结果位置；及时剪除过密枝蔓，及时绑蔓，改善通风透\n光条件，合理施肥，增施磷钾，增强植株抗病力。\n\n（3）前期预防保护用杀菌药剂；花前、花后及近成熟期，用 0.3%苦参碱水剂500~800 倍液，或\n10%苯醚甲环唑水分散粒剂 1 000 倍液等防治。每隔 7~10 天喷药 1 次，需喷 2~3 次。\n\n葡萄炭疽病 病叶\n\n\n\n葡萄炭疽病 病叶\n\n\n\n葡萄炭疽病 果实被害状\n\n\n\n葡萄炭疽病 果实被害状\n\n葡萄炭疽病 病果\n\n\n\n葡萄炭疽病 分生孢子盘和分生孢子\n\n葡萄白腐病\n\n·病原· 无性阶段为白腐盾壳霉菌[ Coniothyrium diplodiella （Speg.） Sacc.]，属半知菌亚门\n（Deuteromycotina）盾壳霉属（ Coniothyrium ）。\n\n·症状· 主要危害果穗、果粒，也危害枝蔓、叶片。果穗先从穗轴和小穗轴发病，病斑水渍状褐色不\n规则状，后向果实蔓延，果粒从果梗开始成淡褐色软腐，扩展至全果实，成深褐色腐烂，表面密生\n灰白色小点，几天后整个果穗腐烂，果梗干枯皱缩，果粒脱落，或僵缩成僵果。枝蔓从损伤处出现\n病斑，水渍状，褐色，表面密生灰白色至深褐色小点，后期病斑皮层纵裂呈乱麻状，病斑以上枝叶\n枯死。叶片病斑常从叶缘向叶内扩展，近圆形，有同心轮纹，初期淡褐色，后变红褐色并干枯破\n裂。\n\n·发病规律· 病菌以菌丝体和分生孢子器在病枝上和土壤表层的病残体中越冬。表土的病残体是第二\n年初侵染的主要菌源。第二年 5 月由病残体散发出的分生孢子靠雨水和气流传播，由伤口侵入，6\n月上旬开始发病，以后当年新病斑上产生的病菌不断散发，引起再次侵染。高温高湿有利发病，常\n常每次雨后有一次发病高峰期。距地面过近的果穗易发病。管理粗放、伤口多的葡萄易发病，近成\n熟的果实易发病。排水不良、地势低洼、园地潮湿、通风透光不良的葡萄园发病重。\n\n·防治方法·\n\n（1）冬季认真清除病果病枝，深埋已落入土中的病果，减少越冬病源。\n\n（2）生长季节及时绑蔓，剪去过密枝蔓，提高结果部位，及时剪除病果病枝；必要时土表喷施杀\n菌剂或石灰。增施生物有机肥料，增强植株抗病力。",
      "·症状· 病菌主要危害枝蔓。病害多发生在接近地表的老蔓上，病部表面初为暗紫褐色，逐渐变为暗\n褐色至黑色，并在表面产生许多小黑点。在潮湿条件下，溢出白色液体。病原侵入韧皮部及木质\n部，到秋季，病部表层纵裂，周围瘤肿，横切病蔓，病部木质部呈暗紫色。病蔓生长衰弱，叶片较\n小、色淡，多在冬季枯死。严重时，春季发出黄绿色叶丛后死去，形成干枯死蔓。\n\n·发病规律· 病菌以菌丝及分生孢子器在被害组织上越冬，翌年 6~7 月份开始传染，潜育期很长，侵\n入后 1 个多月出现症状。分生孢子器吸湿涌出红黄色孢子角，由雨水传播经伤口侵入。\n\n·防治方法·\n\n（1）合理施肥，科学灌水，挂果适量，注意加强防寒保护。\n\n（2）及早清除老蔓的病斑。\n\n（3）春末夏初，喷 1~2 次波尔多液，主要喷施老蔓基部。结合其他病害的防治，对可能受侵染的\n枝蔓喷施药剂。\n\n\n\n\n\n\n葡萄蔓枯病 危害枝条\n\n葡萄蔓枯病 危害枝条\n\n\n\n葡萄蔓枯病 危害枝条\n\n葡萄褐斑病\n\n·病原· 褐斑病有大褐斑和小褐斑 2 种。大褐斑病病原葡萄假尾孢菌[ Pseud ocercospora vitis\n（Lev．）Speg.]，属半知菌亚门（Deuteromycotina）假尾孢属（ Pseudocercospora ）；小褐斑病\n病原座束梗尾孢菌[ Cercospora roseleri （Caff.） Sace.]，属半知菌亚门（Deuteromycotina）尾孢菌\n属（ Cercospora ），又称斑点病、叶斑病等。\n\n·症状· 病菌主要危害叶片。\n\n大褐斑病初发时，在叶片上出现小圆形斑点，扩大后病斑直径可达 3~10 mm，病斑中央黑褐色，\n边缘褐色或红褐色，病斑边界清晰，有时病斑外围具黄绿色晕圈；病斑中部具黑褐色同心环纹，空\n气潮湿时可在叶正、反面的病斑处生有深褐色霉层。发病严重时，许多病斑融合成不规则大斑。\n\n小褐斑病发病时，在叶片上形成多角形或不规则形病斑，深褐色，中央颜色稍浅，病斑直径 2~3\nmm，后期叶背面的病斑处产生灰黑色霉层。发病严重时，许多小病斑融合成不规则大斑，叶片焦\n枯，呈火烧状。\n\n褐斑病病斑引起早期落叶，果实成熟不良，浆果品质不佳，树势衰弱，冬季抗寒性差。\n\n·发病规律· 病菌以孢子和菌丝在被害叶上越冬，翌年借风雨传播。一般先由植株下部叶片开始发\n病，逐渐向上部发展。病菌在高温多湿的环境下，繁殖迅速。因此，在多雨年份容易引起病害流\n行。\n\n·防治方法·\n\n（1）适当施基肥，使树势生长健壮，提高植株抗性；既可减轻病害的发生，又可提高葡萄的产量\n与质量。\n\n（2）发病初期，喷施 22.5%啶氧菌酯悬浮剂 1 500~2 000 倍液，或 70%丙森锌可湿性粉剂 600~800\n倍液，或 50%嘧菌酯水分散粒剂 3 000~5 000 倍液。\n\n\n\n葡萄小褐斑病 叶片被害状\n\n葡萄大褐斑病 叶片被害状\n\n\n\n葡萄褐斑病 病叶\n\n\n\n葡萄褐斑病 分生孢生梗和分生孢子\n\n\n\n葡萄小褐斑病 叶片被害状\n\n葡萄穗轴褐枯病\n\n·病原· 葡萄生链格孢菌（ Alternaria viticola Brun.），属半知菌亚门（Deutero mycotina）链格孢属\n（ Alternaria ）。\n\n·症状· 早春发生在花序、穗轴及幼果上。花序、穗轴发病初期，病斑为淡褐色水渍状不规则小病\n斑，后迅速扩展变为黑褐色，使穗轴病斑以下部位变褐坏死，不久失水干枯，果粒脱落。幼果表面\n产生圆形或椭圆形深褐色病斑，略凹陷，湿度大时有黑色霉层。病变仅限于果粒表皮，随果粒膨\n大，病斑表面呈疮痂状，果粒长成后疮痂脱落，对果实生长影响不大。\n\n·发病规律· 病原菌在葡萄植株表皮上和土壤中越冬，翌年借风雨传播，侵染幼嫩穗轴及幼果，发病\n期集中在花期前后；果粒长到黄豆粒大时，则停止侵染。葡萄开花前后气温较低，如阴雨天气较多\n时，有利于发病，特别是地势低洼、排水不良、管理不善、树势较弱的葡萄园，发病严重。\n\n·防治方法·\n\n（1）搞好果园通风透光，排涝降温。\n\n（2）幼芽萌发前喷3~5波美度石硫合剂，或晶体石硫合剂30倍液；开花前后喷施 10%苯醚甲环唑\n水分散粒剂 1 000 倍液，或 300 g/L醚菌·啶酰菌悬浮剂 1 000~2 000 倍液。\n\n\n\n葡萄穗轴褐枯病 果实穗轴褐变\n\n\n\n葡萄穗轴褐枯病 果实穗轴褐变\n\n\n\n葡萄穗轴褐枯病 果实穗轴褐变\n\n\n\n葡萄穗轴褐枯病 果实穗轴褐变\n\n\n\n葡萄穗轴褐枯病 果实穗轴褐变\n\n\n\n葡萄穗轴褐枯病 果实穗轴褐变\n\n\n\n葡萄虫害\n\n葡萄透翅蛾\n\n·学名· Parcmthrene regale Bulter，属鳞翅目（Lepidoptera）透翅蛾科（Sesiidae）。",
      "葡萄房枯病 分生孢子器和器孢子\n\n葡萄霜霉病\n\n·病原· 葡萄生单轴霉[ Plasmopara viticola （Berk. Et Curt.） Berl et Toni]，属鞭毛菌亚门\n（Flagellum）单轴霉属（ Plasmopara ）。\n\n·症状· 主要危害葡萄叶片，也能侵害嫩梢、花蕾及幼果。叶片受害后，正面初生淡黄绿色油渍状不\n规则小斑，逐渐扩大为黄绿色至褐色多角形病斑；在病斑发展过程中，叶背面产生白色霜状霉层，\n病叶后期变脆，易干枯脱落。嫩梢上最初出现油浸状病斑，逐渐变为黄绿色至褐色，表面产生稀疏\n白色霉状物，病梢生长停滞，扭曲，严重时枯死。幼果感病后，病部褪色，变硬下陷，并产生白色\n霉层，随即皱缩脱落。果粒膨大期受害后，呈褐色软腐状，不久干缩脱落。果实着色后不再感染。\n发病最适宜温度为 10~15℃，秋季低温多雨高湿易引起病害流行。低温高湿时发病较快，高温干旱\n时发病停止。\n\n·发病规律· 病菌以卵孢子在病组织内越冬，或随病叶遗留在土壤中越冬。次年5月卵孢子萌发产生\n芽卵囊和游动孢子，借风雨传播。首先侵染接近地面的叶片，上海地区一般于 5 月下旬开始发病，\n8~10 月为发病盛期，秋季若遇低温、多雨、高湿易引起病害流行。\n\n·防治方法·\n\n（1）秋末冬初及时收集病叶、病果，剪除病梢，结合冬季土地深翻，深埋病残组织。生长期间要\n注意排水，夏季及时剪除多余枝蔓，改善通风条件。\n\n（2）避免在低洼地建立果园，选用抗病品种。\n\n（3）病害发生前期，施用波尔多液等药剂进行预防，每间隔 10~15 天喷 1 次，共喷施 2~3 次。初\n见病斑或在病害高发期，用治疗兼保护药剂进行治疗和预防：21%松脂酸铜水乳剂 67~83 ml/亩、\n46%氢氧化铜水分散粒剂 1 750~2 000 倍液，或22.5%啶氧菌酯悬浮剂 1 500~2 000 倍液，间隔\n10~15 天喷 1 次，连续喷施 2~3 次。在高湿环境或降雨频繁的情况下发病或霜霉病上果，可使用\n\n\n\n20%嘧菌酯水分散粒剂 800~1 600 倍液治疗。药剂应交替使用。\n\n葡萄霜霉病 叶片被害状\n\n\n\n葡萄霜霉病 病叶背面\n\n\n\n葡萄霜霉病 叶片背面被害状\n\n\n\n葡萄霜霉病 幼果被害状\n\n\n\n葡萄霜霉病 病果\n\n\n\n葡萄霜霉病 幼果被害状\n\n葡萄白粉病\n\n·病原· 葡萄钩丝壳菌[ Uncinula necator （Schw.） Burr.]，属子囊菌亚门（Ascom ycotina），钩丝壳\n属（ Uncinula ）。\n\n·症状· 病菌入侵危害葡萄的所有绿色部分。果实受害时，果面形成灰白色粉质病斑，果实生长停\n滞，发育受阻，逐渐硬化变成畸形。叶片被害时，最初失绿，后叶表面形成白色粉质病斑，病斑轮\n廓不整齐，大小不等，叶面皱缩不平，严重时病叶卷曲枯萎。嫩梢受害时，初为灰白色小斑点，不\n断扩大蔓延，可使全蔓受害，随病势的发展，被害枝蔓逐渐由灰白色变成暗灰色、红褐色，终至黑\n色。\n\n·发病规律· 以菌丝在被害组织上或芽内越冬。孢子在温度 4~7℃时即能萌发，最适温度为\n25~28℃。在干旱的夏季或温暖、闷热、多云的天气容易引起病害的大发生。\n\n·防治方法·\n\n（1）要注意及时摘心绑蔓，剪副梢，使蔓均匀分布于架面上，保持通风透光良好。冬季剪除病\n梢，清扫病叶、病果，集中烧毁。\n\n（2）病重地区或易感病的品种，要注意喷药保护。一般在葡萄发芽前喷 1 次3~5 波美度石硫合\n剂；发芽后喷 0.2~0.3 波美度石硫合剂。开花前至幼果期喷 2~3次 10%苯醚甲环唑悬浮剂 3 000 倍\n液，或 30%嘧菌酯悬浮剂 1 000~1 500 倍液，或 43%戊唑醇悬浮剂 2 500 倍液等。\n\n\n\n葡萄白粉病 危害叶片\n\n\n\n葡萄白粉病 危害叶片\n\n\n\n葡萄白粉病 危害叶片\n\n\n\n葡萄白粉病 危害叶片\n\n\n\n葡萄白粉病 危害叶片\n\n\n\n葡萄白粉病 危害叶片\n\n葡萄蔓割病\n\n·病原· 有性阶段为葡萄生小隐孢壳菌[ Cryptosporella viticola （Red.） Shear]，属子囊菌亚门\n（Ascomycotina）小隐孢壳属（ Cryptosporella ）真菌。无性阶段为葡萄拟茎点霉[ Phomopsis\nviticola （Sacc.） Sacc.]，属半知菌亚门（Deuteromycotina）拟茎点霉属（ Phomopsis ）真菌，又称\n葡萄蔓枯病。",
      "（3）发芽前喷施 45%石硫合剂晶体 300~500 倍液；管理要求高或往年白腐病发病重的果园，在展\n叶期喷施 250 g/L戊唑醇水乳剂 2 000~2 500 倍液，两次清园。未发病的田块，可用 60%代森联加\n10%嘧菌酯水分散粒剂 800~900 倍液等杀菌剂预防，每隔 10 天左右喷药 1 次，需喷 2~3 次；病害\n发生初期，用 250 g/L戊唑醇水乳剂 2 000~2 500 倍液，或 12.8%吡唑嘧菌酯加 25.2%啶酰菌胺水分\n散粒剂 1 500~2 500 倍液治疗；遇暴风雨或冰雹后，及时喷施 250 g/L戊唑醇水乳剂 2 000~2 500 倍\n液，或 12.8%吡唑嘧菌酯加 25.2%啶酰菌胺水分散粒剂 1 500~2 500 倍液治疗和铲除，防止病害暴\n发流行。果实近成熟期，用 250 g/L戊唑醇水乳剂 2 000~2 500 倍液，或 12.8%吡唑嘧菌酯加 25.2%\n啶酰菌胺水分散粒剂1 500~2 500 倍液喷雾，重点喷果穗，防治果穗白腐病。\n\n葡萄白腐病 病叶\n\n\n\n葡萄白腐病 病叶\n\n葡萄白腐病 病叶\n\n\n\n葡萄白腐病 果穗被害状\n\n\n\n\n\n\n葡萄白腐病 后期枝蔓症状\n\n葡萄白腐病 早期病果症状\n\n\n\n葡萄白腐病 分生孢子器和器孢子\n\n葡萄灰霉病\n\n·病原· 灰葡萄孢霉（ Botrytis cinerea Pers.），属半知菌亚门（Deuteromycotina）孢盘菌属（\nBotryotinia ）。\n\n·症状· 主要侵害花穗和果实，也能侵害叶片、新梢。花穗开始发病时病部呈淡褐色，很快变成暗褐\n色至黑褐色，变软腐烂，表面密生灰色霉层，有时全花穗腐败坏死，后期常在病部长出黑色块状菌\n核。果实一般在转色期开始发病，初为圆形稍凹陷的病斑，很快引起全果腐烂，长出鼠灰色的霉\n层，并迅速引起全穗果实腐烂。叶片发病时产生淡褐色不规则的病斑，并有不规则的轮纹。\n\n·发病规律· 病菌以分生孢子及菌核在被害部越冬，1 年有 2 次发病高峰期，第一次高峰期是 5 月中\n旬（开花前后），主要危害花穗，第二次高峰期是 8 月上中旬至 9 月上旬（果实着色至成熟期），\n主要危害成熟果实。\n\n病菌适宜于较低温度和较高的空气湿度，花期多雨湿润、果实成熟期降雨不匀、多雷暴雨及台风侵\n袭，均能促使灰霉病发生及发展。\n\n·防治方法·\n\n（1）搞好果园通风透光，降低空气湿度，及时整理枝蔓和摘心抹芽，施用磷钾肥，防止徒长。防\n止虫伤和其他损伤。\n\n（2）开花前可喷洒 1 次 1∶1∶200 波尔多液，或 400 g/L嘧霉胺悬浮剂 1 000~1 500 倍液，或 500\ng/L异菌脲悬浮剂 750~1 000 倍液；果实着色前可喷洒 50%嘧菌环胺水分散粒剂 625~1 000 倍液，\n或 12.8%吡唑嘧菌酯加 25.2%啶酰菌胺水分散粒剂 1 000~2 000 倍液，一般喷洒 1~2 次，每次间隔\n7~10 天，以预防或减轻花、果的发病，或结合黑痘病、炭疽病等一起防治。\n\n（3）发病初期，及时剪除发病花穗，防止扩散蔓延。\n\n葡萄灰霉病 果实被害状\n\n\n\n葡萄灰霉病 果实被害状\n\n\n\n葡萄灰霉病 果穗被害状\n\n\n\n葡萄灰霉病 果实被害状\n\n\n\n葡萄灰霉病 果实被害状\n\n葡萄房枯病\n\n·病原· 无性阶段为葡萄房枯大茎点霉［ Macrophoma faocida （Viala et Ravag） Cav.］，属半知菌\n亚门（Deuteromycotina）大茎点霉属（ Macrophoma ）。\n\n\n\n·症状· 主要危害葡萄穗轴、果柄和果粒。发生初期在果柄或果蒂部位出现淡褐色不规整的病斑，边\n缘有褐色至暗褐色晕圈，当病斑扩大环绕一周时，果柄干枯缢细，果粒失水干枯，表面皱缩，外皮\n逐渐变成黑色，并散生出很多突起的黑色小点。严重时蔓延至穗轴，致使全穗果粒皱缩干枯变成僵\n果，悬于树上不易脱落。\n\n叶片被害时，初发生圆形小斑点，后逐渐扩大，中央变成灰白色，外边褐色，边缘黑色。\n\n·发病规律· 病菌以分生孢子器和子囊壳在被害部越冬，翌年 5~6 月间，借风雨传播到葡萄上侵入发\n病。孢子器在 23℃下经过 4 小时即能萌发侵入寄主。病菌发育最适温度为 35℃，最低 9℃，最高\n40℃。\n\n·防治方法·\n\n（1）秋季彻底清除病枝、病叶、病果等，注意排水，及时剪副梢，改善通风透光条件，降低湿\n度。\n\n（2）增施有机肥，多施磷、钾肥，培育壮树，提高抗病能力。\n\n（3）葡萄上架前喷洒 3~5 度波美度石硫合剂，葡萄落花后可喷施 60%代森联加 10%嘧菌酯水分散\n粒剂 800~900 倍液，或 250 g/L戊唑醇水乳剂 2 000~2 500 倍液，每隔7天喷1次，连续喷施2次。不\n宜使用波尔多液，以免果实出现果锈现象。",
      "梨树萌芽期至开花前（3 月上旬至 4 月上旬），喷洒波尔多液或石硫合剂，保护新叶，杀灭越冬虫\n卵；喷洒 10%苯醚甲环唑水分散粒剂 5 000~6 000 倍液等治疗性药剂防治锈病、黑星病、轮纹病等\n病害；喷洒 20%除虫脲悬浮剂 1 200~2 000 倍液等药剂防治梨木虱、梨二叉蚜、梨冠网蝽、梨瘿蚊\n等害虫。\n\n梨树盛花期（4 月上旬至 4 月中旬），禁止施药。\n\n梨树落花期（4 月下旬），可选 10%苯醚甲环唑水分散粒剂 5 000~6 000 倍液等药剂防治锈病、黑\n星病、轮纹病等病害；选择 20%除虫脲悬浮剂 1 200~2 000 倍液，或 4.3%氯虫苯甲酰胺加 1.8%阿\n维菌素水乳剂 4 000~5 000 倍液等药剂，防治梨小食心虫、梨木虱、梨二叉蚜等害虫。\n\n幼果期（4 月下旬至 6 月上旬），5 月上旬可对梨果进行套袋，防病防虫。可选10%苯醚甲环唑水\n分散粒剂 5 000~6 000 倍液等药剂防治锈病、黑星病、轮纹病等病害；选择 20%除虫脲悬浮剂 1\n200~2 000 倍液，或 4.3%氯虫苯甲酰胺加 1.8%阿维菌素水乳剂 4 000~5 000 倍液等药剂，防治梨小\n食心虫、桃蛀螟、梨木虱等害虫。使用性引诱剂诱杀梨小食心虫、桃蛀螟成虫。\n\n果实膨大期（6 月中旬至 8 月上旬），可选 10%苯醚甲环唑水分散粒剂 5 000~6 000 倍液等药剂防\n\n\n\n治黑星病、轮纹病等病害；选择 20%除虫脲悬浮剂 1 200~2 000倍液，或 4.3%氯虫苯甲酰胺加\n1.8%阿维菌素水乳剂 4 000~5 000 倍液等药剂，防治梨小食心虫、桃蛀螟、梨木虱等害虫。使用性\n引诱剂诱杀梨小食心虫、桃蛀螟成虫。\n\n\n\n四、葡萄\n\n葡萄为葡萄科葡萄属木质藤本植物，小枝圆柱形，叶卵圆形，圆锥花序密集或疏散，果实球形或椭\n圆形。葡萄原产于欧洲、西亚和北非一带，是世界最古老的果树树种之一。葡萄为著名水果，生食\n或制葡萄干，并酿酒，酿酒后的酒脚可提酒石酸，根和藤药用能止呕。\n\n目前，我国葡萄种植面积已达到 1 200 万亩，产量超 1 200 万t。同时葡萄也是上海市林果种植面积\n增长最快的树种。自 20 世纪 80 年代“巨峰”葡萄在上海市嘉定区马陆试种成功后，便如雨后春笋\n般，在沪郊各区发展开来。目前上海市葡萄品种有巨峰、巨玫瑰、夏黑、醉金香、阳光玫瑰、京亚\n等。上海葡萄生产总面积 5 万亩左右。\n\n葡萄主要虫害有葡萄透翅蛾、葡萄脊虎天牛、葡萄根瘤蚜、葡萄短须螨、葡萄粉蚧、葡萄天蛾、葡\n萄二星叶蝉、东方盔蚧、绿盲蝽；主要病害有葡萄黑痘病、葡萄炭疽病、葡萄白腐病、葡萄灰霉\n病、葡萄房枯病、葡萄霜霉病、葡萄白粉病、葡萄蔓割病、葡萄褐斑病、葡萄穗轴褐枯病等。\n\n\n\n葡萄病害\n\n葡萄黑痘病\n\n·病原· 无性阶段为葡萄痂圆孢菌（ Sphaceloma ampelinum de Bary），属半知菌亚门\n（Deuteromycotina）痂圆孢菌属（ Sphaceloma ）；有性阶段为葡萄痂囊腔菌[ Elsinoe ampelina\n（de Bary） Shear.]，属子囊菌亚门（Ascomycotina）痂囊腔菌属（ Elsinoe ）。\n\n·症状· 病菌侵染葡萄的幼嫩绿色部分。叶片发病初期先出现针头大小褐色斑点，以后病斑扩大呈圆\n形或不规则形，褐色，边缘紫褐色，中部淡褐或灰白色，稍凹陷，后期病斑逐渐干枯穿孔。幼果初\n被害时，病斑圆形，淡褐色小斑，以后逐渐扩大呈直径 3~7 mm的病斑，边缘暗紫褐色，中央浅褐\n色或灰白色，稍凹陷，呈鸟眼状，病果粒小而畸形，僵化，味酸，不能正常成熟。嫩梢、卷须、叶\n柄、穗轴、果柄被害时，最初显现紫褐色长椭圆形的病斑，后边缘色泽渐深，呈灰褐色，中央稍凹\n陷。严重时病斑相连，病梢停止生长，萎缩干枯。\n\n·发病规律· 主要以菌丝体在病枝越冬，次年 4~5 月间开始侵害葡萄幼嫩组织。上海地区 4 月底 5 月\n初开始发病，5~6 月梅雨季节最易发生。葡萄从萌芽展叶后到果粒形成是其最易感病的阶段，只侵\n害幼嫩组织，枝叶老熟、果实着色后很少受到侵害。\n\n·防治方法·\n\n（1）冬季修剪时仔细剪除病枝、僵果，清除残叶、剥除老皮，减少越冬病源。\n\n（2）发芽前用硫酸亚铁液涂蔓或喷洒。\n\n（3）芽鳞膨大阶段喷洒 45%石硫合剂晶体 150 倍液。"
    ]
  },
  {
    "question": "葡萄白粉病的病原菌是什么？",
    "answer": "葡萄白粉病的病原菌是葡萄钩丝壳菌（Uncinula necator）。",
    "standard_answer": "葡萄白粉病的病原菌是葡萄钩丝壳菌（Uncinula necator）。",
    "contexts": [
      "葡萄房枯病 分生孢子器和器孢子\n\n葡萄霜霉病\n\n·病原· 葡萄生单轴霉[ Plasmopara viticola （Berk. Et Curt.） Berl et Toni]，属鞭毛菌亚门\n（Flagellum）单轴霉属（ Plasmopara ）。\n\n·症状· 主要危害葡萄叶片，也能侵害嫩梢、花蕾及幼果。叶片受害后，正面初生淡黄绿色油渍状不\n规则小斑，逐渐扩大为黄绿色至褐色多角形病斑；在病斑发展过程中，叶背面产生白色霜状霉层，\n病叶后期变脆，易干枯脱落。嫩梢上最初出现油浸状病斑，逐渐变为黄绿色至褐色，表面产生稀疏\n白色霉状物，病梢生长停滞，扭曲，严重时枯死。幼果感病后，病部褪色，变硬下陷，并产生白色\n霉层，随即皱缩脱落。果粒膨大期受害后，呈褐色软腐状，不久干缩脱落。果实着色后不再感染。\n发病最适宜温度为 10~15℃，秋季低温多雨高湿易引起病害流行。低温高湿时发病较快，高温干旱\n时发病停止。\n\n·发病规律· 病菌以卵孢子在病组织内越冬，或随病叶遗留在土壤中越冬。次年5月卵孢子萌发产生\n芽卵囊和游动孢子，借风雨传播。首先侵染接近地面的叶片，上海地区一般于 5 月下旬开始发病，\n8~10 月为发病盛期，秋季若遇低温、多雨、高湿易引起病害流行。\n\n·防治方法·\n\n（1）秋末冬初及时收集病叶、病果，剪除病梢，结合冬季土地深翻，深埋病残组织。生长期间要\n注意排水，夏季及时剪除多余枝蔓，改善通风条件。\n\n（2）避免在低洼地建立果园，选用抗病品种。\n\n（3）病害发生前期，施用波尔多液等药剂进行预防，每间隔 10~15 天喷 1 次，共喷施 2~3 次。初\n见病斑或在病害高发期，用治疗兼保护药剂进行治疗和预防：21%松脂酸铜水乳剂 67~83 ml/亩、\n46%氢氧化铜水分散粒剂 1 750~2 000 倍液，或22.5%啶氧菌酯悬浮剂 1 500~2 000 倍液，间隔\n10~15 天喷 1 次，连续喷施 2~3 次。在高湿环境或降雨频繁的情况下发病或霜霉病上果，可使用\n\n\n\n20%嘧菌酯水分散粒剂 800~1 600 倍液治疗。药剂应交替使用。\n\n葡萄霜霉病 叶片被害状\n\n\n\n葡萄霜霉病 病叶背面\n\n\n\n葡萄霜霉病 叶片背面被害状\n\n\n\n葡萄霜霉病 幼果被害状\n\n\n\n葡萄霜霉病 病果\n\n\n\n葡萄霜霉病 幼果被害状\n\n葡萄白粉病\n\n·病原· 葡萄钩丝壳菌[ Uncinula necator （Schw.） Burr.]，属子囊菌亚门（Ascom ycotina），钩丝壳\n属（ Uncinula ）。\n\n·症状· 病菌入侵危害葡萄的所有绿色部分。果实受害时，果面形成灰白色粉质病斑，果实生长停\n滞，发育受阻，逐渐硬化变成畸形。叶片被害时，最初失绿，后叶表面形成白色粉质病斑，病斑轮\n廓不整齐，大小不等，叶面皱缩不平，严重时病叶卷曲枯萎。嫩梢受害时，初为灰白色小斑点，不\n断扩大蔓延，可使全蔓受害，随病势的发展，被害枝蔓逐渐由灰白色变成暗灰色、红褐色，终至黑\n色。\n\n·发病规律· 以菌丝在被害组织上或芽内越冬。孢子在温度 4~7℃时即能萌发，最适温度为\n25~28℃。在干旱的夏季或温暖、闷热、多云的天气容易引起病害的大发生。\n\n·防治方法·\n\n（1）要注意及时摘心绑蔓，剪副梢，使蔓均匀分布于架面上，保持通风透光良好。冬季剪除病\n梢，清扫病叶、病果，集中烧毁。\n\n（2）病重地区或易感病的品种，要注意喷药保护。一般在葡萄发芽前喷 1 次3~5 波美度石硫合\n剂；发芽后喷 0.2~0.3 波美度石硫合剂。开花前至幼果期喷 2~3次 10%苯醚甲环唑悬浮剂 3 000 倍\n液，或 30%嘧菌酯悬浮剂 1 000~1 500 倍液，或 43%戊唑醇悬浮剂 2 500 倍液等。\n\n\n\n葡萄白粉病 危害叶片\n\n\n\n葡萄白粉病 危害叶片\n\n\n\n葡萄白粉病 危害叶片\n\n\n\n葡萄白粉病 危害叶片\n\n\n\n葡萄白粉病 危害叶片\n\n\n\n葡萄白粉病 危害叶片\n\n葡萄蔓割病\n\n·病原· 有性阶段为葡萄生小隐孢壳菌[ Cryptosporella viticola （Red.） Shear]，属子囊菌亚门\n（Ascomycotina）小隐孢壳属（ Cryptosporella ）真菌。无性阶段为葡萄拟茎点霉[ Phomopsis\nviticola （Sacc.） Sacc.]，属半知菌亚门（Deuteromycotina）拟茎点霉属（ Phomopsis ）真菌，又称\n葡萄蔓枯病。",
      "·症状· 病菌主要危害枝蔓。病害多发生在接近地表的老蔓上，病部表面初为暗紫褐色，逐渐变为暗\n褐色至黑色，并在表面产生许多小黑点。在潮湿条件下，溢出白色液体。病原侵入韧皮部及木质\n部，到秋季，病部表层纵裂，周围瘤肿，横切病蔓，病部木质部呈暗紫色。病蔓生长衰弱，叶片较\n小、色淡，多在冬季枯死。严重时，春季发出黄绿色叶丛后死去，形成干枯死蔓。\n\n·发病规律· 病菌以菌丝及分生孢子器在被害组织上越冬，翌年 6~7 月份开始传染，潜育期很长，侵\n入后 1 个多月出现症状。分生孢子器吸湿涌出红黄色孢子角，由雨水传播经伤口侵入。\n\n·防治方法·\n\n（1）合理施肥，科学灌水，挂果适量，注意加强防寒保护。\n\n（2）及早清除老蔓的病斑。\n\n（3）春末夏初，喷 1~2 次波尔多液，主要喷施老蔓基部。结合其他病害的防治，对可能受侵染的\n枝蔓喷施药剂。\n\n\n\n\n\n\n葡萄蔓枯病 危害枝条\n\n葡萄蔓枯病 危害枝条\n\n\n\n葡萄蔓枯病 危害枝条\n\n葡萄褐斑病\n\n·病原· 褐斑病有大褐斑和小褐斑 2 种。大褐斑病病原葡萄假尾孢菌[ Pseud ocercospora vitis\n（Lev．）Speg.]，属半知菌亚门（Deuteromycotina）假尾孢属（ Pseudocercospora ）；小褐斑病\n病原座束梗尾孢菌[ Cercospora roseleri （Caff.） Sace.]，属半知菌亚门（Deuteromycotina）尾孢菌\n属（ Cercospora ），又称斑点病、叶斑病等。\n\n·症状· 病菌主要危害叶片。\n\n大褐斑病初发时，在叶片上出现小圆形斑点，扩大后病斑直径可达 3~10 mm，病斑中央黑褐色，\n边缘褐色或红褐色，病斑边界清晰，有时病斑外围具黄绿色晕圈；病斑中部具黑褐色同心环纹，空\n气潮湿时可在叶正、反面的病斑处生有深褐色霉层。发病严重时，许多病斑融合成不规则大斑。\n\n小褐斑病发病时，在叶片上形成多角形或不规则形病斑，深褐色，中央颜色稍浅，病斑直径 2~3\nmm，后期叶背面的病斑处产生灰黑色霉层。发病严重时，许多小病斑融合成不规则大斑，叶片焦\n枯，呈火烧状。\n\n褐斑病病斑引起早期落叶，果实成熟不良，浆果品质不佳，树势衰弱，冬季抗寒性差。\n\n·发病规律· 病菌以孢子和菌丝在被害叶上越冬，翌年借风雨传播。一般先由植株下部叶片开始发\n病，逐渐向上部发展。病菌在高温多湿的环境下，繁殖迅速。因此，在多雨年份容易引起病害流\n行。\n\n·防治方法·\n\n（1）适当施基肥，使树势生长健壮，提高植株抗性；既可减轻病害的发生，又可提高葡萄的产量\n与质量。\n\n（2）发病初期，喷施 22.5%啶氧菌酯悬浮剂 1 500~2 000 倍液，或 70%丙森锌可湿性粉剂 600~800\n倍液，或 50%嘧菌酯水分散粒剂 3 000~5 000 倍液。\n\n\n\n葡萄小褐斑病 叶片被害状\n\n葡萄大褐斑病 叶片被害状\n\n\n\n葡萄褐斑病 病叶\n\n\n\n葡萄褐斑病 分生孢生梗和分生孢子\n\n\n\n葡萄小褐斑病 叶片被害状\n\n葡萄穗轴褐枯病\n\n·病原· 葡萄生链格孢菌（ Alternaria viticola Brun.），属半知菌亚门（Deutero mycotina）链格孢属\n（ Alternaria ）。\n\n·症状· 早春发生在花序、穗轴及幼果上。花序、穗轴发病初期，病斑为淡褐色水渍状不规则小病\n斑，后迅速扩展变为黑褐色，使穗轴病斑以下部位变褐坏死，不久失水干枯，果粒脱落。幼果表面\n产生圆形或椭圆形深褐色病斑，略凹陷，湿度大时有黑色霉层。病变仅限于果粒表皮，随果粒膨\n大，病斑表面呈疮痂状，果粒长成后疮痂脱落，对果实生长影响不大。\n\n·发病规律· 病原菌在葡萄植株表皮上和土壤中越冬，翌年借风雨传播，侵染幼嫩穗轴及幼果，发病\n期集中在花期前后；果粒长到黄豆粒大时，则停止侵染。葡萄开花前后气温较低，如阴雨天气较多\n时，有利于发病，特别是地势低洼、排水不良、管理不善、树势较弱的葡萄园，发病严重。\n\n·防治方法·\n\n（1）搞好果园通风透光，排涝降温。\n\n（2）幼芽萌发前喷3~5波美度石硫合剂，或晶体石硫合剂30倍液；开花前后喷施 10%苯醚甲环唑\n水分散粒剂 1 000 倍液，或 300 g/L醚菌·啶酰菌悬浮剂 1 000~2 000 倍液。\n\n\n\n葡萄穗轴褐枯病 果实穗轴褐变\n\n\n\n葡萄穗轴褐枯病 果实穗轴褐变\n\n\n\n葡萄穗轴褐枯病 果实穗轴褐变\n\n\n\n葡萄穗轴褐枯病 果实穗轴褐变\n\n\n\n葡萄穗轴褐枯病 果实穗轴褐变\n\n\n\n葡萄穗轴褐枯病 果实穗轴褐变\n\n\n\n葡萄虫害\n\n葡萄透翅蛾\n\n·学名· Parcmthrene regale Bulter，属鳞翅目（Lepidoptera）透翅蛾科（Sesiidae）。",
      "（3）发芽前喷施 45%石硫合剂晶体 300~500 倍液；管理要求高或往年白腐病发病重的果园，在展\n叶期喷施 250 g/L戊唑醇水乳剂 2 000~2 500 倍液，两次清园。未发病的田块，可用 60%代森联加\n10%嘧菌酯水分散粒剂 800~900 倍液等杀菌剂预防，每隔 10 天左右喷药 1 次，需喷 2~3 次；病害\n发生初期，用 250 g/L戊唑醇水乳剂 2 000~2 500 倍液，或 12.8%吡唑嘧菌酯加 25.2%啶酰菌胺水分\n散粒剂 1 500~2 500 倍液治疗；遇暴风雨或冰雹后，及时喷施 250 g/L戊唑醇水乳剂 2 000~2 500 倍\n液，或 12.8%吡唑嘧菌酯加 25.2%啶酰菌胺水分散粒剂 1 500~2 500 倍液治疗和铲除，防止病害暴\n发流行。果实近成熟期，用 250 g/L戊唑醇水乳剂 2 000~2 500 倍液，或 12.8%吡唑嘧菌酯加 25.2%\n啶酰菌胺水分散粒剂1 500~2 500 倍液喷雾，重点喷果穗，防治果穗白腐病。\n\n葡萄白腐病 病叶\n\n\n\n葡萄白腐病 病叶\n\n葡萄白腐病 病叶\n\n\n\n葡萄白腐病 果穗被害状\n\n\n\n\n\n\n葡萄白腐病 后期枝蔓症状\n\n葡萄白腐病 早期病果症状\n\n\n\n葡萄白腐病 分生孢子器和器孢子\n\n葡萄灰霉病\n\n·病原· 灰葡萄孢霉（ Botrytis cinerea Pers.），属半知菌亚门（Deuteromycotina）孢盘菌属（\nBotryotinia ）。\n\n·症状· 主要侵害花穗和果实，也能侵害叶片、新梢。花穗开始发病时病部呈淡褐色，很快变成暗褐\n色至黑褐色，变软腐烂，表面密生灰色霉层，有时全花穗腐败坏死，后期常在病部长出黑色块状菌\n核。果实一般在转色期开始发病，初为圆形稍凹陷的病斑，很快引起全果腐烂，长出鼠灰色的霉\n层，并迅速引起全穗果实腐烂。叶片发病时产生淡褐色不规则的病斑，并有不规则的轮纹。\n\n·发病规律· 病菌以分生孢子及菌核在被害部越冬，1 年有 2 次发病高峰期，第一次高峰期是 5 月中\n旬（开花前后），主要危害花穗，第二次高峰期是 8 月上中旬至 9 月上旬（果实着色至成熟期），\n主要危害成熟果实。\n\n病菌适宜于较低温度和较高的空气湿度，花期多雨湿润、果实成熟期降雨不匀、多雷暴雨及台风侵\n袭，均能促使灰霉病发生及发展。\n\n·防治方法·\n\n（1）搞好果园通风透光，降低空气湿度，及时整理枝蔓和摘心抹芽，施用磷钾肥，防止徒长。防\n止虫伤和其他损伤。\n\n（2）开花前可喷洒 1 次 1∶1∶200 波尔多液，或 400 g/L嘧霉胺悬浮剂 1 000~1 500 倍液，或 500\ng/L异菌脲悬浮剂 750~1 000 倍液；果实着色前可喷洒 50%嘧菌环胺水分散粒剂 625~1 000 倍液，\n或 12.8%吡唑嘧菌酯加 25.2%啶酰菌胺水分散粒剂 1 000~2 000 倍液，一般喷洒 1~2 次，每次间隔\n7~10 天，以预防或减轻花、果的发病，或结合黑痘病、炭疽病等一起防治。\n\n（3）发病初期，及时剪除发病花穗，防止扩散蔓延。\n\n葡萄灰霉病 果实被害状\n\n\n\n葡萄灰霉病 果实被害状\n\n\n\n葡萄灰霉病 果穗被害状\n\n\n\n葡萄灰霉病 果实被害状\n\n\n\n葡萄灰霉病 果实被害状\n\n葡萄房枯病\n\n·病原· 无性阶段为葡萄房枯大茎点霉［ Macrophoma faocida （Viala et Ravag） Cav.］，属半知菌\n亚门（Deuteromycotina）大茎点霉属（ Macrophoma ）。\n\n\n\n·症状· 主要危害葡萄穗轴、果柄和果粒。发生初期在果柄或果蒂部位出现淡褐色不规整的病斑，边\n缘有褐色至暗褐色晕圈，当病斑扩大环绕一周时，果柄干枯缢细，果粒失水干枯，表面皱缩，外皮\n逐渐变成黑色，并散生出很多突起的黑色小点。严重时蔓延至穗轴，致使全穗果粒皱缩干枯变成僵\n果，悬于树上不易脱落。\n\n叶片被害时，初发生圆形小斑点，后逐渐扩大，中央变成灰白色，外边褐色，边缘黑色。\n\n·发病规律· 病菌以分生孢子器和子囊壳在被害部越冬，翌年 5~6 月间，借风雨传播到葡萄上侵入发\n病。孢子器在 23℃下经过 4 小时即能萌发侵入寄主。病菌发育最适温度为 35℃，最低 9℃，最高\n40℃。\n\n·防治方法·\n\n（1）秋季彻底清除病枝、病叶、病果等，注意排水，及时剪副梢，改善通风透光条件，降低湿\n度。\n\n（2）增施有机肥，多施磷、钾肥，培育壮树，提高抗病能力。\n\n（3）葡萄上架前喷洒 3~5 度波美度石硫合剂，葡萄落花后可喷施 60%代森联加 10%嘧菌酯水分散\n粒剂 800~900 倍液，或 250 g/L戊唑醇水乳剂 2 000~2 500 倍液，每隔7天喷1次，连续喷施2次。不\n宜使用波尔多液，以免果实出现果锈现象。",
      "·病原· 有性阶段为梨球腔菌［ Mycosphaerella sentina （Fr.） Schrter］，属子囊菌亚门\n（Ascomycotina）球腔菌属（ Mycosphaerella ）；无性阶段为梨生壳针孢（ Septoria piricola\nDesm.），属半知菌亚门（Deuteromycotina）壳针孢属（ Septoria ），又称白星病、斑枯病。\n\n·症状· 主要危害叶片，初期形成圆形或近圆形深褐色斑点，扩展后为病斑中部灰白色、边缘褐色，\n病斑较小。后期病斑表面可散生小黑点。受害严重叶片，其上散布数十个病斑，且常相互愈合成不\n规则形褐色大斑，有时病斑穿孔。严重时，病叶早期脱落，导致树势衰弱。\n\n·发病规律· 是一种高等真菌性病害，病菌主要以分生孢子器在病落叶上越冬。次年产生并释放分生\n孢子，借风雨传播到叶片上进行侵染危害。生长期可有多次再侵染。病害一般在 4 月中旬开始发\n生，5 月中下旬盛发。发病严重的，在 5 月下旬就开始落叶，7 月中下旬落叶最严重。雨水早、湿\n度大时发病较重，树势衰弱、排水不良、管理粗放的果园发病较多。\n\n·防治方法·\n\n（1）加强果园栽培管理。合理施肥，及时排水，科学修剪，使果园通风透光良好，降低环境湿\n度，创造不利于病害发生的环境条件。发芽前彻底清扫落叶，集中深埋或烧毁，消灭病菌越冬场\n所。\n\n（2）药剂防治：该病一般不需单独防治。往年发病严重的个别果园，从发病初期开始喷药，每隔\n10~15 天喷 1 次药，连喷 2 次左右即可有效控制该病的发生危害。常用药剂有 70%甲基托布津可湿\n性粉剂 800~1 000 倍液、10%苯醚甲环唑水分散粒剂 2 000~2 500 倍液等。\n\n\n\n梨褐斑病 叶片中期被害状\n\n\n\n梨褐斑病 叶片正面后期被害状\n\n梨褐斑病 叶片背面后期被害状\n\n\n\n梨褐斑病 叶片早期被害状\n\n梨白粉病\n\n·病原· 梨球针壳菌［ Phyllactinia pyri （Cast.）Homma.］，属子囊菌亚门（Ascom ycotina）球针壳\n属（ Phyllactinia ）。\n\n·症状· 最初在叶背面产生白色霉点，后扩展成大小不一、近圆形白色粉状斑，是病菌菌丝和分生孢\n子，后期白粉层上产生黄色小点，逐渐加深至黑褐色小点，是病菌闭囊壳，白粉斑相应叶片正面黄\n绿色，严重时白粉布满整个叶片，导致病叶变褐枯萎、脱落。\n\n·发病规律· 白粉病是一种高等真菌性病害。病原菌主要以闭囊壳在落叶上或黏附在枝干表面越冬。\n第二年 6~7 月闭囊壳内散出子囊孢子，通过气流或风雨传播，从叶背气孔侵染叶片危害。初侵染\n发病后产生的分生孢子经气流传播后进行再侵染，使病害不断扩散蔓延。白粉病多在雨季开始发\n生，多雨潮湿季节为发生盛期。果园郁蔽、通风透光不良、地势低洼、排水不及时、偏施氮肥等均\n可加重该病发生。\n\n·防治方法·\n\n（1）加强果园栽培管理。合理施肥，及时排水，科学修剪，使果园通风透光良好，降低环境湿\n度，创造不利于病害发生的生态条件。发芽前彻底清扫落叶，集中深埋或烧毁，消灭病菌越冬场\n所。\n\n（2）药剂防治：萌芽期，喷施 1 次 45%石硫合剂晶体 50~80 倍液，杀灭树上越冬病菌。生长期，\n从病害发生初期或雨季到来前开始喷药，每隔 10 天左右喷 1 次，连喷 2~3 次，重点喷洒叶片背\n面。常用药剂有 10%苯醚甲环唑水分散粒剂 2 500~3 000倍液、250 g/L戊唑醇水乳剂 2 000~2 500\n倍液等。\n\n\n\n梨白粉病 叶片被害状\n\n\n\n梨白粉病 叶片被害状\n\n\n\n梨白粉病 叶片被害状\n\n\n\n梨白粉病 叶片被害状\n\n梨白粉病病菌闭囊壳\n\n\n\n梨白粉病 病斑放大\n\n梨炭疽病\n\n·病原· 有性阶段为围小丛壳［ Glomerella cingulata （Stonem.）Spauld. et Schrenk］，属子囊菌亚门\n（Ascomycotina）小丛壳属（ Glomerella ）；无性阶段为胶孢炭疽菌（ Colletotrichum\ngloeosporioides Penz.），属半知菌亚门（Deuteromycotina）炭疽菌属（ Colletotrichum ），又称“苦\n腐病”。\n\n·症状· 病菌主要危害果实，也可侵害枝条，有时还可危害叶片及叶柄。果实染病多从膨大后期开始\n发病，初期在果面上产生褐色至黑褐色小斑点，后病斑逐渐扩大，形成淡褐色至深褐色的腐烂病\n斑，表面凹陷，严重时病斑可烂到果实的 1/4 以上；从发病中后期开始，病斑表面逐渐产生小黑\n点，小黑点上可溢出淡粉红色黏液。",
      "·病原· 有性阶段为苹果双壳菌（ Diplocarpon mali Harada et Sawamura），属子囊菌门双壳属（\nDiplocarpon ）真菌；无性阶段为苹果盘二孢[ Marssonina coronaria （Ell. et Davis） Davis]，属半\n知菌亚门（Deuteromycotina）盘二孢属（ Marssonina ）真菌。\n\n·症状· 主要危害叶片，也侵染果实。叶片上症状有 3 种类型。\n\n（1）同心轮纹型：发病初期在叶片正面形成黄褐色小点，近圆形，后期病斑表面产生同心轮纹状\n排列的小黑点。\n\n（2）针芒型：病斑呈放射状（针芒状）向外扩展。病斑小，数量较多，常遍布叶片。\n\n（3）混合型：病斑较大，近圆形，其外缘呈针芒状，后期病斑中部灰白色，外缘绿色，其上散生\n许多小黑点。\n\n·发病规律· 以分生孢子盘、子囊盘或未受精的菌丝团在落叶和病梢中越冬。春季温度回升、多雨\n时，产生子囊孢子或分生孢子，通过风雨传播。附着胞和侵染丝直接从叶面或叶背侵入，树冠下部\n和内膛叶片最先发病，逐渐向上及外围蔓延。在苹果生长季节，病菌可产生分生孢子进行再侵染。\n潮湿是落叶上病菌形成子囊盘的必要条件。弱树、弱枝发病重，壮树发病轻。管理粗放果园病害发\n生早而重。\n\n·防治方法·\n\n（1）搞好清园：秋末清除园内落叶，集中烧毁。冬前深翻果园，促进病残体分解。早春苹果发芽\n前，在树体及其地面喷布 45%石硫合剂晶体。\n\n（2）加强栽培管理：提高树体抗病力，土壤肥力较差的果园，要增施肥料。合理修剪，注意改善\n树冠内的通风透光。\n\n（3）喷药保护：药剂防治重点应在前期，一般在落花后 10 天左右即开始喷第一次药，每隔 10~15\n天左右喷 1 次药，连续喷施 4~5 次。常用药剂有 10%多抗霉素 1 200 倍液、80%戊唑醇可湿性粉剂\n3 000 倍液、70%代森联干悬浮剂 1 000 倍液等。\n\n\n\n苹果褐斑病 叶片被害状\n\n\n\n苹果褐斑病 叶片被害状\n\n苹果褐斑病 叶片被害状\n\n\n\n苹果褐斑病 果实被害状\n\n苹果斑点病\n\n·病原· 链格孢苹果专化型（ Alternaria alternaria f.sp. mali），属半知菌亚门（Deuteromycotina）链\n格孢属（ Alternaria ）真菌。\n\n·症状· 果面出现黑红斑点，红斑点比例占 80%以上，但不烂果。果顶周围斑点最多，果梗周围几乎\n不见。红斑中有一些斑点，初发为小黑斑，后发软裂口或软化烂果。\n\n·发病规律· 以菌丝体在病落叶、病枝等病残体和秋梢顶芽上越冬。4、5 月降雨时，越冬病菌可产\n生大量分生孢子，通过风雨传播，从伤口或表皮直接侵入幼叶、新梢和果实等组织。降雨早、雨日\n多、雨量大，发病早、发病期长、发病重。树势衰弱，发病重。\n\n·防治方法·\n\n（1）加强栽培管理，增强树势，提高树体抗病力。秋冬季节清除园内残枝落叶、病虫果集中处理\n以减少菌源量；增施腐熟农家肥；改良土壤，不偏施氮肥；合理修剪，改善果园通风透光条件，保\n证枝枝见光，同时，提高土壤通气性；7~9月份多雨季节温度高，湿度大，应防止果园积水，要及\n时排水。\n\n（2）药剂防治：谢花后套袋前新梢生长期，全园喷施 1~2 次 80%代森锰锌可湿性粉剂 800 倍液。\n果实膨大期全园喷施 43%戊唑醇悬浮剂 3 000 倍液，或 10%苯醚甲环唑水分散粒剂 1 500 倍液，或\n40%氟硅唑可湿性粉剂 4 000 倍液。果实着色至成熟期，除袋后及时给树上补喷 1 次 5%吡唑醚菌\n酯+55%代森联水分散粒剂，进一步杀灭病菌。\n\n\n\n苹果斑点病 病果\n\n\n\n苹果斑点病 病果\n\n\n\n苹果斑点病 病果\n\n苹果斑点病 病果\n\n\n\n苹果斑点病 病果\n\n\n\n苹果斑点病 病果\n\n苹果炭疽病\n\n·病原· 有性阶段为炭疽病菌[ Glomerella cingulate （Stonem.） Spauld. et Schrenk]属子囊菌亚门\n（Ascomycotina）小丛壳属（ Glomerella ）；无性阶段为胶孢炭疽菌（ Colletotrichum\ngloeosporioides Penz. et Sacc.），属半知菌亚门（Deuteromycotina）炭疽菌属（ Colletotrichum ）。"
    ]
  },
  {
    "question": "葡萄霜霉病发病的最适宜温度是多少？",
    "answer": "葡萄霜霉病发病的最适宜温度为10~15℃。",
    "standard_answer": "葡萄霜霉病发病的最适宜温度为10~15℃。",
    "contexts": [
      "葡萄房枯病 分生孢子器和器孢子\n\n葡萄霜霉病\n\n·病原· 葡萄生单轴霉[ Plasmopara viticola （Berk. Et Curt.） Berl et Toni]，属鞭毛菌亚门\n（Flagellum）单轴霉属（ Plasmopara ）。\n\n·症状· 主要危害葡萄叶片，也能侵害嫩梢、花蕾及幼果。叶片受害后，正面初生淡黄绿色油渍状不\n规则小斑，逐渐扩大为黄绿色至褐色多角形病斑；在病斑发展过程中，叶背面产生白色霜状霉层，\n病叶后期变脆，易干枯脱落。嫩梢上最初出现油浸状病斑，逐渐变为黄绿色至褐色，表面产生稀疏\n白色霉状物，病梢生长停滞，扭曲，严重时枯死。幼果感病后，病部褪色，变硬下陷，并产生白色\n霉层，随即皱缩脱落。果粒膨大期受害后，呈褐色软腐状，不久干缩脱落。果实着色后不再感染。\n发病最适宜温度为 10~15℃，秋季低温多雨高湿易引起病害流行。低温高湿时发病较快，高温干旱\n时发病停止。\n\n·发病规律· 病菌以卵孢子在病组织内越冬，或随病叶遗留在土壤中越冬。次年5月卵孢子萌发产生\n芽卵囊和游动孢子，借风雨传播。首先侵染接近地面的叶片，上海地区一般于 5 月下旬开始发病，\n8~10 月为发病盛期，秋季若遇低温、多雨、高湿易引起病害流行。\n\n·防治方法·\n\n（1）秋末冬初及时收集病叶、病果，剪除病梢，结合冬季土地深翻，深埋病残组织。生长期间要\n注意排水，夏季及时剪除多余枝蔓，改善通风条件。\n\n（2）避免在低洼地建立果园，选用抗病品种。\n\n（3）病害发生前期，施用波尔多液等药剂进行预防，每间隔 10~15 天喷 1 次，共喷施 2~3 次。初\n见病斑或在病害高发期，用治疗兼保护药剂进行治疗和预防：21%松脂酸铜水乳剂 67~83 ml/亩、\n46%氢氧化铜水分散粒剂 1 750~2 000 倍液，或22.5%啶氧菌酯悬浮剂 1 500~2 000 倍液，间隔\n10~15 天喷 1 次，连续喷施 2~3 次。在高湿环境或降雨频繁的情况下发病或霜霉病上果，可使用\n\n\n\n20%嘧菌酯水分散粒剂 800~1 600 倍液治疗。药剂应交替使用。\n\n葡萄霜霉病 叶片被害状\n\n\n\n葡萄霜霉病 病叶背面\n\n\n\n葡萄霜霉病 叶片背面被害状\n\n\n\n葡萄霜霉病 幼果被害状\n\n\n\n葡萄霜霉病 病果\n\n\n\n葡萄霜霉病 幼果被害状\n\n葡萄白粉病\n\n·病原· 葡萄钩丝壳菌[ Uncinula necator （Schw.） Burr.]，属子囊菌亚门（Ascom ycotina），钩丝壳\n属（ Uncinula ）。\n\n·症状· 病菌入侵危害葡萄的所有绿色部分。果实受害时，果面形成灰白色粉质病斑，果实生长停\n滞，发育受阻，逐渐硬化变成畸形。叶片被害时，最初失绿，后叶表面形成白色粉质病斑，病斑轮\n廓不整齐，大小不等，叶面皱缩不平，严重时病叶卷曲枯萎。嫩梢受害时，初为灰白色小斑点，不\n断扩大蔓延，可使全蔓受害，随病势的发展，被害枝蔓逐渐由灰白色变成暗灰色、红褐色，终至黑\n色。\n\n·发病规律· 以菌丝在被害组织上或芽内越冬。孢子在温度 4~7℃时即能萌发，最适温度为\n25~28℃。在干旱的夏季或温暖、闷热、多云的天气容易引起病害的大发生。\n\n·防治方法·\n\n（1）要注意及时摘心绑蔓，剪副梢，使蔓均匀分布于架面上，保持通风透光良好。冬季剪除病\n梢，清扫病叶、病果，集中烧毁。\n\n（2）病重地区或易感病的品种，要注意喷药保护。一般在葡萄发芽前喷 1 次3~5 波美度石硫合\n剂；发芽后喷 0.2~0.3 波美度石硫合剂。开花前至幼果期喷 2~3次 10%苯醚甲环唑悬浮剂 3 000 倍\n液，或 30%嘧菌酯悬浮剂 1 000~1 500 倍液，或 43%戊唑醇悬浮剂 2 500 倍液等。\n\n\n\n葡萄白粉病 危害叶片\n\n\n\n葡萄白粉病 危害叶片\n\n\n\n葡萄白粉病 危害叶片\n\n\n\n葡萄白粉病 危害叶片\n\n\n\n葡萄白粉病 危害叶片\n\n\n\n葡萄白粉病 危害叶片\n\n葡萄蔓割病\n\n·病原· 有性阶段为葡萄生小隐孢壳菌[ Cryptosporella viticola （Red.） Shear]，属子囊菌亚门\n（Ascomycotina）小隐孢壳属（ Cryptosporella ）真菌。无性阶段为葡萄拟茎点霉[ Phomopsis\nviticola （Sacc.） Sacc.]，属半知菌亚门（Deuteromycotina）拟茎点霉属（ Phomopsis ）真菌，又称\n葡萄蔓枯病。",
      "［产品特点］ 本品为甲氧基丙酸酯类杀菌剂，具有高效、广谱、保护、治疗、铲除、渗透、内吸\n活性、耐雨水冲刷、持效期长等特性；几乎对所有真菌纲（子囊菌纲、担子菌纲、卵菌纲和半知菌\n类）病害，如白粉病、锈病、颖枯病、网斑病、霜霉病、稻瘟病等均有良好的活性。\n\n对作物安全，因其在土壤、水中可以快速降解，故对环境安全。\n\n［防治对象及使用方法］\n\n技术要点\n\n（1）本品最佳用药时间为开花前、谢花后和幼果期。\n\n（2）苹果和樱桃对本品敏感，切勿使用；对邻近苹果和樱桃的作物喷施时，避免药剂雾滴漂移。\n\n（3）本品避免与乳油类农药和有机硅助剂混用。建议与其他作用机制不同的杀菌剂轮换使用，以\n延缓抗性产生。\n\n（4）防治葡萄霜霉病，于病害发生前或初见零星病斑时叶面喷雾 1~2 次，视天气情况和病情发\n展，每次施药间隔 7~10 天；一季作物最多使用 3 次，安全间隔期 10 天。\n\n［注意事项］\n\n（1）使用本品时需做好保护措施，戴好手套、面罩或护目镜及口罩，穿长袖衣、长裤和靴子。避\n免药液接触皮肤、眼睛，避免吸入雾滴。\n\n（2）施药期间切勿抽烟或饮食。施药后，彻底清洗防护用具，洗澡，并更换和清洗工作服。\n\n（3）未用完的制剂应放在原包装内封存，切勿将本品置于饮食容器中。\n\n（4）本品对鱼类有毒，切勿将制剂及其废液弃于池塘、沟渠、河流和湖泊等中，或在河塘中清洗\n施药器具，以免影响鱼类和污染水源。\n\n（5）使用后的包装袋应妥善处理，不得他用或随意丢弃。药液和废液不得污染各类水域、土壤环\n境。\n\n（6）孕妇及哺乳期妇女禁止接触本品。过敏者禁用。\n\n（7）严格按照标签推荐方法使用和贮藏本品。\n\n50%嘧菌酯水分散粒剂\n\n［产品特点］ 本品是β甲氧基丙烯酸酯类杀菌剂，对 14-脱甲基化酶抑制剂、苯甲酰胺类、一羧酰\n胺类和苯并咪唑类产生抗性的菌株有效；具有保护、铲除、渗透、内吸活性。对三大类致病真菌：\n\n\n\n子囊菌、担子菌、半知菌和卵菌纲中的绝大部分病原菌均有效。对葡萄霜霉病、蕹菜白锈病有较好\n的防治效果。\n\n［防治对象及使用方法］\n\n技术要点\n\n（1）根据作物长势，叶面均匀喷雾。产品在葡萄上一季作物最多使用次数 2 次，安全间隔期为 14\n天。\n\n（2）在推荐用药剂量下，对作物安全。\n\n（3）建议与其他作用机制不同的杀菌剂轮换使用。\n\n［注意事项］\n\n（1）使用本品时应穿戴防护服和手套，避免吸入药液；施药期间不可吃食物和饮水。施药后应及\n时洗手和洗脸。\n\n（2）鱼类养殖区、蚕室、桑园附近禁用，施药器械不得在水产养殖区、河塘等水域清洗施药器\n具，施药后田水不得直接排入水体，避免污染水源。\n\n（3）用过的容器应妥善处理，不可做他用，也不可随意丢弃。\n\n（4）避免孕妇及哺乳期妇女接触。\n\n250g/L嘧菌酯悬浮剂\n\n［产品特点］ 本品是一种β甲氧基丙烯酸酯类杀菌剂，通过抑制病原菌线粒体的呼吸作用来阻止其\n能量合成，是一种较新作用机理的杀菌剂，具有保护和治疗双重功效。\n\n［防治对象及使用方法］\n\n技术要点\n\n（1）本品最佳用药时间为开花前、谢花后和幼果期。\n\n（2）为了延缓抗性的产生，建议与其他作用机理的药剂轮换使用。\n\n\n\n（3）避免与乳油类农药和有机硅类助剂混用，使用前需摇匀。\n\n（4）苹果和樱桃对本品敏感，切勿使用；对邻近苹果和樱桃的作物喷施时，避免药剂雾滴漂移。\n\n（5）防治柑橘疮痂病、炭疽病，按推荐剂量，于病害发生前或初见零星病斑时叶面喷雾 1~2 次；\n视天气变化和病情发展，每次施药间隔 7~10 天。根据作物长势，叶面均匀喷雾。一季作物最多使\n用次数 3 次，安全间隔期 14 天。\n\n（6）防治葡萄霜霉病、黑痘病、白腐病，按推荐剂量，于病害发生前或初见零星病斑时叶面喷雾\n1~2 次，视天气变化和病情发展，每次施药间隔 7~10 天。根据作物长势，叶面均匀喷雾。一季作\n物最多使用次数 4 次，安全间隔期 14 天。\n\n［注意事项］\n\n（1）须按照农药安全使用准则使用本品，避免药液接触皮肤、眼睛和污染衣物，避免吸入雾滴。\n切勿在施药现场抽烟或饮食。在饮水、进食和抽烟前，应先洗手、洗脸。\n\n（2）配药时，应戴手套、面罩，穿长袖衣、长裤和靴子。\n\n（3）喷药时，应穿长袖衣、长裤和靴子。\n\n（4）施药后，彻底清洗防护用具，洗澡，并更换和清洗工作服。\n\n（5）使用过的铝箔袋空包装，应直接带离田间，安全保存，并交有资质的部门统一高温焚烧处\n理；其他类型的空包装，应用清水冲洗两次后，带离田间，妥善处理；切勿重复使用或改作其他用\n途。所有施药器具，用后应立即用清水或适当的洗涤剂清洗。\n\n（6）不得污染各类水域，勿将药液或空包装弃于水中，或在河塘中洗涤喷雾器械，避免影响鱼类\n和污染水源。\n\n（7）未用完的制剂应放在原包装内密闭保存，切勿将本品置于饮、食容器中。",
      "（8）远离水产养殖区、河塘等水体施药；禁止在河塘等水体中清洗施药器具；鱼或虾、蟹套养藕\n田禁用；施药后的田水不得直接排入水体。\n\n400g/L嘧霉胺悬浮剂\n\n［产品特点］ 嘧霉胺具有抑制真菌病原侵染酶分泌的功能，并能迅速渗透植物组织在表层组织传\n导。因此，本剂是以保护作用、治疗病菌潜伏侵染和抑制病害扩展为特点的杀菌剂。该药剂也具有\n一定的熏蒸作用；可有效防治黄瓜、番茄以及葡萄灰霉病。\n\n［防治对象及使用方法］\n\n技术要点\n\n（1）按农药安全使用规范操作，原包装摇匀，采用“一次法”稀释配药。在配制药液时，先将推荐\n用量的本产品用少量水在清洁容器中充分搅拌稀释，然后全部转移到喷雾器中，再补足水量并充分\n混匀。\n\n（2）根据作物大小，确定亩用水量，配制药液，进行植株或叶面均匀喷雾处理。\n\n（3）施药应在病害发病前或初期进行叶面喷雾，建议每隔 7~10 天施用 1 次。\n\n（4）本剂在温度较低时的防效更佳，开花期可以使用。\n\n\n\n（5）安全间隔期 7 天，每季最多施用 3 次。\n\n［注意事项］\n\n（1）在保护地使用时，避免高温条件下用药，药后注意通风。\n\n（2）施药时要穿戴防护用具、手套、面罩，避免使药液溅到眼睛和皮肤上，避免口鼻吸入，施药\n后用肥皂洗手、洗脸。\n\n（3）本品对鱼类等水生生物有毒，远离水产养殖区施药，禁止在河塘等水体中清洗施药器具。\n\n（4）空包装应清洗两次并压烂或划破后妥善处理。\n\n（5）孕妇及哺乳期妇女禁止接触本品。\n\n8%宁南霉素水剂\n\n［产品特点］ 本品属于胞嘧啶核苷肽型广谱抗生素杀菌剂，具有预防、治疗作用。本品可延长病\n毒潜育期、破坏病毒粒体结构，降低病毒粒体浓度，提高植株抵抗病毒的能力而达到防治病毒病的\n作用；同时本品还可抑制真菌菌丝生长，并能诱导植物体产生抗性蛋白，提高植物体的免疫力。\n\n［防治对象及使用方法］\n\n技术要点\n\n（1）本品应于作物发病前或发病初期施药，连续喷 2~3 次，每次施药间隔7~10 天。\n\n（2）本品在苹果上使用的安全间隔期为 14 天，每季最多使用次数为 3 次。\n\n（3）本品不可与呈碱性的农药等物质混合使用。药液及其废液不得污染各类水域、土壤等环境。\n\n［注意事项］\n\n（1）使用本品时应穿戴防护服和手套、口罩等，避免吸入药液；施药期间不可吃东西和饮水；施\n药后应及时洗手和洗脸。\n\n（2）不得在河塘等水域清洗施药器具。\n\n（3）用过的容器应妥善处理，不可做他用，也不可随意丢弃。\n\n（4）孕妇及哺乳期妇女禁止接触。\n\n23.4%双炔酰菌胺悬浮剂\n\n［产品特点］ 本品为酰胺类杀菌剂，对由卵菌纲病原菌引起的病害有较好的防效，对处于萌发阶\n段的孢子具有较高的活性且可抑制菌丝生长和孢子的形成。\n\n［防治对象及使用方法］\n\n\n\n技术要点\n\n（1）推荐在作物谢花后或坐果期使用本品，快速生长期配合内吸性较强的产品。\n\n（2）本品耐雨水冲刷，药后 1 小时或药液干后遇雨药效几乎不受影响。\n\n（3）在连续阴雨或湿度较大的环境中，或者当病情较重的情况下，建议使用较高剂量。\n\n（4）为获得最佳的防治效果，尽量于病害发生之前整株均匀喷雾。\n\n（5）防治葡萄霜霉病，按推荐剂量，在发病初期喷雾使用，或在作物谢花后或雨天来临前，根据\n病害发展和天气情况连续使用 2~3 次，每次间隔 7~14 天，对水后植株均匀充分喷雾。一季作物最\n多使用次数 3 次，安全间隔期 3 天。\n\n［注意事项］\n\n（1）按照农药安全使用准则使用本品。避免药液接触皮肤、眼睛和污染衣物，避免吸入雾滴。切\n勿在施药现场抽烟或饮食。在饮水、进食和抽烟前，应先洗手、洗脸及暴露部位皮肤。\n\n（2）配药和喷药时，应穿戴手套、面罩和靴子。\n\n（3）施药后，彻底清洗防护用具，洗澡，并更换和清洗工作服。\n\n（4）使用过的铝箔袋空包装，须直接带离田间，安全保存，并交有资质的部门统一高温焚烧处\n理；其他类型的空包装，须用清水冲洗三次后，带离田间，妥善处理；切勿重复使用或改作其他用\n途。所有施药器具，用后应立即用清水或适当的洗涤剂清洗。\n\n（5）药液及其废液不得污染各类水域、土壤等环境。勿将药液或空包装弃于水中或在河塘中洗涤\n喷雾器械，避免污染水源。\n\n（6）未用完的制剂应放在原包装内密闭保存，切勿将本品置于饮、食容器中。\n\n（7）过敏者禁用。使用中有任何不良反应应及时就医。孕妇及哺乳期妇女禁止接触。\n\n21%松脂酸铜水乳剂\n\n［产品特点］ 本品是一种高效低毒的有机铜保护性杀菌剂，对霜霉病菌蛋白质的合成起抑制作\n用，致使菌体死亡。具有持效期长、使用方便的特点，有预防保护和治疗双重作用，可较好防治葡\n萄霜霉病。\n\n［防治对象及使用方法］\n\n技术要点\n\n（1）葡萄霜霉病发生前期或初期均匀喷雾处理，间隔 7~14 天用 1 次药。",
      "（3）发芽前喷施 45%石硫合剂晶体 300~500 倍液；管理要求高或往年白腐病发病重的果园，在展\n叶期喷施 250 g/L戊唑醇水乳剂 2 000~2 500 倍液，两次清园。未发病的田块，可用 60%代森联加\n10%嘧菌酯水分散粒剂 800~900 倍液等杀菌剂预防，每隔 10 天左右喷药 1 次，需喷 2~3 次；病害\n发生初期，用 250 g/L戊唑醇水乳剂 2 000~2 500 倍液，或 12.8%吡唑嘧菌酯加 25.2%啶酰菌胺水分\n散粒剂 1 500~2 500 倍液治疗；遇暴风雨或冰雹后，及时喷施 250 g/L戊唑醇水乳剂 2 000~2 500 倍\n液，或 12.8%吡唑嘧菌酯加 25.2%啶酰菌胺水分散粒剂 1 500~2 500 倍液治疗和铲除，防止病害暴\n发流行。果实近成熟期，用 250 g/L戊唑醇水乳剂 2 000~2 500 倍液，或 12.8%吡唑嘧菌酯加 25.2%\n啶酰菌胺水分散粒剂1 500~2 500 倍液喷雾，重点喷果穗，防治果穗白腐病。\n\n葡萄白腐病 病叶\n\n\n\n葡萄白腐病 病叶\n\n葡萄白腐病 病叶\n\n\n\n葡萄白腐病 果穗被害状\n\n\n\n\n\n\n葡萄白腐病 后期枝蔓症状\n\n葡萄白腐病 早期病果症状\n\n\n\n葡萄白腐病 分生孢子器和器孢子\n\n葡萄灰霉病\n\n·病原· 灰葡萄孢霉（ Botrytis cinerea Pers.），属半知菌亚门（Deuteromycotina）孢盘菌属（\nBotryotinia ）。\n\n·症状· 主要侵害花穗和果实，也能侵害叶片、新梢。花穗开始发病时病部呈淡褐色，很快变成暗褐\n色至黑褐色，变软腐烂，表面密生灰色霉层，有时全花穗腐败坏死，后期常在病部长出黑色块状菌\n核。果实一般在转色期开始发病，初为圆形稍凹陷的病斑，很快引起全果腐烂，长出鼠灰色的霉\n层，并迅速引起全穗果实腐烂。叶片发病时产生淡褐色不规则的病斑，并有不规则的轮纹。\n\n·发病规律· 病菌以分生孢子及菌核在被害部越冬，1 年有 2 次发病高峰期，第一次高峰期是 5 月中\n旬（开花前后），主要危害花穗，第二次高峰期是 8 月上中旬至 9 月上旬（果实着色至成熟期），\n主要危害成熟果实。\n\n病菌适宜于较低温度和较高的空气湿度，花期多雨湿润、果实成熟期降雨不匀、多雷暴雨及台风侵\n袭，均能促使灰霉病发生及发展。\n\n·防治方法·\n\n（1）搞好果园通风透光，降低空气湿度，及时整理枝蔓和摘心抹芽，施用磷钾肥，防止徒长。防\n止虫伤和其他损伤。\n\n（2）开花前可喷洒 1 次 1∶1∶200 波尔多液，或 400 g/L嘧霉胺悬浮剂 1 000~1 500 倍液，或 500\ng/L异菌脲悬浮剂 750~1 000 倍液；果实着色前可喷洒 50%嘧菌环胺水分散粒剂 625~1 000 倍液，\n或 12.8%吡唑嘧菌酯加 25.2%啶酰菌胺水分散粒剂 1 000~2 000 倍液，一般喷洒 1~2 次，每次间隔\n7~10 天，以预防或减轻花、果的发病，或结合黑痘病、炭疽病等一起防治。\n\n（3）发病初期，及时剪除发病花穗，防止扩散蔓延。\n\n葡萄灰霉病 果实被害状\n\n\n\n葡萄灰霉病 果实被害状\n\n\n\n葡萄灰霉病 果穗被害状\n\n\n\n葡萄灰霉病 果实被害状\n\n\n\n葡萄灰霉病 果实被害状\n\n葡萄房枯病\n\n·病原· 无性阶段为葡萄房枯大茎点霉［ Macrophoma faocida （Viala et Ravag） Cav.］，属半知菌\n亚门（Deuteromycotina）大茎点霉属（ Macrophoma ）。\n\n\n\n·症状· 主要危害葡萄穗轴、果柄和果粒。发生初期在果柄或果蒂部位出现淡褐色不规整的病斑，边\n缘有褐色至暗褐色晕圈，当病斑扩大环绕一周时，果柄干枯缢细，果粒失水干枯，表面皱缩，外皮\n逐渐变成黑色，并散生出很多突起的黑色小点。严重时蔓延至穗轴，致使全穗果粒皱缩干枯变成僵\n果，悬于树上不易脱落。\n\n叶片被害时，初发生圆形小斑点，后逐渐扩大，中央变成灰白色，外边褐色，边缘黑色。\n\n·发病规律· 病菌以分生孢子器和子囊壳在被害部越冬，翌年 5~6 月间，借风雨传播到葡萄上侵入发\n病。孢子器在 23℃下经过 4 小时即能萌发侵入寄主。病菌发育最适温度为 35℃，最低 9℃，最高\n40℃。\n\n·防治方法·\n\n（1）秋季彻底清除病枝、病叶、病果等，注意排水，及时剪副梢，改善通风透光条件，降低湿\n度。\n\n（2）增施有机肥，多施磷、钾肥，培育壮树，提高抗病能力。\n\n（3）葡萄上架前喷洒 3~5 度波美度石硫合剂，葡萄落花后可喷施 60%代森联加 10%嘧菌酯水分散\n粒剂 800~900 倍液，或 250 g/L戊唑醇水乳剂 2 000~2 500 倍液，每隔7天喷1次，连续喷施2次。不\n宜使用波尔多液，以免果实出现果锈现象。",
      "［产品特点］ 嘧霉胺具有抑制真菌病原侵染酶分泌的功能，并能迅速渗透植物组织在表层组织传\n导。因此，是以保护作用、治疗病菌潜伏侵染和抑制病害扩展为特点的杀菌剂。该药剂也具有一定\n的熏蒸作用；对葡萄、草莓、番茄、洋葱、菜豆、豌豆、黄瓜、茄子等作物以及观赏植物的灰霉\n病、苹果黑腥病有优异的防效。\n\n［防治对象及使用方法］\n\n技术要点\n\n（1）本品在灰霉病发生初期用药，注意喷雾均匀，视病害发生情况，每间隔5~7 天喷药 1 次，可\n连续施药 2 次。\n\n（2）在葡萄上的安全间隔期为 7 天；葡萄每季最多施用次数为 3 次。\n\n（3）本品不可与呈强酸、强碱性的农药等物质混用。\n\n（4）建议与其他作用机制不同的杀菌剂交替使用，以延缓抗性产生。\n\n［注意事项］\n\n（1）在保护地使用时，避免高温条件下用药，药后注意通风。\n\n（2）施药时要穿戴防护用具、手套、面罩，避免使药液溅到眼睛和皮肤上，避免口鼻吸入，施药\n后用肥皂洗手、洗脸。\n\n（3）本品对鱼类等水生生物有毒，远离水产养殖区施药，禁止在河塘等水体中清洗施药器具。\n\n（4）用过的空包装应妥善处理，不可做他用，也不可随意丢弃。\n\n（5）孕妇及哺乳期妇女禁止接触本品。\n\n50%代森联+10%嘧菌酯水分散粒剂\n\n［产品特点］ 本品中代森联为保护性杀菌剂，对卵菌纲真菌引起的各种病害有较好的防效。嘧菌\n酯具有很好的渗透、内吸活性。一者混配增效显著，兼具保护和治疗作用。对防治葡萄霜霉病和白\n腐病都有较好的效果。\n\n［防治对象及使用方法］\n\n技术要点\n\n（1）按推荐剂量，于病害发生前或初见零星病斑时叶面喷雾 1~2 次，视天气变化和病情发展，应\n间隔 7~10 天喷药 1 次。\n\n\n\n（2）根据作物长势，每亩喷药液量 45~75 L，叶面均匀喷雾。\n\n［注意事项］\n\n（1）使用本品应遵守农药安全使用规定，穿戴手套、面罩、防护服和靴子等防护用具。\n\n（2）苹果和樱桃等较为敏感作物，应先小面积试验进行验证。对邻近苹果和樱桃作物喷施，避免\n药剂漂移。\n\n（3）避免与乳油类农药和有机硅助剂混用。\n\n（4）避免药液接触皮肤、眼睛和污染衣物，避免吸入雾滴；施药时不得抽烟、饮水、吃东西。\n\n（5）注意与其他作用机制不同的杀菌剂交替使用，以延缓抗性的产生；不可与呈碱性的农药等物\n质混用。\n\n（6）不得污染各个水域，勿将药液或空包装弃于水中，不得在河塘中洗涤喷雾器械，避免影响鱼\n类和污染水源。\n\n（7）未用完的制剂应放在原包装内密闭保存，切勿将本品置于食物及饮料容器中。\n\n（8）孕妇及哺乳期内妇女避免接触。\n\n80%克菌丹水分散粒剂\n\n［产品特点］ 本品是一种广谱、低毒、保护性杀菌剂。本品对靶标病原菌有多个作用方式，不易\n产生抗性。喷施后可快速渗入病菌孢子，干扰病菌的呼吸、细胞膜的形成和细胞分裂而杀死病菌。\n本品在水中分散性好、悬浮性好、黏着性强，耐雨水冲刷，喷药后可在作物表面形成保护膜，阻断\n病原菌的萌发和侵入。本品不可与碱性物质混用。对柑橘树树脂病有防治作用。\n\n［防治对象及使用方法］\n\n技术要点\n\n（1）本品安全间隔期 21 天，每季作物最多使用 3 次。本品为保护性杀菌剂，打药时要均匀细致，\n以保证良好药效。\n\n（2）本品不易与矿物油类物质同时使用，两者使用间隔 15 天以上为好。\n\n（3）在推荐剂量下使用对登记作物相对安全，建议与其他作用机制不同的杀菌剂轮换使用，以延\n缓抗性产生。\n\n［注意事项］\n\n（1）施药时穿防护衣、戴口罩、手套，避免皮肤接触、避免溅入眼睛内。\n\n（2）避免逆风打药。\n\n（3）清洗施药器械要远离水源，不能随意倾倒残余药液，以免污染水源环境。\n\n（4）孕妇、哺乳期妇女及过敏者禁用，使用中有任何不良反应须及时就医。\n\n（5）用过的包装材料不可挪作他用，应焚烧或深埋，或交给当地环保部门统一处理。\n\n\n\n250g/L戊唑醇水乳剂\n\n［产品特点］ 本品为二唑类低毒、内吸性杀菌剂，通过叶片均匀吸收并向顶端传导。本品具有保\n护、治疗作用。在推荐剂量下使用，本品对作物相对安全。\n\n［防治对象及使用方法］\n\n技术要点\n\n（1）防治苹果斑点落叶病应在苹果树春梢期施药 2 次，秋梢期 1 次。防治梨树黑星病应在梨园初\n见病斑时喷药，一般用药间隔 10~15 天，连续施药 2 次。每个生长季最多用药 2 次，安全间隔期\n30 天。\n\n（2）防治葡萄白腐病应根据各地病害防治历，制定用药适期。一般从落花后开始用药，每次打药\n间隔10~15天，每个生长季最多用药3次。最大使用浓度1 000倍，安全间隔 7 天。\n\n（3）防治梨树黑星病应在梨园初见病斑时喷药，连续施药 2 次，打药间隔10~15 天。\n\n（4）大风天气或预计 1 小时内下雨，勿施药。\n\n（5）本品不可与碱性物质混用。"
    ]
  },
  {
    "question": "杨梅癌肿病（杨梅疮）的病原菌属于哪类细菌？",
    "answer": "杨梅癌肿病的病原菌并非细菌，而是属于放线菌门的**结瘤农杆菌**（*Agrobacterium tumefaciens*）。该病原菌可引起植物组织异常增生，形成肿瘤状病斑。",
    "standard_answer": "属于假单胞菌属（Pseudomonas）细菌，具体为丁香假单胞萨氏亚种杨梅致病变种。",
    "contexts": [
      "·发病规律· 病原主要在发病植株树枝上，或落于土壤中的植物枝条肿瘤内越冬。春季是杨梅癌肿病\n发病初期，病菌在病瘤表面流出菌脓后，借助雨水、空气、水滴飞溅、昆虫等方法传播，农事操作\n的工具也可传播该病。病菌主要从伤口、叶痕处侵入致病，此外，嫁接也是传病的重要途径之一。\n染病杨梅一般于 4 月下旬开始发病，5 月中下旬肿瘤出现。该病在温暖多雨、树龄老化、树势衰\n弱、伤口较多的果园发病偏重，幼树上发病较少，特别是新园区不见病害。\n\n·防治方法·\n\n（1）保护树体，防止受伤。由于病菌主要从伤口侵入，因此在果实采摘时，要尽量避免损伤树\n体。在风力较大的地区栽植杨梅，最好设立防风支架，防止大风造成杨梅树伤口而增大感染概率。\n如果产生伤口，要及时涂上波尔多液等保护剂。有条件的地方，可以在果园人工建造防风林屏障，\n对减轻发病有利。\n\n（2）新梢抽生前，及时剪除并烧毁发病枝条。冬季或春初树体发芽前，进行肿瘤剪除，并用抗菌\n剂大蒜素或硫酸铜 100 倍液消毒处理伤口，再外涂伤口保护剂。\n\n（3）4 月下旬至 5 月上旬开始喷药，即春梢抽发时，全面喷 1 次 1∶2∶200 波尔多液，或用 14%\n络氨铜水剂 250~400 倍液，或 30%琥胶肥酸铜悬浮液 400~500倍液，交替用药，防止产生抗药性。\n一般 7~10 天喷 1 次，连喷 2~3 次。如遇风灾，造成树体大量伤口，增加感染机会，应在风灾后及\n时喷施 1 次波尔多液保护。\n\n\n\n杨梅癌肿病 植株被害状\n\n杨梅癌肿病 被害枝干\n\n\n\n杨梅癌肿病 被害枝干\n\n杨梅癌肿病 病枝上肿瘤\n\n\n\n杨梅癌肿病 病枝上肿瘤\n\n杨梅褐斑病\n\n·病原· 杨梅球腔菌（ Mycosphacrcalla myricac Saw.），属子囊菌亚门（Ascomycotina）座囊菌科\n（Dothideaceae）。\n\n·症状· 主要危害杨梅叶片。病菌侵入叶片后，初期出现针头大小的紫红色小点，后逐渐扩大呈近圆\n形不规则病斑，直径一般为 4~8 mm。病斑中央红褐色，边缘褐色或灰褐色，后期病斑中央转变成\n浅红褐色或灰白色，其上密生灰黑色的细小粒点，病斑逐渐联结成斑块，致使病叶干枯脱落。\n\n·发病规律· 以子囊果在落叶或树上的病叶中过冬。浙江地区 4 月底至 5 月初产生子囊孢子，5 月中\n旬后子囊孢子成熟，遇雨水或空气潮湿，借助风、雨、水传播蔓延。孢子从叶片的气孔、伤口侵\n入，孢子萌发侵入叶片后并不马上表现症状，潜伏期 3~4 个月，一般至当年 8~9 月才开始在叶面\n上出现新病斑，10 月病斑增多并开始落叶，严重时至第二年的落叶率在 70%~80%。落叶后不久，\n引起花芽和小枝枯死。5~6 月雨水多，湿度大，该病发病程度重；反之，则轻。土壤瘠薄、有机质\n含量少、树势生长衰弱、易发病，排水不良、黏重土壤、通风透光条件差的杨梅园发病重。山脚处\n杨梅树的发病比山腰或山顶重。\n\n·防治方法·\n\n（1）冬季至早春萌芽前要结合修剪将病虫枝、干枯枝连同园内落叶一并加以集中烧毁或深埋，同\n时要对树冠喷 1 次 3~5 波美度石硫合剂，减少病害传播。喷施石硫合剂，可在药液中加入 5~10\nmg/L 2，4-D，以减少不正常落叶。\n\n（2）园内土壤要注意深翻改土，增施有机肥和钾肥，并及时搞好排涝抗旱工作，以增强树势，提\n高植株抗病能力。\n\n（3）5~7 月发病初期要注意喷药保护，成年结果树多在采果前 20~30 天、采果后及时喷药，以保\n护叶片不受病菌侵害。药剂可选用硫酸铜∶生石灰∶水=1∶2∶200 的波尔多液，或 33.5%喹啉铜\n悬浮剂 1 000~2 000 倍液、250 g/L嘧菌酯悬浮剂 800~1 000 倍液等高效低毒杀菌剂。喷药时要仔\n细，树冠枝干、叶背、叶面均要喷到喷匀。\n\n\n\n（4）10~11 月发现褐斑病引起落叶时，要结合根外追肥，对树冠喷 1~2 次70%甲基托布津 800~1\n000 倍液加 2，4-D 10~20 mg/L。\n\n杨梅褐斑病 病叶\n\n\n\n杨梅褐斑病 病叶\n\n\n\n杨梅褐斑病 病叶\n\n\n\n杨梅褐斑病 病叶\n\n\n\n杨梅褐斑病 病叶\n\n\n\n杨梅褐斑病 病叶\n\n杨梅枝腐病\n\n·病原· 病菌有性阶段为冠黑腐皮壳[ Valsa coronatra （Hoffm））Fr.]，属子囊菌亚门\n（Ascomycotina）黑腐皮壳属（ Valsa ），无性阶段为核果壳囊孢菌（ Cytospora leucostoma\nSacc，）属半知菌亚门（Deuteromycotina）壳囊孢属（ Physalospora ）真菌。",
      "·症状· 病菌主要危害杨梅枝干的皮层，特别是在老树的枝干上发病较多，致使枝干腐烂，树体早\n衰。枝干病斑初期呈红褐色，稍隆起，皮层组织松软，用手指按时即下陷，其后在病枝上产生许多\n密集细小的黑色小粒点。\n\n·发病规律· 该病菌在病残体上越冬，病菌从枝干伤口、裂缝或新梢与基枝的节间侵入，并从此处开\n始发病，逐渐蔓延整个枝梢，直至二三年生枝序都发病枯萎。雨天潮湿时，枯枝上的病斑吸水，分\n生孢子从孔口溢出，借助风雨扩散，进行再侵染。发病程度与雨量成正比关系，雨水多、果园潮\n湿、管理粗放，树势较弱则发病较严重。\n\n·防治方法·\n\n（1）深翻改土，增施有机肥和钾肥，注意氮、磷、钾的合理搭配与微肥的应用，科学修剪，改善\n树体通透性等，促使树势健壮，减少病害发生。\n\n（2）清除病树及时剪除病梢，将病枝、病叶、死树集中烧毁，以减少病菌侵染源。\n\n（3）为防新梢发病，在春梢抽生初期至 6 月上旬果实成熟前，每隔 7~10 天喷 1 次药，连喷 2~3\n次杀菌剂，可选 70%甲基托布津可湿性粉剂 800~1 000 倍液，或 50%多菌灵可湿性粉剂 500~800 倍\n液，交替使用。\n\n\n\n杨梅枝腐病 病枝\n\n杨梅枝腐病 病枝\n\n\n\n杨梅枝腐病 枝干病斑\n\n\n\n杨梅枝腐病 病斑\n\n杨梅赤衣病\n\n·病原· 鲑色伏革菌（ Corticium saimonicolor Berk），属担子菌门（Basidiomy cotina）伏革菌属（\nCorticium ）。\n\n\n\n·症状· 病菌主要危害杨梅枝干，尤以主枝及侧枝基部发病较多，上部枝条发病较少，老树发病严\n重。病初，枝干的阴面树皮上见到很细的白色丝网，以后出现橘红色粉末，逐渐扩展到全枝，形成\n一大片粉红色或橙黄色的霉层。受害枝条长势弱，叶片小而黄，树势衰弱，果形变小味酸。\n\n·发病规律· 病原菌菌丝在病组织中越冬，春季气温回升时病原菌菌丝向四周扩展，担孢子随水流传\n播，从伤口或皮孔侵入。浙江等地始病期一般为 3 月中旬；高峰期，春季为 4~6 月，秋季为 9~10\n月。4 月下旬开始形成粉红色子实层，5 月上中旬产生担孢子，并持续至 11 月；11 月后病菌在树\n体内休眠。该病害发生与降水有密切关系，多雨有利于病菌孢子的形成、传播、萌发和入侵。此\n外，园地土壤黏重、园间积水，或栽培管理粗放，均会使发病加重。\n\n·防治方法·\n\n（1）杨梅发展新区，不从病区引种杨梅苗木和接穗。\n\n（2）清除果园杂木，做好排水防涝，加强整枝修剪，促进树体通风透光，增施有机肥料和钾肥，\n增强树势，提高树体抗病能力。\n\n（3）冬季做好整枝修剪工作。在剪除枯枝、病枝、清理果园枯枝、落叶的基础上，树冠、地面喷\n施 3~5°Be石硫合剂，或在 2 月下旬至 3 月初（杨梅开花前），树干喷 10 倍松脂碱合剂（松香碱在\n花期禁止喷施，否则会造成大量落花），可兼治树干上的地衣苔藓。\n\n（4）如休眠期错过防治、生长季节赤衣病发生严重的，可选择 80%乙蒜素乳油 800~1 000 倍液进\n行喷施，有较好的防效。防治赤衣病的关键是早发现、早防治，如果发病前期不重视，病害蔓延到\n树冠上部的小枝，就会引起树势严重衰退，甚至死亡。\n\n杨梅赤衣病 被害状\n\n\n\n杨梅赤衣病 被害状\n\n\n\n杨梅赤衣病 植株被害状\n\n杨梅锈病\n\n·病原· 牧野裸孢锈菌（ Caeoma makinoi Kusano），属担子菌门（Basidiom ycotina）裸孢锈菌属（\nCaeoma ）。\n\n·症状· 锈病主要危害幼芽、叶和花，大树龄杨梅树发病率较高。冬末春初，在杨梅花期内，病菌陆\n续侵入危害。3 月中旬至 4 月上旬为发病高峰。受害杨梅开花提早，花量减少；发病植株当年发新\n芽着生橙黄色斑点，破裂后从中散发橙黄色粉末。花器被害时，还原成叶形，多呈肥厚的肉质片，\n上生橙黄色病斑。发病叶不久腐烂掉落，造成大部分枝梢秃头。患病树结果少、结小果，而且前期\n大量落花，中后期大量落果。\n\n·发病规律· 病菌以菌丝在枝梢上的被害部位，特别是隆突部潜伏越冬。次年春初由菌丝直接侵入幼\n芽等危害，并以夏孢子进行广泛传染。3 月下旬至 4 月中旬为发病高峰期。病害多发于老树。\n\n·防治方法·\n\n（1）采果后，截锯主干基部大杈处，掘断些浮根群，施草木灰等，促使隐芽萌发新枝。\n\n（2）于芽前的 2~3 月和采果后的 7~8 月，株施人畜肥或土杂肥 40~50 kg。\n\n（3）杨梅萌芽期喷 4 度石硫合剂，或 1∶1∶100 或 1∶1∶140 的波尔多液；结果期可用 70%甲基\n托布津 700~800倍液喷洒。\n\n\n\n杨梅锈病 病叶\n\n杨梅炭疽病",
      "·病原· 病原菌有性阶段为梅小丛壳[ Glomerella mume （Hori） Hemmi]，属子囊菌亚门\n（Ascomycotina）小丛壳属（ Glomerella ）；无性阶段为半知菌亚门（Deuteromycotina）炭疽菌（\nColletotrichum spp.）。\n\n·症状· 病菌主要危害杨梅春梢的枝梢和嫩叶。感病植株多在叶片边缘产生半圆形病斑，后逐渐扩\n大，病斑呈褐色或黑褐色，有些病斑呈灰白色，直径 6~8 mm，病健部有黄褐色晕圈，上有黑色小\n粒点，后病斑干燥脱落，严重时整叶枯死脱落。嫩梢被害，则布满点点病斑，逐渐变成秃枝。病菌\n也能侵染果实，使果实腐烂、脱落。\n\n·发病规律· 病菌以分生孢子和菌丝体在发病树木的嫩梢上越冬，一般 4 月底 5 月上旬开始发病，8\n月上中旬达到发病高峰期。病菌借雨水传播蔓延，一般5 月上旬雨水多，病害重。\n\n·防治方法·\n\n（1）增强树体抗病性，每年在抽梢前和采果后施用草木灰或有机肥，并对成年树根系培土。\n\n（2）在 4 月和 9 月，将感病树体的光秃梢和枯枝除去，抹去无用萌蘖，增强通风透光。\n\n（3）采果后和萌芽前各喷施1次1︰140~1︰160 的波尔多液，结果初期对树体喷洒 68%精甲霜·锰\n锌水分散粒剂600~800 倍液。\n\n（4）杀虫结合，配合杀灭蚊蝇、白蚂蚁、金龟子和蚜虫等。\n\n\n\n杨梅炭疽病 被害状\n\n杨梅炭疽病 病叶\n\n\n\n杨梅白腐病\n\n·病原· 病原青霉菌属（ Penicillium sp.）、绿色木霉菌（ Trichoderma viride Pers.Ex Fr.）为主，分别\n属子囊菌亚门（Ascomycotina）青霉菌属（ Penicillium ）以及绿色木霉属（ Trichoderma ），又称\n杨梅白腐烂、烂杨梅。\n\n·症状· 病菌主要危害杨梅果实。一般在杨梅采摘的中、后期发病。在果实表面产生许多白色霉状\n物，开始仅少数肉柱萎蔫，似果实局部软化；继而白点面积逐渐增大，蔓延至半个果实甚至全果，\n一般不到 2 天，这种带白点的杨梅果实即会脱落。\n\n·发病规律· 病菌在腐烂果或土中越冬，靠暴雨冲击将病菌飞溅到树冠近地面的果实上，再经雨水冲\n击，致使整个树冠被侵染。杨梅成熟期雨水越多，杨梅成熟度越高，果实软腐，病菌滋生，往往发\n病较重。\n\n·防治方法·\n\n（1）利用薄膜避雨设施栽培或喷洒营养液，提高果实硬度，增强抗病力。\n\n（2）在杨梅果实转色期，可喷施 10%抑霉唑水乳剂 500~700 倍液，或 250 g/L嘧菌酯悬浮剂 3\n333~5 000 倍液，或 250 g/L吡唑嘧菌酯乳油 1 000~2 000 倍液，间隔 15 天轮换使用，以减少杨梅白\n腐病病菌耐药性的产生。\n\n杨梅白腐病 病果\n\n\n\n杨梅白腐病 病果\n\n\n\n杨梅虫害\n\n杨梅小黄卷叶蛾\n\n·学名· Adoxophyes orang （Fischer v. Roslerstamm），属鳞翅目（Lepidoptera）卷蛾科\n（Tortricidae）。\n\n·鉴别特征· 成虫：体长 6~8 mm，翅展 15~20 mm，黄褐色；前翅略成长方形，在翅基部、翅中部\n及翅尖有深褐色斑纹 3 条，翅角上有“V”形褐斑；后翅淡黄色。卵：长 0.7 mm，数十粒鱼鳞状排列\n成扁平椭圆形卵块，其上覆有胶质薄膜。幼虫：体长 13~18 mm，宽 2.5 mm，黄绿色，头部棕褐\n色，前胸破皮板褐色，后缘深黑褐色，硬皮板下方两侧各有 2 个椭圆形褐斑，体毛短，绿色。蛹：\n长 7~9 mm，宽3 mm，黄褐色，腹部 2~8 节，背面近后缘有短刺 1 列，末端有钩状刺 8 根。\n\n·生活习性· 以老熟幼虫在卷叶苞内或枯枝落叶中越冬。越冬幼虫翌年 4 月上旬化蛹，下旬羽化成\n虫；成虫白天潜伏在杨梅丛中，夜间活跃，有趋光性，常把卵块产在叶面或叶背，每雌可产卵百余\n粒。初孵幼虫活泼，爬行或吐丝借风分散到新梢或展开的嫩叶上，吐丝缀结叶片成苞，躲在苞中取\n食叶肉，仅留 1 层表皮，呈枯黄色。\n\n·危害特点· 幼虫危害嫩叶，卷缩成虫苞，严重时新梢一片焦枯。嫩梢生长受抑或花蕾、幼果期受\n害，导致落蕾、落幼果。在浙西 1 年发生 5 代。除 1 代发生较整齐外，以后各代有不同程度的世代\n重叠。一般 5~9 月均为幼虫危害期，尤其春梢、果实期 5~6 月以第一二代发生危害最重，第四代\n危害次之。以幼虫爬至杨梅树嫩顶、枝梢上危害，大部分匿居在梢尖缝处，有的在嫩叶端吐丝卷\n叶，咀食叶肉。\n\n·防治方法·\n\n（1）卷叶蛾发生严重的园子，及时人工摘除或剪切新虫苞、卵块，并烧毁或深埋。\n\n（2）在果树面积较大的地方，于 5~10 月架设黑光灯、频振式杀虫灯等诱杀成虫。",
      "·症状· 该病是毁灭性细菌病害，主要危害新梢、枝干和叶片，造成枝蔓或整株枯死。染病初期叶上\n产生红色小点，接着产生 2~3 mm暗褐色不规则形病斑，四周具明显的黄色水渍状晕圈。湿度大时\n迅速扩展成水渍状大病斑，其边缘因受叶脉所限产生多角形病斑，有的不产生晕圈，多个病斑融合\n时，主脉间全部暗褐色，有菌脓溢出，叶片向里或外翻。小枝条染病初为暗绿色水渍状，后变暗褐\n色，产生纵向龟裂，症状向继续伸长的新梢和茎部扩展，不久使整个新梢变成暗褐色萎蔫枯死。枝\n干染病多于 1 月中下旬在芽眼四周、叶痕、皮孔、伤口处出现，病部产生纵向龟裂，溢出水滴状白\n色菌脓，皮层很快出现坏死，呈红色或暗红色，病组织凹陷成溃疡状，造成枝干上部萎蔫干枯。\n\n·发病规律· 病菌主要在枝蔓病组织内越冬，春季从病部伴菌脓溢出，借风、雨、昆虫和农事作业、\n工具等传播，经伤口、水孔、气孔和皮孔侵入。病原细菌侵入细胞组织后，经过一段时间的潜育繁\n殖，破坏输导组织和叶肉细胞，继续溢出菌脓进行再侵染。猕猴桃溃疡病病菌属低温高湿性侵染细\n菌，春季旬均温 10~14℃，如遇大风雨或连日高湿阴雨天气，病害易流行。地势高的果园风大，植\n株枝叶摩擦伤口多，有利于细菌传播和侵入。在整个生育期中，以春季伤流期发病较普遍，随之转\n重。谢花期后，气温升高，病害停止流行，仅个别株侵染。\n\n·防治方法·\n\n（1）科学管理水肥，做好排水，保持园内通风透光，营造不利于病害滋生的条件。增强树势，提\n高树体抗病力。\n\n（2）新叶萌发期，喷施石硫合剂进行预防。该病重在预防，必须做好前期的预防工作。\n\n（3）病害发生期，喷施 4%春雷霉素可湿性粉剂 400 倍液等杀菌剂进行防治。\n\n（4）做好冬季修剪和清园工作，集中清理落叶落枝，并集中销毁，消灭越冬病原菌。\n\n\n\n猕猴桃细菌性溃疡病 果实被害状\n\n\n\n猕猴桃细菌性溃疡病 危害主干\n\n\n\n\n\n\n猕猴桃细菌性溃疡病 危害主干\n\n猕猴桃细菌性溃疡病 危害主干\n\n\n\n猕猴桃细菌性溃疡病 危害主干\n\n\n\n猕猴桃虫害\n\n斜纹夜蛾\n\n·学名· Prodenia litura Fabricius，属鳞翅目（Lepidoptera）夜蛾科（Noctuidae），又名连纹夜蛾、斜\n纹贪夜蛾。\n\n·鉴别特征· 参照柑橘虫害斜纹夜蛾（p36）。\n\n·生活习性· 参照柑橘虫害斜纹夜蛾（p36）。\n\n·危害特点· 参照柑橘虫害斜纹夜蛾（p36）。\n\n·防治方法· 参照柑橘虫害斜纹夜蛾（p36）。\n\n斜纹夜蛾 幼虫\n\n\n\n斜纹夜蛾 幼虫\n\n\n\n斜纹夜蛾 成虫\n\n\n\n猕猴桃病虫防治历\n\n\n\n\n\n\n十、蓝莓\n\n蓝莓为杜鹃花科越橘属多年生低灌木，主要分布在气候温凉、阳光充足地区。蓝莓原生于北美洲与\n东亚，生长于海拔 900~2 300 m的地区。在我国主要分布在东北地区，长白山、大小兴安岭一带自\n然生长较多的野生品种。蓝莓果实中含有丰富的花青素，具有良好的营养保健作用，还有防止脑神\n经老化、强心、抗癌、软化血管、增强人体免疫等功能，是世界粮食及农业组织推荐的五大健康水\n果之一。\n\n我国目前蓝莓的栽培大多局限于气候及土壤条件适宜的地区，上海地区主要分布在青浦、松江、金\n山等地，上海蓝莓生产总面积约 1 500 亩。\n\n蓝莓主要病虫包括蓝莓根癌病、蓝莓僵果病等。\n\n\n\n蓝莓病害\n\n蓝莓灰霉病\n\n·病原· 灰葡萄孢（ Botrytis cinerea Pers.），属子囊菌亚门（Ascomycotina）孢盘菌属（ Botryotinia\n）。\n\n·症状· 病菌侵染蓝莓的花、果实和叶片、花序轴及枝条部位。初期从已过盛花期的残留花瓣、花托\n或幼果柱头开始侵染，后产生白色霉层；果实受害部位果皮初呈灰白色、水渍状，后组织软腐，病\n部表面密生灰色至灰白色霉层，风干后果实干瘪、僵硬；叶片染病多从叶尖发生，病斑呈“V”字\n形。\n\n·发病规律· 蓝莓开花结果期棚内温度低，在 13~23℃、空气相对湿度超过 90%条件下，持续 3 天以\n上即发病。蓝莓灰霉病病菌腐生性强，蓝莓生长势弱易发病，缺钙、缺镁利其发病，旧棚较新棚发\n病重。\n\n·防治方法·\n\n（1）做好秋冬季节修剪和清园工作，尽量消灭越冬病原菌，减少来年侵染源。\n\n（2）加强水肥管理，促进树体营养吸收，增强树势，提高树体抵抗力。\n\n（3）喷施波尔多液或石硫合剂进行预防消灭病菌工作；发病期喷施 10%苯醚甲环唑悬浮剂 1\n500~2 000 倍液，或 70%代森联水分散粒剂 500~700 倍液等杀菌剂开展治疗性防治工作，每 10~15\n天喷施 1 次，连续喷施 2 次。\n\n蓝莓灰霉病 病枝\n\n\n\n蓝莓灰霉病 病枝\n\n蓝莓灰霉病 病叶\n\n\n\n蓝莓灰霉病 病枝\n\n蓝莓灰霉病 病叶\n\n\n\n蓝莓灰霉病 病果\n\n蓝莓僵果病",
      "·防治方法·\n\n（1）注意不要采带虫接穗，苗木和接穗出圃要及时采取处理措施。\n\n（2）少用或避免使用广谱型农药，保护和利用天敌。\n\n（3）冬季和早春，喷 3~5 波美度石硫合剂，消灭越冬若虫。抓住两个防治关键，一是 4 月上中\n旬，虫体开始膨大时，喷 0.5 波美度石硫合剂；二是 5 月下旬至 6 月上旬，卵孵化盛期可喷 30%松\n脂酸钠水乳剂 150~200 倍液。\n\n东方盔蚧 群集危害\n\n\n\n东方盔蚧 群集危害\n\n\n\n东方盔蚧 介壳\n\n\n\n东方盔蚧 介壳\n\n绿盲蝽\n\n·学名· Lygus lucorum Meyer-Dur，属半翅目（Hemiptera）盲蝽科（Miridae）。\n\n·鉴别特征· 成虫：体长约 5 mm，宽约 2.5 mm，黄绿或浅绿色；头部略呈三角形，黄褐色，前胸背\n板绿色，前缘有脊棱，足绿色，胫节刺黑褐色，跗节、爪均黑色，前翅膜片半透明暗灰色。卵：长\n口袋形，长约 1 mm，黄绿色。老熟若虫：体绿色，密被黑色细毛，长约 3 mm。\n\n·生活习性· 1 年发生 3~7 代，以卵在葡萄伤口组织内或以成虫在杂草丛中越冬，翌年春季当平均气\n温达 15℃以上时越冬卵孵化。4 月中为孵化盛期。5 月上中旬成虫羽化，成虫寿命最长可达 50 余\n天。产卵期长达 30~40 天，发生世代重叠现象，成虫产卵于寄主嫩茎皮层组织内，每雌产卵数 10\n粒至 300 多粒，卵期 6~11 天，成、若虫白天多潜伏在隐蔽处，夜间活动吮吸寄主嫩叶、嫩芽、花\n蕾。喜多雨潮湿，6~8 月雨量偏多，则危害加重，温室大棚内发生严重，10 月中下旬开始产卵越\n冬。\n\n·危害特点· 以成虫和若虫刺吸葡萄幼嫩器官的汁液。被害幼叶最初出现细小黑褐色坏死斑点，严重\n时叶片扭曲皱缩；花蕾被害产生小黑斑；刺吸果实汁液，幼果产生黑色斑点，果面坏死斑变大；新\n梢生长点被害呈黑褐色坏死斑。\n\n·防治方法·\n\n（1）结合果园冬季清园，春前清除杂草。果树修剪后，应清理剪下的枝梢。\n\n（2）多雨季节注意开沟排水、中耕除草，降低园内湿度。\n\n（3）加强果园管理，改善架面通风透光条件。\n\n\n\n（4）对幼树及偏旺树，避免冬剪过重；多施磷钾肥料，控制用氮量，防止葡萄徒长。\n\n（5）发生危害时，可喷 3%啶虫脒微乳剂 2 000~2 500 倍液，或 240 g/L虫螨腈悬浮剂 1 250~2 500\n倍液等。\n\n绿盲蝽 成虫\n\n\n\n绿盲蝽 成虫\n\n\n\n\n\n\n绿盲蝽 危害叶片\n\n绿盲蝽 危害叶片\n\n\n\n绿盲蝽 成虫\n\n绿盲蝽 卵\n\n\n\n葡萄病虫防治历\n\n\n\n五、杨梅\n\n杨梅（ Myrica rubra ），属木兰纲杨梅科杨梅属，小乔木或灌木植物，原产于浙江省慈溪和余姚\n市，现在我国华东各地和湖南、广东、广西、贵州等地区均有分布，是我国的一种特产水果。世界\n杨梅 90%以上集中在中国。日本、越南、印度、泰国和欧美等国有零星栽培。\n\n2016 年，中国杨梅种植面积达 23.7 万hm 2 ，产量 83 万t左右。其中，浙江是中国杨梅的主产地。\n杨梅产量和栽培面积前 10 的主产县，浙江分别包揽 6 席、7 席，栽种面积更占到中国杨梅栽种面\n积的 60%以上。\n\n杨梅果实色泽鲜艳、汁液丰富、营养价值高、酸甜爽口，除鲜食外，还可用白酒或糖浸渍作药用，\n具有消食止呕、生津止渴、治痢疾、利尿等功效，具有很高的经济价值。杨梅是常绿阔叶树，适应\n性强，对土壤的要求不高，是园林绿化结合生产的优良树种。\n\n目前，杨梅主要病害有杨梅癌肿病、杨梅褐斑病、杨梅枝腐病、杨梅赤衣病、杨梅锈病、杨梅炭疽\n病、杨梅白腐病；虫害主要有杨梅小黄卷叶蛾、柏牡蛎蚧、星天牛、褐天牛、梳扁粉虱、蓑蛾等。\n监测的方法主要包括人工调查监测、测报灯监测、昆虫信息素监测等。\n\n\n\n杨梅病害\n\n杨梅癌肿病\n\n·病原· 丁香假单胞萨氏亚种杨梅致病变种（ Pseudomonas syringae pv.myricae），属变形细菌门\n（Proteobacteria）假单胞菌属（ Pseudomonas ）细菌，又称杨梅溃疡病，俗称“杨梅疮”。\n\n·症状· 发病初期在病枝上产生乳白色小突起，表面光滑，后逐渐增大形成球形肿瘤，表面凹凸不\n平，木栓变成褐色或黑褐色。肿瘤小型如樱桃大小，大的直径可达10 cm以上。发病枝条上的肿瘤\n少则 1~3 个，多则达 7~9 个，或更多，一般在枝节部发生较多。因营养物质运输受阻而导致树势\n早衰，严重时还会引起全株死亡。"
    ]
  },
  {
    "question": "杨梅卷叶蛾（小黄卷叶蛾）的越冬虫态及场所是什么？",
    "answer": "杨梅小黄卷叶蛾以老熟幼虫在卷叶苞内或枯枝落叶中越冬。",
    "standard_answer": "以老熟幼虫在卷叶苞内或枯枝落叶中越冬。",
    "contexts": [
      "·病原· 病原菌有性阶段为梅小丛壳[ Glomerella mume （Hori） Hemmi]，属子囊菌亚门\n（Ascomycotina）小丛壳属（ Glomerella ）；无性阶段为半知菌亚门（Deuteromycotina）炭疽菌（\nColletotrichum spp.）。\n\n·症状· 病菌主要危害杨梅春梢的枝梢和嫩叶。感病植株多在叶片边缘产生半圆形病斑，后逐渐扩\n大，病斑呈褐色或黑褐色，有些病斑呈灰白色，直径 6~8 mm，病健部有黄褐色晕圈，上有黑色小\n粒点，后病斑干燥脱落，严重时整叶枯死脱落。嫩梢被害，则布满点点病斑，逐渐变成秃枝。病菌\n也能侵染果实，使果实腐烂、脱落。\n\n·发病规律· 病菌以分生孢子和菌丝体在发病树木的嫩梢上越冬，一般 4 月底 5 月上旬开始发病，8\n月上中旬达到发病高峰期。病菌借雨水传播蔓延，一般5 月上旬雨水多，病害重。\n\n·防治方法·\n\n（1）增强树体抗病性，每年在抽梢前和采果后施用草木灰或有机肥，并对成年树根系培土。\n\n（2）在 4 月和 9 月，将感病树体的光秃梢和枯枝除去，抹去无用萌蘖，增强通风透光。\n\n（3）采果后和萌芽前各喷施1次1︰140~1︰160 的波尔多液，结果初期对树体喷洒 68%精甲霜·锰\n锌水分散粒剂600~800 倍液。\n\n（4）杀虫结合，配合杀灭蚊蝇、白蚂蚁、金龟子和蚜虫等。\n\n\n\n杨梅炭疽病 被害状\n\n杨梅炭疽病 病叶\n\n\n\n杨梅白腐病\n\n·病原· 病原青霉菌属（ Penicillium sp.）、绿色木霉菌（ Trichoderma viride Pers.Ex Fr.）为主，分别\n属子囊菌亚门（Ascomycotina）青霉菌属（ Penicillium ）以及绿色木霉属（ Trichoderma ），又称\n杨梅白腐烂、烂杨梅。\n\n·症状· 病菌主要危害杨梅果实。一般在杨梅采摘的中、后期发病。在果实表面产生许多白色霉状\n物，开始仅少数肉柱萎蔫，似果实局部软化；继而白点面积逐渐增大，蔓延至半个果实甚至全果，\n一般不到 2 天，这种带白点的杨梅果实即会脱落。\n\n·发病规律· 病菌在腐烂果或土中越冬，靠暴雨冲击将病菌飞溅到树冠近地面的果实上，再经雨水冲\n击，致使整个树冠被侵染。杨梅成熟期雨水越多，杨梅成熟度越高，果实软腐，病菌滋生，往往发\n病较重。\n\n·防治方法·\n\n（1）利用薄膜避雨设施栽培或喷洒营养液，提高果实硬度，增强抗病力。\n\n（2）在杨梅果实转色期，可喷施 10%抑霉唑水乳剂 500~700 倍液，或 250 g/L嘧菌酯悬浮剂 3\n333~5 000 倍液，或 250 g/L吡唑嘧菌酯乳油 1 000~2 000 倍液，间隔 15 天轮换使用，以减少杨梅白\n腐病病菌耐药性的产生。\n\n杨梅白腐病 病果\n\n\n\n杨梅白腐病 病果\n\n\n\n杨梅虫害\n\n杨梅小黄卷叶蛾\n\n·学名· Adoxophyes orang （Fischer v. Roslerstamm），属鳞翅目（Lepidoptera）卷蛾科\n（Tortricidae）。\n\n·鉴别特征· 成虫：体长 6~8 mm，翅展 15~20 mm，黄褐色；前翅略成长方形，在翅基部、翅中部\n及翅尖有深褐色斑纹 3 条，翅角上有“V”形褐斑；后翅淡黄色。卵：长 0.7 mm，数十粒鱼鳞状排列\n成扁平椭圆形卵块，其上覆有胶质薄膜。幼虫：体长 13~18 mm，宽 2.5 mm，黄绿色，头部棕褐\n色，前胸破皮板褐色，后缘深黑褐色，硬皮板下方两侧各有 2 个椭圆形褐斑，体毛短，绿色。蛹：\n长 7~9 mm，宽3 mm，黄褐色，腹部 2~8 节，背面近后缘有短刺 1 列，末端有钩状刺 8 根。\n\n·生活习性· 以老熟幼虫在卷叶苞内或枯枝落叶中越冬。越冬幼虫翌年 4 月上旬化蛹，下旬羽化成\n虫；成虫白天潜伏在杨梅丛中，夜间活跃，有趋光性，常把卵块产在叶面或叶背，每雌可产卵百余\n粒。初孵幼虫活泼，爬行或吐丝借风分散到新梢或展开的嫩叶上，吐丝缀结叶片成苞，躲在苞中取\n食叶肉，仅留 1 层表皮，呈枯黄色。\n\n·危害特点· 幼虫危害嫩叶，卷缩成虫苞，严重时新梢一片焦枯。嫩梢生长受抑或花蕾、幼果期受\n害，导致落蕾、落幼果。在浙西 1 年发生 5 代。除 1 代发生较整齐外，以后各代有不同程度的世代\n重叠。一般 5~9 月均为幼虫危害期，尤其春梢、果实期 5~6 月以第一二代发生危害最重，第四代\n危害次之。以幼虫爬至杨梅树嫩顶、枝梢上危害，大部分匿居在梢尖缝处，有的在嫩叶端吐丝卷\n叶，咀食叶肉。\n\n·防治方法·\n\n（1）卷叶蛾发生严重的园子，及时人工摘除或剪切新虫苞、卵块，并烧毁或深埋。\n\n（2）在果树面积较大的地方，于 5~10 月架设黑光灯、频振式杀虫灯等诱杀成虫。",
      "（3）卵期饲放赤眼蜂，每代放蜂 3~4 次，隔 5~7 天放 1 次，每亩放蜂量 2.5 万头。\n\n（4）狠抓 5~6 月份以第一二代为主害代幼虫的防治，压低虫源基数。防治可选用 0.5%苦参碱水分\n散粒剂 1 000 倍液，或 20%氯虫苯甲酰胺 5 000 倍液，或10%氟苯虫酰胺·阿维菌素 2 000~2 500 倍\n液。\n\n\n\n杨梅小黄卷叶蛾 危害状\n\n\n\n杨梅小黄卷叶蛾 危害状\n\n\n\n杨梅小黄卷叶蛾 幼虫\n\n\n\n杨梅小黄卷叶蛾 成虫\n\n柏牡蛎蚧\n\n·学名· Lepidosaphes cupressi Borchsenius，属半翅目（Hemiptera）盾蚧科（Diaspididae）。\n\n·鉴别特征· 雌成虫：介壳长形或弯曲为逗点形，前端较尖，后端宽圆，呈棕褐色。雄成虫：呈长筒\n形，介壳棕褐色。卵：初产卵呈乳白色半透明状，椭圆形，藏在雌成虫介壳内，当若虫孵化后，卵\n壳大部分留存在雌成虫介壳后端空间处。若虫：初孵若虫呈半透明，椭圆形，个体小，后变乳白\n色，行动迅速，先在雌成虫介壳下出来活动；当气候变化时，则又能回到母体下，固着于树体，吸\n取树体汁液，分泌出蜡质，有白色丝状物包裹着。\n\n·生活习性· 在浙江省一年发生 2 代，以受精雌成虫在枝条、叶片上越冬。越冬的雌成虫在 4 月中旬\n开始，产第一代卵，5 月中旬若虫孵化开始，5 月下旬至 6 月上旬为孵化高峰期，7 月上旬结束。\n即于 7 月上中旬就有枯枝出现。6 月上旬又始见雄成虫，7 月上旬达到高峰，与雌成虫交配后，于\n7 月中下旬雌成虫开始产卵，并开始孵化，8 月上旬为孵化盛期，直至 10 月上旬或中旬结束。雄蛹\n初见期为 10月中旬，隔 4~6 天后初见雄成虫，并进行交尾，以受精雌成虫越冬。\n\n·危害特点· 雌成虫主要危害 1~3 年生的杨梅枝梢，群集危害；雄成虫主要固定在叶片的中脉两侧。\n此虫从树冠中、下部的枝叶开始向上蔓延扩展；山坡地危害以西坡与北坡发生较多；郁闭园发生\n多，散生树发生少；与其他果树混栽园发生较轻，连片杨梅园发生重。\n\n·防治方法·\n\n（1）受柏牡蛎蚧危害的杨梅树，应加强肥料管理，最好使用猪、羊厩灰，促进树体健康生长。\n\n\n\n（2）结合修剪，剪除虫枝，减少虫口数量。\n\n（3）第一代若虫发生高峰期是用药防治的关键时间。喷洒 1 次 30%松脂酸钠水乳剂 300 倍液，或\n99%矿物油乳油 100~200 倍液，可获得很好的防治效果。\n\n柏牡蛎蚧 危害状\n\n\n\n柏牡蛎蚧 危害状\n\n\n\n柏牡蛎蚧 危害状\n\n星天牛\n\n·学名· Anoplophora chinensis （Förster），属鞘翅目（Coleoptera）天牛科（Cerambycidae）。\n\n·鉴别特征· 成虫：黑色，有光泽；长 19~44 mm，宽 6~13.5 mm；前胸背面中瘤明显，两侧具尖锐\n粗大的侧刺突；鞘翅基部密布黑色小颗粒突起，每翅具大小不同的小白斑 15~20 个，排成 5 横\n行，斑点排列有时很不整齐。卵：长椭圆形，长 5~6 mm，乳白色，孵化前为黄褐色。幼虫：老熟\n幼虫体长 38~60 mm，淡黄白色，体圆筒形，略扁，前胸背板有 1 块黄褐色“凸”形硬皮板，其前方\n左右各有一黄褐色形似飞鸟形斑纹。蛹：纺锤形，长约 30 mm，黄白色，老熟时呈褐色。\n\n·生活习性· 上海 1 年发生 1 代，以老熟幼虫在树干或主根的蛀道内越冬，翌年3 月恢复活动危害。\n4 月开始化蛹，蛹期 20 天左右。5 月成虫开始羽化，6 月为羽化高峰，8 月下旬仍可见成虫。羽化\n后啃食嫩枝皮、叶片作为补充营养，可造成枝叶枯萎，10 天后才交尾，交尾后 3~4 天产卵，产卵\n刻槽为“T”形或“人”形，每雌一般产卵 20~30 粒，高的可达 70 多粒。卵多产于树干基部 10 cm以\n内，5 月下旬至 6 月中旬为产卵盛期。卵期 9~15 天。6 月上旬可见初孵幼虫，共 6 龄。初孵幼虫\n先在皮层内盘旋蛀食，危害部位有细木屑和酱油状液体渗出，8 月下旬幼虫蛀入木质部。蛀至木质\n部 2~3 mm深度后，蛀成向上或向下的虫道不断危害，并向树体外排泄木屑状粪便。9 月下旬后，\n绝大部分幼虫转头向下，并渐向根部蛀食。整个幼虫期长达 10 个月，蛀道长达 50~60 cm，有的虫\n体在树体表层盘旋蛀食，造成韧皮部坏死，可使树木当年枯萎死亡或风折；11 月左右越冬。\n\n·防治方法·\n\n（1）成虫期（5~6 月）人工捕杀成虫。\n\n（2）对主干涂白，防止成虫产卵。\n\n（3）发现主干基部的刻槽，可用锤击或刮除的方法杀死卵及低龄幼虫。\n\n\n\n（4）可在成虫羽化期喷洒绿色威雷 150 倍液触杀成虫。",
      "·危害特点· 幼虫吐丝缀连叶片，潜居缀叶中取食危害，新叶受害严重。树上有果时，常将叶片缀贴\n果面上或将两果缀连在一起，在叶果间啃食果皮，将果面啃食成一个个小坑洼状虫斑，故称“舔皮\n虫”，多雨时常导致果实腐烂。\n\n·防治方法·\n\n（1）利用成虫趋光性，杀虫灯诱杀成虫。\n\n（2）药剂防治：幼虫期防治，药剂可选用 32 000 IU/mg苏云金杆菌可湿性粉剂200倍液、20%除虫\n脲悬浮剂1 200~2 000倍液、0.3%印楝素乳油400~600倍液、1%苦参碱可溶液剂 1 000~1 500 倍液。\n\n棉褐带卷蛾 成虫\n\n\n\n棉褐带卷蛾 成虫\n\n\n\n棉褐带卷蛾 幼虫\n\n棉褐带卷蛾 雄成虫\n\n\n\n棉褐带卷蛾 雄成虫\n\n梨小食心虫\n\n·学名· Grapholita molesta Busck，属鳞翅目（Lepidoptera）卷蛾科（Tortricidae），又名梨小。\n\n·鉴别特征· 参照桃树梨小食心虫（p70）。\n\n·生活习性· 参照桃树梨小食心虫（p70）。\n\n\n\n·危害特点· 参照桃树梨小食心虫（p70）。\n\n·防治方法· 参照桃树梨小食心虫（p70）。\n\n梨小食心虫 成虫\n\n\n\n梨小食心虫 成虫\n\n\n\n梨小食心虫 危害状\n\n\n\n梨小食心虫 幼虫\n\n桃蛀螟\n\n·学名· Dichocrocis punctiferalis Guenée，属鳞翅目（Lepidoptera）螟蛾科（Pyra lidae），又名桃蠹\n螟，桃斑螟。\n\n·鉴别特征· 参照桃树虫害（p72）。\n\n·生活习性· 参照桃树虫害（p72）。\n\n·危害特点· 参照桃树虫害（p72）。\n\n·防治方法· 参照桃树虫害（p72）。\n\n\n\n桃蛀螟 成虫\n\n\n\n桃蛀螟 成虫\n\n\n\n桃蛀螟 危害状\n\n\n\n桃蛀螟 幼虫\n\n梨剑纹夜蛾\n\n·学名· Acronicta rumicis Linnaeus，属鳞翅目（Lepidoptera）夜蛾科（Noctuidae），又名梨叶夜蛾。\n\n·鉴别特征· 成虫：体长 14~17 mm，翅展 32~46 mm，体灰棕色、暗棕色，头、胸及前翅黑色，前\n翅有白色斑纹，基线、内线和外线为双曲黑线，外线、亚端线为曲折白线，后翅棕黄色，外缘色\n浓，缘毛白褐色。卵：半球形，初为乳白色，后为红褐色。老熟幼虫：体长约 30 mm，褐色，体\n疏生有黄褐色长毛的毛瘤，头部黑色，腹部背面有 1 列黑斑，第二、第八节背面有 2 个红色斑纹；\n亚背线有 1 列白点；气门下线白色或灰黄色，曲折；第一至第八气门之间生有 1 个近三角形斑纹；\n毛片枯黄色、毛红色或黑色。蛹：长 15~18 mm，黑褐色。茧：长约 20 mm，椭圆形，土色。\n\n·生活习性· 梨剑纹夜蛾一年发生 3~4 代，以蛹在土中结茧越冬。翌年 5~6 月成虫羽化、交尾，卵产\n于叶上。6~7 月和 8~9 月是各代幼虫发生期，夏季在叶上结茧化蛹。10 月幼虫入土结茧、化蛹越\n冬。\n\n·危害特点· 初孵幼虫啮食叶片叶肉残留表皮，稍大食叶成缺刻和孔洞。\n\n·防治方法·\n\n（1）利用成虫趋光性，杀虫灯诱杀成虫。\n\n（2）药剂防治：幼虫期防治，药剂可选用 32 000 IU/mg苏云金杆菌可湿性粉剂200倍液、20%除虫\n脲悬浮剂1 200~2 000倍液、0.3%印楝素乳油400~600倍液、1%苦参碱可溶液剂 1 000~1 500 倍液。\n\n\n\n梨剑纹夜蛾 幼虫\n\n\n\n梨纹剑夜蛾 幼虫\n\n\n\n梨剑纹夜蛾 成虫\n\n\n\n梨剑纹夜蛾 成虫\n\n梨瘿蚊\n\n·学名· Dasineua pyri Bonche，属双翅目（Diptera）瘿蚊科（Cecidomyiidae）。\n\n·鉴别特征· 雌成虫：体长 1.4~1.8 mm，翅展 3.3~4.3 mm，腹末有长约 1.2 mm的管状伪产卵器。雄\n成虫：体长 1.2~1.4 mm，翅展约 3.5 mm，体暗红色，头小，前翅具蓝紫色闪光，后翅退化成平衡\n棒，淡黄色。卵：长椭圆形，长约 0.28 mm，初产时淡橘黄色，孵化前变为橘红色。老熟幼虫：体\n长 1.8~2.4 mm，长纺锤形，橘红色，前胸腹面有“丫”字形黄色剑骨片。蛹：裸蛹，橘红色，长\n1.6~1.8 mm，蛹外有白色胶质茧。\n\n·生活习性· 梨瘿蚊一年发生 2~3 代。3 月中旬开始出现越冬代成虫，4 月上旬为发生盛期。第一代\n成虫 5 月上旬发生，第二代成虫 6 月上旬发生。老熟幼虫脱叶后，弹落地面或随雨水沿枝干下行，\n寻找适当的场所结茧化蛹，降雨潮湿有利于梨瘿蚊的发生。\n\n·危害特点· 以幼虫危害芽和嫩叶，芽、叶被害后出现黄色斑点，叶面呈现凹凸不平，叶缘向正面卷\n曲，严重时叶片纵卷，甚至成双筒状。幼虫危害的同时不断分泌刺激性物质，使叶肉组织肿胀、畸\n形，不能展开，造成受害叶早期脱落。\n\n·防治方法·",
      "·鉴别特征· 成虫：体长 18~24.5 mm，宽 8~11.5 mm，密布黑色点刻；背部棕褐色；前胸背板、小\n盾片、前翅革质部有不规则细碎黄色突起斑纹；前翅膜质部分黑色；腹面黄白色；头部稍狭长，前\n尖；触角 5 节，黑色丝状。卵：近鼓状，顶端具盖，白色。若虫：初龄若虫胸、腹背面有许多红、\n黄、黑相间的横纹；2 龄若虫腹背前面有 6 个红黄色斑点，后面中间有 1 个椭圆形褐色突起斑；老\n熟若虫与成虫相似，红褐色或黑褐色，触角 4 节、黑色，前胸背板中部及小盾片两侧具有 6 个淡红\n色斑点，腹背中部具暗色斑 3 个，其上各有淡红色臭腺孔 2 个。\n\n·生活习性· 一年发生一代，以成虫在草丛、屋檐、墙缝、树皮裂缝、枯枝落叶下等隐蔽处越冬。越\n冬成虫于翌年 5~7 月交配产卵，卵多产于叶背，卵期 10 天。5月中旬始见初孵若虫，7~8 月羽化为\n成虫，10 月开始越冬。成虫飞行力强，喜在树冠上部活动，有假死性，受惊时分泌臭液，会假死\n掉落地面。\n\n·危害特点· 以成虫和若虫刺吸危害果实，果实整个生长期均可受害。果实受害处表面凹陷，内部组\n织石细胞增多，局部停止生长，果面凹凸不平，果实变硬、畸形、形成疙瘩梨，丧失商品价值。\n\n·防治方法·\n\n（1）人工防治：梨树发芽前，彻底清除果园内枯枝落叶、杂草，消灭越冬害虫。果实套袋，防止\n果实受害。\n\n（2）药剂防治：在产卵高峰期至若虫孵化盛期及时喷药。药剂可选用 20%啶虫脒可湿性粉剂 6\n000~8 000 倍液等。\n\n\n\n麻皮蝽 危害梨果\n\n\n\n麻皮蝽 初孵若虫\n\n\n\n麻皮蝽 若虫\n\n\n\n麻皮蝽 成虫\n\n铜绿异丽金龟\n\n·学名· Anomala corpulenta Motschulsky，属鞘翅目（Coleoptera）丽金龟科（Rutelidae），又名铜绿\n金龟子。\n\n·鉴别特征· 成虫：体长 24~30 mm，宽 15~18 mm；背面铜绿色，有光泽，前胸背板两侧具有黄褐\n色细边，鞘翅铜绿色；每翅各有隆起的纵线 3 条，腹部米黄色，有光泽，臀板三角形，常有 1 个近\n三角形黑斑。卵：白色，初产为椭圆形，后逐渐变为球形，长 2 mm左右。幼虫：体长约 40 mm，\n头部暗黄色，体乳白色，常弯曲呈“C”形，各体节多褶皱，腹部末端 3 节膨大，青黑色，肛门\n呈“一”字横裂，在肛门周边散生多根刚毛。蛹：椭圆形，长约 25 mm，土黄色。\n\n\n\n·生活习性· 铜绿异丽金龟一年发生 1 代，以 3 龄幼虫在土中越冬。翌年 4 月下旬化蛹，6~7 月成虫\n羽化出土危害，到 8 月下旬终止。成虫具有较强的趋光性和假死性，成虫咬食梨、葡萄等果树和红\n叶李、女贞等林木的叶片补充营养。幼虫于 8月出现，幼虫为蛴螬，是重要的地下害虫，在土中啃\n食多种果树、林木的根茎或根部皮层。11 月蛴螬进入越冬期。\n\n·危害特点· 以成虫咬食花蕾、花器、嫩芽及叶片危害，食成孔洞、缺刻等，严重时将花蕾、花器、\n嫩芽吃光，影响开花、坐果及树体生长。\n\n·防治方法·\n\n（1）灯光诱杀成虫。\n\n（2）下午或傍晚用震落法捕杀成虫。\n\n（3）加强管理，中耕除草、松土，捕杀幼虫。\n\n（4）幼虫危害时，开沟、打洞浇灌或泼浇杀虫剂。药剂可用苏云金杆菌或20%除虫脲悬浮剂 1\n200~2 000 倍液。\n\n\n\n铜绿异丽金龟 成虫\n\n\n\n铜绿异丽金龟 成虫\n\n\n\n铜绿异丽金龟 成虫\n\n\n\n铜绿异丽金龟 成虫\n\n\n\n铜绿异丽金龟 成虫\n\n棉褐带卷蛾\n\n·学名· Adoxophyes orana Fischer von Roslerstamm，属鳞翅目（Lepidoptera）卷蛾科\n（Tortricidae），又名苹果小卷蛾、小黄卷叶蛾。\n\n·鉴别特征· 成虫：体长 6~10 mm，翅展 15~20 mm，体黄褐色；前翅外缘较直，呈长方形，黄褐色\n或暗褐色，前翅前缘中央有斜向后缘的暗褐色带，在末端分为 2叉，呈倒“Y”字形，近前缘前端也\n有 1 条斜向后缘的暗褐色带；后翅暗黄褐色。卵：浅黄色，椭圆形略扁平，孵化时褐色。老熟幼\n虫：体长 13~15 mm，黄绿至淡绿色，头小，全身细长。蛹：黄褐色，长 9~10 mm，腹部 2~7 节背\n\n\n\n面各有 2 排刺突，第一排较第二排大。\n\n·生活习性· 棉褐带卷蛾一年发生 5~6 代，以老熟幼虫在枯枝叶中越冬。越冬幼虫 4 月末 5 月初化\n蛹，5 月上中旬羽化。成虫有趋光性，羽化后 1~2 天交尾，交尾后 2 天产卵，卵块呈鱼鳞状产在叶\n背。卵期 6~9 天。幼虫缀叶取食，当叶苞内叶片枯死时，转移结新苞，受惊后吐丝下垂。老熟幼\n虫在叶苞内化蛹。",
      "·危害特点· 幼虫在全株危害。低龄幼虫群集啃食叶片，3 龄开始分散危害叶片、嫩茎，4 龄后暴\n食，可吃光叶肉，仅剩叶脉，老熟幼虫可蛀食果实。\n\n·防治方法·\n\n（1）清除种植区域杂草，翻耕晒土或土壤灌水，破坏、恶化斜纹夜蛾的化蛹场所，消灭越冬虫\n蛹，减少虫源基数。人工摘除卵块和初孵幼虫群集危害的叶片，减少斜纹夜蛾幼虫数量，降低幼虫\n危害。\n\n（2）杀虫灯诱蛾：利用斜纹夜蛾成虫趋光性，于盛发期利用黑光灯诱杀。悬挂性诱剂诱捕器，引\n诱雄虫，降低雌雄交配率，减少后代种群数量。\n\n\n\n（3）化学防治：斜纹夜蛾 4 龄以上幼虫皮厚，具有很强的抗药性，在卵孵高峰至 3 龄幼虫分散\n前，用足药液量，均匀喷雾叶面及叶背，使药剂能直接喷到虫体和食物上，触杀、胃毒并进，增强\n毒杀效果。药剂可用 1.8%阿维菌素水乳剂3 000 倍液，或 1%苦参碱 800~1 500 倍液，每隔 5~7 天\n喷 1 次，交替使用，连喷3~4 次。一般下午用药，土表及杂草上也要喷到。\n\n斜纹夜蛾 低龄幼虫\n\n\n\n斜纹夜蛾 成虫\n\n\n\n斜纹夜蛾 低龄幼虫\n\n斜纹夜蛾 老熟幼虫\n\n玉带凤蝶\n\n\n\n·学名· Papilio polytes Linnaeus，属鳞翅目（Lepidoptera）凤蝶科（Papilionidae）。\n\n·鉴别特征· 成虫：体长 25~28 mm，翅展 95~100 mm，全体黑色；胸部背有 10个小白点，成 2 纵\n列；胸前翅外缘有 7~9 个黄白色斑点，后翅外缘呈波浪形，有尾突，翅中部有黄白色斑 7 个，横\n贯全翅似玉带。卵：球形，直径 1.2 mm，初淡黄白，后变深黄色，孵化前灰黑至紫黑色。幼虫：\n体长 45 mm，头黄褐，体绿至深绿色，前胸有紫红色臭丫腺。幼虫共 5 龄，初龄黄白色，2 龄黄褐\n色，3 龄黑褐色；1~3 龄体上有肉质突起褐淡色斑纹，似鸟粪；4 龄后油绿色，体上斑纹与老熟幼\n虫相似。蛹：长 30 mm，体色多变，有灰褐、灰黄、灰黑、灰绿等，头顶两侧和胸背部各有1突\n起，胸背突起两侧略突出似菱角形。\n\n·生活习性· 1 年发生 4 代，少数 5 代。以蛹在枝干和叶背等隐蔽处越冬。翌年5月上旬成虫开始羽\n化。成虫白天活动，交尾产卵于寄主新梢嫩叶上，多单产。第一代为 5 月中旬至 6 月中下旬危害，\n初食嫩叶边缘，后食全叶，仅剩主脉和叶柄，对幼苗和小树危害明显。6 月中下旬第一代成虫羽\n化，第二三代成虫期在 7 月中下旬和 8 月中下旬。2~4 代幼虫期分别在 6 月下旬至 7 月下旬、7 月\n下旬至 8 月上旬、8 月下旬至 9 月中旬。\n\n·危害特点· 以幼虫危害柑橘的芽、嫩叶和新梢。叶片被啃食成孔洞状，严重时全叶被吃的仅剩叶\n柄。苗木和幼树受害时可影响抽梢。\n\n·防治方法·\n\n（1）对幼苗、小树可人工捕杀卵、幼虫和蛹。\n\n（2）药剂防治：可用 32 000 IU/mg苏云金杆菌可湿性粉剂，或 25%灭幼脲Ⅲ号 1 500 倍液，或\n0.3%苦参碱水剂 1 000 倍液喷雾防治。\n\n玉带凤蝶 卵\n\n\n\n玉带凤蝶 1 龄幼虫\n\n玉带凤蝶 3 龄幼虫\n\n玉带凤蝶 4 龄幼虫\n\n\n\n玉带凤蝶 5 龄幼虫\n\n玉带凤蝶 预蛹\n\n\n\n玉带凤蝶 雌成虫\n\n\n\n玉带凤蝶 雄成虫\n\n柑橘凤蝶\n\n·学名· Papilio xuthus Linnaeus，属鳞翅目（Lepidoptera）凤蝶科（Papilionidae）。\n\n·鉴别特征· 成虫：体长约 27 mm，翅展 91 mm左右，翅绿黄色，沿脉纹有黑色带。幼虫：黄绿\n色，体长 48 mm左右；4 龄前黑褐色，杂有白色，形似鸟粪；5龄幼虫绿色，体肥壮，体表光滑，\n疣突消失，气门黄色或白色、椭圆形、小，后胸背面两侧各有 1 枚蛇眼状斑，前缘红色，中后部分\n黑色，中部有一白色纵纹；两眼斑间为一浅黄绿色横带，带内具开口向后的墨绿色“U”形\n纹；“Y”形嗅腺发达，橙黄色，气味浓烈。卵：长 1~1.3 mm，散产，初产时淡黄色，逐渐加深为黄\n褐色；圆球状，无明显棱脊，有的卵壳上布有不明显的微小皱纹。蛹：长 24~30 mm，宽8~11\nmm；近菱形，头顶部分叉，猫头状；背面凹陷，腹面凸起；初化蛹时腹面灰白色，背面淡黄绿\n色。\n\n·生活习性· 4 月始见成虫。卵产于嫩梢、叶上。幼虫 3 龄前食叶肉，虫体褐色似鸟粪，后渐变黄绿\n色，啃食全叶，受惊时会伸出橘黄色臭角腺。\n\n·危害特点· 参照玉带凤蝶\n\n·防治方法· 参考玉带凤蝶\n\n\n\n柑橘凤蝶 成虫\n\n\n\n柑橘凤蝶 成虫\n\n柑橘凤蝶 末龄幼虫\n\n\n\n柑橘凤蝶 幼虫\n\n\n\n柑橘凤蝶 蛹\n\n\n\n柑橘被害状及三龄幼虫\n\n柑橘凤蝶 幼虫\n\n\n\n柑橘凤蝶 蛹\n\n\n\n蜗牛和蛞蝓类"
    ]
  },
  {
    "question": "星天牛的产卵刻槽呈什么形状？",
    "answer": "星天牛的产卵刻槽呈“U”形或马蹄形。",
    "standard_answer": "星天牛的产卵刻槽为“T”形或“人”形。",
    "contexts": [
      "（5）幼虫孵化后仍在皮层内蛀食（6~7 月），可利用“细木屑”和“酱油状液体流出”等特征在危害\n部人工挖除、钩杀皮层内的幼虫。\n\n星天牛 排泄物\n\n\n\n星天牛 羽化孔\n\n\n\n星天牛 取食刻槽\n\n\n\n星天牛 幼虫\n\n\n\n星天牛 蛹\n\n\n\n星天牛 雌成虫\n\n\n\n星天牛 雄成虫\n\n褐天牛\n\n·学名· Nadezhdiella cantori Hope，属鞘翅目（Coleoptera）天牛科（Ceram bycidae）。\n\n·鉴别特征· 成虫：体长 26~51 mm，黑褐色或黑色，有光泽，体表长有灰黄色绒毛，头、胸、背面\n稍带黄褐色；雄成虫触角超过体长的 1/2~2/3，雌成虫触角较身体略短。卵：圆形，长约 8 mm，初\n产时呈乳白色，后变为黄褐色，卵壳上有网状花纹。老熟幼虫：体长 46~50 mm，乳白色。蛹：乳\n白色或淡黄色，翅芽端部可达腹部第三节末端。\n\n·生活习性· 褐天牛在浙江省 2 年发生 1 代，以幼虫或成虫在枝干内越冬，幼虫期长达 15~20 个月。\n7 月上旬前孵化的幼虫，于翌年 8 月上旬到 10 月上旬化蛹，10月上旬至 11 月上旬羽化为成虫，并\n在蛹室中潜伏越冬；8 月以后孵化的幼虫需经历2 个冬季，到第三年的 5~6 月化蛹，8 月以后成虫\n外出活动，越冬虫态有成虫、2 年生幼虫和当年生幼虫。\n\n·防治方法·\n\n（1）剪除杨梅树上的病虫枝，保持树干光滑，4~8 月清除树根基部杂草，杜绝天牛成虫钻入危\n害。在天牛成虫钻出羽化孔时，人工捕捉成虫，一般在 5~6 月晴天中午及午后或傍晚进行，此时\n\n\n\n成虫多栖息枝端，在树枝上交尾。利用天牛成虫体型较大、行动迟缓、受震后假死坠地的特性，直\n接摇树，待成虫假死坠地后捕杀。4~8 月发现树干基部有幼虫蛀食排出木屑，可用细钢丝钩杀幼\n虫，或在蛀入孔塞入药棉杀灭幼虫。\n\n（2）清除果园周围杂草、残枝落叶，及时中耕除草，破坏杨梅天牛的栖息与产卵场所。加强栽培\n管理，树干根茎部定期培上厚土，以提高天牛的产卵部位，便于清除卵粒。在冬春季涂白枝干，堵\n塞树干上洞孔，以减少杨梅天牛产卵。\n\n（3）在果园边缘、山顶、林道旁设置诱捕器，或悬挂频振式杀虫灯、黑光灯等，诱杀天牛成虫。\n\n（4）充分利用天敌昆虫、食虫螨类、食虫鸟类等防控杨梅天牛，亦可应用肿腿蜂、病原线虫等进\n行生物防治。\n\n褐天牛 成虫\n\n\n\n褐天牛 成虫\n\n\n\n褐天牛 成虫\n\n褐天牛 成虫\n\n梳扁粉虱\n\n·学名· Aleuroplatus pectiniferus Quaintance ＆ Baker，属半翅目（Hemiptera）扁粉虱属（\nAleuroplatus ），又称胶扁粉虱、黑胶粉虱。\n\n·鉴别特征· 雌成虫：长 2 mm，头胸部暗灰色，腹部橘红色，腹末开口呈钝端，有短柄附于叶背\n\n\n\n面，前翅暗灰色，有 6 块淡黄色斑，后翅亦有淡色斑。雄成虫：略小于雌成虫，交配辅器钳状，突\n出于腹部末端，配器楔形。卵：黄褐色，香蕉形，略弯曲，竖立，卵壳表面光滑，长约 0.2 mm，\n有卵柄，附于叶背上。幼虫：初孵时体长 0.25 mm左右，粉红或浅黄色，后逐渐变成红棕色；2 龄\n幼虫长梨圆形，前端略尖，后端平截而向内略凹入，背部漆黑革质，腹面灰白膜质，背面中部有脊\n状隆起。胸气门陷处各有一簇白色蜡毛，臀部也有一团蜡毛，体缘腺成栉齿状突出；2龄后的幼虫\n失去胸足与触角，呈扁椭圆形，介壳状，黑色，臀部有一簇白色蜡毛。蛹：长约lmm，为裸蛹，初\n蛹淡黄色，半透明；后渐变为橙黄色，复眼黑色，翅芽灰色，伪蛹壳黑色，卵圆形，前端尖小，后\n端锐圆，在胸气管褶处稍收缩，整个蛹壳深埋于胶质下。\n\n·生活习性· 在浙江 1 年发生 1 代，以 2 龄幼虫于黑色蛹壳下在叶背越冬。次年 3月下旬化蛹，4 月\n上旬开始羽化，4 月中旬为羽化盛期。成虫有多次交尾现象，交尾后即可产卵，卵大多产于新梢叶\n背边缘。每次雌成虫产卵量 21~40 粒。成虫产卵后转移到新梢嫩叶上栖息，善飞翔，群集性。卵\n期 2 个月，幼虫在 6 月上中旬出现，善于爬行，幼虫群集在叶片背面吸取汁液，严重时每叶近百\n头，分泌大量蜜露等排泄物，从而诱发煤污病，影响光合作用，导致枝枯叶落，树势衰退。7 月中\n下旬普遍蜕皮后进入 2 龄幼虫，虫体背腹扁平，形成黑色介壳，并分泌无色透明的黏胶固定着虫\n体，2龄幼虫以后就在介壳下发育至 3 龄，直到化蛹为止不再迁移位置。\n\n·防治方法·\n\n（1）剪掉衰弱和密生枝条，增加树体通风透光，降低虫口密度。\n\n（2）喷洒生物益菌座壳孢菌，对水喷洒树冠或与其他杀虫剂混用。\n\n（3）用背负式喷雾器，在叶背、叶面、树干喷施 99%矿物油乳油 100~200倍液。\n\n\n\n梳扁粉虱 危害状\n\n\n\n梳扁粉虱 虫体\n\n\n\n梳扁粉虱 危害状\n\n蓑蛾",
      "·鉴别特征· 成虫：体长 8.5~10 mm，翅展 24~36 mm；头胸背面黑褐色，腹面深褐色；头、胸及前\n翅表面多被绿色蜡粉；前翅前缘、外缘深褐色，向中域及后缘颜色逐渐变淡；前缘外方 1/3 处稍凹\n入，此处有 1 个三角形至半圆形淡黄褐色斑；后翅暗褐色，半透明。卵：长 0.8~1.2 mm，乳白\n色，长卵形；初产时为乳白色，后渐变成白色至浅蓝色；近孵化时为灰褐色。若虫：体长 3~6\nmm，体略呈钝菱形，翅芽处最宽，体疏被白色蜡粉，腹部末端有 10 条白色绵毛状蜡丝，呈扇状\n伸出，其中 2条向上向前弯曲并张开，平时腹端上弯，白色绵毛状蜡丝覆于体背以保护身体，常可\n作孔雀开屏状。\n\n·生活习性· 南方一般 1 年发生 2 代，以卵于当年生枝条内、叶脉或叶柄的组织内越冬。翌年 4 月上\n旬至 4 月下旬陆续孵化，若虫盛发期在 4 月中旬至 6 月上旬；第二代若虫盛发期在 8~9 月。成虫\n白天活动，擅跳、飞行迅速，喜于嫩枝、芽、叶上刺吸汁液。\n\n·危害特点· 成虫飞行力较强且迅速，产卵于当年生枝木质部内，再分泌白色棉絮状物覆盖卵表面。\n若产卵枝条较粗，尚不会造成枝枯，但如枝条较细，则会造成枝梢枯死。\n\n·防治方法·\n\n（1）冬春季节，剪除树枝上卵块，清除果园内杂草，集中销毁，减少越冬虫源。\n\n（2）保护好园内草蛉、异色瓢虫、螳螂等生物天敌。\n\n（3）及时监测虫情，在若虫 1~3 龄期，选择 0.3%苦参碱水剂 600~800 倍液进行喷雾防治。\n\n\n\n柿广翅蜡蝉 若虫\n\n柿广翅蜡蝉 成虫\n\n柿广翅蜡蝉 产卵及危害状\n\n\n\n柿广翅蜡蝉 成虫\n\n八点广翅蜡蝉\n\n·学名· Ricania speculum Walker，属半翅目（Hemiptera）广翅蜡蝉科（Ricaniidae）。\n\n·鉴别特征· 成虫：体长 6~7 mm，翅展 18~27 mm；头、胸部黑褐色；触角刚毛状；翅革质、密布\n纵横网状脉纹；前翅宽大，略呈三角形，翅面被稀薄白色蜡粉，翅上具灰白色透明斑 5~6 个；后\n翅半透明，翅脉煤褐色，中室端有 1 个白色透明斑。卵：长卵圆形，长 1.2~1.4 mm，乳白色。若\n虫：低龄乳白色；体略呈钝菱形，暗黄褐色；腹部末端有 4 束白色绵毛状蜡丝，呈扇状伸出，中间\n一对略长；蜡丝被于体背以保护身体，常可呈孔雀开屏状，向上直立或伸向后方。\n\n·生活习性· 1 年发生一代，以卵在当年生枝条里越冬。若虫 5 月中下旬至 6 月上中旬孵化，低龄若\n虫常数头排列于同一嫩枝上刺吸汁液危害，4 龄后散布于枝梢叶果间，爬行迅速，善于跳跃，若虫\n期 40~50 天。7 月上旬成虫羽化，危害至 10 月。成虫产卵于当年生嫩枝木质部内，产卵孔排成一\n纵列，孔外带出部分木丝并覆有白色絮状蜡丝。成虫有聚集产卵的习性。\n\n·危害特点· 成、若虫刺吸嫩枝、芽、叶汁液；排泄物易引发病害；雌虫产卵时将产卵器刺入嫩枝茎\n内，破坏枝条组织，被害嫩枝轻则叶枯黄、长势弱且难以形成叶芽和花芽，重则枯死。\n\n·防治方法· 参照柿广翅蜡蝉。\n\n\n\n八点广翅蜡蝉 产卵刻槽\n\n八点广翅蜡蝉 成虫\n\n\n\n八点广翅蜡蝉 成虫\n\n八点广翅蜡蝉 成虫\n\n白星花金龟\n\n\n\n·学名· Liocola brevitarsis Lewis，属鞘翅目（Coleoptera）金龟科（Scarabaeidae），别称白星花金龟\n子。\n\n·鉴别特征· 成虫：体长 17~24 mm，宽 9~12 mm，椭圆形，具古铜或青铜色光泽，体表散布众多不\n规则白绒斑；触角深褐色；前胸背板与鞘翅前缘之间有一个三角片；鞘翅宽大，近长方形，白绒斑\n多为横向波浪形。卵：圆形至椭圆形，乳白色，长1.7~2 mm。幼虫：体长 24~39 mm，头部褐色，\n体柔软肥胖而多皱纹，常弯曲呈“C”状。蛹：体长 20~23 mm，裸蛹，初为黄白，渐变为黄褐。\n\n·生活习性· 一年发生 1 代，主要以 2~3 龄幼虫于土中越冬，以地下根或腐殖质为食。翌年 4~6 月，\n幼虫在地下 20 cm深的土壤中老熟化蛹；大约 20 天后，蛹羽化为成虫；成虫于 5 月上旬出现，6~7\n月为发生盛期。成虫白天活动，有假死性，受惊后掉落或飞走；对甜味、酒醋味有趋性，飞行力\n强，常群聚危害花、果，产卵于土中。卵期 10~12 天孵化成幼虫（蛴螬），幼虫在土壤中取食并\n进行越冬。幼虫多以腐败物为食，并危害根系。\n\n·危害特点· 成虫主要危害花和果实，至花腐烂，果实近成熟时被啃食至果肉腐烂。幼虫主要危害果\n树根系。\n\n·防治方法·\n\n（1）冬春深翻土壤，树干涂白，消灭越冬虫源。\n\n（2）自制糖醋液诱杀成虫。\n\n（3）利用成虫的假死性和趋化性，于清早或傍晚在树下铺塑料布，摇动树体，捕杀成虫。\n\n（4）利用杀虫灯光诱杀成虫。\n\n\n\n\n\n\n白星花金龟 成虫",
      "mm，黄白色。\n\n·生活习性· 华东地区 2 年发生 1 代，以一或二年生幼虫于蛀道内越冬。经过两个冬天的幼虫到第三\n年 6~7 月间化蛹。成虫 6 月下旬至 7 月中下旬为盛发期。成虫喜欢取食桑树枝干皮补充营养。成\n虫产卵前，用上颚将树皮啃成乱麻状，然后在内产一粒卵。幼虫孵化后渐入心髓，由上向下钻蛀，\n每隔 5~6 cm咬一排粪孔，第三年达 17~19 个。\n\n·危害特点· 成虫食害嫩枝皮和叶；幼虫蛀害枝干的皮下和木质部内，向下蛀食，隧道内无粪屑，隔\n一定距离向外蛀 1 通气排粪屑孔，排出大量粪屑，导致树势早衰，重者枯死。\n\n·防治方法·\n\n（1）根据啃食枝条皮层症状及早捕杀成虫。根据产卵刻槽切除卵粒。\n\n（2）果园周围少种桑类植物、榆树、杨树、刺槐等。\n\n（3）春秋两季为药杀幼虫关键时期。向鲜粪排孔内注药，每孔蛀入 10 ml药液后用泥土将孔封\n闭，药剂可用 1.8%阿维菌素水乳剂 500 倍液，发现幼虫排粪孔后，将药液注入。\n\n\n\n桑天牛 卵\n\n桑天牛 幼虫\n\n\n\n\n\n\n桑天牛 幼虫及危害状\n\n桑天牛 蛹\n\n\n\n桑天牛 羽化孔\n\n\n\n桑天牛 成虫\n\n\n\n桑天牛 取食刻槽\n\n\n\n\n\n\n七、柿\n\n柿树为柿科柿属落叶大乔木，原产我国长江流域，且已有三千多年栽培历史。柿树是深根性树种，\n喜温暖，适生于中性土壤，较耐寒，耐旱，不耐盐碱。柿树除有食用价值，还具有良好的观赏效\n果，可作为观赏树种。入秋后的柿果和柿叶颜色鲜艳，令人赏心悦目。\n\n据不完全统计，中国栽培的柿树品种有 800 个以上。上海地区柿主要分布在金山区、崇明区等地，\n上海柿生产总面积约 520 亩，主要病虫包括柿绒蚧、白星花金龟、柿树角斑病、柿黑星病等。\n\n\n\n柿树病害\n\n柿树炭疽病\n\n·病原· 柿盘长孢菌（ Gloeosporium kaki ），属半知菌亚门（Deuteromycotina）盘长孢属（\nGloeosporium ）。\n\n·症状· 果实、嫩梢和叶片均可染病。果实发病初期出现深褐色或黑色小斑点，逐渐扩大为圆形或椭\n圆形病斑，稍凹陷，外围呈黄褐色，病斑中央密生灰色至黑色轮纹状排列的小粒；果内形成黑色硬\n块，果实早落，一般一个病果上有 1~2 个病斑，多的也有十几个。新梢感病初期产生黑色小圆\n斑，扩大后病斑暗褐色，长椭圆形，中部稍凹陷并现褐色纵裂，产生黑色小点；病斑下部木质部腐\n朽，枝条易枯死。叶片发病时，叶片病斑多在叶柄和叶脉上出现，病斑开始为黄褐色，后期变为黑\n色或黑褐色，长条状或不规则形。\n\n·发病规律· 病菌以菌丝体在枝梢病部或病果、叶痕及冬芽中越冬。翌年夏天产生分生孢子，借风\n雨、昆虫传播，从伤口或皮孔直接侵入。枝梢发病一般始于 6 月上旬；果实发病时期一般在 6 月下\n旬至采收期。发病重时 7 月下旬果实开始脱落。高温、高湿利于发病，雨后气温升高或夏季多雨发\n病重。\n\n·防治方法·\n\n（1）加强水肥管理，增强树势，提高树体抗病力，改善园内通风透光条件，降低田间湿度。多施\n有机肥，增施磷、钾肥。\n\n（2）冬春季节及时修剪病枝，摘除病僵果，并清园，消灭越冬病原。\n\n（3）药剂防治：发芽前喷施 45%石硫合剂晶体 30 倍液做好预防保护；展叶、幼果期喷施波尔多\n液 100 倍液等杀菌剂进行治疗性防治。\n\n柿树炭疽病 病果\n\n\n\n柿树炭疽病 病果\n\n柿树炭疽病 病果\n\n\n\n柿树炭疽病 病枝和病果\n\n\n\n柿树炭疽病 分生孢子盘和分生孢子\n\n柿树黑星病\n\n·病原· 柿黑星孢（ Fusicladium kaki Hori et Yoshino），属半知菌亚门（Deutero mycotina）黑星孢属\n（ Fusicladium ）。\n\n·症状· 果实、叶片和枝梢均可染病。果实病斑圆形或不规则形，稍硬化呈疮痂状，病斑处易裂开，\n病果易脱落。叶片染病初期，叶脉上生黑色小点，后沿叶脉蔓延扩大为多角形或不定形漆黑色病\n斑，湿度大时背面出现黑色霉层，即病菌分生孢子梗和分生孢子。枝梢染病形成纺锤形或椭圆形淡\n褐色凹陷病斑，重则病斑处开裂呈溃疡状或折断。\n\n·发病规律· 病菌以菌丝或分生孢子在枝梢病斑上或病叶、病果上越冬。翌年春孢子萌发，从气孔、\n皮孔和伤口等处直接侵入，5 月间病菌形成菌丝后产生分生孢子，借风雨传播，潜育期 7~10 天，\n进行多次再侵染，扩大蔓延。\n\n·防治方法·\n\n（1）萌芽展叶时，树体喷施 5 波美度石硫合剂或 1∶4∶400 倍式波尔多液 1~2次，预防保护新\n叶；萌芽后喷施苯醚甲环唑等内吸治疗药剂进行防治；生长季节一般掌握在 6 月上中旬、落花后喷\n施嘧菌酯、代森联等杀菌剂杀灭园内病菌孢子，可使用 50%嘧菌酯水分散粒剂 1 000~2 000 倍液，\n或 50%多菌灵可湿性粉剂600~800 倍液等。",
      "（3）卵期饲放赤眼蜂，每代放蜂 3~4 次，隔 5~7 天放 1 次，每亩放蜂量 2.5 万头。\n\n（4）狠抓 5~6 月份以第一二代为主害代幼虫的防治，压低虫源基数。防治可选用 0.5%苦参碱水分\n散粒剂 1 000 倍液，或 20%氯虫苯甲酰胺 5 000 倍液，或10%氟苯虫酰胺·阿维菌素 2 000~2 500 倍\n液。\n\n\n\n杨梅小黄卷叶蛾 危害状\n\n\n\n杨梅小黄卷叶蛾 危害状\n\n\n\n杨梅小黄卷叶蛾 幼虫\n\n\n\n杨梅小黄卷叶蛾 成虫\n\n柏牡蛎蚧\n\n·学名· Lepidosaphes cupressi Borchsenius，属半翅目（Hemiptera）盾蚧科（Diaspididae）。\n\n·鉴别特征· 雌成虫：介壳长形或弯曲为逗点形，前端较尖，后端宽圆，呈棕褐色。雄成虫：呈长筒\n形，介壳棕褐色。卵：初产卵呈乳白色半透明状，椭圆形，藏在雌成虫介壳内，当若虫孵化后，卵\n壳大部分留存在雌成虫介壳后端空间处。若虫：初孵若虫呈半透明，椭圆形，个体小，后变乳白\n色，行动迅速，先在雌成虫介壳下出来活动；当气候变化时，则又能回到母体下，固着于树体，吸\n取树体汁液，分泌出蜡质，有白色丝状物包裹着。\n\n·生活习性· 在浙江省一年发生 2 代，以受精雌成虫在枝条、叶片上越冬。越冬的雌成虫在 4 月中旬\n开始，产第一代卵，5 月中旬若虫孵化开始，5 月下旬至 6 月上旬为孵化高峰期，7 月上旬结束。\n即于 7 月上中旬就有枯枝出现。6 月上旬又始见雄成虫，7 月上旬达到高峰，与雌成虫交配后，于\n7 月中下旬雌成虫开始产卵，并开始孵化，8 月上旬为孵化盛期，直至 10 月上旬或中旬结束。雄蛹\n初见期为 10月中旬，隔 4~6 天后初见雄成虫，并进行交尾，以受精雌成虫越冬。\n\n·危害特点· 雌成虫主要危害 1~3 年生的杨梅枝梢，群集危害；雄成虫主要固定在叶片的中脉两侧。\n此虫从树冠中、下部的枝叶开始向上蔓延扩展；山坡地危害以西坡与北坡发生较多；郁闭园发生\n多，散生树发生少；与其他果树混栽园发生较轻，连片杨梅园发生重。\n\n·防治方法·\n\n（1）受柏牡蛎蚧危害的杨梅树，应加强肥料管理，最好使用猪、羊厩灰，促进树体健康生长。\n\n\n\n（2）结合修剪，剪除虫枝，减少虫口数量。\n\n（3）第一代若虫发生高峰期是用药防治的关键时间。喷洒 1 次 30%松脂酸钠水乳剂 300 倍液，或\n99%矿物油乳油 100~200 倍液，可获得很好的防治效果。\n\n柏牡蛎蚧 危害状\n\n\n\n柏牡蛎蚧 危害状\n\n\n\n柏牡蛎蚧 危害状\n\n星天牛\n\n·学名· Anoplophora chinensis （Förster），属鞘翅目（Coleoptera）天牛科（Cerambycidae）。\n\n·鉴别特征· 成虫：黑色，有光泽；长 19~44 mm，宽 6~13.5 mm；前胸背面中瘤明显，两侧具尖锐\n粗大的侧刺突；鞘翅基部密布黑色小颗粒突起，每翅具大小不同的小白斑 15~20 个，排成 5 横\n行，斑点排列有时很不整齐。卵：长椭圆形，长 5~6 mm，乳白色，孵化前为黄褐色。幼虫：老熟\n幼虫体长 38~60 mm，淡黄白色，体圆筒形，略扁，前胸背板有 1 块黄褐色“凸”形硬皮板，其前方\n左右各有一黄褐色形似飞鸟形斑纹。蛹：纺锤形，长约 30 mm，黄白色，老熟时呈褐色。\n\n·生活习性· 上海 1 年发生 1 代，以老熟幼虫在树干或主根的蛀道内越冬，翌年3 月恢复活动危害。\n4 月开始化蛹，蛹期 20 天左右。5 月成虫开始羽化，6 月为羽化高峰，8 月下旬仍可见成虫。羽化\n后啃食嫩枝皮、叶片作为补充营养，可造成枝叶枯萎，10 天后才交尾，交尾后 3~4 天产卵，产卵\n刻槽为“T”形或“人”形，每雌一般产卵 20~30 粒，高的可达 70 多粒。卵多产于树干基部 10 cm以\n内，5 月下旬至 6 月中旬为产卵盛期。卵期 9~15 天。6 月上旬可见初孵幼虫，共 6 龄。初孵幼虫\n先在皮层内盘旋蛀食，危害部位有细木屑和酱油状液体渗出，8 月下旬幼虫蛀入木质部。蛀至木质\n部 2~3 mm深度后，蛀成向上或向下的虫道不断危害，并向树体外排泄木屑状粪便。9 月下旬后，\n绝大部分幼虫转头向下，并渐向根部蛀食。整个幼虫期长达 10 个月，蛀道长达 50~60 cm，有的虫\n体在树体表层盘旋蛀食，造成韧皮部坏死，可使树木当年枯萎死亡或风折；11 月左右越冬。\n\n·防治方法·\n\n（1）成虫期（5~6 月）人工捕杀成虫。\n\n（2）对主干涂白，防止成虫产卵。\n\n（3）发现主干基部的刻槽，可用锤击或刮除的方法杀死卵及低龄幼虫。\n\n\n\n（4）可在成虫羽化期喷洒绿色威雷 150 倍液触杀成虫。",
      "·危害特点· 主要在苹果树干枝的伤疤、隙缝及根部等处吸取养分，影响树势和花芽分化，造成减\n产，危害方式较为隐蔽。树干、枝条和根系受害严重处，逐渐形成瘤状突起，被覆大量白色棉絮状\n物，拨去棉絮状物，可见红色蚜虫体。\n\n·防治方法·\n\n（1）苹果发芽前树干喷施 45%石硫合剂晶体。\n\n（2）参见苹果黄蚜的防治用药。\n\n\n\n苹果绵蚜 聚集危害\n\n苹果绵蚜 聚集危害\n\n\n\n苹果绵蚜 聚集危害\n\n苹果绵蚜 聚集危害\n\n\n\n苹果绵蚜 聚集危害\n\n山楂叶螨\n\n·学名· Tetranyhus viennensis ，属蛛形纲（Arachnida）叶螨科（Tetranychidae）。\n\n·鉴别特征· 成螨：雌成螨卵圆形，体长 0.54~0.59 mm，冬型鲜红色，夏型暗红色；雄成螨体长\n0.35~0.45 mm，体末端尖削，橙黄色。卵：圆球形，春季产卵呈橙黄色，夏季产卵呈黄白色。幼\n螨：初孵幼螨体圆形、黄白色，取食后为淡绿色，3对足。若螨：4 对足，前期若螨体背开始出现\n刚毛，两侧有明显墨绿色斑，后期若螨体较大，体形似成螨。\n\n·生活习性· 1 年发生 5~9 代，以受精雌虫在树皮裂缝、靠近树干基部 3 cm处的土缝中越冬，有时还\n可以在杂草、枯枝落叶或石块下面越冬。华北地区多在 4 月上旬出蛰，并上树危害；6 月上旬为第\n二代卵孵化盛期，如防治不及时，易导致山楂叶螨的暴发流行，致叶片焦枯脱落。该虫危害时间较\n长，4~7 月均可危害，7 月份以后出现越冬虫态。\n\n·危害特点· 以幼螨、若螨和成螨危害叶片。常群集在叶片背面的叶脉两侧，并吐丝拉网，在网下刺\n吸叶片汁液。被害叶片出现失绿斑点，甚至变成黄褐色或红褐色，光合作用降低，严重者枯焦，似\n火烧状，提前落叶。\n\n·防治方法·\n\n（1）萌芽前刮除翘皮、粗皮，消灭大量越冬虫源。\n\n（2）3 月下旬喷布 45%石硫合剂晶体。\n\n（3）药剂防治：生长期喷药，可选用 5%噻螨酮可湿性粉剂、20%哒螨灵可湿性粉剂 2 000 倍液、\n5.6%阿维·哒螨灵微乳剂 1 000 倍液、24%螺螨酯悬浮剂4 000 倍液等。\n\n\n\n山楂叶螨 成螨\n\n\n\n山楂叶螨（镜下） 成螨\n\n\n\n山楂叶螨 危害状\n\n\n\n山楂叶螨 聚集危害\n\n桃小食心虫\n\n·学名· Carposina sasakii Matsumura ，属鳞翅目（Lepidoptera）卷蛾科（Tortricidae）。\n\n\n\n·鉴别特征· 雌性成虫：体较大，体长 7~8 mm，翅展 15~18 mm；雄性虫体较小，体长 5~6 mm，翅\n展 13~15 mm，全体灰白色至灰褐色，复眼红褐色，成虫前翅前缘后方有一个倒三角形黑斑。老熟\n幼虫：长13~16 mm，桃红色，腹部色淡，头黄褐色，前胸盾黄褐至深褐色，臀板黄褐或粉红；前\n胸只 2 根刚毛；腹足趾钩单序环 10~24个，臀足趾钩 9~14 个，无臀栉。\n\n·生活习性· 1 年发生 1~2 代，以 2 代为主。以老熟幼虫在树干周围土层内做扁圆形茧越冬。5 月中\n下旬开始咬破越冬茧爬出地面，寻找土质松软、较潮湿的场所做“蛹化茧”化蛹。5 月初土壤越潮\n湿，幼虫开始出土时间越晚。一般越冬代幼虫出土至成虫羽化需 14~20 天。越冬代成虫出现时间\n在 6 月中下旬，可延续到 7 月初。第一代成虫 8 月中下旬发生，以晚熟品种（如富士）落卵最多，\n幼虫发育成熟后脱果入土结茧越冬。\n\n·危害特点· 初孵幼虫蛀果后，蛀孔常流出透明水珠状果胶，称“眼泪滴”，干后呈白色。幼虫在果内\n窜食，后达果心。蛀道内留有淡褐色虫粪，称“豆沙馅”。危害严重时，果面凹凸不平，畸形，\n称“猴头果”。幼虫脱果后，果面有小圆形脱果孔。\n\n·防治方法·\n\n（1）6 月上旬使用 3%辛硫磷颗粒剂，按每亩 3~5 kg撒施到树干周围，施药后浅锄，使农药进入表\n土层内，或用 40%辛硫磷乳油 500 倍液喷灌树基周围。\n\n（2）利用桃小食心虫性诱剂测报，从连续诱到成虫开始喷药。药剂有 25%灭幼脲悬浮剂 1 000 倍\n液、35%氯虫苯甲酰胺悬浮剂 7 000~10 000 倍液等。\n\n\n\n桃小食心虫 苹果被害状\n\n桃小食心虫 越冬茧\n\n\n\n桃小食心虫 卵\n\n\n\n桃小食心虫 蛹化茧\n\n桃小食心虫 幼虫\n\n\n\n桃小食心虫 蛹\n\n\n\n桃小食心虫 羽化状\n\n\n\n桃小食心虫 成虫\n\n\n\n桃小食心虫 成虫\n\n桑天牛\n\n·学名· Apriona germari （Hope），属鞘翅目（Coleoptera）天牛科（Cerambycidae）。\n\n·鉴别特征· 成虫：体长 34~46 mm，体和鞘翅黑色，被黄褐色短毛。卵：长椭圆形，长 5~7 mm，\n前端较细，略弯曲，黄白色。幼虫：圆筒形，长大时长 45~60 mm，乳白色。蛹：纺锤形，长约 50"
    ]
  },
  {
    "question": "苹果腐烂病主要有哪两种症状类型？",
    "answer": "苹果腐烂病主要有两种症状类型：溃疡型和枝枯型。  \n溃疡型初期病部呈红褐色、稍隆起，组织松软，按压下陷，常流出黄褐色液体，后期病皮破裂、收缩下陷，出现小黑点，最终导致上部枝条枯死。  \n枝枯型多发生在衰弱枝条或干桩部位，病斑扩展环绕枝条一周后，造成整枝枯死，并在病部产生黑色小点。",
    "standard_answer": "主要有溃疡型和枝枯型两种症状。",
    "contexts": [
      "·病原· 苹果黑腐皮壳菌（ Valsa mali Miyabe et Yamada），属子囊菌亚门（Ascomycotina）腐皮壳\n属（ Diaporthe ）。无性阶段为苹果干腐烂壳蕉孢菌（ Cytospora mandshurica Miura），属半知菌\n亚门（Deuteromycotina）囊孢壳属（ Physalospora ）。\n\n·症状· 主要在苹果树的主干和大枝分杈部位发病，一般表现为主干受害皮层腐烂坏死，具体为两\n种，即溃疡性和枝枯型。溃疡型：发病初期，病部呈现红褐色，稍微隆起，出现水渍状或组织松\n软，内部组织变成暗红褐色，使用手指按压下陷。一般的病部流出黄褐色的液体，病皮易破裂。病\n部因失水而逐渐收缩下陷，产生明显的小黑点。最终致上部枝条枯死。枝枯型：发病于比较弱势的\n枝条以及干桩等部位，随着病部的逐渐扩大，形状出现变化，病斑环绕一周后，树木枯死，后出现\n黑色小点。\n\n·发病规律· 主要以菌丝体、分生孢子器及子囊壳在病枝干、果园及其周围堆放的病残体上越冬。春\n天遇雨时，大量分生孢子和子囊孢子通过雨水飞溅和昆虫活动传播，从伤口（冻伤、剪锯伤、环剥\n伤、虫伤等）、叶痕、果柄痕和皮孔侵入。当树体或局部组织衰弱、抗病力低下时，病菌迅速生\n长，产生毒素，并向四周扩展蔓延，导致皮层组织腐烂。当侵染点组织健康、树势强壮时，病菌则\n停止扩展，处于潜伏状态。\n\n·防治方法·\n\n（1）11 月进行树干涂白，常用配制方为生石灰 10 kg、石硫合剂原液 1 kg、盐 1 kg、动物油 0.5\nkg、水 30 kg。\n\n（2）入冬前进行病斑治疗，检查表面溃疡，将病部树皮表层组织及周围少量健康组织刮除，以防\n入冬后向深层蔓延。每次刮治后，伤口涂抹腐必清乳剂3倍液，或 5%菌毒清 50 倍液等，或 45%石\n硫合剂晶体 150 倍液，杀死残留在病部的病菌。\n\n（3）春季发芽前进行药剂铲除，刮掉粗皮，清除病残枝干、残桩。全树喷 45%石硫合剂晶体，再\n对树体易发病部位涂抹 70%甲基硫菌灵可湿性粉剂 150 倍液。\n\n（4）6 月下旬和 11 月上旬用 5%菌毒清 500 倍液喷洒，或用甲基硫菌灵涂刷主干、主枝等，防止\n表层产生溃疡和晚秋出现新的坏死病痕，施药前先刮除病疤及表层溃疡斑和粗皮下干斑。\n\n\n\n苹果腐烂病 病枝干\n\n\n\n苹果腐烂病 溃疡型病枝干\n\n\n\n苹果腐烂病 子囊壳、子囊，子囊孢子和拟侧丝\n\n\n\n\n\n\n苹果干腐病 病枝干\n\n苹果轮纹病\n\n·病原· 葡萄座腔菌（ Botryosphaeria dothidea ）和粗皮葡萄座腔菌（ B. kuwatsukai ），均属子囊菌\n亚门（Ascomycotina）葡萄座腔菌属（ Botryosphaeria ），又称粗皮病。\n\n·症状· 主要侵染枝干和果实。先是侵染枝干，随后通过降雨侵染果实。危害枝干：病菌从皮孔中心\n侵入，形成扁圆形或椭圆形、红褐色小病斑，质地紧硬，边缘龟裂，与正常组织形成一道环沟。翌\n年龟裂加深，病变组织翘起，病斑连在一起，表皮粗糙。侵染果实：一般从幼果开始，多在近成熟\n期和贮藏期发病，以皮孔为中心，生成水浸状小斑点，后形成同心轮纹状，向四周扩大，病部呈现\n褐色或淡褐色，并有茶褐色黏液溢出。如条件适宜，病斑发展快，病果不凹陷，不变形，有酸臭\n味。\n\n·发病规律· 以菌丝体、子座在被害枝干、死枝及散落在果园中的树枝上越冬。春季温度回升后，越\n冬菌丝体扩展危害，通过风雨传播，侵染枝干、果实或叶片。当气温20℃以上，相对湿度75%以\n上，或连续降雨3~4天，病原开始在果园内传播、侵染。雨量大，降雨日数多，病菌孢子释放量\n多，寄主感染概率增加，病害发生严重；干旱易导致树势衰弱，诱发枝干严重发病。果实自坐果后\n至成熟期（4 月底至9 月）均能感染轮纹病，尤以 5~7 月为病菌集中侵入时期。随着果实长大和表\n皮木栓化，果实染病率不断下降。近成熟的果实抗侵入能力较强，抗扩展能力较弱。\n\n·防治方法·\n\n（1）培育、选用无病苗木，发现病苗应立即拔除，并及时喷药保护。\n\n（2）冬季结合修剪，剪除病虫枝，发芽前带出园外烧毁。发芽前喷 5 波美度石硫合剂。\n\n（3）开春刮除主干和主枝上病斑，并涂杀菌剂。\n\n（4）在落花后 7~10 天，每隔 10~15 天喷 1 次，共喷 2~3 次。可选用药剂有 1∶2（~3）∶200 波\n尔多液、70%甲基硫菌灵可湿性粉剂 800 倍液，或 10%苯醚甲环唑水分散粒剂 1 500 倍液等。\n\n\n\n苹果轮纹病 果实被害状\n\n苹果轮纹病 果实被害状\n\n\n\n苹果轮纹病 果实被害状（后期）\n\n苹果轮纹病 果实被害状\n\n\n\n\n\n\n苹果轮纹病 枝干被害状\n\n苹果褐斑病",
      "·病原· 有性阶段为苹果双壳菌（ Diplocarpon mali Harada et Sawamura），属子囊菌门双壳属（\nDiplocarpon ）真菌；无性阶段为苹果盘二孢[ Marssonina coronaria （Ell. et Davis） Davis]，属半\n知菌亚门（Deuteromycotina）盘二孢属（ Marssonina ）真菌。\n\n·症状· 主要危害叶片，也侵染果实。叶片上症状有 3 种类型。\n\n（1）同心轮纹型：发病初期在叶片正面形成黄褐色小点，近圆形，后期病斑表面产生同心轮纹状\n排列的小黑点。\n\n（2）针芒型：病斑呈放射状（针芒状）向外扩展。病斑小，数量较多，常遍布叶片。\n\n（3）混合型：病斑较大，近圆形，其外缘呈针芒状，后期病斑中部灰白色，外缘绿色，其上散生\n许多小黑点。\n\n·发病规律· 以分生孢子盘、子囊盘或未受精的菌丝团在落叶和病梢中越冬。春季温度回升、多雨\n时，产生子囊孢子或分生孢子，通过风雨传播。附着胞和侵染丝直接从叶面或叶背侵入，树冠下部\n和内膛叶片最先发病，逐渐向上及外围蔓延。在苹果生长季节，病菌可产生分生孢子进行再侵染。\n潮湿是落叶上病菌形成子囊盘的必要条件。弱树、弱枝发病重，壮树发病轻。管理粗放果园病害发\n生早而重。\n\n·防治方法·\n\n（1）搞好清园：秋末清除园内落叶，集中烧毁。冬前深翻果园，促进病残体分解。早春苹果发芽\n前，在树体及其地面喷布 45%石硫合剂晶体。\n\n（2）加强栽培管理：提高树体抗病力，土壤肥力较差的果园，要增施肥料。合理修剪，注意改善\n树冠内的通风透光。\n\n（3）喷药保护：药剂防治重点应在前期，一般在落花后 10 天左右即开始喷第一次药，每隔 10~15\n天左右喷 1 次药，连续喷施 4~5 次。常用药剂有 10%多抗霉素 1 200 倍液、80%戊唑醇可湿性粉剂\n3 000 倍液、70%代森联干悬浮剂 1 000 倍液等。\n\n\n\n苹果褐斑病 叶片被害状\n\n\n\n苹果褐斑病 叶片被害状\n\n苹果褐斑病 叶片被害状\n\n\n\n苹果褐斑病 果实被害状\n\n苹果斑点病\n\n·病原· 链格孢苹果专化型（ Alternaria alternaria f.sp. mali），属半知菌亚门（Deuteromycotina）链\n格孢属（ Alternaria ）真菌。\n\n·症状· 果面出现黑红斑点，红斑点比例占 80%以上，但不烂果。果顶周围斑点最多，果梗周围几乎\n不见。红斑中有一些斑点，初发为小黑斑，后发软裂口或软化烂果。\n\n·发病规律· 以菌丝体在病落叶、病枝等病残体和秋梢顶芽上越冬。4、5 月降雨时，越冬病菌可产\n生大量分生孢子，通过风雨传播，从伤口或表皮直接侵入幼叶、新梢和果实等组织。降雨早、雨日\n多、雨量大，发病早、发病期长、发病重。树势衰弱，发病重。\n\n·防治方法·\n\n（1）加强栽培管理，增强树势，提高树体抗病力。秋冬季节清除园内残枝落叶、病虫果集中处理\n以减少菌源量；增施腐熟农家肥；改良土壤，不偏施氮肥；合理修剪，改善果园通风透光条件，保\n证枝枝见光，同时，提高土壤通气性；7~9月份多雨季节温度高，湿度大，应防止果园积水，要及\n时排水。\n\n（2）药剂防治：谢花后套袋前新梢生长期，全园喷施 1~2 次 80%代森锰锌可湿性粉剂 800 倍液。\n果实膨大期全园喷施 43%戊唑醇悬浮剂 3 000 倍液，或 10%苯醚甲环唑水分散粒剂 1 500 倍液，或\n40%氟硅唑可湿性粉剂 4 000 倍液。果实着色至成熟期，除袋后及时给树上补喷 1 次 5%吡唑醚菌\n酯+55%代森联水分散粒剂，进一步杀灭病菌。\n\n\n\n苹果斑点病 病果\n\n\n\n苹果斑点病 病果\n\n\n\n苹果斑点病 病果\n\n苹果斑点病 病果\n\n\n\n苹果斑点病 病果\n\n\n\n苹果斑点病 病果\n\n苹果炭疽病\n\n·病原· 有性阶段为炭疽病菌[ Glomerella cingulate （Stonem.） Spauld. et Schrenk]属子囊菌亚门\n（Ascomycotina）小丛壳属（ Glomerella ）；无性阶段为胶孢炭疽菌（ Colletotrichum\ngloeosporioides Penz. et Sacc.），属半知菌亚门（Deuteromycotina）炭疽菌属（ Colletotrichum ）。",
      "·症状· 初期的症状与桃褐腐病极为相似，花期受害，病花迅速变褐枯死，多残，留在枝上而不脱\n落，叶片发病初为圆形或近圆形褐色水烫状病斑，后可见有深浅相间的轮纹；新梢上病斑褐色，有\n流胶，幼果发病初期，果面上产生淡绿褐色近圆形病斑，后病果全部腐烂，并干缩成僵果，果面产\n生很厚的白色菌丝，并形成很多白色至灰黑色大小不一的菌核，病果无霉臭味。\n\n·发病规律· 本病病菌主要以菌核在病僵果、树上、地面上越冬。翌年桃树开花时菌核萌发形成子囊\n盘，从中散发出大量的子囊孢子，如天气潮湿多雨，即能造成大量花朵的发病。病花的组织碎片及\n残体遇到风雨即被吹散，并散落和黏附在叶片和幼果上，引起叶片和幼果的发病。因此在病叶和病\n果的病斑上，多可明显地看到黏附有由病花散落的花器残余物。\n\n·防治方法·\n\n（1）落叶后至发芽前，彻底清除树上、树下的病僵果，集中烧毁；及时疏花疏果；合理修剪，使\n园内通风良好，降低小气候湿度。\n\n（2）发芽前全园喷施一次 45%石硫合剂晶体 200~300 倍液，铲除树上的病原菌；落花后 3~5 天开\n始喷药防病，常用药剂有 500 g/L异菌脲悬浮剂 800 倍液、70%甲基托布津可湿性粉剂 1 000~1 200\n倍液；每隔 10~15 天防治 1 次，共防治2~3 次。\n\n桃菌核病 嫩梢被害状\n\n\n\n桃菌核病 发病后期果实\n\n\n\n桃菌核病 果实被害状\n\n桃菌核病 分生孢子和孢子囊\n\n\n\n桃菌核病 无性孢子\n\n桃煤污病\n\n·病原· 无性阶段属半知菌亚门（Deuteromycotina）丝孢目（Hyphomycetales），主要有多主枝孢[\nCladosporium hergarum （Pers.） Link.]、大孢枝孢（ C.macrocarpum preuss ）、链格孢[ Alternaria\nalternata （Fr.） Keissl]、出芽短梗霉[ Aureobasidium pullulans （de Bary） Arn].和炱壳小圆孢（\nCheatasbalisa microglobulosa ）等，上海以煤烟霉属（ Fumago sp.）常见。有性阶段为子囊菌亚门\n（Ascomycotina）煤炱科（Capnodiaceae）或小煤炱科（Meliolaceac）。\n\n·症状· 主要危害叶片、果实和枝条。被害处初现污褐色霉点，圆形或不规则形，后形成煤烟状黑色\n霉层，严重时布满叶面、果面及枝，影响光合作用，降低果实商品价值。\n\n·发病规律· 病原菌以菌丝体和分生孢子在病叶上、土壤内及植物残体上越过休眠期，翌春病菌借风\n雨或蚜虫、介壳虫、粉虱等昆虫传播蔓延。以蚜虫、介壳虫、粉虱等刺吸式口器昆虫的分泌物为养\n料。凡刺吸式口器昆虫发生严重、果园种植过密、枝杈过密、湿度大、通风透光差，往往发病严\n重。\n\n·防治方法·\n\n（1）改善桃园小气候，雨后及时排水，增强通透性，防止湿气滞留。及时防治蚜虫等害虫。\n\n（2）发病初期，可选用 40%多菌灵胶悬剂 600 倍液，40%克菌丹可湿性粉剂400 倍液，每 15 天喷\n洒 1 次，共喷 1~2 次。\n\n\n\n桃煤污病 被害叶片\n\n\n\n桃煤污病 叶片被害状\n\n\n\n桃煤污病 叶片被害状\n\n桃煤污病 果实被害状\n\n\n\n桃煤污病 叶片被害状\n\n\n\n桃煤污病 叶片被害状\n\n桃细菌性穿孔病\n\n·病原· 油菜黄单孢菌桃李致病变种[ Xanthomonas campestris pv. pruni（Smith） Dowson]，属于变形\n菌门（Proteobacteria）黄单孢杆菌属（ Xnthomons ）细菌。\n\n\n\n·症状· 该病主要危害叶片，枝梢和果实也能受害。叶片感病后出现水渍状小点，淡褐色，逐渐扩大\n成圆形，近圆形斑，直径 2~5 mm，褐色或紫褐色，外有黄色晕圈。数个病斑可相互连成不规则\n斑，后期病斑周围产生裂纹，病斑脱落后形成穿孔斑；穿孔斑边缘常残留病斑组织，同一叶病斑多\n时叶片变黄，提早脱落。高湿环境下病斑背面分泌黄白色黏液。夏秋抽生的枝梢感病后产生春季溃\n疡斑，紫褐色，油浸状，微隆起，长圆形小斑，成为第二年初侵染主要来源。春夏抽生的枝梢感病\n后产生夏季溃疡斑，暗紫色，油浸状，椭圆形，中间稍凹陷，当年干枯死亡，不能成为第二年来\n源。枝梢病斑绕枝条一周后，病斑以上枝条枯死。果实受害后产生淡褐色水渍状小圆斑，扩大后褐\n色，稍凹陷，病斑常开裂，较深，易腐烂。\n\n·发病规律· 病菌主要在病梢上越冬，第二年病斑出现菌脓，经风雨或昆虫传播，一般 4 月中旬展叶\n后就可发病，5~6 月梅雨季节和 8~9 月台风季节为病害高峰期。果实成熟期多雨发病更重。\n\n·防治方法·\n\n（1）选栽抗病桃树品种。",
      "·症状· 主要危害苹果树果实，也可侵染枝条、果台及衰弱枝等。果实发病初期，果面可见针头大小\n淡褐色小斑点，病斑呈圆形且边缘清晰，外有红色晕圈；后病斑逐渐扩大呈褐色或深褐色，表面略\n凹陷或扁平，圆形或近圆形，表面凹陷，果肉腐烂。腐烂组织向果心呈圆锥状，变褐，具苦味，与\n健果肉界限明显。病斑在果实上数目不定，几个至数十个，病斑可融合，条件合适时，病斑可扩展\n到果面的1/3~1/2，严重时病斑相连导致全果腐烂。果实腐烂失水后干缩成僵果，脱落或挂在树\n上。\n\n·发病规律· 主要以菌丝体在枯死枝、破伤枝、死果台及病僵果上越冬，也可在刺槐上越冬。主要通\n过风雨传播，从果实皮孔、伤口或直接侵入危害。病菌从幼果期至成果期均可侵染果实。前期侵染\n病菌，由于幼果抗病力较强而处于潜伏状态，不发病；果实近成熟期后抗病力降低导致发病，具有\n明显的潜伏侵染现象。潮湿条件下越冬病菌可产生大量病菌孢子，近成熟果实发病后产生的病菌孢\n子（粉红色黏液）可再次侵染危害果实。在田间可多次再侵染。降雨早且多时，有利于炭疽病菌的\n产生、传播、侵染，后期病害发生则较重。\n\n·防治方法·\n\n（1）结合修剪，剪除枯枝、病虫枝、徒长枝和病僵果，集中烧毁。发病期及时摘除病果，清除地\n\n\n\n面落果。\n\n（2）果园周围避免用刺槐和核桃等主树木作防风林。\n\n（3）重病果园，早春萌芽前对树体喷 1 次 3~5 波美度石硫合剂。\n\n（4）生长期应谢花坐果后即开始施药，每隔 15 天左右喷 1 次，连续喷 3~4 次；迟熟品种可适当\n增加喷药次数。可选药剂 1∶2（~3）∶200 波尔多液、50%甲基硫菌灵可湿性粉剂 1 000 倍液、\n10%苯醚甲环唑水分散粒剂 1 500 倍液、25%吡唑醚菌酯乳油 2 000 倍液等。\n\n苹果炭疽病 病果\n\n\n\n苹果炭疽病 病果\n\n\n\n苹果炭疽病 病果\n\n\n\n苹果炭疽病 病果\n\n\n\n苹果炭疽病 1.分生孢子盘和分生孢子；2.子囊壳、子囊和子囊孢子\n\n\n\n苹果虫害\n\n苹果黄蚜\n\n·学名· Aphis citricolavander （Goot），属半翅目（Hemiptera）蚜虫科（Aphididae）。\n\n·鉴别特征· 有翅胎生雌蚜：头、胸部和腹管、尾片均为黑色，腹部呈黄绿色或绿色，两侧有黑斑。\n无翅胎生雌蚜：体长 1.4~1.8 mm，纺锤形，黄绿色，复眼、腹管及尾片均为漆黑色。若蚜：鲜黄\n色，触角、腹管及足均为黑色。卵：椭圆形，漆黑色。\n\n·生活习性· 1 年发生 10 余代，以卵在寄主枝梢的皮缝、芽旁越冬；翌年苹果芽萌动时开始孵化，\n约在 5 月上旬孵化结束。初孵若蚜先在芽缝或芽侧危害，10 余天后，产生无翅和少量有翅胎生雌\n蚜。5~6 月间，以孤雌生殖的方式产生有翅和无翅胎生雌蚜；6~7 月间繁殖最快，产生大量有翅蚜\n扩散蔓延，造成严重危害；7~8 月间气候不适，发生量逐渐减少，秋后又有回升；10 月间出现性\n母，产生性蚜，雌雄交尾产卵，以卵越冬。\n\n·危害特点· 若蚜、成蚜群集寄主新梢、嫩叶背面刺吸汁液，叶片受害初期表现花叶病般症状，叶尖\n向背面横卷，严重时造成落叶。苗圃和幼龄果树受害较重。\n\n·防治方法·\n\n（1）冬季结合刮老树皮，进行人工刮卵，消灭越冬卵。\n\n（2）苹果萌芽时（越冬卵开始孵化期）和 5~6 月间产生有翅蚜时，喷施 3%啶虫脒微乳剂 2 000~2\n500 倍液，或 10%烯啶虫胺可溶液剂（或水剂）2 000 倍液，或 22.4%螺虫乙酯悬浮剂 5 000 倍液\n等。\n\n苹果黄蚜 聚集危害\n\n\n\n苹果黄蚜 聚集危害\n\n\n\n苹果黄蚜 聚集危害\n\n\n\n苹果黄蚜 聚集危害\n\n苹果绵蚜\n\n·学名· Eriosoma lanigerum （Hausmann），属半翅目（Hemiptera）瘿绵蚜科（Pemphigidae）。\n\n·鉴别特征· 体长 1.5~4.9 mm，有时被蜡粉，但缺蜡片。喙末节短钝至长尖。腹部大于头部与胸部\n之和。前胸与腹部各节常有缘瘤。表皮光滑、有网纹或皱纹或由微刺或颗粒组成的斑纹。体毛尖锐\n或顶端膨大为头状或扇状。有翅蚜触角通常6 节。\n\n·生活习性· 1 年发生 10 余代，以 2、3 龄若蚜在寄主隐蔽危害处及根部越冬。3 月下旬开始繁殖，5\n月底形成第一个高峰。6 月下旬至 7 月中旬形成第二个高峰，9~10 月中旬还可能形成第三个繁殖\n高峰。6 月和 9、10 月有翅蚜发生，转移较近新寄主。最适宜繁殖温度为 22~25℃ ；如气温上升到\n26℃以上且连续数日，对其繁殖不利。气温降至 8℃以下，大批绵蚜进入越冬状态。",
      "·病原· 有性阶段为梨球腔菌［ Mycosphaerella sentina （Fr.） Schrter］，属子囊菌亚门\n（Ascomycotina）球腔菌属（ Mycosphaerella ）；无性阶段为梨生壳针孢（ Septoria piricola\nDesm.），属半知菌亚门（Deuteromycotina）壳针孢属（ Septoria ），又称白星病、斑枯病。\n\n·症状· 主要危害叶片，初期形成圆形或近圆形深褐色斑点，扩展后为病斑中部灰白色、边缘褐色，\n病斑较小。后期病斑表面可散生小黑点。受害严重叶片，其上散布数十个病斑，且常相互愈合成不\n规则形褐色大斑，有时病斑穿孔。严重时，病叶早期脱落，导致树势衰弱。\n\n·发病规律· 是一种高等真菌性病害，病菌主要以分生孢子器在病落叶上越冬。次年产生并释放分生\n孢子，借风雨传播到叶片上进行侵染危害。生长期可有多次再侵染。病害一般在 4 月中旬开始发\n生，5 月中下旬盛发。发病严重的，在 5 月下旬就开始落叶，7 月中下旬落叶最严重。雨水早、湿\n度大时发病较重，树势衰弱、排水不良、管理粗放的果园发病较多。\n\n·防治方法·\n\n（1）加强果园栽培管理。合理施肥，及时排水，科学修剪，使果园通风透光良好，降低环境湿\n度，创造不利于病害发生的环境条件。发芽前彻底清扫落叶，集中深埋或烧毁，消灭病菌越冬场\n所。\n\n（2）药剂防治：该病一般不需单独防治。往年发病严重的个别果园，从发病初期开始喷药，每隔\n10~15 天喷 1 次药，连喷 2 次左右即可有效控制该病的发生危害。常用药剂有 70%甲基托布津可湿\n性粉剂 800~1 000 倍液、10%苯醚甲环唑水分散粒剂 2 000~2 500 倍液等。\n\n\n\n梨褐斑病 叶片中期被害状\n\n\n\n梨褐斑病 叶片正面后期被害状\n\n梨褐斑病 叶片背面后期被害状\n\n\n\n梨褐斑病 叶片早期被害状\n\n梨白粉病\n\n·病原· 梨球针壳菌［ Phyllactinia pyri （Cast.）Homma.］，属子囊菌亚门（Ascom ycotina）球针壳\n属（ Phyllactinia ）。\n\n·症状· 最初在叶背面产生白色霉点，后扩展成大小不一、近圆形白色粉状斑，是病菌菌丝和分生孢\n子，后期白粉层上产生黄色小点，逐渐加深至黑褐色小点，是病菌闭囊壳，白粉斑相应叶片正面黄\n绿色，严重时白粉布满整个叶片，导致病叶变褐枯萎、脱落。\n\n·发病规律· 白粉病是一种高等真菌性病害。病原菌主要以闭囊壳在落叶上或黏附在枝干表面越冬。\n第二年 6~7 月闭囊壳内散出子囊孢子，通过气流或风雨传播，从叶背气孔侵染叶片危害。初侵染\n发病后产生的分生孢子经气流传播后进行再侵染，使病害不断扩散蔓延。白粉病多在雨季开始发\n生，多雨潮湿季节为发生盛期。果园郁蔽、通风透光不良、地势低洼、排水不及时、偏施氮肥等均\n可加重该病发生。\n\n·防治方法·\n\n（1）加强果园栽培管理。合理施肥，及时排水，科学修剪，使果园通风透光良好，降低环境湿\n度，创造不利于病害发生的生态条件。发芽前彻底清扫落叶，集中深埋或烧毁，消灭病菌越冬场\n所。\n\n（2）药剂防治：萌芽期，喷施 1 次 45%石硫合剂晶体 50~80 倍液，杀灭树上越冬病菌。生长期，\n从病害发生初期或雨季到来前开始喷药，每隔 10 天左右喷 1 次，连喷 2~3 次，重点喷洒叶片背\n面。常用药剂有 10%苯醚甲环唑水分散粒剂 2 500~3 000倍液、250 g/L戊唑醇水乳剂 2 000~2 500\n倍液等。\n\n\n\n梨白粉病 叶片被害状\n\n\n\n梨白粉病 叶片被害状\n\n\n\n梨白粉病 叶片被害状\n\n\n\n梨白粉病 叶片被害状\n\n梨白粉病病菌闭囊壳\n\n\n\n梨白粉病 病斑放大\n\n梨炭疽病\n\n·病原· 有性阶段为围小丛壳［ Glomerella cingulata （Stonem.）Spauld. et Schrenk］，属子囊菌亚门\n（Ascomycotina）小丛壳属（ Glomerella ）；无性阶段为胶孢炭疽菌（ Colletotrichum\ngloeosporioides Penz.），属半知菌亚门（Deuteromycotina）炭疽菌属（ Colletotrichum ），又称“苦\n腐病”。\n\n·症状· 病菌主要危害果实，也可侵害枝条，有时还可危害叶片及叶柄。果实染病多从膨大后期开始\n发病，初期在果面上产生褐色至黑褐色小斑点，后病斑逐渐扩大，形成淡褐色至深褐色的腐烂病\n斑，表面凹陷，严重时病斑可烂到果实的 1/4 以上；从发病中后期开始，病斑表面逐渐产生小黑\n点，小黑点上可溢出淡粉红色黏液。"
    ]
  },
  {
    "question": "45%石硫合剂晶体在梨树萌芽期防治梨锈病时的推荐倍数是多少？",
    "answer": "关于45%石硫合剂晶体在梨树萌芽期防治梨锈病的推荐使用倍数，当前提供的信息中未包含该药剂的具体使用浓度或稀释倍数。因此，无法给出确切的推荐倍数。建议参考该药剂的产品标签说明或咨询当地农业技术推广部门以获取准确的使用指导。",
    "standard_answer": "推荐喷洒45%石硫合剂晶体50~80倍液。",
    "contexts": [
      "（1）本品应于梨树黑星病发病前或发病初期施药，注意对梨树全株均匀喷雾，防止漏喷，确保防\n效。\n\n（2）大风天或预计 1 小时内降雨，勿施药。\n\n（3）在梨树上使用时的安全间隔期为 21 天，每季作物最多使用 2 次。\n\n（4）不可与碱性农药等物质混合使用。\n\n（5）建议与其他作用机制不同的杀菌剂轮换使用，以延缓抗性产生。\n\n［注意事项］\n\n（1）严格按规定用药量和方法使用；药液及其废液不得污染各类水域、土壤等环境。\n\n（2）避免在低于 10℃和高于 30℃环境中贮存。\n\n（3）本品对水蚤毒性高，对赤眼蜂有风险，禁止在鱼塘、河流附近使用，以免对水生生物等有益\n生物产生危害，天敌放飞区、蚕室及桑园附近禁用，远离水产养殖区施药，禁止在河塘等水体中清\n洗施药器具。\n\n（4）使用本品时应穿戴防护服和手套，避免吸入药液。施药期间不可吃东西和饮水；施药后应及\n时洗手和洗脸。\n\n（5）孕妇及哺乳期妇女禁止接触。\n\n（6）用药后包装物妥善处理，勿污染环境，不可做他用，也不可随意丢弃。\n\n70%甲基硫菌灵水分散粒剂\n\n［产品特点］ 本品属苯并咪唑类，是一种广谱性内吸杀菌剂，能防治多种作物病害，具有内吸、\n预防、治疗作用。它在植物体内转化为多菌灵，干扰菌的有丝分裂中纺锤体的形成，影响细胞分\n裂。对梨树黑星病有较好的防治效果。\n\n［防治对象及使用方法］\n\n技术要点\n\n（1）在梨树黑星菌初侵染期施药，以对水 1 000 倍为宜喷雾，最多连续施药 2次，施药间隔期为 7\n天。\n\n（2）按照推荐剂量施药，梨树上的采收间隔期为 21 天，每季最多使用 2 次。\n\n（3）大风或降雨天勿施药。\n\n（4）不能与铜制剂等物质混用；不能长期单一使用，应与其他不同作用机制的杀菌剂轮换使用。\n\n\n\n［注意事项］\n\n（1）使用本品时应穿戴防护服和手套，避免吸入药液。施药期间不可吃东西和饮水。施药后应及\n时洗手和洗脸。\n\n（2）远离水产养殖区用药，禁止在河塘等水体中清洗施药器具；避免药液污染水源。虾、蟹套养\n稻田禁用，施药后田水不得直接排入水体。\n\n（3）孕妇及哺乳期的妇女禁止接触。\n\n（4）用过的容器应妥善处理，不可做他用，也不可随意丢弃。\n\n33.5%喹啉铜悬浮剂\n\n［产品特点］ 喹啉铜是一种有机铜螯合物。在作物表面形成一层严密的保护膜，抑制病菌萌发和\n侵入，从而达到防病治病的目的。\n\n［防治对象及使用方法］\n\n技术要点\n\n（1）在病害发病前或发病初期，按推荐剂量开始施药，防治柑橘溃疡病，每隔 7~10 天施药 1\n次。\n\n（2）柑橘安全间隔期 30 天，每季最多使用 2 次。\n\n（3）建议选择不同机制的杀菌剂，轮换使用，缓解抗性压力。\n\n［注意事项］\n\n（1）药液及其废液不得污染各类水域、土壤等环境。\n\n（2）施用时应注意穿戴防护衣物；使用时，勿吸烟及饮食；施用后及时清洗外露的皮肤、用过的\n器具和污染的衣物。\n\n（3）本剂对水生生物毒性较高，须远离水产养殖区、河塘等水体施药。操作使用时不要将药液、\n器械清洗液倒入江河，以免污染水源；禁止在河塘等水体中清洗施药器具，注意对水生生物的影\n响。\n\n（4）过敏者禁用，使用中有任何不量反应应及时就医。\n\n（5）孕妇和哺乳期妇女禁止接触。\n\n（6）使用后容器需集中深埋处理，或交由专门收集处理部门。不得随意丢弃或作他用。\n\n77%硫酸铜钙可湿性粉剂\n\n［产品特点］ 保护性杀菌剂，络合态硫酸铜钙，其独特的铜离子和钙离子大分子络合物，确保铜\n离子缓慢、持久释放。遇水才释放杀菌的铜离子，而病菌也只有遇水后才萌发侵染，两者完全同\n步。本品对黄瓜霜霉病、柑橘溃疡病有防治效果。\n\n［防治对象及使用方法］\n\n\n\n技术要点\n\n（1）安全间隔期，柑橘 32 天，最多使用 4 次。\n\n（2）不可与强酸、强碱性物质混用。\n\n（3）不能与含有其他金属元素的药剂和微肥混合使用，也不宜与强碱性和强酸性物质混用。\n\n（4）桃，李，杏，柿子，大白菜，菜豆，莴笋，荸荠等对本品敏感，不宜使用。苹果、梨树的花\n期、幼果期对铜离子敏感，本品含铜离子，应慎用。\n\n（5）每年铜使用量不能超过 6 kg/hm 2 （0.4 kg/亩）。\n\n［注意事项］\n\n（1）使用过的药械需清洗两遍，在洗涤药械和处理废弃物时不要污染水源。对水生生物危害极\n大，使用时应关注对水生生物的影响。\n\n（2）使用过的空包装不可挪用，应采取焚烧或者掩埋等方法，加以妥善处理。\n\n（3）使用后及时清洗暴露部位皮肤。\n\n（4）过敏者禁用，使用中有任何不良反应须及时就医。\n\n14%络氨铜水剂\n\n［产品特点］ 本品主要通过铜离子发挥杀菌作用，铜离子与病原菌细胞膜表面上的K+离子、H+离\n子等阳离子交换，使病原菌细胞膜上的蛋白质凝固，同时部分铜离子渗透入病原菌细胞内与某些酶\n结合，影响其活性，起到一定的抗病作用。",
      "梨树主要病虫种类有梨锈病、梨轮纹病、梨黑星病等病害，梨小食心虫、桃蛀螟、梨木虱、梨冠网\n蝽等害虫。开展梨树病虫害监测，能够掌握病虫害的发生变化规律，及时有效地控制病虫灾害，为\n梨树的有效防治提供科学的依据。\n\n\n\n梨树病害\n\n梨锈病\n\n·病原· 梨胶锈菌（ Gymnosporangium haraeanum Syd.），属担子菌亚门（Basidiomycotina）胶锈菌\n属（ Gymnosporangium ）。\n\n·症状· 侵害叶片、新梢、果实，受害叶片正面出现橙黄色小点，后变成圆形斑，小点变成黑色。病\n斑扩大后正面凹下，叶背凸起，产生灰褐色毛状物是病菌锈子器，散发出黄褐色粉末，是病菌锈孢\n子，以后病斑变黑，病叶枯死早落。幼果病斑中央凹下，边缘产生毛状物，病果生长停滞，畸形早\n落。果柄、叶柄受害则病部稍膨大，也产生毛状物；新梢受害产生龟裂病斑，易折断。\n\n·发病规律· 病菌在龙柏、桧柏、塔柏等植物上越冬，可存活多年。3 月中旬至4 月中旬病菌担孢子\n借风雨传播到梨树危害。梨树在 4 月底、5 月初出现症状，5 月中旬开始出现毛状物，散出的锈孢\n子借风雨传播到龙柏等植物，侵入后越冬成次年病菌来源。梨树四周 5~10 km范围内存在龙柏等植\n物就有利病害发生。2 月温度偏高，3~4 月雨水偏多，有利病害发生，加重危害。\n\n·防治方法·\n\n（1）在梨园 5 km范围内不种植桧柏。\n\n（2）加强果园栽培管理。合理施肥，及时排水，科学修剪，使果园通风透光，降低环境湿度，创\n造不利于病害发生的环境条件。发芽前彻底清扫落叶，集中深埋或烧毁，消灭病菌越冬场所。\n\n（3）药剂防治：梨树开始萌芽展叶时，喷洒波尔多液保护新叶；落花后若叶片上出现锈病时可喷\n洒 10%苯醚甲环唑水分散粒剂 5 000~6 000 倍液，或 22.5%啶氧菌酯悬浮剂 1 500~2 000 倍液等，每\n次喷药间隔 7~10 天，连续喷雾 2~3 次。注意避开开花期喷药。\n\n梨锈病 叶片正面危害状\n\n\n\n梨锈病 病叶\n\n梨锈病 叶片背面危害状\n\n\n\n转主寄主-桧柏 冬孢子角\n\n梨锈病 发病后期危害状\n\n\n\n梨锈病 1.性孢子器；2.冬孢子及其萌发；3.龙柏上的冬孢子角（部分已吸水膨胀）；4.锈子器和锈\n孢子\n\n\n\n梨锈病 病果\n\n梨黑星病\n\n·病原· 有性阶段为梨黑星菌（ Venturia nashicola Tanak et Yamamota），属子囊菌亚门\n（Ascomycotina）黑星菌属（ Venturia ）；无性阶段为梨黑腥孢菌（ Fusicladium virecens Bon.），\n属半知菌亚门（Deuteromycotina）黑星孢属（ Fusicladium ）。\n\n·症状· 可危害梨树的所有绿色幼嫩组织。以叶片、果实和新梢受害为主。发病后的主要特点是病斑\n表面产生墨绿色至黑色霉状物。\n\n（1）叶片染病：多数先在背面产生墨绿色至黑色星芒型霉状物，正面相对应处为边缘不明显的淡\n黄绿色病斑；严重时霉状物可布满叶背大部分，叶正面则呈花叶状。后期病斑变褐枯死，严重时导\n\n\n\n致早期落叶。\n\n（2）果实染病：果实膨大期受害，多数形成圆形或近圆形黑色病斑。较早发病者，病斑凹陷、开\n裂，病果畸形、易早落；较晚发病者，病斑略凹陷，可产生浓密霉状物，有时病斑外围有明显的黄\n晕；气候干燥时病斑表面很少产生霉层，表现为“青疔”状；环境潮湿时，霉状物上有时可腐生“红\n粉菌”。\n\n（3）新梢染病：从下至上逐渐产生黑色霉层，并可扩展到叶柄甚至叶片基部及叶脉上；严重时，\n病梢叶片逐渐变黄、变红、干枯、脱落，最后只留下一个“黑橛”。\n\n·发病规律· 黑星病在田间有多次再侵染现象，流行性很强，有两个发生高峰：一是落花后至果实膨\n大初期；二是采收前 1~1.5 个月。前期病梢出现的多少、幼叶幼果发病率的高低是决定当年黑星病\n发生轻重的主要因素之一。后期果实越接近成熟受害越重，是病菌严重危害果实的时期。黑星病的\n发生轻重与降雨关系密切，尤其是幼果期的降雨，雨日多，病害发生重；密植果园、低洼潮湿果园\n往往发病较重。\n\n·防治方法·\n\n（1）加强果园管理：落叶后至发芽前彻底清除树上、树下落叶，集中深埋或烧毁。\n\n（2）药剂防治：梨树开始萌芽展叶时，喷洒波尔多液保护新叶；萌芽后开花前喷洒 1 次内吸治疗\n性药剂，杀死芽内病菌，减少病梢形成数量，药剂可选 10%苯醚甲环唑水分散粒剂 5 000~6 000 倍\n液；落花后至果实膨大初期，控制幼叶、幼果发病，一般喷药 3~4 次，每次喷药间隔 7~10 天。药\n剂可选 10%苯醚甲环唑水分散粒剂 5 000~6 000 倍液、50%醚菌酯水分散粒剂 3 000~5 000 倍液、\n70%代森联水分散粒剂 500~700 倍液等。",
      "［防治对象及使用方法］\n\n技术要点\n\n（1）配制药液时，向喷雾器中注入少量水，然后加入推荐用量的异菌脲制剂，充分搅拌药液使之\n完全溶解后，加入足量水。\n\n（2）根据作物大小，确定亩用水量，配制药液，进行植株或叶面均匀喷雾处理。\n\n（3）异菌脲是一种以保护性为主的触杀型杀菌剂，施药应在病害发生初期进行，建议每隔 7~10\n天施用 1 次。\n\n（4）安全间隔期：苹果 7 天；葡萄 14 天。\n\n（5）每季最多施用次数：不超过 3 次。\n\n［注意事项］\n\n（1）施药时应穿工作服戴手套，不可吸烟、饮水或进食。\n\n（2）施药后用肥皂洗手、脸及裸露皮肤、工作服和手套。\n\n（3）用过的空包装应妥善处理，不可再用。\n\n（4）本品对鱼类等水生生物有毒，远离水产养殖区施药，禁止在河塘等水体中清洗施药器具。\n\n\n\n（5）孕妇及哺乳期妇女禁止接触本品。\n\n10%抑霉唑水乳剂\n\n［产品特点］ 本品为咪唑类内吸性杀菌剂。本品对苹果树炭疽病、腐烂病具有较好的防治效果。\n\n［防治对象及使用方法］\n\n技术要点\n\n（1）本品应于苹果树炭疽病发病初期进行施药，隔 10~15 天施 1 次，连施 2~3次为宜；防治苹果\n树腐烂病应于苹果树彻底刮除病疤后，对苹果树枝干喷雾；注意喷雾均匀、周到。\n\n（2）大风天或预计 1 小时内降雨，勿施药。\n\n（3）本品在苹果树上使用的安全间隔期为 14 天，每季作物最多使用 3 次。\n\n（4）不可与呈碱性的农药等物质混合使用。\n\n（5）建议与其他作用机制不同的杀菌剂轮换使用，以延缓抗性产生。\n\n［注意事项］\n\n（1）严格按规定用药量和方法使用。药液及其废液不得污染各类水域、土壤等环境。\n\n（2）本品对鱼类、藻类毒性高，对赤眼蜂为高风险，鱼塘及河流附近、赤眼蜂等天敌昆虫放飞区\n禁用；远离水产养殖区施药，以免对水生生物等有益生物产生危害；虾、蟹套养稻田禁用，施药后\n的田水不得直接排入水体；禁止在河塘等水体中清洗施药器具。\n\n（3）使用本品时应穿防护服和戴手套，避免吸入药液。施药期间不可吃东西和饮水，施药后应及\n时洗手和洗脸。\n\n（4）用过的容器应妥善处理，不可做他用，也不可随意丢弃。\n\n（5）避免孕妇及哺乳期妇女接触。对眼睛有刺激性。\n\n10%氟硅唑水乳剂\n\n［产品特点］ 本品为低毒杀菌剂，其主要作用机理是破坏和阻止病菌细胞的重要成分麦角甾醇的\n生物合成，对子囊菌、担子菌和半知菌所致病害防效显著，药效持久；作物一经喷治，能迅速渗入\n植物体内，能避免被雨水冲失，以达到全面保护及杀菌效果。\n\n［防治对象及使用方法］\n\n技术要点\n\n（1）应在发病初期使用本品，注意喷雾均匀，视病害发生情况，每 10 天左右施药 1 次，可连续用\n\n\n\n药 2 次。\n\n（2）大风天或预计 4 小时内下雨，勿施药。\n\n（3）本品安全间隔期为 21 天，每季作物最多使用 2 次。\n\n（4）酥梨品种幼果前期嫩叶萌发时，使用本品偶有新叶片卷缩现象，过一段时间会恢复，但仍需\n避开此时期使用。对藻状菌纲引起的病害无效。\n\n［注意事项］\n\n（1）因各地气候、土壤等条件不同，具体用法用量应在当地农技部门指导下使用。\n\n（2）防止对鱼毒害和污染水源。禁止在河塘等水域中清洗施药器具，蚕室与桑园附近禁用。\n\n（3）施药时必须穿戴口罩、手套等防护用品。施药时不得吸烟、进食、饮水等，身体不适时勿施\n药。\n\n（4）未使用完的药液勿随意倾倒，避免污染水源。\n\n（5）孕妇及哺乳期妇女禁止接触本品。\n\n22.5%啶氧菌酯悬浮剂\n\n［产品特点］ 本品属甲氧基丙烯酸酯类杀菌剂，线粒体呼吸抑制剂。本产品为广谱性内吸杀菌\n剂，活性高。\n\n［防治对象及使用方法］\n\n技术要点\n\n（1）本品不可与强酸、强碱性物质混用。药液及其废液不得污染各类水域、土壤等环境。\n\n（2）葡萄安全间隔期 14 天，每季最多使用 3 次。\n\n（3）温室大棚环境复杂，该产品不建议在温室大棚使用。\n\n（4）建议与其他作用机制不同的杀菌剂轮换使用。\n\n［注意事项］\n\n（1）遵守一般农药使用规则。施药时要穿戴防护用具、手套，避免使药液溅到眼睛、皮肤和衣服\n上，避免口鼻吸入，施药后用肥皂洗手、洗脸。\n\n（2）清洗喷雾器的废水和废弃的包装不可污染河流、井水、湖泊及其他开放性水源。使用后的空\n袋冲洗两次后妥善处理，切勿重复使用或改作其他用途。\n\n（3）喷施的药液应避免漂移至水生生物栖息地。\n\n（4）孕妇和哺乳期妇女禁止接触本品。\n\n（5）用过的容器应妥善处理，不可做他用，也不可随意丢弃。\n\n\n\n400g/L嘧霉胺悬浮剂",
      "（7）建议与不同作用机制的杀菌剂轮换使用。\n\n［注意事项］\n\n（1）必须严格执行农药安全使用规定，使用时应有劳动防护措施，穿戴劳动保护用品，不得吸\n烟、饮食。\n\n（2）避免在高温强日照下施药。\n\n（3）甜瓜对本类杀菌剂高度敏感，本品禁止用于甜瓜。\n\n（4）大多数作物花期敏感，应避免在花期用药。\n\n（5）包装物不得挪作他用。\n\n（6）用过的容器应妥善处理，不可他用，也不可随意丢弃。\n\n（7）孕妇及哺乳期妇女禁止接触本品。\n\n430g/L戊唑醇悬浮剂\n\n［产品特点］ 低毒农药。本产品是内吸性二唑类杀菌剂，活性较高，内吸性较强，持效期较长，\n具有保护、治疗作用。可防治梨树上的黑星病、苹果树斑点落叶病、水稻稻曲病，而且在推荐剂量\n下对作物安全。\n\n［防治对象及使用方法］\n\n技术要点\n\n（1）梨树黑星病发病初期，对水以每株喷液量 2~2.5 kg喷雾施药，每次施药间隔 7 天，一般施药\n2~3 次。\n\n（2）在梨树上最多施药次数为 4 次，安全间隔期为 21 天。\n\n（3）宜与不同作用机制的杀菌剂轮换使用。\n\n（4）大风天或预计 1 小时内有雨，勿施药。\n\n［注意事项］\n\n（1）必须严格执行农药安全使用规定，使用时应有劳动防护措施，穿戴劳动保护用品，不得吸\n烟、饮食。\n\n（2）本品对鱼类等水生生物有毒，远离水产养殖区施药，禁止在河塘等水体中清洗施药器具。\n\n（3）包装物不得挪作他用。\n\n（4）用过的容器应妥善处理，不可他用，也不可随意丢弃。\n\n（5）孕妇及哺乳期妇女禁止接触本品。\n\n80亿芽孢/g甲基型芽孢杆菌LW-6可湿性粉剂\n\n\n\n［产品特点］ 低毒微生物源农药。本品通过成功定殖至植物根际、体表或体内，改变其周围菌群\n环境和种类，与病原菌竞争植物周围的位点，并且分泌多种抗菌物质以抑制病原菌生长，同时诱导\n植物防御系统抵御病原菌入侵，从而达到有效排斥、抑制和杀灭病菌的作用。\n\n［防治对象及使用方法］\n\n技术要点\n\n（1）本品应于病害初期或发病前施药效果最佳，视病害发生情况，每 7~10 天施药 1 次，可连续\n用药 2~3 次。施药时注意使药液均匀喷施至作物各部分。\n\n（2）本品不能与含铜物质或链霉素等杀菌剂混用；不能与强酸性和强碱性物质混用。\n\n（3）不宜与杀细菌的化学农药直接混用或直接使用，否则效果可能有所下降。勿在强阳光下喷\n雾，晴天傍晚或阴天全天用药效果最佳。\n\n（4）大风天或预计 1 小时内有雨，勿施药。\n\n（5）宜与不同作用机制的杀菌剂轮换使用。\n\n［注意事项］\n\n（1）药剂贮存、运输温度不要高于 35℃，避免反复冻融；避免长时间光照。\n\n（2）必须严格执行农药安全使用规定，使用时应有劳动防护措施，穿戴劳动保护用品，不得吸\n烟、饮食。\n\n（3）本品对家蚕毒性高，蚕园及桑园附近禁用，远离水产养殖区施药，禁止在河塘等水体中清洗\n施药器具。\n\n（4）包装物不得挪作他用。\n\n（5）用过的容器应妥善处理，不可他用，也不可随意丢弃。\n\n（6）孕妇及哺乳期妇女禁止接触本品。\n\n\n\n参考文献\n[1] 安然, 瓮艳荣, 刘娜, 等. 苹果园病虫害的局部发生与挑治[J]. 北方果树, 2018, (1):24~26, 31.\n\n[2] 安月晴, 杨晓平, 胡红菊, 等。梨瘿蚊综合防治技术进展[J].湖北植保, 2019, (4): 56~60.\n\n[3] 白明第, 陆晓英, 张武, 等。几种生物药剂对葡萄白粉病防治效果初报[J].中国南方果树,2019, (1):\n69~71.\n\n[4] 白瑞霞, 王越辉, 马之胜, 等。桃红颈天牛研究进展[J].中国森林病虫, 2017, (2): 5~9.\n\n[5] 曹娟。桃树的病虫害及防治[J].现代园艺, 2017, (13): 164~165.\n\n[6] 曹素芳, 赵明新, 王玮, 等. 甘肃省景泰县梨茎蜂发生动态监测[J]. 中国农学通报, 2017,33(6):\n155~158.\n\n[7] 曾传龙, 谢标洪。江西省赣州葡萄主要病虫害的发生与防治[J].现代园艺, 2016, (1): 88.\n\n[8] 柴全喜, 宋素智. 水木坚蚧的发生与防治[J]. 山西果树, 2016, (4): 59.\n\n[9] 车升国, 樊庆军, 温延臣, 等. 菏泽市葡萄主要病害鉴别与综合防控技术[J]. 山西果树,2019, 187(1):\n55~57.\n\n[10] 邓亚丽, 冯巧菊, 徐金刚, 等. 葡萄天蛾和葡萄蔓割病的发生与防治[J].现代农村科技,2013, (24):\n26~27.\n\n[11] 董冉, 魏树伟, 冉昆, 等. 梨炭疽病的发生与防治措施[J]. 中国果树, 2017, (1): 56~57.",
      "（3）本品可与其他不同作用机制的杀菌剂轮换使用。\n\n（4）葡萄，发病前或初期用药，每间隔 7~14 天施药 1 次，连续施药，每季作物最多施药 3 次。\n安全间隔期 7 天。\n\n（5）苹果树，第一次施药应在苹果谢花后 7~10 天进行，以后每次间隔 10~15天施药 1 次，连续施\n药 4 次。每季作物最多使用 4 次，安全间隔期 28 天。\n\n（6）柑橘树：发病前或初期用药，每次间隔 10~14 天施药 1 次，连续施药。每季作物施药 3 次，\n安全间隔期 21 天。\n\n（7）桃树：发病前或初期用药，每次间隔 7~10 天施药 1 次，连续施药，每季作物最多施药 3\n次。安全间隔期 28 天。\n\n［注意事项］\n\n（1）避免暴露，施药时必须穿戴防护衣或使用保护措施。药液及其废液不得污染各类水域、土壤\n等环境。\n\n（2）施药后用清水及肥皂彻底清洗脸及其他裸露部位。\n\n（3）操作时应远离儿童和家畜。\n\n（4）操作时不要污染水面或灌渠。\n\n（5）药剂应现混现对，配好的药液要立即使用。\n\n（6）毁掉空包装袋，并按照当地的有关规定处置所有的废弃物。\n\n（7）药液及其废液不得污染各类水域、土壤等环境，赤眼蜂等天敌放飞区禁用，蚕室桑园附近禁\n用，开花植物花期禁用。\n\n（8）远离水产养殖区、河塘等水体施药，禁止在河塘等水体中清洗施药器具。\n\n（9）孕妇及哺乳期妇女禁止接触。\n\n\n\n22.5%啶氧菌酯悬浮剂\n\n［产品特点］ 本品属甲氧基丙烯酸酯类杀菌剂，线粒体呼吸抑制剂。本产品为广谱性内吸杀菌\n剂，活性高。\n\n［防治对象及使用方法］\n\n技术要点\n\n（1）本品不可与强酸、强碱性物质混用。建议与其他作用机制不同的杀菌剂轮换使用。\n\n（2）葡萄安全间隔期为 14 天，每季最多使用 3 次。\n\n［注意事项］\n\n（1）温室大棚环境复杂，该产品不建议在温室大棚使用。\n\n（2）遵守一般农药使用规则。施药时要穿戴防护用具、手套，避免使药液溅到眼睛、皮肤和衣服\n上，避免口鼻吸入，施药后用肥皂洗手、洗脸。\n\n（3）清洗喷雾器的废水和废弃的包装不可污染河流、井水、湖泊及其他开放性水源。使用后的空\n袋冲洗两次后妥善处理，切勿重复使用或改作其他用途。\n\n（4）喷施的药液应避免漂移至水生生物栖息地。\n\n（5）孕妇和哺乳期妇女禁止接触本品。\n\n（6）用过的容器应妥善处理，不可做他用，也不可随意丢弃。\n\n10%多抗霉素可湿性粉剂\n\n［产品特点］ 多抗霉素是一种多氧嘧啶核苷类农用抗菌素。它能有效地抑制真菌细胞壁骨架成分\n——几丁质的合成。可防治苹果、番茄、黄瓜、烟草、西瓜和葡萄作物上的病害。\n\n［防治对象及使用方法］\n\n技术要点\n\n（1）苹果树在开花后 10 天内和病害多发期开始使用本品，番茄、黄瓜、烟草、西瓜和葡萄在病害\n发生初期开始使用本品。\n\n（2）苹果树每季使用本品最多 3 次，安全间隔期为 7 天；葡萄每季最多使用本品为 3 次，安全间\n隔期为 7 天。\n\n\n\n（3）避免过度连用，建议与其他作用机制的药剂轮换使用，不可混用波尔多液等碱性物质。\n\n［注意事项］\n\n（1）孕妇及哺乳期妇女避免接触。\n\n（2）施药时要穿长袖工作衣裤，应戴面罩、橡皮手套；施药时不可吸烟、饮水、进食；施药后必\n须用肥皂清洗面部、手脚等身体裸露部分，并用清水漱口。\n\n（3）远离水产养殖区施药；剩余药液和清洗药具的废液应该避免污染鱼塘等水源，残余药剂和包\n装物应妥善处理，避免发生中毒和环境事故。\n\n40%多菌灵悬浮剂\n\n［产品特点］ 本品是一种苯并咪唑类内吸性杀菌剂，兼有保护和治疗作用。对梨树黑星病有较好\n的治疗作用。\n\n［防治对象及使用方法］\n\n技术要点\n\n（1）在梨树谢花后开始发现病芽梢时，用本品 400~600 倍液喷雾。\n\n（2）本品在梨树上使用的安全间隔期 28 天，每季最多使用 3 次。\n\n（3）大风天或预计 1 小时内降雨，勿施药。\n\n（4）不能与铜制剂及强酸、强碱性物质混用。\n\n（5）长期单一使用多菌灵易使病菌产生抗药性，应与其他作用机制杀菌剂轮换使用。\n\n［注意事项］\n\n（1）施药时应穿防护用品，避免吸入药液。施药期间不可吃东西和饮水。施药后应及时洗手和洗\n脸。\n\n（2）使用和清洗施药器具的水不要污染河流、池塘等水体。\n\n（3）孕妇及哺乳期妇女应避免接触。\n\n（4）用过的空袋等容器应妥善处理，不可做他用，也不可随意丢弃。\n\n20%氟硅唑可湿性粉剂\n\n［产品特点］ 本品是二唑类杀菌剂。该药主要是破坏和阻止病菌的细胞膜重要组成成分麦角甾醇\n的生物合成，导致细胞膜不能形成，使病菌死亡。对子囊菌纲、担子菌纲和半知菌类的病菌所致病\n害有效，对卵菌无效。本品对梨树黑星病具有较好的防治效果。\n\n［防治对象及使用方法］\n\n\n\n技术要点"
    ]
  },
  {
    "question": "蓑蛾类害虫具有什么样的趋性，可用于物理防治？",
    "answer": "蓑蛾类害虫具有强烈的趋光性，可在夜晚8～9时利用黑光灯、频振式杀虫灯等进行诱杀，以降低其发生基数。",
    "standard_answer": "蓑蛾类害虫具有强烈的趋光性。",
    "contexts": [
      "·学名· 主要发生大窠蓑蛾（ Clania variegate Snellen）、白囊蓑蛾（ Chalioides kondonis\nMatsumura）、茶蓑蛾（ Clania minuscula Butler），均属鳞翅目（Lepidoptera）蓑蛾科\n（Psychidae）。\n\n·鉴别特征· 初孵幼虫：头黑色，后变黄褐至黑褐色，体肥大，胸足发达，腹足短小；初孵幼虫先吐\n丝营造护囊，后负囊行走与危害，护囊随幼虫长大而加大。大窠蓑蛾护囊：长约 60 mm，灰黄褐\n色，护囊外常包 1~2 张枯叶，护囊丝质较疏松。白囊蓑蛾：护囊长 30~40 mm，细长纺锤形，灰白\n色，护囊不附任何残叶与枝梗，全用丝缀成，丝质较致密，常挂于叶背面。茶蓑蛾：护囊外缀有排\n列整齐小枝梗。\n\n·生活习性· 大窠蓑蛾在浙江省 1 年发生 1 代，以老熟幼虫封囊越冬，翌年 3 月下旬至 4 月上中旬开\n始化蛹，5 月中下旬成虫羽化；羽化后雌虫仍在囊内，雄虫从护囊末端飞出，与囊内雌虫交配产\n卵；5 月下旬幼虫孵化爬出护囊分散活动，并咬碎叶片连缀在一起筑新护囊，7~9 月危害最严重，\n11 月开始越冬。\n\n白囊蓑蛾在浙江省 1 年发生 1 代，以低龄幼虫越冬。于 6 月中旬至 7 月上旬化蛹，7 月中下旬出现\n幼虫，低龄幼虫仅食叶肉，高龄幼虫吞食叶片，剩留叶脉。10 月上中旬停食并开始越冬；7 月中旬\n至 8 月中旬发生最多。\n\n茶蓑蛾在浙江省 1 年发生 1~2 代，以幼虫越冬。于 3 月开始取食，6~8 月发生第一代幼虫。卵产于\n袋内，孵化出的幼虫从护囊排泄孔钻出，爬到枝叶上或吐丝下垂，被风吹散迁移。头胸露于袋外，\n护囊挂于腹部取食。\n\n·危害特点· 以幼虫取食杨梅新梢叶片和嫩枝皮，致使小枝枯死，甚至全树枯死，严重影响杨梅的开\n花结果及树体的生长。\n\n·防治方法·\n\n\n\n（1）结合春梢、夏梢的整形修剪和冬季清园，剪除虫袋，并集中销毁。\n\n（2）蓑蛾类害虫具有强烈的趋光性，在夜晚 8~9 时，悬挂黑光灯、频振式杀虫灯等诱杀成虫，可\n降低害虫的发生基数。\n\n（3）幼虫和蛹期，多种寄生和捕食性天敌，如鸟类、寄生蜂及致病微生物，可加以保护和利用。\n用 32 000 IU/mg苏云金杆菌可湿性粉剂 200 倍液喷洒，或用核型多角体病毒制剂喷雾。幼虫初孵期\n喷洒 35%氯虫苯甲酰胺水分散粒剂17 500~25 000 倍液，注意要求喷湿护囊。\n\n蓑蛾 整株被害状\n\n\n\n蓑蛾 取食\n\n蓑蛾 蓑囊\n\n\n\n大窠蓑蛾 蓑囊\n\n\n\n蓑蛾 幼虫\n\n\n\n大蓑蛾 雄成虫\n\n\n\n白囊蓑蛾 护囊\n\n\n\n小蓑蛾 护囊\n\n\n\n杨梅病虫防治历\n\n（续表）\n\n\n\n\n\n\n六、苹果\n\n苹果病虫害发生种类多、持续时间长、危害严重、防治难度大，直接影响苹果产量和质量。当前常\n见主要病害有腐烂病、轮纹病、干腐病、炭疽病、霉心病、褐斑病、斑点病、白粉病、锈病等，常\n见主要害虫有苹果黄蚜、瘤蚜、绵蚜、山楂叶螨、全爪螨、二斑叶螨、康氏粉蚧、绿盲蝽、桃小食\n心虫、梨小食心虫、苹果小卷叶蛾、顶梢卷叶蛾、平毛金龟甲、桑天牛等。\n\n苹果腐烂病在管理粗放的果园发生严重，造成枝干枯死或整株死亡。苹果轮纹病在当前主推的矮化\n密植园普遍发生较重，不但影响树势，还是导致果实烂果的重要原因。近几年春季干旱，苹果园干\n腐病有加重趋势，嫁接口以上部位，甚至枝干出现干枯死亡。苹果锈病每年 4~6 月份发生较重，\n与其冬孢子在绿化柏树上越冬量大有关。苹果炭疽病 7~8 月份发生，不仅危害果实，也造成叶片\n严重干枯。套袋苹果果实黑点病、红点病发生比较普遍，主要是弱寄生菌在果实表面出现腐生组织\n造成的，长期高温多雨环境下更容易发病。苹果黄蚜每年春季普遍发生，需要及时喷药防治；有些\n果园夏秋季节发生也较重。苹果绵蚜因危害部位隐蔽难防治，目前已经普遍发生，危害日趋严重。\n害螨、食心虫、卷叶虫等在局部地区或果园有一定程度发生。绿盲蝽、茶翅蝽、黄斑蝽等在苹果落\n花后至套袋前危害幼果较重，是造成畸形果的重要原因。\n\n\n\n当前防治苹果病虫害主要是根据病虫害发生流行规律和苹果生长管理要求，采取综合防治措施。重\n点加强苹果休眠期、发芽后至套袋前阶段的防治。现在主要还是依靠药剂进行防治，大量使用农药\n防治也产生一些问题，如病虫害抗性增强、杀伤自然天敌、影响果品质量及果园环境等。科学合理\n防控苹果病虫害越来越受到重视，如病虫发生流行监测预警、精准施药、果园生草繁育自然天敌、\n\n\n\n使用选择性药剂、物理机械防控技术等都有了比较快的发展，对提高防控效果、果品质量及果园生\n态环境都有了很大的促进作用。\n\n\n\n苹果病害\n\n苹果腐烂病",
      "·学名· 主要发生大窠蓑蛾（ Clania variegata ）、小蓑蛾（ Acanthopsyche sp），属鳞翅目\n（Lepidoptera）蓑蛾科（Psychidae），又称袋蛾、避债虫、负囊虫等。\n\n·鉴别特征· 参照杨梅虫害蓑蛾（p192）。\n\n·生活习性· 参照杨梅虫害蓑蛾（p192）。\n\n·危害特点· 参照杨梅虫害蓑蛾（p192）。\n\n·防治方法· 参照杨梅虫害蓑蛾（p192）。\n\n\n\n小蓑蛾 护囊\n\n小蓑蛾 取食\n\n\n\n大蓑蛾 取食叶片\n\n大蓑蛾 蓑囊\n\n\n\n大蓑蛾 雄蛹\n\n\n\n大蓑蛾 雌蛹\n\n大蓑蛾 幼虫\n\n\n\n蓝莓主要病虫害防治历期表\n\n\n\n\n\n\n第二部分\n\n果林常用农药\n\n\n\n一、农药基础知识\n\n\n\n（一）农药的定义\n\n农药是指用于预防、消灭或者控制危害农业、林业的病、虫、草、鼠、兔害等有害生物，以及有目\n的地调节植物、昆虫生长的化学药品，或者来源于生物、其他天然物质的一种物质或者几种物质的\n混合物及其制剂。\n\n传统农药的概念：农药主要是指用来防治危害农林牧业生产的有害生物（害虫、害螨、病菌、线\n虫、杂草、鼠类）和调节植物生长发育的化学物质。\n\n\n\n（二）农药的三证\n\n农药“三证”是指农药登记证或农药临时登记证、农药生产许可证或农药生产批准文件、农药产品标\n准证。\n\n每个农药生产企业的每一个农药商品制剂，在其农药标签上都必须有“三证”的三个证号。农药登记\n证号的开头为“PD”等，农药临时登记证号的开头为“LS”；农药生产许可证号的开头为“XK”，农药\n生产批准文件号开头为“HNP”等；农药产品标准证号的开头为“GB”（国家标准）、“HB”（行业标\n准）、“Q”（企业标准）。\n\n每个农药企业的每一个商品化的农药产品，在农药标签上须有“三证”证号，“三证”不全的，或冒用\n其他农药产品“三证”，或冒用其他厂家“三证”，产品属伪劣假冒范围，属违法行为。\n\n一个农药产品，有了“三证”，不按“三证”中规定的技术要求组织生产，产品质量达不到“三证”的有\n关规定，产品即为劣质次品，因此酿成后果，生产厂家要负法律责任。\n\n\n\n（三）农药的颜色表示\n\n\n\n（四）农药的分类\n\n农药有很多分类方法，但一般按三种分类方式：按来源、防治对象和作用方式分类。\n\n1. 按来源分类\n\n（1）矿物源农药：起源于天然矿物原料的无机化合物和石油的农药，统称为矿物源农药。\n\n（2）生物源农药：是指利用生物资源开发的农药，生物包括动物、植物、微生物。\n\n（3）有机合成农药：其中的化学合成农药是由人工研制合成，并由化学工业生产的一类农药；而\n以天然产品中的活性物质作为母体，进行模拟合成或作为模版予以结构改造、研究合成效果更好的\n类似化合物，叫仿生合成农药。\n\n化学合成农药的特点是药效高、见效快、用量少、用途广，可适应各种不同的需要，但是污染环\n境，易使有害生物产生抗药性。但化学合成农药是目前使用最广，用量最大，在未来较长时间内有\n不可代替性。\n\n2. 按防治对象分类\n\n按防治对象，农药可分为杀虫剂、杀螨剂、杀软体动物剂、杀菌剂、杀线虫剂、除草剂、植物生长\n调节剂、杀鼠剂等。\n\n杀菌剂——对病原菌能起毒害、杀死、抑制或中和其有毒代谢物的药剂。\n\n杀虫剂——对有害昆虫机体有毒或通过其他途径可控制其种群形成或减轻、消除危害的药剂。\n\n杀螨剂——防除植食性有害螨类的药剂。\n\n杀线虫剂——防治农作物线虫病害的药剂。\n\n除草剂——防除、消灭、控制杂草的药剂。\n\n杀鼠剂——毒杀各种有害鼠类的药剂。\n\n植物生长调节剂——调节生长发育、控制生长速度、植株高矮、成熟早晚、开花、结果数量及促进\n作物呼吸代谢而增加产量的化学药剂。\n\n3. 按照作用方式分类\n\n杀虫剂作用方式：胃毒，内吸，熏蒸，触杀，拒食，驱避，引诱。\n\n杀菌剂作用方式：保护，治疗，铲除。\n\n除草剂作用方式：触杀、内吸。\n\n杀虫剂进入昆虫体内的途径：口腔、体壁、气门。\n\n\n\n（五）农药的剂型\n\n未经过加工的农药一般称为原药。\n\n原药都要经过加工、加入适当的填充剂量和辅助剂，制成含有一定成分、一定规格的制剂才能使\n用。经过加工的药剂称制剂。\n\n一些传统的农药剂型如粉剂、可湿性粉剂、乳油正逐步为对环境友好的农药新剂型如悬浮剂\n（SC）、水乳剂（EW）、悬乳剂（SE）、微乳剂（ME）、水分散粒剂（WG）、干悬浮剂\n（DF）、可溶性粒剂（SG），微囊悬浮剂（CS）等所取代。\n\n水基化农药新剂型有：水乳剂（EW）、微乳剂（ME）、微囊悬浮剂（CS）、水悬浮剂（SC）。\n\n1.可湿性粉剂（WP）",
      "·危害特点· 幼虫在全株危害。低龄幼虫群集啃食叶片，3 龄开始分散危害叶片、嫩茎，4 龄后暴\n食，可吃光叶肉，仅剩叶脉，老熟幼虫可蛀食果实。\n\n·防治方法·\n\n（1）清除种植区域杂草，翻耕晒土或土壤灌水，破坏、恶化斜纹夜蛾的化蛹场所，消灭越冬虫\n蛹，减少虫源基数。人工摘除卵块和初孵幼虫群集危害的叶片，减少斜纹夜蛾幼虫数量，降低幼虫\n危害。\n\n（2）杀虫灯诱蛾：利用斜纹夜蛾成虫趋光性，于盛发期利用黑光灯诱杀。悬挂性诱剂诱捕器，引\n诱雄虫，降低雌雄交配率，减少后代种群数量。\n\n\n\n（3）化学防治：斜纹夜蛾 4 龄以上幼虫皮厚，具有很强的抗药性，在卵孵高峰至 3 龄幼虫分散\n前，用足药液量，均匀喷雾叶面及叶背，使药剂能直接喷到虫体和食物上，触杀、胃毒并进，增强\n毒杀效果。药剂可用 1.8%阿维菌素水乳剂3 000 倍液，或 1%苦参碱 800~1 500 倍液，每隔 5~7 天\n喷 1 次，交替使用，连喷3~4 次。一般下午用药，土表及杂草上也要喷到。\n\n斜纹夜蛾 低龄幼虫\n\n\n\n斜纹夜蛾 成虫\n\n\n\n斜纹夜蛾 低龄幼虫\n\n斜纹夜蛾 老熟幼虫\n\n玉带凤蝶\n\n\n\n·学名· Papilio polytes Linnaeus，属鳞翅目（Lepidoptera）凤蝶科（Papilionidae）。\n\n·鉴别特征· 成虫：体长 25~28 mm，翅展 95~100 mm，全体黑色；胸部背有 10个小白点，成 2 纵\n列；胸前翅外缘有 7~9 个黄白色斑点，后翅外缘呈波浪形，有尾突，翅中部有黄白色斑 7 个，横\n贯全翅似玉带。卵：球形，直径 1.2 mm，初淡黄白，后变深黄色，孵化前灰黑至紫黑色。幼虫：\n体长 45 mm，头黄褐，体绿至深绿色，前胸有紫红色臭丫腺。幼虫共 5 龄，初龄黄白色，2 龄黄褐\n色，3 龄黑褐色；1~3 龄体上有肉质突起褐淡色斑纹，似鸟粪；4 龄后油绿色，体上斑纹与老熟幼\n虫相似。蛹：长 30 mm，体色多变，有灰褐、灰黄、灰黑、灰绿等，头顶两侧和胸背部各有1突\n起，胸背突起两侧略突出似菱角形。\n\n·生活习性· 1 年发生 4 代，少数 5 代。以蛹在枝干和叶背等隐蔽处越冬。翌年5月上旬成虫开始羽\n化。成虫白天活动，交尾产卵于寄主新梢嫩叶上，多单产。第一代为 5 月中旬至 6 月中下旬危害，\n初食嫩叶边缘，后食全叶，仅剩主脉和叶柄，对幼苗和小树危害明显。6 月中下旬第一代成虫羽\n化，第二三代成虫期在 7 月中下旬和 8 月中下旬。2~4 代幼虫期分别在 6 月下旬至 7 月下旬、7 月\n下旬至 8 月上旬、8 月下旬至 9 月中旬。\n\n·危害特点· 以幼虫危害柑橘的芽、嫩叶和新梢。叶片被啃食成孔洞状，严重时全叶被吃的仅剩叶\n柄。苗木和幼树受害时可影响抽梢。\n\n·防治方法·\n\n（1）对幼苗、小树可人工捕杀卵、幼虫和蛹。\n\n（2）药剂防治：可用 32 000 IU/mg苏云金杆菌可湿性粉剂，或 25%灭幼脲Ⅲ号 1 500 倍液，或\n0.3%苦参碱水剂 1 000 倍液喷雾防治。\n\n玉带凤蝶 卵\n\n\n\n玉带凤蝶 1 龄幼虫\n\n玉带凤蝶 3 龄幼虫\n\n玉带凤蝶 4 龄幼虫\n\n\n\n玉带凤蝶 5 龄幼虫\n\n玉带凤蝶 预蛹\n\n\n\n玉带凤蝶 雌成虫\n\n\n\n玉带凤蝶 雄成虫\n\n柑橘凤蝶\n\n·学名· Papilio xuthus Linnaeus，属鳞翅目（Lepidoptera）凤蝶科（Papilionidae）。\n\n·鉴别特征· 成虫：体长约 27 mm，翅展 91 mm左右，翅绿黄色，沿脉纹有黑色带。幼虫：黄绿\n色，体长 48 mm左右；4 龄前黑褐色，杂有白色，形似鸟粪；5龄幼虫绿色，体肥壮，体表光滑，\n疣突消失，气门黄色或白色、椭圆形、小，后胸背面两侧各有 1 枚蛇眼状斑，前缘红色，中后部分\n黑色，中部有一白色纵纹；两眼斑间为一浅黄绿色横带，带内具开口向后的墨绿色“U”形\n纹；“Y”形嗅腺发达，橙黄色，气味浓烈。卵：长 1~1.3 mm，散产，初产时淡黄色，逐渐加深为黄\n褐色；圆球状，无明显棱脊，有的卵壳上布有不明显的微小皱纹。蛹：长 24~30 mm，宽8~11\nmm；近菱形，头顶部分叉，猫头状；背面凹陷，腹面凸起；初化蛹时腹面灰白色，背面淡黄绿\n色。\n\n·生活习性· 4 月始见成虫。卵产于嫩梢、叶上。幼虫 3 龄前食叶肉，虫体褐色似鸟粪，后渐变黄绿\n色，啃食全叶，受惊时会伸出橘黄色臭角腺。\n\n·危害特点· 参照玉带凤蝶\n\n·防治方法· 参考玉带凤蝶\n\n\n\n柑橘凤蝶 成虫\n\n\n\n柑橘凤蝶 成虫\n\n柑橘凤蝶 末龄幼虫\n\n\n\n柑橘凤蝶 幼虫\n\n\n\n柑橘凤蝶 蛹\n\n\n\n柑橘被害状及三龄幼虫\n\n柑橘凤蝶 幼虫\n\n\n\n柑橘凤蝶 蛹\n\n\n\n蜗牛和蛞蝓类",
      "·危害特点· 主要危害叶，幼虫常群集树叶吐丝结网幕，在其内食害叶片。1~2 龄幼虫只取食叶肉，\n严重时全株树叶被吃光，只留下叶脉，整个叶片呈透明的纱网状，3 龄幼虫开始将叶片咬成缺刻，\n4 龄幼虫开始分成若干个小的群体，形成几个网幕，4 龄幼虫食量大增，5 龄后进入单个取食的暴\n食期。发生严重时可将全株树叶食光，造成部分枝条甚至整株死亡，严重威胁林果业，造成惊人的\n损失。\n\n·防治方法·\n\n（1）人工摘除卵块及网幕，可在美国白蛾卵期及三龄前幼虫结网幕期，开展人工摘除卵块及网幕\n防治。\n\n（2）围草诱蛹：在老熟幼虫化蛹前，在树干离地 1~1.5 m处，绑稻草或草帘，按照上松下紧围绑\n起来，诱集幼虫化蛹。结束后统一收集，并进行无害化处理。\n\n（3）药剂防治：在幼虫发育初期、破网前进行防治，可选喷 32 000 IU/mg苏云金杆菌 200~400 倍\n液、0.5%苦参碱水分散粒剂 1 250~1 650 倍液、5%杀铃脲悬浮剂 1 250~2 500 倍液，每次喷药应间\n隔 5~10 天，连续喷施 2~3 次。注意农药轮换交替使用。\n\n\n\n美国白蛾 幼虫\n\n美国白蛾 幼虫\n\n美国白蛾 幼虫\n\n\n\n美国白蛾 产卵\n\n\n\n美国白蛾 成虫 林间交尾\n\n\n\n美国白蛾 卵块\n\n美国白蛾 成虫前足基部\n\n\n\n美国白蛾 蛹\n\n\n\n美国白蛾 越冬代成虫（左，雄；右，雌）\n\n\n\n美国白蛾 桑树网幕\n\n\n\n美国白蛾 柿树网幕\n\n\n\n美国白蛾 桃树网幕\n\n桃红颈天牛\n\n·学名· Aromia bungii Faldermann，属鞘翅目（Coleoptera）天牛科（Ceram bycidae），又名红颈天\n牛、铁炮虫、哈虫。\n\n·鉴别特征· 成虫：体长 28~37 mm，体漆黑色，有光泽，仅前胸背面棕红色（极少数黑色）；前胸\n密布横皱，前胸两侧各有刺突 1 个，背面有瘤突 4 个；翅鞘表面光滑，翅基部较前胸宽，后端较\n狭。卵：长椭圆形，乳白色，长 6~7 mm。幼虫：体长42~52 mm，乳白色；前胸背板的前缘和侧缘\n有 4 个稍骨化的黄棕色斑块，中间的两块横长方形，中央凹陷。蛹：淡黄白色，长 32~46 mm。\n\n·生活习性· 每 2~3 年发生 1 代，以不同虫龄的幼虫在蛀道内越冬；一般低龄幼虫在韧皮部下越冬，\n高龄幼虫在木质部内。翌年春幼虫开始活动、蛀食；危害严重时，红褐色粉粒状粪屑可堆满树干基\n部。6~9 月成虫羽化，7~8 月为成虫羽化盛期。成虫活跃，有假死性，啃食嫩枝和熟果。卵产于树\n皮缝隙内，近地面 30~40 cm处的树干上产卵率最高，单雌产卵 170 粒左右，卵期 1~2 周。幼虫孵\n化后先在韧皮部皮层下蛀食，形成弯曲虫道，粪屑堆于皮层内，一般情况下不排出。当年冬季即以\n小幼虫在皮层内越冬。第二年开春后恢复活动，向木质部边材部分蛀食，虫道向下发展。当幼虫长\n至 30 mm时，可再向上蛀食心材，并在其中度过第二个冬天。第三年 4~6 月老熟幼虫在虫道末端\n黏结虫粪、木屑筑成蛹室，虫体转动头部向上，在蛹室内化蛹，6~7 月陆续羽化。天敌有管氏肿腿\n\n\n\n蜂，其成蜂可以潜入蛀道寻觅天牛幼虫寄生。\n\n·危害特点· 主要危害木质部，幼虫孵出后向下蛀食韧皮部，后期蛀入木质部，削弱树势，严重时可\n致整株枯死。\n\n·防治方法·\n\n（1）重点放在消灭成虫上，在成虫期人工捕杀效果很好；尤其中午，成虫有从树冠下到干基部栖\n息的习性，便于捕杀；也可用浸过药的熟果置于树杈上诱杀成虫。\n\n（2）幼虫期用人工勾除方式防治，或释放管氏肿腿蜂、花绒寄甲等天敌防治。\n\n\n\n桃红颈天牛 排泄物\n\n\n\n桃红颈天牛 排泄物\n\n桃红颈天牛 幼虫\n\n\n\n桃红颈天牛 成虫\n\n\n\n桃红颈天牛 成虫\n\n草履蚧\n\n·学名· Drosicha corpulenta Kuwana，属半翅目（Hemiptera）珠蚧科Drosicha corpulenta，又名桑\n虱、日本履绵蚧、草鞋蚧。\n\n·鉴别特征· 雌成虫：长椭圆形，黄褐色或红褐色，似草鞋状，无翅，体长约 10 mm，体被霜状白色\n蜡粉，腹部有横皱褶和纵沟。雄成虫：紫红色，体长5~6 mm，翅展 10 mm；1 对前翅，淡紫黑\n色，半透明，翅上有两条淡黑色条纹，后翅退化为平衡棒。卵：椭圆形，初产时黄白色，渐变为黄\n褐色，卵产于白色绵状卵囊中。若虫：外形与雌虫相似，但虫体较小。蛹：圆筒形，褐色，外被白\n色絮状物。",
      "·生活习性· 老熟幼虫在树冠下土中 3~7 cm处越冬。成虫在柑橘现蕾期羽化出土，4 月中下旬至 5 月\n初危害严重。成虫多于早、晚活动，以傍晚最盛，飞行力弱，羽化后 1~2 天即可交配产卵；一般\n阴湿低洼橘园发生较多，壤土、砂壤土利于幼虫存活，发生较多，3~4 月多阴雨有利于成虫发生，\n幼虫脱蕾期，多雨有利于幼虫入土。柑橘显蕾开花季节遇多雨天气，该虫发生严重。\n\n·危害特点· 喜在花蕾开始现白、直径 2~3 mm的花蕾内产卵；孵化的幼虫在花蕾内活动取食，并产\n生大量黏液。受害花蕾膨大变形如灯笼，花瓣略带绿色，并有分散绿色小点，导致被害花蕾不能正\n常开花和授粉，最后枯萎脱落，严重影响产量。\n\n·防治方法·\n\n（1）冬季深翻或春季浅耕树冠周围土壤。在开花期发现灯笼状畸形花蕾，立即人工摘除受害花\n蕾，集中园外深埋或烧毁。\n\n（2）多数花蕾变白时，于产卵之前树冠喷药毒杀成虫，可喷洒 75%灭蝇胺可湿性粉剂 5 000 倍液\n等，选择无风，特别是雨后天晴的傍晚或早晨喷施树冠。喷药时周到均匀，每隔 5~7 天喷 1 次，\n共喷 2~3 次；重点是花蕾和叶背，地面和树冠同时喷药。\n\n\n\n柑橘花蕾蛆 幼虫\n\n\n\n柑橘花蕾蛆 蛹\n\n柑橘花蕾蛆 危害花（中间）和正常开放花\n\n\n\n柑橘潜叶蛾\n\n·学名· Phyllocnistis citrella Stainton，属鳞翅目（Lepidoptera）潜叶蛾科（Lyone tiidae），又名橘潜\n蛾、潜叶虫。\n\n·鉴别特征· 成虫：体银白色，体长 2 mm，翅展 4 mm，触角丝状，前翅披针形，翅基部具 2 条黑\n褐色纹，翅近中部有黑褐色“Y”形斜纹，前缘中部至外缘有橘黄色缘毛，顶角有黑圆斑 1 个；后翅\n银白色，针叶形，缘毛极长。卵：椭圆形，白色、透明，底部平而成半圆形突起，长 0.3~0.6\nmm。初孵幼虫：浅绿色，形似蝌蚪。老熟幼虫：体扁平，纺锤形，长约 4 mm，胸腹部背面背中\n线两侧有 4 个凹陷孔，排列整齐。体黄绿色，头三角形，腹部末端尖细，具 1 对细长的铗状物。\n蛹：纺锤形，初为淡黄色，后为深黄褐色，长 2.5 mm。茧：黄褐色。\n\n·生活习性· 一般一年发生 9~10 代，多的达 15 代，世代重叠，多以幼虫和蛹在柑橘的秋梢或冬梢上\n越冬，5 月下旬晚春梢上始见幼虫危害，7~9 月严重危害秋梢。成虫昼伏夜出，飞行敏捷，趋光性\n弱，卵多散产在嫩叶背面主脉附近。初孵幼虫由卵底潜入皮下危害，蛀道白色光亮，有 1 条由虫粪\n组成的细线。\n\n·危害特点· 幼虫潜入嫩叶、嫩梢表皮下蛀食叶肉，形成银白色弯曲的隧道，内留有虫粪，在中央形\n成一条黑线，虫道蜿蜒曲折，导致被害叶卷缩、硬化，叶片易脱落，新梢生长停滞。幼虫危害造成\n的伤口易染溃疡病，常诱发柑橘溃疡病，被害卷叶又为红蜘蛛、介壳虫、卷叶蛾等害虫提供了越冬\n场所。\n\n·防治方法·\n\n（1）结合栽培管理及时抹芽控梢，摘除过早、过晚的新梢，通过水、肥管理使夏梢、秋梢抽发整\n齐健壮。\n\n（2）于潜叶蛾发生始盛期或新梢 3 mm长时，选用 20%氯虫苯甲酰胺悬浮剂3 000 倍液，或 1%苦\n皮藤素水乳剂 4 000~5 000 倍液、0.3%印楝素乳油 400~600倍液、1.8%阿维菌素水乳剂 4 000~5 000\n倍液等喷雾防治。\n\n一般隔 7 天左右喷药 1 次，连喷 2~3 次。防治成虫应在傍晚喷药，潜入叶内的低龄幼虫应在午后\n喷药，并注意药剂的轮换使用。\n\n\n\n柑橘被害状\n\n\n\n柑橘潜叶蛾 卵\n\n柑橘潜叶蛾 成虫\n\n\n\n柑橘潜叶蛾 幼虫\n\n\n\n柑橘潜叶蛾 蛹\n\n\n\n柑橘被害状\n\n\n\n柑橘潜叶蛾 幼虫\n\n\n\n柑橘潜叶蛾 幼虫\n\n\n\n柑橘潜叶蛾 成虫\n\n斜纹夜蛾\n\n·学名· Prodenia litura Fabricius，属鳞翅目（Lepidoptera）夜蛾科（Noctuidae），又名连纹夜蛾、斜\n纹贪夜蛾。\n\n·鉴别特征· 成虫：体长 16~21 mm，翅展 37~42 mm，全体灰褐色；前翅黄褐色，具有复杂的黑褐\n色斑纹，后翅白色，带有红色闪光，外缘有 1 条褐色线。老熟幼虫：体长 38~51 mm，体色因虫\n龄、食料、季节而变化，从初孵幼虫时的绿色渐变为老熟时的黑褐色，背线、亚背线橘黄色，亚背\n线内侧具三角形黑斑一对。卵：半球形，直径约 0.5 mm，成块，黄白色，外覆黄白色绒毛。蛹：\n长 18~20 mm，圆筒形，赤褐至暗褐色。\n\n·生活习性· 斜纹夜蛾为迁飞性害虫。主要以蛹在土中越冬。成虫昼伏夜出，有较强的趋光性，喜食\n糖、酒、醋等发酵物。成虫多产卵于叶背，产卵后 2~3 天即能孵化，初孵幼虫常群集危害，2~3 龄\n后分散，4 龄后进入暴食期。幼虫畏光，7 月下旬至 9 月下旬为盛发期。"
    ]
  }
]